type,link_type,key,name,rank,description,evidence,evidenceSources,conid,currency,symbol,exchange,assetType,navigable
automotive,autonomous_vehicles,SG9999000020,FLEX LTD,28,Proporciona soluciones de fabricación y cadena de suministro cruciales para el desarrollo y la producción de componentes y sistemas utilizados en vehículos autónomos.,"La participación de Flex en Vehículos Autónomos es evidente a través de su segmento Flex Reliability Solutions (FRS), que incluye explícitamente 'Automotriz, incluida la movilidad de próxima generación, autónoma, conectividad, electrificación y tecnologías inteligentes'. Este segmento atiende al mercado final automotriz y ha visto gastos de capital para respaldar su negocio automotriz, aunque experimentó una disminución de un bajo porcentaje de un solo dígito en las ventas netas debido a una menor demanda de los clientes. Si bien la tecnología autónoma es parte de las soluciones automotrices de Flex, no parece ser una inversión de primer nivel y no hay indicios de singularidad en esta área.","[{'name': 'flex-Q225-10-Q', 'url': 'https://storage.googleapis.com/reflexivity-documents-prod/edgar/filing/10-q/flex-Q225-10-Q.html'}, {'name': 'flex-Q325-10-Q', 'url': 'https://storage.googleapis.com/reflexivity-documents-prod/edgar/filing/10-q/flex-Q325-10-Q.html'}]",4596077,USD,FLEX,SMART,STK,True
automotive,autonomous_vehicles,US6937181088,PACCAR INC,29,Implica el desarrollo e integración de tecnologías de conducción autónoma en sus ofertas de camiones comerciales.,"PACCAR está activamente involucrado en el desarrollo de una plataforma de vehículos autónomos, mientras monitorea de cerca los avances de empresas como Aurora, Kodiak y STACK. La empresa está priorizando la seguridad como principio fundamental en sus iniciativas de conducción autónoma y continúa desarrollando su plataforma de vehículos autónomos. Si bien PACCAR reconoce el progreso realizado por otras empresas en el desarrollo de conductores autónomos, actualmente prefiere operar camiones con conductor.",,272992,USD,PCAR,SMART,STK,True
automotive,autonomous_vehicles,US5949181045,MICROSOFT CORP,30,Proporciona infraestructura de computación en la nube y servicios de inteligencia artificial que respaldan el desarrollo y la implementación de tecnologías de vehículos autónomos.,,,272093,USD,MSFT,SMART,STK,True
automotive,autonomous_vehicles,US0378331005,APPLE INC,31,Participa en la investigación y el desarrollo de tecnologías pertinentes para sistemas de conducción autónoma.,,,265598,USD,AAPL,SMART,STK,True
automotive,autonomous_vehicles,US82982T1060,SITIME CORP,32,Apoya la evolución tecnológica dentro del sector de vehículos autónomos.,"La participación de SiTime en el tema de Vehículos Autónomos es evidente a través de sus soluciones utilizadas en la electrónica automotriz, particularmente en ADAS para coches autónomos, donde la mayor precisión en la sincronización es esencial. La compañía enfatiza que la sincronización de precisión es crucial para el posicionamiento, la detección, el control del motor y la sincronización precisos en operaciones totalmente autónomas dentro de vehículos ADAS L3+ y L4. Además, SiTime está integrado en las principales plataformas de robotaxi, lo que destaca el papel de la compañía en este segmento creciente del mercado automotriz, con la expectativa de que los ingresos aumentarán junto con estos mercados.","[{'name': 'sitm-FY24-10-K', 'url': 'https://storage.googleapis.com/reflexivity-documents-prod/edgar/filing/10-k/sitm-FY24-10-K.html'}]",392585451,USD,SITM,SMART,STK,True
automotive,autonomous_vehicles,KYG037AX1015,AMBARELLA INC,33,Contribuye a la industria de vehículos autónomos.,,,115324103,USD,AMBA,SMART,STK,False
automotive,autonomous_vehicles,US08975B1098,BIGBEAR.AI HOLDINGS INC,34,Desarrolla soluciones de inteligencia artificial que contribuyen al avance y operación de vehículos autónomos.,"El compromiso de BigBear.ai con los Vehículos Autónomos es evidente a través de sus inversiones en ConductorOS y habilitación de autonomía, alineándose con los fondos de autonomía de IA militar de $16 mil millones destinados a escalar sistemas aéreos no tripulados enjambre. El software ConductorOS de la empresa demostró un rendimiento excepcional en el ejercicio Talisman Sabre, mejorando la toma de decisiones en el campo de batalla y la coordinación de activos a través del despliegue de modelos de IA en tiempo real. Además, BigBear.ai está demostrando activamente avances con tecnologías que respaldan la autonomía de defensa, incluido ConductorOS para los esfuerzos de desarrollo de formación de drones del DoD, lo que indica un enfoque en el avance de las capacidades autónomas dentro del sector de defensa.",,530965695,USD,BBAI,SMART,STK,False
automotive,autonomous_vehicles,US6821891057,ON SEMICONDUCTOR,35,"Proporciona soluciones de semiconductores esenciales para la detección, el procesamiento y la gestión de energía en sistemas de conducción autónoma.",,,8677881,USD,ON,SMART,STK,True
automotive,autonomous_vehicles,US2315611010,CURTISS-WRIGHT CORP,36,Contribuye al tema de Vehículos Autónomos.,"El compromiso de Curtiss-Wright con los Vehículos Autónomos es evidente en su enfoque estratégico para aprovechar la IA, el aprendizaje automático y los sistemas autónomos dentro de las aplicaciones de defensa. La empresa anticipa que la adopción de estos avances conducirá a apoyar las crecientes demandas tecnológicas, creando nuevas vías para el crecimiento de los ingresos y la expansión de los márgenes. Si bien no es un enfoque principal, la integración de sistemas autónomos se considera un medio para abrir nuevas puertas para Curtiss-Wright.",,6236,USD,CW,SMART,STK,True
automotive,autonomous_vehicles,US2441991054,DEERE & CO,37,Desarrolla equipos agrícolas y de construcción autónomos para mejorar la productividad y la eficiencia en estos sectores.,,,6393,USD,DE,SMART,STK,True
automotive,autonomous_vehicles,US0420682058,ARM HOLDINGS PLC-ADR,38,"Proporciona arquitecturas de procesador fundamentales y propiedad intelectual esencial para las plataformas de computación avanzada que impulsan los vehículos autónomos, permitiendo un procesamiento a bordo eficiente y potente.","El enfoque de ARM en Vehículos Autónomos es evidente a través del lanzamiento de Zena CSS, una plataforma específicamente optimizada para cargas de trabajo automotrices impulsadas por IA, incluidas las aplicaciones de conducción autónoma. La plataforma Zena CSS está diseñada para operar dentro de los planos de control y datos de sistemas autónomos, particularmente en aplicaciones ADAS de L2 a L4. ARM enfatiza la importancia estratégica de esta plataforma para la tecnología de vehículos autónomos.",,653400472,USD,ARM,SMART,STK,False
automotive,autonomous_vehicles,US5494982029,LUCID GROUP INC,39,"Integra sistemas avanzados de asistencia al conductor y capacidades de conducción autónoma en sus vehículos eléctricos, contribuyendo al desarrollo más amplio de tecnologías de autoconducción.","El compromiso de Lucid con los vehículos autónomos está impulsado significativamente por sus asociaciones con Uber y Nuro para desarrollar un robotaxi premium de próxima generación, aprovechando el sistema de autonomía de Nivel 4 de Nuro y la arquitectura de vehículos de Lucid. Esta colaboración tiene como objetivo crear una experiencia de robotaxi totalmente integrada para la plataforma de transporte de Uber, combinando la arquitectura de vehículos definida por software de Lucid con las capacidades de conducción autónoma de Nuro. La compañía y Uber colaborarán con Nuro para desarrollar y desplegar una flota de vehículos autónomos que se utilizarán como robotaxis en la plataforma de Uber, con el compromiso de Uber de comprar un mínimo de 20.000 vehículos Lucid Gravity Plus durante seis años.","[{'name': 'lcid-Q225-10-Q', 'url': 'https://storage.googleapis.com/reflexivity-documents-prod/edgar/filing/10-q/lcid-Q225-10-Q.html'}]",810758322,USD,LCID,SMART,STK,False
automotive,autonomous_vehicles,US76954A1034,RIVIAN AUTOMOTIVE INC-A,40,Participa en el tema de la industria de Vehículos Autónomos.,"El enfoque de Rivian en Vehículos Autónomos es evidente a través del desarrollo y la mejora continua de la Plataforma de Autonomía de Rivian, que la empresa considera una ventaja tecnológica clave. La empresa lanzó una plataforma de segunda generación con mejoras en la pila de percepción y la computación, utilizando un enfoque centrado en la IA y hardware tecnológico integrado verticalmente. Rivian ha lanzado la conducción manos libres con los ojos en la carretera para sus vehículos de segunda generación y se enfoca en ofrecer autonomía curva a curva, con planes de expandirse a funcionalidad manos libres y sin supervisión, incluso planeando un Día de IA y Autonomía para compartir su hoja de ruta de productos y tecnología. La empresa también tiene la intención de ofrecer Rivian Autonomy Platform+ como un servicio de suscripción premium en el futuro.","[{'name': 'rivn-Q225-10-Q', 'url': 'https://storage.googleapis.com/reflexivity-documents-prod/edgar/filing/10-q/rivn-Q225-10-Q.html'}, {'name': 'rivn-FY24-10-K', 'url': 'https://storage.googleapis.com/reflexivity-documents-prod/edgar/filing/10-k/rivn-FY24-10-K.html'}]",525768800,USD,RIVN,SMART,STK,False
automotive,autonomous_vehicles,US49338L1035,KEYSIGHT TECHNOLOGIES IN,41,Aborda aspectos del tema de Vehículos Autónomos.,"La participación de Keysight en Vehículos Autónomos es evidente a través de las continuas inversiones en I+D de sus clientes en esta área, específicamente en tecnologías y aplicaciones de próxima generación. La empresa destaca que sus clientes están progresando en iniciativas estratégicas clave a largo plazo, como la I+D para vehículos definidos por software y la conducción autónoma. A pesar de los retrasos en el gasto a corto plazo, la participación del cliente sigue siendo alta a medida que invierten en vehículos eléctricos y autónomos de próxima generación, lo que indica un interés y dedicación continuos al sector de vehículos autónomos.","[{'name': 'keys-Q225-10-Q', 'url': 'https://storage.googleapis.com/reflexivity-documents-prod/edgar/filing/10-q/keys-Q225-10-Q.html'}, {'name': 'keys-Q324-10-Q', 'url': 'https://storage.googleapis.com/reflexivity-documents-prod/edgar/filing/10-q/keys-Q324-10-Q.html'}, {'name': 'keys-Q125-10-Q', 'url': 'https://storage.googleapis.com/reflexivity-documents-prod/edgar/filing/10-q/keys-Q125-10-Q.html'}, {'name': 'keys-FY24-10-K', 'url': 'https://storage.googleapis.com/reflexivity-documents-prod/edgar/filing/10-k/keys-FY24-10-K.html'}]",170167160,USD,KEYS,SMART,STK,True
automotive,autonomous_vehicles,US5150981018,LANDSTAR SYSTEM INC,42,Está asociado con el tema de la industria de Vehículos Autónomos.,"La participación de Landstar en el tema de Vehículos Autónomos se demuestra a través de su inversión en Cavnue, LLC, una empresa centrada en la integración de tecnología e infraestructura vial para avanzar en vehículos conectados y autónomos. Landstar Investment Holdco, LLC, una subsidiaria de propiedad total, compró unidades de Clase A de Cavnue por aproximadamente $4.999 millones en efectivo. Esta inversión significa el interés de Landstar en el espacio de los vehículos autónomos, aunque representa una participación accionaria minoritaria.","[{'name': 'lstr-FY24-10-K', 'url': 'https://storage.googleapis.com/reflexivity-documents-prod/edgar/filing/10-k/lstr-FY24-10-K.html'}]",271344,USD,LSTR,SMART,STK,True
automotive,autonomous_vehicles,US92839U2069,VISTEON CORP,43,Abarca actividades relacionadas con el tema de Vehículos Autónomos.,"Las plataformas de Visteon utilizan soluciones de hardware y software para apoyar la evolución digital, eléctrica y autónoma de sus clientes automotrices. Como empresa global de tecnología automotriz, Visteon tiene como objetivo mejorar las experiencias de conducción a través de soluciones conectadas y seguras. El enfoque de la empresa incluye la asignación de capital a iniciativas que refuercen las capacidades internas y exploren oportunidades inorgánicas, destacando la importancia de la evolución autónoma para sus prioridades estratégicas.","[{'name': 'vc-Q125-10-Q', 'url': 'https://storage.googleapis.com/reflexivity-documents-prod/edgar/filing/10-q/vc-Q125-10-Q.html'}, {'name': 'vc-FY24-10-K', 'url': 'https://storage.googleapis.com/reflexivity-documents-prod/edgar/filing/10-k/vc-FY24-10-K.html'}, {'name': 'vc-Q324-10-Q', 'url': 'https://storage.googleapis.com/reflexivity-documents-prod/edgar/filing/10-q/vc-Q324-10-Q.html'}]",79565601,USD,VC,SMART,STK,True
automotive,autonomous_vehicles,US90353T1007,UBER TECHNOLOGIES INC,44,Explora e integra tecnología de conducción autónoma para mejorar su red de transporte y entrega.,"El compromiso de Uber con los Vehículos Autónomos es evidente a través de múltiples asociaciones y despliegues. La empresa ha ampliado las zonas de operación con Waymo y WeRide, lanzando exclusivamente con Waymo en Atlanta, y anunciando asociaciones con Baidu, Lucid, Nuro y Wayve. Uber está aumentando significativamente los despliegues autónomos en EE. UU. e internacionalmente, invirtiendo en actores de software y hardware en el espacio autónomo. La alta utilización de los vehículos Waymo en la red de Uber, que supera el 99% de sus conductores en términos de viajes, demuestra aún más el compromiso y la inversión de la empresa en tecnología de vehículos autónomos.",,365207014,USD,UBER,SMART,STK,True
automotive,autonomous_vehicles,US03937C1053,ARCBEST CORP,45,Explora la integración de tecnologías de vehículos autónomos para mejorar las operaciones futuras de logística y transporte.,"La participación de ArcBest con vehículos autónomos se refleja en su inversión de capital anterior en Phantom Auto, un proveedor de software de operación remota; sin embargo, esta inversión se canceló debido a que Phantom Auto cesó sus operaciones durante el primer trimestre de 2024. ArcBest también está invirtiendo en carretillas elevadoras y retráctiles robóticas móviles autónomas, como parte de su conjunto de hardware y software Vaux™, que moderniza y transforma la forma en que se maneja la carga en las operaciones de almacén y muelle. Estos robots combinan software inteligente y capacidad de teleoperación remota para manejar de forma independiente el movimiento de materiales dentro de almacenes, centros de distribución y plantas de fabricación, mientras son monitoreados por humanos.","[{'name': 'arcb-Q125-10-Q', 'url': 'https://storage.googleapis.com/reflexivity-documents-prod/edgar/filing/10-q/arcb-Q125-10-Q.html'}, {'name': 'arcb-FY24-10-K', 'url': 'https://storage.googleapis.com/reflexivity-documents-prod/edgar/filing/10-k/arcb-FY24-10-K.html'}]",150304976,USD,ARCB,SMART,STK,True
