type,link_type,key,name,rank,description,evidence,evidenceSources,conid,currency,symbol,exchange,assetType,navigable
automotive,autonomous_vehicles,US88160R1014,TESLA INC,1,"Desarrolla e implementa tecnología avanzada de conducción autónoma en sus vehículos, con el objetivo de lograr la autonomía total y mejorar la seguridad y la comodidad de los conductores.","La participación de Tesla en vehículos autónomos es evidente a través de su desarrollo y despliegue continuo de capacidades de conducción totalmente autónoma (FSD) y la creación del Robotaxi, Cybercab, diseñado específicamente. La compañía ha lanzado con éxito servicios de robotaxi en Austin, brindando viajes sin conductor, y está buscando activamente aprobaciones regulatorias para la expansión a nuevas áreas. El compromiso de Tesla se ve aún más subrayado por su enfoque en automóviles autónomos y robotaxis a gran escala, utilizando IA y un chip de IA diseñado por Tesla para lograr una solución general para la autonomía, y la próxima fase de crecimiento de la producción se está iniciando con avances en este campo.","[{'name': 'tsla-Q225-10-Q', 'url': 'https://storage.googleapis.com/reflexivity-documents-prod/edgar/filing/10-q/tsla-Q225-10-Q.html'}, {'name': 'tsla-FY24-10-K', 'url': 'https://storage.googleapis.com/reflexivity-documents-prod/edgar/filing/10-k/tsla-FY24-10-K.html'}, {'name': 'tsla-Q125-10-Q', 'url': 'https://storage.googleapis.com/reflexivity-documents-prod/edgar/filing/10-q/tsla-Q125-10-Q.html'}, {'name': 'tsla-Q324-10-Q', 'url': 'https://storage.googleapis.com/reflexivity-documents-prod/edgar/filing/10-q/tsla-Q324-10-Q.html'}]",76792991,USD,TSLA,SMART,STK,True
automotive,autonomous_vehicles,US67066G1040,NVIDIA CORP,2,"Desarrolla plataformas integrales de computación de IA, que incluyen hardware y software, que son esenciales para el desarrollo, entrenamiento y despliegue de automóviles autónomos y sistemas autónomos.","El compromiso de NVIDIA con los Vehículos Autónomos es evidente a través de sus plataformas de conducción autónoma, que contribuyen significativamente a los ingresos del sector automotriz. Esto se demuestra con un notable aumento interanual de los ingresos del sector automotriz, impulsado por estas plataformas. Las soluciones de la empresa, como el SoC NVIDIA Thor y la plataforma de software Drive AV, están en producción y son utilizadas por empresas como Hyundai para el diseño de fábricas y la validación de vehículos autónomos. Además, el reconocimiento de NVIDIA en el Autonomous Grand Challenge subraya su papel activo en el avance de la tecnología de vehículos autónomos.","[{'name': 'nvda-Q325-10-Q', 'url': 'https://storage.googleapis.com/reflexivity-documents-prod/edgar/filing/10-q/nvda-Q325-10-Q.html'}, {'name': 'nvda-FY25-10-K', 'url': 'https://storage.googleapis.com/reflexivity-documents-prod/edgar/filing/10-k/nvda-FY25-10-K.html'}, {'name': 'nvda-Q225-10-Q', 'url': 'https://storage.googleapis.com/reflexivity-documents-prod/edgar/filing/10-q/nvda-Q225-10-Q.html'}, {'name': 'nvda-Q126-10-Q', 'url': 'https://storage.googleapis.com/reflexivity-documents-prod/edgar/filing/10-q/nvda-Q126-10-Q.html'}]",4815747,USD,NVDA,SMART,STK,True
automotive,autonomous_vehicles,US60741F1049,MOBILEYE GLOBAL INC-A,3,"Desarrolla sistemas avanzados de asistencia al conductor y tecnologías de conducción autónoma, proporcionando soluciones críticas que permiten el desarrollo y la implementación de vehículos autónomos.","Mobileye está significativamente invertida en tecnología de vehículos autónomos, particularmente a través de su sistema Mobileye Drive e iniciativas de robotaxi. La compañía está desarrollando y desplegando activamente sistemas de conducción autónoma, con alianzas establecidas con Volkswagen, Holon, Lyft y Uber para integrar su tecnología en servicios de robotaxi. Mobileye está en camino de lanzar robotaxis sin conductor para finales de 2026, utilizando su ECU basada en EyeQ6 High, DRIVE 64, y se enfoca en permitir la adopción masiva de vehículos autónomos a través de su conjunto integral de tecnologías de software y hardware.","[{'name': 'mbly-Q225-10-Q', 'url': 'https://storage.googleapis.com/reflexivity-documents-prod/edgar/filing/10-q/mbly-Q225-10-Q.html'}, {'name': 'mbly-FY24-10-K', 'url': 'https://storage.googleapis.com/reflexivity-documents-prod/edgar/filing/10-k/mbly-FY24-10-K.html'}]",593660024,USD,MBLY,SMART,STK,False
automotive,autonomous_vehicles,KYG651631007,JOBY AVIATION INC,4,"Desarrolla vehículos aéreos autónomos, contribuyendo a la evolución más amplia de los sistemas de transporte de autoconducción.","La participación de Joby en vehículos autónomos es evidente a través de su desarrollo de aeronaves híbridas para la defensa de EE. UU., combinando capacidades VTOL con tecnologías de vuelo autónomo en colaboración con L3Harris. Esta asociación tiene como objetivo entregar aeronaves autónomas e híbridas, lo que se enfatiza aún más en la distinción de Joby como la única empresa en proporcionar eVTOL a una base de la Fuerza Aérea de EE. UU. y realizar misiones tanto pilotadas como no pilotadas. Si bien el DOD ha cambiado su enfoque hacia estas tecnologías, lo que ha llevado a ajustes en los contratos existentes, Joby está buscando activamente nuevos contratos e invirtiendo en tecnología de hidrógeno-eléctrica y autónoma para capitalizar las oportunidades emergentes dentro del sector de la defensa.","[{'name': 'joby-Q225-10-Q', 'url': 'https://storage.googleapis.com/reflexivity-documents-prod/edgar/filing/10-q/joby-Q225-10-Q.html'}]",507188246,USD,JOBY,SMART,STK,False
automotive,autonomous_vehicles,US37045V1008,GENERAL MOTORS CO,5,"Desarrolla y despliega tecnología de vehículos autónomos a través de su subsidiaria dedicada, con el objetivo de integrar capacidades autónomas en futuras soluciones de transporte.","La participación de GM en el tema de Vehículos Autónomos es evidente a través de sus continuos esfuerzos de desarrollo y comercialización, principalmente a través de Cruise, que está probando activamente vehículos autónomos y planeando un regreso a las operaciones comerciales sin conductor. Este compromiso está respaldado además por el enfoque estratégico de GM en la tecnología de AV personal, incluidas las inversiones en ADAS y Super Cruise, que guía el desarrollo de vehículos personales autónomos. Si bien GM ha reenfocado su estrategia de conducción autónoma en vehículos personales y ha combinado esfuerzos técnicos de Cruise y GM, la compañía todavía está priorizando el desarrollo de ADAS como un camino hacia vehículos personales totalmente autónomos, lo que refleja su visión de un futuro con cero accidentes y cero congestión.","[{'name': 'gm-Q125-10-Q', 'url': 'https://storage.googleapis.com/reflexivity-documents-prod/edgar/filing/10-q/gm-Q125-10-Q.html'}, {'name': 'gm-Q225-10-Q', 'url': 'https://storage.googleapis.com/reflexivity-documents-prod/edgar/filing/10-q/gm-Q225-10-Q.html'}, {'name': 'gm-Q324-10-Q', 'url': 'https://storage.googleapis.com/reflexivity-documents-prod/edgar/filing/10-q/gm-Q324-10-Q.html'}, {'name': 'gm-FY24-10-K', 'url': 'https://storage.googleapis.com/reflexivity-documents-prod/edgar/filing/10-k/gm-FY24-10-K.html'}]",80986742,USD,GM,SMART,STK,True
automotive,autonomous_vehicles,US6668071029,NORTHROP GRUMMAN CORP,6,Desarrolla e integra tecnologías relevantes para el sector de Vehículos Autónomos.,"La participación de Northrop Grumman en Vehículos Autónomos es evidente a través del desarrollo de Beacon, un banco de pruebas de misiones voladoras diseñado para acelerar las capacidades de misiones autónomas. Esta iniciativa aprovecha la amplia experiencia de la empresa, que incluye décadas de trabajo y 500.000 horas de vuelo autónomo, para apoyar el avance de los sistemas autónomos de próxima generación. Al integrar software y hardware, Beacon permite a los socios de la industria acelerar su progreso en autonomía, destacando el papel de Northrop Grumman en el fomento de la innovación dentro del sector.",,10376,USD,NOC,SMART,STK,True
automotive,autonomous_vehicles,US0517741072,AURORA INNOVATION INC,7,"Desarrolla el Aurora Driver, una tecnología de conducción autónoma diseñada para operar de manera segura y eficiente camiones y vehículos de pasajeros autónomos, contribuyendo al avance de la movilidad autónoma.","El enfoque de Aurora en vehículos autónomos es evidente a través del desarrollo de Aurora Driver, un sistema de autoconducción diseñado para integrarse en diversas plataformas de vehículos, incluidos vehículos de pasajeros, vehículos comerciales ligeros y camiones Clase 8. La compañía ha lanzado operaciones comerciales de transporte de carga sin conductor en carreteras públicas en los EE. UU., con camiones impulsados por Aurora Driver realizando entregas entre Dallas y Houston, y ha recorrido más de 20,000 millas seguras sin conductor. Además, Aurora está expandiendo activamente sus rutas comerciales y trabajando para validar operaciones sin conductor en condiciones climáticas más desafiantes, asociándose con empresas como Volvo y PACCAR para desarrollar camiones autónomos.","[{'name': 'aur-Q125-10-Q', 'url': 'https://storage.googleapis.com/reflexivity-documents-prod/edgar/filing/10-q/aur-Q125-10-Q.html'}, {'name': 'aur-FY24-10-K', 'url': 'https://storage.googleapis.com/reflexivity-documents-prod/edgar/filing/10-k/aur-FY24-10-K.html'}, {'name': 'aur-Q225-10-Q', 'url': 'https://storage.googleapis.com/reflexivity-documents-prod/edgar/filing/10-q/aur-Q225-10-Q.html'}]",524706371,USD,AUR,SMART,STK,False
automotive,autonomous_vehicles,US4581401001,INTEL CORP,8,"Desarrolla plataformas informáticas avanzadas y procesadores especializados críticos para las necesidades de procesamiento, inteligencia artificial y conectividad de los sistemas de conducción autónoma.",,,270639,USD,INTC,SMART,STK,True
automotive,autonomous_vehicles,US02079K3059,ALPHABET INC-CL A,9,"Desarrolla tecnología avanzada de conducción autónoma a través de Waymo, proporcionando servicios de transporte autónomo y contribuyendo al avance del transporte totalmente sin conductor.","La participación de Google en el tema de Vehículos Autónomos es principalmente a través de Waymo, que está generando ingresos de servicios de transporte autónomo. Waymo está experimentando un crecimiento sustancial, demostrado por un aumento significativo en los viajes pagados de pasajeros y la expansión a nuevas ciudades, incluidas asociaciones con Uber. Además, Google está invirtiendo en el desarrollo de modelos de IA para robótica, incluidos nuevos modelos Gemini Robotics, lo que indica un interés continuo en tecnologías autónomas.","[{'name': 'googl-Q225-10-Q', 'url': 'https://storage.googleapis.com/reflexivity-documents-prod/edgar/filing/10-q/googl-Q225-10-Q.html'}]",208813719,USD,GOOGL,SMART,STK,True
automotive,autonomous_vehicles,US5024311095,L3HARRIS TECHNOLOGIES INC,10,"Proporciona tecnologías críticas de detección, comunicación y navegación esenciales para el desarrollo y despliegue de vehículos autónomos en los sectores de defensa, inteligencia y comercial.","L3Harris está involucrada en el tema de Vehículos Autónomos a través de inversiones aceleradas en plataformas autónomas. Esto incluye trabajos con Palantir en el programa Titan del Ejército de EE. UU., con entregas iniciales de vehículos definidos por IA equipados con enlaces de datos y SATCOM seguro. La empresa identifica las plataformas autónomas como una fortaleza central, lo que se refleja en sus esfuerzos para permitir un procesamiento de datos más rápido y efectivo en el campo de batalla para el Ejército.",,371886040,USD,LHX,SMART,STK,True
automotive,autonomous_vehicles,KYG070341048,BAIDU INC-CLASS A,11,"Se enfoca en el desarrollo y comercialización de tecnología de conducción autónoma, incluida su plataforma Apollo, que sustenta los servicios de robotaxi y las soluciones de vehículos inteligentes.",,,476787454,HKD,9888,SEHK,STK,False
automotive,autonomous_vehicles,US0567521085,BAIDU INC - SPON ADR,12,"Desarrolla soluciones avanzadas de conducción autónoma, incluida su plataforma Apollo, contribuyendo significativamente a la investigación, desarrollo y comercialización de vehículos autónomos y tecnologías relacionadas.",,,35359385,USD,BIDU,SMART,STK,False
automotive,autonomous_vehicles,JP3633400001,TOYOTA MOTOR CORP,13,"Desarrolla e integra tecnologías avanzadas de conducción autónoma en su línea de vehículos, contribuyendo a la evolución de las soluciones de movilidad autónoma.",,,13905804,JPY,7203,SMART,STK,False
automotive,autonomous_vehicles,JE00BTDN8H13,APTIV PLC,14,Desarrolla e integra sistemas de seguridad avanzados y plataformas de conducción autónoma esenciales para el progreso de la tecnología de vehículos autoconducidos.,"El compromiso de Aptiv con el tema de Vehículos Autónomos es evidente a través de su enfoque estratégico en habilitar soluciones de movilidad inteligente y acelerar la comercialización de tecnologías de seguridad activa y conducción autónoma. La empresa está desarrollando activamente soluciones de conducción automatizada líderes en el mercado, incluyendo software y tecnologías de sensores, y está suministrando componentes a programas de vehículos autónomos. Además, la empresa conjunta de Aptiv, Motional, se dedica al diseño, desarrollo y comercialización de tecnologías de conducción autónoma, incluyendo pruebas de sistemas completamente sin conductor y plataformas de conducción autónoma.","[{'name': 'aptv-Q324-10-Q', 'url': 'https://storage.googleapis.com/reflexivity-documents-prod/edgar/filing/10-q/aptv-Q324-10-Q.html'}, {'name': 'aptv-FY24-10-K', 'url': 'https://storage.googleapis.com/reflexivity-documents-prod/edgar/filing/10-k/aptv-FY24-10-K.html'}]",748351585,USD,APTV,SMART,STK,True
automotive,autonomous_vehicles,DE0005439004,CONTINENTAL AG,15,Permite avances dentro del sector de Vehículos Autónomos.,,,14106,EUR,CON,SMART,STK,False
automotive,autonomous_vehicles,US65345N1063,NEXTNAV INC,16,Facilita el progreso en el sector de Vehículos Autónomos.,"La participación de la compañía en vehículos autónomos se destaca por su énfasis en la necesidad de datos precisos de Posicionamiento, Navegación y Sincronización (PNT) para aplicaciones de IA dentro de este sector. El CEO cita consistentemente los vehículos autónomos como un ejemplo clave de casos de uso de IA que dependen de datos precisos en tiempo real y PNT resilientes, advirtiendo que datos PNT incorrectos pueden conducir a resultados peligrosos y erróneos. Además, la compañía subraya que el PNT resiliente sirve como un elemento fundamental para la IA en vehículos autónomos, siendo la ubicación y la sincronización precisas críticas para la toma de decisiones efectiva de la IA.",,523778418,USD,NN,SMART,STK,False
automotive,autonomous_vehicles,US0231351067,AMAZON.COM INC,17,"Desarrolla e invierte en tecnología de conducción autónoma, incluidos robotaxis y posibles aplicaciones para servicios de logística y entrega.","El compromiso de Amazon con el tema de Vehículos Autónomos es evidente a través de su inversión en el desarrollo de vehículos autónomos para servicios de transporte compartido. Esta iniciativa se destaca en el contexto de los costos de tecnología e infraestructura, lo que refleja los esfuerzos más amplios de la empresa para ofrecer una amplia gama de productos y servicios. El enfoque de Amazon incluye la construcción y el despliegue de software y dispositivos electrónicos innovadores, junto con el desarrollo de una red de satélites, siendo los vehículos autónomos para servicios de transporte compartido un componente de estas iniciativas. Las inversiones de la empresa en tecnología e infraestructura abarcan la nómina y los gastos relacionados para los empleados involucrados en la investigación y el desarrollo de productos y servicios nuevos y existentes.","[{'name': 'amzn-Q125-10-Q', 'url': 'https://storage.googleapis.com/reflexivity-documents-prod/edgar/filing/10-q/amzn-Q125-10-Q.html'}, {'name': 'amzn-Q225-10-Q', 'url': 'https://storage.googleapis.com/reflexivity-documents-prod/edgar/filing/10-q/amzn-Q225-10-Q.html'}, {'name': 'amzn-Q324-10-Q', 'url': 'https://storage.googleapis.com/reflexivity-documents-prod/edgar/filing/10-q/amzn-Q324-10-Q.html'}, {'name': 'amzn-FY24-10-K', 'url': 'https://storage.googleapis.com/reflexivity-documents-prod/edgar/filing/10-k/amzn-FY24-10-K.html'}]",3691937,USD,AMZN,SMART,STK,True
automotive,autonomous_vehicles,KR7005380001,HYUNDAI MOTOR CO,18,"Desarrolla e integra tecnologías avanzadas de conducción autónoma en sus vehículos, contribuyendo a la evolución de las capacidades de autoconducción dentro de la industria automotriz.",,,17382507,KRW,005380,KSE,STK,False
automotive,autonomous_vehicles,JP3551500006,DENSO CORP,19,"Proporciona componentes y sistemas avanzados, como sensores, unidades de control electrónico y software, que son integrales para el desarrollo y la implementación de tecnologías de conducción autónoma.",,,13905745,JPY,6902,SMART,STK,False
automotive,autonomous_vehicles,US0382221051,APPLIED MATERIALS INC,20,"Proporciona equipos y materiales críticos para la fabricación de semiconductores que permiten la producción de chips avanzados esenciales para sistemas de conducción autónoma, incluidos sensores y procesadores de IA.","La empresa reconoce que los vehículos autónomos, junto con otras tecnologías como la IA, el IoT y el 5G, son impulsores emergentes del mercado final que crean la próxima ola de crecimiento para la industria de los semiconductores. Su segmento de Sistemas de Semiconductores atiende a clientes cuyos productos se utilizan en vehículos eléctricos y autónomos. Los productos de la empresa se utilizan en diversas aplicaciones, incluidos los automóviles, y reconocen los vehículos eléctricos y autónomos como impulsores de crecimiento.","[{'name': 'amat-FY24-10-K', 'url': 'https://storage.googleapis.com/reflexivity-documents-prod/edgar/filing/10-k/amat-FY24-10-K.html'}, {'name': 'amat-Q225-10-Q', 'url': 'https://storage.googleapis.com/reflexivity-documents-prod/edgar/filing/10-q/amat-Q225-10-Q.html'}, {'name': 'amat-Q125-10-Q', 'url': 'https://storage.googleapis.com/reflexivity-documents-prod/edgar/filing/10-q/amat-Q125-10-Q.html'}]",266093,USD,AMAT,SMART,STK,True
automotive,autonomous_vehicles,US3453708600,FORD MOTOR CO,21,"Se centra en el desarrollo e integración de tecnologías de conducción autónoma en su futura línea de vehículos, con el objetivo de mejorar la seguridad y la comodidad.","Ford está desarrollando activamente sistemas autónomos de Nivel 3 y explorando oportunidades de servicios de gestión de flotas para flotas comerciales de Nivel 4 a través de Ford Pro, lo que indica una inversión continua en tecnología de vehículos autónomos. Sin embargo, Ford Next ha cambiado su enfoque de invertir principalmente en el desarrollo de capacidades de vehículos autónomos a incubar y lanzar nuevos negocios, lo que sugiere un compromiso evolutivo con el tema. Si bien Ford está progresando en su sistema de Nivel 3 y continuará actualizando las mejoras de BlueCruise, su enfoque principal ahora está en la gestión de flotas grandes de Nivel 4, particularmente en lo que respecta a repuestos y servicio.","[{'name': 'f-FY24-10-K', 'url': 'https://storage.googleapis.com/reflexivity-documents-prod/edgar/filing/10-k/f-FY24-10-K.html'}]",9599491,USD,F,SMART,STK,True
automotive,autonomous_vehicles,US6882392011,OSHKOSH CORP,22,Mantiene una presencia en el tema de Vehículos Autónomos.,"La participación de Oshkosh con Vehículos Autónomos es evidente a través de su desarrollo y aprovechamiento de tecnologías disruptivas en autonomía en toda su cartera. Esto se demuestra aún más por las inversiones de Oshkosh AeroTech en vehículos autónomos de manipulación de equipaje y su enfoque en aplicar capacidades tecnológicas, incluida la funcionalidad autónoma, para reducir costos. La empresa se especializa en el diseño, desarrollo y fabricación de vehículos y equipos especialmente diseñados, integrando innovaciones en electrificación, autonomía y conectividad para mejorar la eficiencia y el impacto.","[{'name': 'osk-FY24-10-K', 'url': 'https://storage.googleapis.com/reflexivity-documents-prod/edgar/filing/10-k/osk-FY24-10-K.html'}]",272856,USD,OSK,SMART,STK,True
automotive,autonomous_vehicles,FR0013176526,VALEO,23,Desarrolla y suministra sistemas avanzados de asistencia al conductor y tecnologías de sensores esenciales para permitir capacidades de conducción autónoma en vehículos.,,,235161255,EUR,FR,SMART,STK,False
automotive,autonomous_vehicles,US87151X1019,SYMBOTIC INC,24,Contribuye a la temática de Vehículos Autónomos.,"El compromiso de la compañía con los Vehículos Autónomos es evidente en su utilización de robots totalmente autónomos, que son controlados por software de sistema habilitado por inteligencia artificial para mejorar las operaciones de la cadena de suministro. Estos robots automatizan procesos de almacenamiento como despaletización, almacenamiento, selección y paletización. La compañía cree que este enfoque puede convertirse en el estándar para las operaciones de almacén, diferenciando su solución en el mercado.","[{'name': 'sym-Q225-10-Q', 'url': 'https://storage.googleapis.com/reflexivity-documents-prod/edgar/filing/10-q/sym-Q225-10-Q.html'}]",566188877,USD,SYM,SMART,STK,False
automotive,autonomous_vehicles,US5253271028,LEIDOS HOLDINGS INC,25,No hay evidencia específica disponible para describir la relación de la empresa con el tema de los Vehículos Autónomos.,"El compromiso de Leidos con los Vehículos Autónomos está impulsado significativamente por sus capacidades de autonomía marítima, como lo demuestra su Arquitectura de Embarcaciones Autónomas de Leidos (LAVA) y su uso en embarcaciones de superficie y submarinas no tripuladas. La compañía destaca su alineación con los planes de la Marina de los EE. UU. para desplegar flotas integradas de vehículos tripulados y no tripulados, solidificando aún más su posición en la autonomía marítima. Esto se ve reforzado por la contratación de Leidos por parte de la Marina de los EE. UU. para inspeccionar buques comerciales para su posible conversión a embarcaciones de superficie no tripuladas medianas autónomas, y la asignación de fondos para embarcaciones autónomas y software relacionado en el proyecto de ley de conciliación fiscal de 2025.",,134280621,USD,LDOS,SMART,STK,True
automotive,autonomous_vehicles,US6752321025,OCEANEERING INTL INC,26,"Desarrolla y proporciona soluciones y sistemas robóticos autónomos para entornos complejos y peligrosos, contribuyendo a la aplicación más amplia de tecnologías de vehículos autónomos en operaciones industriales y submarinas especializadas.","La participación de OII en Vehículos Autónomos es evidente a través de su segmento de Productos Fabricados, que proporciona soluciones integrales, incluyendo gestión de programas, diseño de ingeniería, fabricación/ensamblaje e instalación de tecnología robótica móvil autónoma en diversos sectores como el industrial, manufacturero, sanitario, de almacenes y parques temáticos comerciales. Sin embargo, este segmento ha experimentado márgenes más bajos en sus negocios de robótica móvil, lo que refleja los costos de los proyectos incipientes de sistemas de transporte autónomo. Los negocios de robótica móvil de la empresa también reflejan los costos de los proyectos incipientes de sistemas de transporte autónomo, lo que indica un impacto financiero, aunque dentro del contexto más amplio de una mayor actividad en negocios relacionados con la energía.","[{'name': 'oii-Q324-10-Q', 'url': 'https://storage.googleapis.com/reflexivity-documents-prod/edgar/filing/10-q/oii-Q324-10-Q.html'}, {'name': 'oii-FY24-10-K', 'url': 'https://storage.googleapis.com/reflexivity-documents-prod/edgar/filing/10-k/oii-FY24-10-K.html'}]",10780,USD,OII,SMART,STK,True
automotive,autonomous_vehicles,NL0009538784,NXP SEMICONDUCTORS NV,27,"Proporciona soluciones críticas de semiconductores que permiten funciones de detección, procesamiento y control esenciales para los sistemas de vehículos autónomos.","La participación de NXP en la industria de Vehículos Autónomos es evidente a través de su negocio automotriz, que incluye productos de seguridad ADAS. El enfoque de la empresa en la tecnología de radar, impulsado por los crecientes niveles de ADAS, y su anticipación de taxis robot más generalizados, subrayan aún más su compromiso. Reforzando este compromiso, NXP adquirió TTTech Auto para potenciar sus capacidades en vehículos definidos por software.","[{'name': 'nxpi-Q324-10-Q', 'url': 'https://storage.googleapis.com/reflexivity-documents-prod/edgar/filing/10-q/nxpi-Q324-10-Q.html'}]",77791077,USD,NXPI,SMART,STK,True
