type,link_type,key,name,rank,description,evidence,evidenceSources,conid,currency,symbol,exchange,assetType,navigable
financials,banking_technology,US2987361092,EURONET WORLDWIDE INC,34,Ofrece procesamiento de transacciones electrónicas y servicios de cajeros automáticos que son integrales para la infraestructura operativa del sector bancario.,"Euronet participa significativamente en la tecnología bancaria a través de su plataforma Ren, que es utilizada por bancos de todo el mundo para ofrecer un servicio al cliente moderno y en tiempo real. Esta plataforma impulsa miles de cajeros automáticos en los EE. UU. para un banco importante de EE. UU., y Euronet ha asegurado acuerdos con bancos internacionales como Santander, Security Bank, Axis Bank y May Bank para potenciar sus servicios con Ren. Además, Dandelion Wholesale de Euronet proporciona cumplimiento de grado bancario y soluciones de depósito en tiempo real, mejorando su posición en la entrega de soluciones bancarias innovadoras reconocidas por los líderes de la industria.",,4729968,USD,EEFT,SMART,STK,True
financials,banking_technology,US63947X1019,NCINO INC,35,Desarrolla un sistema operativo basado en la nube diseñado para mejorar la eficiencia y la experiencia del cliente de las instituciones financieras.,"El enfoque de nCino en Tecnología Bancaria es evidente a través de su plataforma SaaS nativa en la nube, que permite a las instituciones financieras gestionar préstamos, incorporación, apertura de cuentas y gestión de carteras en diversas líneas de negocio. La plataforma aborda los desafíos relacionados con la tecnología heredada y la infraestructura fragmentada al ofrecer automatización inteligente y un sistema unificado. Al ayudar a las instituciones financieras a modernizar sus operaciones, incorporar clientes y gestionar el ciclo de vida de los préstamos, nCino demuestra su compromiso de proporcionar soluciones integrales de tecnología bancaria.","[{'name': 'ncno-Q325-10-Q', 'url': 'https://storage.googleapis.com/reflexivity-documents-prod/edgar/filing/10-q/ncno-Q325-10-Q.html'}]",537162956,USD,NCNO,SMART,STK,False
financials,banking_technology,US6658591044,NORTHERN TRUST CORP,36,"Aprovecha e invierte en soluciones tecnológicas avanzadas para mejorar sus operaciones bancarias, servicios al cliente y ofertas financieras digitales.",,,272565,USD,NTRS,SMART,STK,True
financials,banking_technology,US0185811082,BREAD FINANCIAL HOLDINGS INC,37,"Aprovecha la tecnología bancaria para ofrecer productos y servicios financieros, mejorando la eficiencia operativa y la experiencia del cliente.","La autodescripción de la empresa como una 'empresa de servicios financieros tecnológicamente avanzada' indica su participación en la tecnología bancaria. Si bien la empresa ofrece soluciones de pago, préstamos y ahorro, su énfasis en la tecnología sugiere un papel en sus operaciones. Sin embargo, la ausencia de detalles específicos o contribuciones de ingresos relacionadas con la tecnología bancaria implica que no es un pilar estratégico central.","[{'name': 'bfh-Q225-10-Q', 'url': 'https://storage.googleapis.com/reflexivity-documents-prod/edgar/filing/10-q/bfh-Q225-10-Q.html'}]",12362013,USD,BFH,SMART,STK,True
financials,banking_technology,US7841171033,SEI INVESTMENTS COMPANY,38,Proporciona soluciones de externalización tecnológica y operativa que apoyan a las instituciones bancarias en la gestión de sus operaciones y procesos de inversión.,,,274224,USD,SEIC,SMART,STK,True
financials,banking_technology,US29357K1034,ENOVA INTERNATIONAL INC,39,Proporciona soluciones de tecnología financiera que respaldan y mejoran varios aspectos de las operaciones bancarias.,"El enfoque de Enova en Tecnología Bancaria es evidente en su operación como una empresa de tecnología y análisis que brinda servicios financieros en línea. La empresa aprovecha tecnología propietaria, análisis y capacidades de servicio al cliente para agilizar la evaluación, suscripción y financiación de préstamos para consumidores y pequeñas empresas. Enova también opera una plataforma de préstamos basada en Internet con tecnología flexible y escalable, utilizando datos recopilados del comportamiento del cliente para refinar sus procesos de análisis y suscripción.","[{'name': 'enva-Q225-10-Q', 'url': 'https://storage.googleapis.com/reflexivity-documents-prod/edgar/filing/10-q/enva-Q225-10-Q.html'}]",171878394,USD,ENVA,SMART,STK,True
financials,banking_technology,PR30040P1032,EVERTEC INC,40,Proporciona soluciones tecnológicas críticas y servicios de procesamiento de pagos que sustentan las operaciones bancarias y las transacciones financieras en los mercados que atiende.,"La participación de Evertec en la Tecnología Bancaria es evidente a través de su provisión de un conjunto integral de servicios para la banca central, que abarca la externalización de tecnología, la supervisión de fraudes en transacciones de pago y soluciones de gestión de procesos de negocio que incluyen el procesamiento de la banca central. Las soluciones de la empresa se extienden a la concesión de licencias, soporte, mantenimiento e implementación de software utilizado para productos financieros como la banca central, crédito, inversiones y incorporación digital. Además, Evertec facilita servicios de procesamiento de pagos, permitiendo a las instituciones financieras gestionar programas de tarjetas de crédito, débito, cajeros automáticos y EBT, además de proporcionar acceso a la red de débito ATH y gestionar transacciones de cajeros automáticos y TPV.","[{'name': 'evtc-Q324-10-Q', 'url': 'https://storage.googleapis.com/reflexivity-documents-prod/edgar/filing/10-q/evtc-Q324-10-Q.html'}, {'name': 'evtc-FY24-10-K', 'url': 'https://storage.googleapis.com/reflexivity-documents-prod/edgar/filing/10-k/evtc-FY24-10-K.html'}, {'name': 'evtc-Q225-10-Q', 'url': 'https://storage.googleapis.com/reflexivity-documents-prod/edgar/filing/10-q/evtc-Q225-10-Q.html'}, {'name': 'evtc-Q125-10-Q', 'url': 'https://storage.googleapis.com/reflexivity-documents-prod/edgar/filing/10-q/evtc-Q125-10-Q.html'}]",125661037,USD,EVTC,SMART,STK,True
financials,banking_technology,FR0000050809,SOPRA STERIA GROUP,41,Está activa en el sector de tecnología bancaria.,,,1322102,EUR,SOP,SMART,STK,False
financials,banking_technology,US70932M1071,PENNYMAC FINANCIAL SERVICES,42,Aprovecha la tecnología para mejorar sus operaciones de servicios financieros y sus capacidades digitales dentro del sector bancario.,"El compromiso de PennyMac con la tecnología bancaria es evidente en su enfoque en la implementación de nuevas tecnologías para impulsar la eficiencia y reducir los costos. La empresa enfatiza su tecnología y procesos líderes en la industria, respaldados por tecnologías patentadas de primer nivel con capacidades avanzadas. PennyMac también está integrando activamente la IA para mejorar los procesos y el servicio al cliente, incluido el establecimiento de un equipo de IA dentro de su grupo de tecnología para identificar e implementar oportunidades de IA. Este compromiso se extiende a la expansión de su negocio de subadministración, aprovechando la tecnología para ofrecer una propuesta de valor convincente a los propietarios de MSR.",,339976292,USD,PFSI,SMART,STK,False
financials,banking_technology,US05465C1009,AXOS FINANCIAL INC,43,Integra tecnología bancaria avanzada para mejorar sus servicios financieros digitales y su eficiencia operativa.,"La participación de la compañía en Tecnología Bancaria es evidente en su autodescripción como una 'compañía de servicios financieros diversificada y orientada a la tecnología', respaldada por inversiones en tecnología. Sus plataformas tecnológicas centradas en el cliente ofrecen soluciones de banca, compensación, custodia y asesoramiento de inversiones tanto a clientes minoristas como empresariales. La compañía enfatiza su enfoque impulsado por la tecnología y la provisión de soluciones de banca, compensación, custodia y asesoramiento de inversiones, lo que indica una dependencia de la tecnología bancaria.","[{'name': 'ax-Q325-10-Q', 'url': 'https://storage.googleapis.com/reflexivity-documents-prod/edgar/filing/10-q/ax-Q325-10-Q.html'}]",333107927,USD,AX,SMART,STK,True
financials,banking_technology,US6311031081,NASDAQ INC,44,Proporciona tecnología y soluciones de infraestructura de mercado críticas que respaldan las operaciones y actividades de negociación de instituciones bancarias y financieras.,"El enfoque de Nasdaq en la tecnología bancaria es evidente en las inversiones de sus clientes en la modernización de la infraestructura, la mejora de la gestión de riesgos y el cumplimiento normativo, y la lucha contra el fraude financiero dentro de los sectores bancario y de mercados de capitales. Nasdaq Verafin demuestra innovación de productos en todos los segmentos de clientes, incluidos bancos de Nivel 1 y Nivel 2, a través de su estrategia de ""land and expand"" (captación y expansión), que incluye nuevas contrataciones, ventas cruzadas y ventas adicionales. Además, Nasdaq Boardvantage se vendió a un gran banco internacional, lo que destaca la participación de la empresa en la provisión de soluciones tecnológicas a la industria bancaria.",,29380756,USD,NDAQ,SMART,STK,True
financials,banking_technology,US75960P1049,REMITLY GLOBAL INC,45,Opera en el sector de Tecnología Bancaria.,,,516382772,USD,RELY,SMART,STK,False
financials,banking_technology,IL0011858912,PAGAYA TECHNOLOGIES LTD -A,46,"Desarrolla soluciones de evaluación crediticia y gestión de riesgos impulsadas por inteligencia artificial, lo que permite a las instituciones financieras mejorar sus procesos de préstamo.","El negocio de Pagaya se centra en la provisión de soluciones tecnológicas bancarias, y la compañía aspira a convertirse en un socio tecnológico de préstamos de confianza para el ecosistema de finanzas de consumo. Pagaya implementa ciencia de datos sofisticada y tecnología impulsada por IA para mejorar los resultados de las instituciones financieras, sus clientes e inversores. La tecnología de IA de la compañía permite a los socios convertir una mayor proporción de su volumen de solicitudes en préstamos originados, expandiendo su ecosistema y generando ingresos incrementales, satisfaciendo así las complejas necesidades de las principales instituciones financieras.","[{'name': 'pgy-Q125-10-Q', 'url': 'https://storage.googleapis.com/reflexivity-documents-prod/edgar/filing/10-q/pgy-Q125-10-Q.html'}]",689365099,USD,PGY,SMART,STK,False
financials,banking_technology,US3167731005,FIFTH THIRD BANCORP,47,Se centra en aprovechar la tecnología para mejorar sus servicios y operaciones bancarias.,,,269318,USD,FITB,SMART,STK,True
financials,banking_technology,US50155Q1004,KYNDRYL HOLDINGS INC,48,"Proporciona servicios esenciales de infraestructura de TI y soluciones de transformación digital, permitiendo operaciones tecnológicas bancarias avanzadas para instituciones financieras.","El compromiso de Kyndryl con la Tecnología Bancaria implica la modernización de los entornos de TI, la reducción del riesgo operativo, la gestión de la deuda técnica, la habilitación del uso de IA y la garantía del cumplimiento de los cambios regulatorios como DORA para bancos e instituciones financieras. Esto se destaca por un contrato de 5 años y 500 millones de dólares con un banco líder en América Latina, donde Kyndryl se asocia con Microsoft para modernizar los sistemas de TI y mejorar los servicios de banca digital. Estos esfuerzos demuestran el papel de Kyndryl en el apoyo y avance de la tecnología bancaria a través de asociaciones estratégicas e iniciativas de modernización.",,520488080,USD,KD,SMART,STK,True
financials,banking_technology,US83406F1021,SOFI TECHNOLOGIES INC,49,Proporciona un conjunto integral de soluciones de tecnología financiera que permiten servicios de banca digital para los consumidores.,"La participación de SoFi en Tecnología Bancaria es evidente a través de la operación de SoFi Bank, que ofrece una gama de productos financieros que incluyen cuentas corrientes y de ahorro y tarjetas de crédito. La empresa origina nuevos préstamos dentro de SoFi Bank y explora productos bancarios adicionales. Además, SoFi proporciona servicios de plataforma tecnológica, que incluyen una plataforma bancaria central y digital nativa de la nube, una plataforma de eventos y autorización, y soluciones complementarias como un motor de IA conversacional y una plataforma de riesgo de pagos en tiempo real que utiliza IA y aprendizaje automático. La Plataforma Tecnológica de SoFi también apoya la innovación para otras empresas, permitiéndoles crear y lanzar productos financieros.","[{'name': 'sofi-FY24-10-K', 'url': 'https://storage.googleapis.com/reflexivity-documents-prod/edgar/filing/10-k/sofi-FY24-10-K.html'}, {'name': 'sofi-Q225-10-Q', 'url': 'https://storage.googleapis.com/reflexivity-documents-prod/edgar/filing/10-q/sofi-Q225-10-Q.html'}]",494162724,USD,SOFI,SMART,STK,False
financials,banking_technology,KYG6683N1034,NU HOLDINGS LTD/CAYMAN ISL-A,50,"Aprovecha tecnología bancaria avanzada para ofrecer servicios financieros digitales, mejorando la accesibilidad y la eficiencia en el sector bancario.","El enfoque de Nubank en la tecnología bancaria es evidente en su modelo de banca digital, que impulsa la principialidad y da como resultado una alta relación DAU/MAU. La empresa está experimentando una transformación de IA, construyendo productos financieros de clase mundial con una pila tecnológica sofisticada, y ha incorporado a un CTO con experiencia en la escalada de plataformas tecnológicas complejas. Esta inversión en tecnología contribuye a eficiencias de escala, automatización de procesos y reducción de costos, siendo el modelo de banca digital una característica definitoria que desbloquea el potencial de ganancias.",,531212348,USD,NU,SMART,STK,False
financials,banking_technology,US6934751057,PNC FINANCIAL SERVICES GROUP,51,"Aprovecha diversos avances tecnológicos para mejorar sus operaciones bancarias, la experiencia del cliente y las ofertas de servicios digitales.","PNC está activamente involucrado con la tecnología bancaria a través de varias iniciativas. La compañía está invirtiendo en tecnología para mejorar los servicios bancarios en línea y móviles, incluido el lanzamiento de un nuevo sistema de banca en línea e IA móvil para el servicio al cliente. Además, PNC está utilizando tecnología de pagos para apoyar a las empresas de criptomonedas, lo que refleja sus esfuerzos para modernizar su infraestructura y servicios bancarios.",,11240,USD,PNC,SMART,STK,True
