type,link_type,key,name,rank,description,evidence,evidenceSources,conid,currency,symbol,exchange,assetType,navigable,theme_id
consumer and retail,clothing_and_accessories,JE00BS44BN30,BIRKENSTOCK HOLDING PLC,23,"Fabrica y vende calzado, incluidas sandalias y zapatos, estableciendo su presencia como un actor clave dentro del mercado más amplio de ropa y accesorios.","La conexión de Birkenstock con el tema de Ropa y Accesorios es evidente en su línea de productos en expansión, que incluye siluetas abiertas y cerradas, con ingresos de siluetas cerradas que crecen al doble de la tasa del grupo en general. El surtido de productos de la compañía incluye una variedad de estilos de calzado, incluida la expansión a zapatos con cordones, y están experimentando una fuerte demanda en todas las categorías de productos. Esto está respaldado además por el crecimiento en las ventas de siluetas clásicas de cuero y la creciente participación de los ingresos de estilos cerrados, lo que demuestra la amplitud de sus ofertas de productos en las tiendas minoristas.",,658821477,USD,BIRK,SMART,STK,False,CL2
consumer and retail,clothing_and_accessories,US2270461096,CROCS INC,24,"Fabrica y vende una diversa gama de productos de calzado, estableciendo su presencia dentro del sector de ""Ropa y Accesorios"".","La participación de Crocs en el tema de Ropa y Accesorios es evidente en su negocio principal, que gira en torno al diseño, desarrollo, marketing y venta de calzado y accesorios de estilo de vida informal. Los productos principales de la empresa incluyen calzado como zuecos y sandalias bajo las marcas Crocs y HEYDUDE, con ingresos de la marca Crocs que alcanzan los 761,6 millones de dólares. Si bien el calzado es central, Crocs también ofrece dijes Jibbitz para la personalización, lo que contribuye al crecimiento a través de la distribución y la presentación en tienda, aunque el enfoque principal de la empresa sigue estando en sus líneas de calzado.","[{'name': 'crox-Q125-10-Q', 'url': 'https://storage.googleapis.com/reflexivity-documents-prod/edgar/filing/10-q/crox-Q125-10-Q.html'}, {'name': 'crox-Q324-10-Q', 'url': 'https://storage.googleapis.com/reflexivity-documents-prod/edgar/filing/10-q/crox-Q324-10-Q.html'}, {'name': 'crox-FY24-10-K', 'url': 'https://storage.googleapis.com/reflexivity-documents-prod/edgar/filing/10-k/crox-FY24-10-K.html'}]",37792836,USD,CROX,SMART,STK,True,CL2
consumer and retail,clothing_and_accessories,US8760301072,TAPESTRY INC,25,Contribuye a la industria de Ropa y Accesorios.,"El compromiso de Tapestry con el tema de Ropa y Accesorios es evidente a través de su identidad como una casa de accesorios icónicos y marcas de estilo de vida, que incluyen Coach, Kate Spade y Stuart Weitzman. El sólido crecimiento de Coach, particularmente en artículos de cuero, bolsos y accesorios, supera consistentemente a la industria, lo que demuestra la vitalidad de la marca y su atractivo valor. Este crecimiento está respaldado además por campañas de marketing exitosas como el lanzamiento de la colección Primavera 2025 y el posicionamiento de lujo expresivo de la marca que resuena a nivel mundial, impulsando ganancias de dos dígitos en mercados clave.","[{'name': 'tpr-Q225-10-Q', 'url': 'https://storage.googleapis.com/reflexivity-documents-prod/edgar/filing/10-q/tpr-Q225-10-Q.html'}, {'name': 'tpr-FY25-10-K', 'url': 'https://storage.googleapis.com/reflexivity-documents-prod/edgar/filing/10-k/tpr-FY25-10-K.html'}, {'name': 'tpr-Q125-10-Q', 'url': 'https://storage.googleapis.com/reflexivity-documents-prod/edgar/filing/10-q/tpr-Q125-10-Q.html'}, {'name': 'tpr-Q325-10-Q', 'url': 'https://storage.googleapis.com/reflexivity-documents-prod/edgar/filing/10-q/tpr-Q325-10-Q.html'}]",292491487,USD,TPR,SMART,STK,True,CL2
consumer and retail,clothing_and_accessories,US9264001028,VICTORIA'S SECRET & CO,26,"Opera como un minorista global prominente especializado en lencería, ropa de dormir y productos de belleza, contribuyendo significativamente al mercado de ropa y accesorios.","El negocio de Victoria's Secret está significativamente entrelazado con la industria de la Ropa y Accesorios, ya que la empresa se identifica como una marca global especializada en lencería femenina. Las marcas de la empresa, Victoria's Secret y PINK, ofrecen una variedad de prendas y accesorios, con la ropa PINK mostrando un rendimiento positivo impulsado por el producto y la participación del cliente. La empresa también se enfoca en la innovación en moda y tecnología, con equipos dedicados trabajando en ropa y accesorios, incluyendo lencería, sujetadores, ropa deportiva y ropa PINK.","[{'name': 'vsco-Q125-10-Q', 'url': 'https://storage.googleapis.com/reflexivity-documents-prod/edgar/filing/10-q/vsco-Q125-10-Q.html'}, {'name': 'vsco-Q224-10-Q', 'url': 'https://storage.googleapis.com/reflexivity-documents-prod/edgar/filing/10-q/vsco-Q224-10-Q.html'}, {'name': 'vsco-Q324-10-Q', 'url': 'https://storage.googleapis.com/reflexivity-documents-prod/edgar/filing/10-q/vsco-Q324-10-Q.html'}, {'name': 'vsco-FY24-10-K', 'url': 'https://storage.googleapis.com/reflexivity-documents-prod/edgar/filing/10-k/vsco-FY24-10-K.html'}]",502415513,USD,VSCO,SMART,STK,True,CL2
consumer and retail,clothing_and_accessories,US9043111072,UNDER ARMOUR INC-CLASS A,27,"Se enfoca en el diseño, fabricación y comercialización de ropa deportiva, calzado y accesorios, atendiendo a consumidores que buscan ropa y productos relacionados impulsados por el rendimiento.","Under Armour se identifica como un desarrollador, comercializador y distribuidor líder de ropa y accesorios de rendimiento de marca, con planes de crecimiento a través del aumento de las ventas en estas áreas. La empresa está trabajando activamente para mejorar la calidad y el diseño de su ropa y accesorios, centrándose en sus principales impulsores de volumen y rediseñando artículos clave para un mejor rendimiento y diseños más audaces. Under Armour también está lanzando productos que definen el pináculo y redefiniendo categorías centrales con materiales innovadores, como la colección UA Halo y NEOLAST, lo que demuestra un compromiso con la mejora de sus líneas de productos.","[{'name': 'uaa-Q125-10-Q', 'url': 'https://storage.googleapis.com/reflexivity-documents-prod/edgar/filing/10-q/uaa-Q125-10-Q.html'}, {'name': 'uaa-Q225-10-Q', 'url': 'https://storage.googleapis.com/reflexivity-documents-prod/edgar/filing/10-q/uaa-Q225-10-Q.html'}, {'name': 'uaa-FY25-10-K', 'url': 'https://storage.googleapis.com/reflexivity-documents-prod/edgar/filing/10-k/uaa-FY25-10-K.html'}, {'name': 'uaa-Q325-10-Q', 'url': 'https://storage.googleapis.com/reflexivity-documents-prod/edgar/filing/10-q/uaa-Q325-10-Q.html'}]",36786278,USD,UAA,SMART,STK,True,CL2
consumer and retail,clothing_and_accessories,US7782961038,ROSS STORES INC,28,"Ofrece una amplia selección de ropa y accesorios a través de su modelo minorista de precios reducidos, atendiendo a un amplio mercado de consumidores.","Ross Stores opera Ross Dress for Less y dd's DISCOUNTS, ambas ofrecen ropa y accesorios. La ropa de mujer, hombre y niño representa una parte importante de las ventas, además de los accesorios. El negocio de mujer, incluido el denim, ha mostrado fortaleza, con una mejora generalizada en las categorías de ropa.","[{'name': 'rost-FY24-10-K', 'url': 'https://storage.googleapis.com/reflexivity-documents-prod/edgar/filing/10-k/rost-FY24-10-K.html'}, {'name': 'rost-Q224-10-Q', 'url': 'https://storage.googleapis.com/reflexivity-documents-prod/edgar/filing/10-q/rost-Q224-10-Q.html'}, {'name': 'rost-Q324-10-Q', 'url': 'https://storage.googleapis.com/reflexivity-documents-prod/edgar/filing/10-q/rost-Q324-10-Q.html'}, {'name': 'rost-Q125-10-Q', 'url': 'https://storage.googleapis.com/reflexivity-documents-prod/edgar/filing/10-q/rost-Q125-10-Q.html'}]",273939,USD,ROST,SMART,STK,True,CL2
consumer and retail,clothing_and_accessories,US0028962076,ABERCROMBIE & FITCH CO-CL A,29,"Se especializa en el diseño, abastecimiento y venta de una amplia gama de ropa y accesorios a través de sus operaciones minoristas globales.","El negocio de Abercrombie & Fitch se centra en la industria de la ropa y los accesorios, ofreciendo una amplia gama de prendas de vestir para hombres, mujeres y niños a través de sus marcas Abercrombie y Hollister. Esto es evidente en la presentación constante de la empresa de su amplia gama de prendas de vestir y accesorios vendidos a través de sus tiendas y canales digitales. El enfoque de la empresa en mantenerse culturalmente relevante y satisfacer las necesidades de los clientes a través de sus líneas de ropa y accesorios, adaptándose a las tendencias emergentes y los comentarios de los clientes, enfatiza aún más la importancia de este tema. La empresa ha experimentado un crecimiento en las ventas netas tanto para las marcas Abercrombie como para Hollister, con categorías específicas como forros polares, jeans, faldas, vestidos, trajes de baño y ropa deportiva impulsando las ventas.","[{'name': 'anf-Q224-10-Q', 'url': 'https://storage.googleapis.com/reflexivity-documents-prod/edgar/filing/10-q/anf-Q224-10-Q.html'}, {'name': 'anf-Q125-10-Q', 'url': 'https://storage.googleapis.com/reflexivity-documents-prod/edgar/filing/10-q/anf-Q125-10-Q.html'}, {'name': 'anf-FY24-10-K', 'url': 'https://storage.googleapis.com/reflexivity-documents-prod/edgar/filing/10-k/anf-FY24-10-K.html'}, {'name': 'anf-Q324-10-Q', 'url': 'https://storage.googleapis.com/reflexivity-documents-prod/edgar/filing/10-q/anf-Q324-10-Q.html'}]",2585399,USD,ANF,SMART,STK,True,CL2
consumer and retail,clothing_and_accessories,US9170471026,URBAN OUTFITTERS INC,30,"Contribuye a la temática de Ropa y Accesorios diseñando, obteniendo y comercializando una diversa gama de prendas de vestir y artículos complementarios.","La ropa y los accesorios son fundamentales para el negocio de URBN, como lo demuestra su prominencia en múltiples marcas, incluidas Anthropologie, Free People y Urban Outfitters. Estas marcas ofrecen una diversa gama de prendas y accesorios, dirigidos a diferentes datos demográficos y estilos, y Anthropologie experimenta crecimiento en todas las categorías de productos. El segmento minorista de la empresa, que incluye estas marcas, representa una parte significativa de las ventas netas consolidadas, y la ropa y los accesorios contribuyen sustancialmente a los ingresos.","[{'name': 'urbn-Q125-10-Q', 'url': 'https://storage.googleapis.com/reflexivity-documents-prod/edgar/filing/10-q/urbn-Q125-10-Q.html'}, {'name': 'urbn-Q224-10-Q', 'url': 'https://storage.googleapis.com/reflexivity-documents-prod/edgar/filing/10-q/urbn-Q224-10-Q.html'}, {'name': 'urbn-Q324-10-Q', 'url': 'https://storage.googleapis.com/reflexivity-documents-prod/edgar/filing/10-q/urbn-Q324-10-Q.html'}, {'name': 'urbn-FY25-10-K', 'url': 'https://storage.googleapis.com/reflexivity-documents-prod/edgar/filing/10-k/urbn-FY25-10-K.html'}]",275527,USD,URBN,SMART,STK,True,CL2
consumer and retail,clothing_and_accessories,US4583341098,INTERPARFUMS INC,31,Desarrolla y comercializa fragancias que se posicionan como accesorios complementarios dentro de la industria de la ropa y la moda en general.,"El compromiso de Interparfums con el tema de Ropa y Accesorios se debe principalmente a su papel como licenciatario exclusivo de fragancias para Longchamp, una marca francesa de artículos de cuero y moda con presencia global. Esta asociación implica el lanzamiento de la primera fragancia femenina de Longchamp, con un enfoque en Europa y Asia Pacífico, combinando el legado de Longchamp con la experiencia en fragancias de Interparfums. Además, Interparfums está lanzando fragancias para marcas como Roberto Cavalli, GUESS, DKNY, Ferragamo y Abercrombie.",,6857699,USD,IPAR,SMART,STK,True,CL2
consumer and retail,clothing_and_accessories,US5002551043,KOHLS CORP,32,"Ofrece una diversa selección de ropa y accesorios para mujeres, hombres y niños, atendiendo a diversos estilos y preferencias dentro del mercado minorista.","Kohl's demuestra una conexión notable con el tema de Ropa y Accesorios, como lo evidencia su modelo de negocio principal, que implica la venta de indumentaria, calzado y accesorios de marcas propias y nacionales a precios moderados, tanto en tiendas como en línea. El enfoque de la empresa en este tema se ve aún más resaltado por el hecho de que las ventas disminuyeron en todas las líneas de negocio, excepto en Accesorios, que experimentó un crecimiento, impulsado particularmente por las ventas de Sephora. Además, la indumentaria femenina se identifica como una categoría muy importante, que sirve como un motor clave del rendimiento general de la empresa, con inversiones continuas para mejorar las marcas propias y optimizar las opciones dentro de este segmento.","[{'name': 'kss-Q224-10-Q', 'url': 'https://storage.googleapis.com/reflexivity-documents-prod/edgar/filing/10-q/kss-Q224-10-Q.html'}, {'name': 'kss-Q324-10-Q', 'url': 'https://storage.googleapis.com/reflexivity-documents-prod/edgar/filing/10-q/kss-Q324-10-Q.html'}, {'name': 'kss-FY24-10-K', 'url': 'https://storage.googleapis.com/reflexivity-documents-prod/edgar/filing/10-k/kss-FY24-10-K.html'}]",8942,USD,KSS,SMART,STK,True,CL2
consumer and retail,clothing_and_accessories,US1462291097,CARTER'S INC,33,"Se enfoca en el diseño, abastecimiento y comercialización de ropa y accesorios, principalmente para bebés y niños pequeños.","Como el mayor comercializador de marca de ropa para niños pequeños en América del Norte, la participación de la empresa en el tema de Ropa y Accesorios es significativa. Sus marcas principales, Carter's y OshKosh B'gosh, son reconocidas por su ropa y accesorios de alta calidad para niños, mientras que otras marcas como Skip Hop, Little Planet y Otter Avenue ofrecen ropa, accesorios y ropa de dormir para bebés y niños pequeños. La empresa diseña, obtiene y comercializa una variedad de ropa y accesorios para niños pequeños, con un enfoque en la calidad, el valor de la marca y la lealtad del consumidor.","[{'name': 'cri-Q324-10-Q', 'url': 'https://storage.googleapis.com/reflexivity-documents-prod/edgar/filing/10-q/cri-Q324-10-Q.html'}, {'name': 'cri-Q225-10-Q', 'url': 'https://storage.googleapis.com/reflexivity-documents-prod/edgar/filing/10-q/cri-Q225-10-Q.html'}]",26593783,USD,CRI,SMART,STK,True,CL2
consumer and retail,clothing_and_accessories,CH1134540470,ON HOLDING AG-CLASS A,34,"Contribuye al tema ""Ropa y accesorios"" a través de su diseño innovador y distribución global de calzado deportivo de alto rendimiento, ropa y accesorios de primera calidad.","El compromiso de On con el tema de Ropa y Accesorios es evidente a través de la rápida expansión de su negocio de indumentaria, que se está volviendo cada vez más importante para la estrategia general de la empresa. Este crecimiento se demuestra por el casi duplicación de las ventas netas de ropa durante los primeros tres meses del año, y en la primera mitad de este año, las ventas de ropa superaron a las de la franquicia de calzado Cloudtilt. On se está construyendo activamente como una marca de ropa deportiva de pies a cabeza, mostrando indumentaria en eventos como la Semana de la Moda de París y lanzando colaboraciones con figuras como Zendaya, con la ropa de correr, entrenamiento y tenis como áreas clave de enfoque.",,513880603,USD,ONON,SMART,STK,False,CL2
consumer and retail,clothing_and_accessories,US50050N1037,KONTOOR BRANDS INC,35,"Se enfoca en el diseño, fabricación y comercialización de indumentaria y accesorios, contribuyendo al mercado global de ropa y accesorios.","El negocio de Kontoor Brands se centra en la industria de la ropa y los accesorios, ya que la empresa diseña, fabrica, adquiere, vende y licencia estos artículos bajo sus marcas principales, Wrangler y Lee. Este enfoque se ve aún más enfatizado por la adquisición de Helly Hansen, una marca especializada en ropa y calzado para exteriores. La participación de la empresa en el mercado de la ropa y los accesorios es evidente en su atención al negocio principal de mezclilla de Wrangler, el reposicionamiento de la marca Lee en mezclilla y las líneas de ropa de esquí y ropa de trabajo de Helly Hansen.","[{'name': 'ktb-Q125-10-Q', 'url': 'https://storage.googleapis.com/reflexivity-documents-prod/edgar/filing/10-q/ktb-Q125-10-Q.html'}, {'name': 'ktb-Q225-10-Q', 'url': 'https://storage.googleapis.com/reflexivity-documents-prod/edgar/filing/10-q/ktb-Q225-10-Q.html'}, {'name': 'ktb-FY24-10-K', 'url': 'https://storage.googleapis.com/reflexivity-documents-prod/edgar/filing/10-k/ktb-FY24-10-K.html'}, {'name': 'ktb-Q324-10-Q', 'url': 'https://storage.googleapis.com/reflexivity-documents-prod/edgar/filing/10-q/ktb-Q324-10-Q.html'}]",363803376,USD,KTB,SMART,STK,True,CL2
consumer and retail,clothing_and_accessories,US02553E1064,AMERICAN EAGLE OUTFITTERS,36,Opera como un minorista que ofrece una variedad de ropa y accesorios para hombres y mujeres jóvenes.,"American Eagle Outfitters se identifica como un minorista especializado líder a nivel mundial, con ropa y accesorios como ofertas de productos principales bajo sus marcas American Eagle y Aerie. La compañía discute extensamente varias categorías de ropa, incluyendo jeans, tops, lencería, ropa deportiva, ropa de dormir y accesorios, con un enfoque en el fortalecimiento de las colecciones y la obtención de márgenes más altos. Las campañas de marketing presentan artículos de ropa específicos, lo que indica una gran inversión y enfoque en esta área. La compañía ha visto mejoras en categorías clave y se enfoca en la construcción de negocios de franquicia.","[{'name': 'aeo-Q125-10-Q', 'url': 'https://storage.googleapis.com/reflexivity-documents-prod/edgar/filing/10-q/aeo-Q125-10-Q.html'}, {'name': 'aeo-Q324-10-Q', 'url': 'https://storage.googleapis.com/reflexivity-documents-prod/edgar/filing/10-q/aeo-Q324-10-Q.html'}, {'name': 'aeo-FY24-10-K', 'url': 'https://storage.googleapis.com/reflexivity-documents-prod/edgar/filing/10-k/aeo-FY24-10-K.html'}, {'name': 'aeo-Q224-10-Q', 'url': 'https://storage.googleapis.com/reflexivity-documents-prod/edgar/filing/10-q/aeo-Q224-10-Q.html'}]",4725951,USD,AEO,SMART,STK,True,CL2
consumer and retail,clothing_and_accessories,US4103451021,HANESBRANDS INC.,37,"Fabrica y comercializa una diversa gama de productos de lencería, ropa deportiva y calcetería, sirviendo a diversos segmentos del mercado global de ropa y accesorios.","Hanesbrands se identifica como un líder mundial en la industria de la indumentaria, enfatizando su cartera de marcas reconocidas que incluye Hanes, Bonds, Bali y Maidenform. La empresa diseña, fabrica, obtiene y vende una amplia gama de prendas de vestir íntima, como camisetas, sujetadores, bragas, fajas, ropa interior y calcetines, junto con otros productos de indumentaria. Los segmentos de Hanesbrands obtienen ingresos principalmente de prendas de vestir íntima y otros productos de indumentaria, con un enfoque tanto en los mercados de EE. UU. como en los internacionales, incluyendo ropa deportiva, batas médicas y ropa de estar por casa.","[{'name': 'hbi-FY24-10-K', 'url': 'https://storage.googleapis.com/reflexivity-documents-prod/edgar/filing/10-k/hbi-FY24-10-K.html'}, {'name': 'hbi-Q324-10-Q', 'url': 'https://storage.googleapis.com/reflexivity-documents-prod/edgar/filing/10-q/hbi-Q324-10-Q.html'}]",40369429,USD,HBI,VALUE,STK,True,CL2
consumer and retail,clothing_and_accessories,US22160K1051,COSTCO WHOLESALE CORP,38,Sirve como un canal minorista que ofrece una gama de ropa y accesorios a su base de miembros.,,,272997,USD,COST,SMART,STK,True,CL2
consumer and retail,clothing_and_accessories,US2533931026,DICK'S SPORTING GOODS INC,39,Ofrece una diversa selección de ropa y accesorios deportivos para diversos deportes y actividades al aire libre.,"La exposición de DICK'S Sporting Goods al tema de Ropa y Accesorios es evidente en su extensa oferta de indumentaria y accesorios, un componente clave de sus ofertas minoristas. La compañía enfatiza la provisión de un ""look de pies a cabeza"" para atletas y la atención de las necesidades de deportes de equipo, con marcas verticales como DSG, CALIA y VRST que resuenan bien con los consumidores. Los aumentos en las ventas comparables han sido impulsados por el crecimiento en indumentaria deportiva y accesorios, aunque también se han observado declines en categorías de indumentaria relacionadas con actividades al aire libre. La compañía tiene como objetivo proporcionar a las marcas verticales un espacio mejorado en la tienda y marketing, lo que indica un enfoque continuo en esta categoría de productos.","[{'name': 'dks-Q224-10-Q', 'url': 'https://storage.googleapis.com/reflexivity-documents-prod/edgar/filing/10-q/dks-Q224-10-Q.html'}, {'name': 'dks-Q324-10-Q', 'url': 'https://storage.googleapis.com/reflexivity-documents-prod/edgar/filing/10-q/dks-Q324-10-Q.html'}, {'name': 'dks-FY24-10-K', 'url': 'https://storage.googleapis.com/reflexivity-documents-prod/edgar/filing/10-k/dks-FY24-10-K.html'}]",16310970,USD,DKS,SMART,STK,True,CL2
consumer and retail,clothing_and_accessories,US5562691080,STEVEN MADDEN LTD,40,"Diseña y comercializa calzado de moda, bolsos y otros accesorios, sirviendo directamente a la industria de la ropa y los accesorios.","Steven Madden, Ltd. diseña, obtiene y comercializa calzado, accesorios y prendas de vestir de marca y de etiqueta privada a la moda, distribuyendo estos productos a través de canales mayoristas y directos al consumidor. El segmento de Accesorios/Ropa al por Mayor de la empresa se centra en bolsos y prendas de vestir, contribuyendo una parte notable de los ingresos de la empresa, con $143.2 millones en ingresos de accesorios y ropa al por mayor en un trimestre reciente. La empresa también tiene como objetivo ofrecer surtidos de productos de moda en estas categorías, y están trasladando la producción a países como Vietnam, Camboya, México y Brasil para productos de ropa.","[{'name': 'shoo-Q324-10-Q', 'url': 'https://storage.googleapis.com/reflexivity-documents-prod/edgar/filing/10-q/shoo-Q324-10-Q.html'}, {'name': 'shoo-Q225-10-Q', 'url': 'https://storage.googleapis.com/reflexivity-documents-prod/edgar/filing/10-q/shoo-Q225-10-Q.html'}, {'name': 'shoo-Q125-10-Q', 'url': 'https://storage.googleapis.com/reflexivity-documents-prod/edgar/filing/10-q/shoo-Q125-10-Q.html'}, {'name': 'shoo-FY24-10-K', 'url': 'https://storage.googleapis.com/reflexivity-documents-prod/edgar/filing/10-k/shoo-FY24-10-K.html'}]",4818051,USD,SHOO,SMART,STK,True,CL2
consumer and retail,clothing_and_accessories,US63845R1077,NATIONAL VISION HOLDINGS INC,41,Contribuye al mercado de accesorios a través de la provisión de diversos productos de óptica.,,,293891401,USD,EYE,SMART,STK,True,CL2
consumer and retail,clothing_and_accessories,US1220171060,BURLINGTON STORES INC,42,Opera como un minorista que ofrece una amplia variedad de ropa y accesorios a los consumidores.,"Burlington Stores demuestra su participación en la industria de la ropa y los accesorios a través de su amplia selección de mercancía de temporada y enfocada en la moda, que incluye prêt-à-porter femenino, moda masculina, ropa juvenil, ropa de bebé, calzado y accesorios. La empresa obtiene ingresos al ofrecer una línea completa de ropa a precios asequibles y ha tenido un fuerte desempeño en categorías como belleza, accesorios, zapatos y ropa en las secciones de damas, caballeros y niños. Burlington también está expandiendo su oferta en categorías existentes como la ropa de dama, lo que indica un enfoque continuo en este tema.","[{'name': 'burl-FY24-10-K', 'url': 'https://storage.googleapis.com/reflexivity-documents-prod/edgar/filing/10-k/burl-FY24-10-K.html'}]",135699190,USD,BURL,SMART,STK,True,CL2
consumer and retail,clothing_and_accessories,US2786421030,EBAY INC,43,Facilita la compra y venta de una amplia gama de ropa y accesorios a través de su mercado en línea global.,"La conexión de eBay con el tema de Ropa y Accesorios es evidente a través de varias iniciativas y resultados financieros. La categoría de moda de la empresa genera más de 10 mil millones de dólares en GMV anualmente, y categorías de enfoque como artículos de lujo y ropa han contribuido positivamente al crecimiento. Para mejorar la experiencia del cliente, eBay ha lanzado experiencias de compra impulsadas por IA y ha ampliado sus servicios de autenticación para ropa urbana y prendas de lujo tanto en EE. UU. como en el Reino Unido, incluso introduciendo estándares mejorados de calificación de estado para la ropa.","[{'name': 'ebay-Q125-10-Q', 'url': 'https://storage.googleapis.com/reflexivity-documents-prod/edgar/filing/10-q/ebay-Q125-10-Q.html'}, {'name': 'ebay-Q225-10-Q', 'url': 'https://storage.googleapis.com/reflexivity-documents-prod/edgar/filing/10-q/ebay-Q225-10-Q.html'}]",4347086,USD,EBAY,SMART,STK,True,CL2
