type,link_type,key,name,rank,description,evidence,evidenceSources,conid,currency,symbol,exchange,assetType,navigable,theme_id
consumer and retail,clothing_and_accessories,US36237H1014,G-III APPAREL GROUP LTD,44,"Diseña, adquiere y comercializa una cartera diversa de ropa y accesorios, contribuyendo al sector minorista de moda.","La participación de G-III Apparel Group en el tema de Ropa y Accesorios es sustancial, ya que la empresa diseña, obtiene y comercializa una amplia gama de ropa y accesorios. Esto incluye ropa exterior, vestidos, ropa deportiva, trajes de baño, bolsos, calzado y equipaje, lo que indica un enfoque significativo en estas categorías de productos. La cartera de la empresa presenta más de 30 marcas propias y con licencia reconocidas a nivel mundial, como DKNY, Donna Karan y Karl Lagerfeld, que impulsan el impulso de las ventas y se expanden a nuevas categorías y ofertas de estilo de vida. La experiencia de G-III en diseño, abastecimiento, distribución y marketing solidifica aún más su posición en la industria de la moda, con un claro énfasis en el crecimiento de sus marcas a través de surtidos ampliados y expansión global.","[{'name': 'giii-Q324-10-Q', 'url': 'https://storage.googleapis.com/reflexivity-documents-prod/edgar/filing/10-q/giii-Q324-10-Q.html'}, {'name': 'giii-Q125-10-Q', 'url': 'https://storage.googleapis.com/reflexivity-documents-prod/edgar/filing/10-q/giii-Q125-10-Q.html'}, {'name': 'giii-Q224-10-Q', 'url': 'https://storage.googleapis.com/reflexivity-documents-prod/edgar/filing/10-q/giii-Q224-10-Q.html'}, {'name': 'giii-FY24-10-K', 'url': 'https://storage.googleapis.com/reflexivity-documents-prod/edgar/filing/10-k/giii-FY24-10-K.html'}]",269747,USD,GIII,SMART,STK,True,CL2
consumer and retail,clothing_and_accessories,US1729081059,CINTAS CORP,45,"Proporciona uniformes y ropa corporativa, contribuyendo al sector de la ropa profesional dentro del mercado más amplio de ropa y accesorios.","Cintas está fuertemente involucrada en la industria de la Ropa y Accesorios, principalmente a través de sus programas de alquiler y venta de uniformes de identidad corporativa. La empresa es el principal proveedor de estos servicios en América del Norte, ofreciendo una amplia gama de prendas, incluida ropa resistente al fuego y ropa de seguridad de alta visibilidad, a veces a través de asociaciones exclusivas como con Chef Works y Carhartt. El segmento de Alquiler de Uniformes y Servicios para Instalaciones de Cintas, que incluye uniformes, constituye una parte importante de los ingresos de la empresa, lo que resalta la importancia de la ropa y los accesorios para su modelo de negocio.","[{'name': 'ctas-Q225-10-Q', 'url': 'https://storage.googleapis.com/reflexivity-documents-prod/edgar/filing/10-q/ctas-Q225-10-Q.html'}, {'name': 'ctas-Q125-10-Q', 'url': 'https://storage.googleapis.com/reflexivity-documents-prod/edgar/filing/10-q/ctas-Q125-10-Q.html'}]",268149,USD,CTAS,SMART,STK,True,CL2
consumer and retail,clothing_and_accessories,US80517M1099,SAVERS VALUE VILLAGE INC,46,"Contribuye al tema de Ropa y Accesorios ofreciendo una selección diversa de prendas y accesorios de segunda mano, promoviendo la asequibilidad y la reutilización en el mercado minorista.",,,639336278,USD,SVV,SMART,STK,False,CL2
consumer and retail,clothing_and_accessories,US0994061002,BOOT BARN HOLDINGS INC,47,"Opera como un minorista que ofrece ropa occidental y de trabajo, incluyendo botas, ropa y accesorios, sirviendo como un proveedor clave dentro del mercado especializado de ropa y accesorios.","Boot Barn se identifica como la cadena minorista de estilo de vida más grande de los EE. UU. dedicada al calzado, la ropa y los accesorios relacionados con el oeste y el trabajo, con una oferta de productos que incluye una amplia variedad de ropa y accesorios coordinados. La compañía experimenta un crecimiento generalizado en las principales categorías de mercancías, incluidas las botas y la ropa western para damas y hombres, así como la mezclilla. Este crecimiento, particularmente en los negocios de botas y ropa western para damas, resalta la importancia de la ropa y los accesorios como ofertas principales para la compañía.","[{'name': 'boot-Q225-10-Q', 'url': 'https://storage.googleapis.com/reflexivity-documents-prod/edgar/filing/10-q/boot-Q225-10-Q.html'}, {'name': 'boot-Q126-10-Q', 'url': 'https://storage.googleapis.com/reflexivity-documents-prod/edgar/filing/10-q/boot-Q126-10-Q.html'}, {'name': 'boot-Q325-10-Q', 'url': 'https://storage.googleapis.com/reflexivity-documents-prod/edgar/filing/10-q/boot-Q325-10-Q.html'}, {'name': 'boot-FY25-10-K', 'url': 'https://storage.googleapis.com/reflexivity-documents-prod/edgar/filing/10-k/boot-FY25-10-K.html'}]",172185600,USD,BOOT,SMART,STK,True,CL2
consumer and retail,clothing_and_accessories,US48138M1053,JUMIA TECHNOLOGIES AG-ADR,48,Participa en el tema de la industria de la ropa y los accesorios.,,,360310571,USD,JMIA,SMART,STK,False,CL2
consumer and retail,clothing_and_accessories,US00402L1070,ACADEMY SPORTS & OUTDOORS IN,49,"Proporciona una amplia variedad de indumentaria, calzado y accesorios para diversas actividades deportivas y al aire libre.","El negocio de Academy Sports + Outdoors está significativamente ligado a la industria de la ropa y los accesorios, como lo demuestra el hecho de que la indumentaria y el calzado constituyen consistentemente una parte sustancial de sus ventas netas. La indumentaria se identifica como una categoría clave, que a veces representa más de una cuarta parte de las ventas netas. El enfoque de la empresa se ve aún más subrayado por sus estrategias de comercialización, como la comercialización cruzada de indumentaria, calzado y accesorios, y la introducción de nuevas marcas como Jordan y Converse.","[{'name': 'aso-Q324-10-Q', 'url': 'https://storage.googleapis.com/reflexivity-documents-prod/edgar/filing/10-q/aso-Q324-10-Q.html'}, {'name': 'aso-Q224-10-Q', 'url': 'https://storage.googleapis.com/reflexivity-documents-prod/edgar/filing/10-q/aso-Q224-10-Q.html'}, {'name': 'aso-Q125-10-Q', 'url': 'https://storage.googleapis.com/reflexivity-documents-prod/edgar/filing/10-q/aso-Q125-10-Q.html'}, {'name': 'aso-FY24-10-K', 'url': 'https://storage.googleapis.com/reflexivity-documents-prod/edgar/filing/10-k/aso-FY24-10-K.html'}]",448389035,USD,ASO,SMART,STK,True,CL2
consumer and retail,clothing_and_accessories,US9780971035,WOLVERINE WORLD WIDE INC,50,"Se dedica al diseño, fabricación y distribución de ropa y accesorios.","El compromiso de la empresa con el tema de Ropa y Accesorios es evidente a través de su identidad como diseñador, comercializador y licenciante global de calzado, ropa y accesorios de marca. Esto se ve reforzado por la visión estratégica de la empresa de construir y hacer crecer marcas de ropa y accesorios de alta energía. La empresa tiene acuerdos de licencia multianuales para ropa y accesorios Merrell®, y su cartera de marcas incluye segmentos como el Active Group, que presenta ropa Merrell® y Saucony®, y ropa deportiva Sweaty Betty®. La empresa también aprovecha la experiencia en ropa de Sweaty Betty® en toda su cartera para mejorar el rendimiento de las marcas de calzado.","[{'name': 'www-Q125-10-Q', 'url': 'https://storage.googleapis.com/reflexivity-documents-prod/edgar/filing/10-q/www-Q125-10-Q.html'}, {'name': 'www-Q225-10-Q', 'url': 'https://storage.googleapis.com/reflexivity-documents-prod/edgar/filing/10-q/www-Q225-10-Q.html'}, {'name': 'www-FY24-10-K', 'url': 'https://storage.googleapis.com/reflexivity-documents-prod/edgar/filing/10-k/www-FY24-10-K.html'}, {'name': 'www-Q324-10-Q', 'url': 'https://storage.googleapis.com/reflexivity-documents-prod/edgar/filing/10-q/www-Q324-10-Q.html'}]",13938,USD,WWW,SMART,STK,True,CL2
consumer and retail,clothing_and_accessories,US76156B1070,REVOLVE GROUP INC,51,"Opera como un minorista en línea especializado en una amplia gama de ropa y accesorios, atendiendo a consumidores que buscan prendas de moda y artículos complementarios.","El negocio de Revolve Group está significativamente ligado a la industria de la Ropa y los Accesorios, como lo demuestran sus operaciones comerciales principales a través de los segmentos REVOLVE y FWRD, ambos ofrecen una amplia gama de ropa, calzado y accesorios. El rendimiento financiero de la empresa se ve muy influenciado por estas categorías de productos, y la ropa de moda, los vestidos, los bolsos, los zapatos y los accesorios constituyen una parte sustancial de las ventas netas. Este énfasis se resalta aún más en eventos como el REVOLVE Festival, que exhibe estilos que marcan tendencia, y asociaciones estratégicas, como la colaboración con Cardi B para lanzar líneas de ropa y belleza, lo que demuestra el enfoque y la inversión de la empresa en este sector.","[{'name': 'rvlv-Q225-10-Q', 'url': 'https://storage.googleapis.com/reflexivity-documents-prod/edgar/filing/10-q/rvlv-Q225-10-Q.html'}, {'name': 'rvlv-FY24-10-K', 'url': 'https://storage.googleapis.com/reflexivity-documents-prod/edgar/filing/10-k/rvlv-FY24-10-K.html'}, {'name': 'rvlv-Q125-10-Q', 'url': 'https://storage.googleapis.com/reflexivity-documents-prod/edgar/filing/10-q/rvlv-Q125-10-Q.html'}]",369919463,USD,RVLV,SMART,STK,False,CL2
consumer and retail,clothing_and_accessories,US0708301041,BATH & BODY WORKS INC,52,"Ofrece una variedad de productos accesorios que complementan sus ofertas principales de cuidado personal y fragancias para el hogar, contribuyendo así al mercado de 'Ropa y Accesorios'.",,,502252263,USD,BBWI,SMART,STK,True,CL2
consumer and retail,clothing_and_accessories,US0050981085,ACUSHNET HOLDINGS CORP,53,"Fabrica y vende ropa y accesorios relacionados con el golf, incluyendo indumentaria, gorras y guantes, diseñados para el rendimiento y el estilo en el campo.","La participación de la empresa en el tema de Ropa y Accesorios es evidente a través de sus marcas FootJoy y Titleist. La empresa diseña, desarrolla, fabrica y distribuye ropa y prendas de golf para exteriores, y FootJoy es reconocida como una marca líder en indumentaria de rendimiento. Si bien las ventas de ropa de golf FootJoy han experimentado fluctuaciones debido a cambios en los volúmenes de ventas de prendas de vestir, la empresa reconoce la importancia de mercados específicos como Corea y discute las tendencias de rendimiento, lo que indica un enfoque estratégico continuo, aunque moderado, en este segmento.","[{'name': 'golf-Q125-10-Q', 'url': 'https://storage.googleapis.com/reflexivity-documents-prod/edgar/filing/10-q/golf-Q125-10-Q.html'}, {'name': 'golf-Q324-10-Q', 'url': 'https://storage.googleapis.com/reflexivity-documents-prod/edgar/filing/10-q/golf-Q324-10-Q.html'}, {'name': 'golf-Q225-10-Q', 'url': 'https://storage.googleapis.com/reflexivity-documents-prod/edgar/filing/10-q/golf-Q225-10-Q.html'}, {'name': 'golf-FY24-10-K', 'url': 'https://storage.googleapis.com/reflexivity-documents-prod/edgar/filing/10-k/golf-FY24-10-K.html'}]",253210637,USD,GOLF,SMART,STK,True,CL2
consumer and retail,clothing_and_accessories,US30260D1037,FIGS INC-CLASS A,54,"Diseña y vende ropa y accesorios profesionales, contribuyendo al segmento especializado del mercado de ropa y accesorios.","FIGS está fuertemente invertida en el mercado de ropa y accesorios, centrándose principalmente en profesionales de la salud. La oferta de la empresa incluye una amplia gama de ropa de quirófano y no de quirófano, como ropa exterior, calzado y ropa de estar, siendo la ropa de quirófano una parte importante de los ingresos netos. FIGS enfatiza la calidad, durabilidad, estilo y comodidad en su ropa de quirófano, impulsando la innovación en tejidos, ajuste y siluetas para construir un sistema de capas uniforme dentro de la industria de la indumentaria para el cuidado de la salud.","[{'name': 'figs-Q225-10-Q', 'url': 'https://storage.googleapis.com/reflexivity-documents-prod/edgar/filing/10-q/figs-Q225-10-Q.html'}, {'name': 'figs-FY24-10-K', 'url': 'https://storage.googleapis.com/reflexivity-documents-prod/edgar/filing/10-k/figs-FY24-10-K.html'}]",493581450,USD,FIGS,SMART,STK,False,CL2
consumer and retail,clothing_and_accessories,US98585X1046,YETI HOLDINGS INC,55,Ofrece una gama de prendas y accesorios diseñados para uso en exteriores y recreativo.,"La participación de YETI en el tema de Ropa y Accesorios es evidente a través de su oferta de indumentaria, que incluye camisas y gorras, así como su línea de productos de bolsos y mochilas. La empresa ha experimentado un impulso significativo en su negocio de bolsos y mochilas, con productos como las mochilas Cayo y Ranchero recibiendo críticas positivas y la bolsa Camino experimentando un aumento en la demanda. YETI también ha invertido en esta área al abrir una oficina de diseño y desarrollo para bolsos y equipaje y al adquirir Mystery Ranch, un diseñador y fabricante de mochilas y bolsos. Si bien los bolsos y la indumentaria forman parte de la oferta de productos de YETI, no son el enfoque principal, ya que las neveras portátiles y los recipientes para bebidas siguen siendo centrales para la marca.","[{'name': 'yeti-Q125-10-Q', 'url': 'https://storage.googleapis.com/reflexivity-documents-prod/edgar/filing/10-q/yeti-Q125-10-Q.html'}, {'name': 'yeti-FY24-10-K', 'url': 'https://storage.googleapis.com/reflexivity-documents-prod/edgar/filing/10-k/yeti-FY24-10-K.html'}, {'name': 'yeti-Q324-10-Q', 'url': 'https://storage.googleapis.com/reflexivity-documents-prod/edgar/filing/10-q/yeti-Q324-10-Q.html'}]",338719595,USD,YETI,SMART,STK,True,CL2
consumer and retail,clothing_and_accessories,US88339P1012,REALREAL INC/THE,56,"Opera un mercado en línea especializado en artículos de lujo de consignación autenticados, con un enfoque significativo en ropa y accesorios.","The RealReal, como el mercado en línea más grande del mundo de productos de lujo de reventa autenticados, demuestra una conexión significativa con el tema de Ropa y Accesorios a través de su modelo de negocio principal. La empresa ofrece productos en múltiples categorías, incluyendo moda femenina y masculina, joyería fina y relojes, con una parte sustancial de los ingresos derivada de las ventas a consignación. El enfoque de la empresa en la reventa de lujo incluye intrínsecamente ropa y accesorios, con mención específica de 'artículos listos para usar' y la influencia del valor de reventa en las decisiones de compra de los consumidores. La empresa también aprovecha las relaciones existentes con los consignadores para desbloquear un valioso suministro en múltiples categorías, incluyendo moda femenina, moda masculina, joyería y relojes.","[{'name': 'real-Q125-10-Q', 'url': 'https://storage.googleapis.com/reflexivity-documents-prod/edgar/filing/10-q/real-Q125-10-Q.html'}, {'name': 'real-FY24-10-K', 'url': 'https://storage.googleapis.com/reflexivity-documents-prod/edgar/filing/10-k/real-FY24-10-K.html'}, {'name': 'real-Q225-10-Q', 'url': 'https://storage.googleapis.com/reflexivity-documents-prod/edgar/filing/10-q/real-Q225-10-Q.html'}]",373210998,USD,REAL,SMART,STK,False,CL2
consumer and retail,clothing_and_accessories,US2540671011,DILLARDS INC-CL A,57,"Opera grandes almacenes que ofrecen una amplia gama de ropa, accesorios y otras mercancías a los consumidores.","Dillard's está significativamente involucrada en la industria de la ropa y los accesorios, como lo demuestran los detallados datos de ventas proporcionados para varias categorías de prendas de vestir. El segmento de operaciones minoristas de la compañía incluye porcentajes sustanciales de ventas en ropa de mujer, ropa y accesorios de hombre, y zapatos. Además, la compañía informa y discute consistentemente las tendencias de ventas en múltiples categorías de ropa, incluyendo ropa de mujer, accesorios y lencería de mujer, ropa de jóvenes y niños, y ropa y accesorios de hombre, lo que indica un fuerte enfoque en estas líneas de productos.","[{'name': 'dds-Q324-10-Q', 'url': 'https://storage.googleapis.com/reflexivity-documents-prod/edgar/filing/10-q/dds-Q324-10-Q.html'}, {'name': 'dds-Q125-10-Q', 'url': 'https://storage.googleapis.com/reflexivity-documents-prod/edgar/filing/10-q/dds-Q125-10-Q.html'}, {'name': 'dds-FY24-10-K', 'url': 'https://storage.googleapis.com/reflexivity-documents-prod/edgar/filing/10-k/dds-FY24-10-K.html'}]",6390,USD,DDS,SMART,STK,False,CL2
consumer and retail,clothing_and_accessories,US9047081040,UNIFIRST CORP/MA,58,"Proporciona uniformes, ropa de trabajo y ropa de protección, ofreciendo servicios textiles esenciales dentro de la industria más amplia de Ropa y Accesorios.","El negocio de UniFirst se centra en gran medida en la industria de la ropa y los accesorios, ya que diseña, fabrica, personaliza, alquila, limpia, entrega y vende una amplia gama de uniformes y ropa de protección. La empresa es un proveedor líder de uniformes de trabajo y ropa de trabajo de protección en América del Norte, sirviendo a más de 300.000 ubicaciones de clientes y equipando a más de 2 millones de trabajadores cada día hábil. Las prendas representan la mayor parte de sus costos de mercancía, que se obtienen a nivel mundial a través de la autoproducción, asociaciones de subcontratación y proveedores externos.","[{'name': 'unf-Q125-10-Q', 'url': 'https://storage.googleapis.com/reflexivity-documents-prod/edgar/filing/10-q/unf-Q125-10-Q.html'}, {'name': 'unf-FY24-10-K', 'url': 'https://storage.googleapis.com/reflexivity-documents-prod/edgar/filing/10-k/unf-FY24-10-K.html'}]",13271,USD,UNF,SMART,STK,True,CL2
consumer and retail,clothing_and_accessories,US1311931042,TOPGOLF CALLAWAY BRANDS CORP,59,Contribuye al tema de ropa y accesorios a través de su gama de ropa y accesorios específicos para golf.,"La empresa demuestra su participación en el tema de Ropa y Accesorios a través de su segmento de Estilo de Vida Activo, que abarca marcas como Callaway, TravisMathew, Jack Wolfskin y OGIO. Este segmento presenta artículos blandos, que incluyen ropa y accesorios, y la empresa discute los ingresos, las tendencias de ventas y las condiciones del mercado que afectan a estas líneas de productos. Si bien TravisMathew muestra fortaleza en las categorías masculinas principales y crecimiento en nuevas áreas como ropa exterior y ropa femenina, la empresa también aborda la debilidad del mercado y los realineamientos estratégicos dentro del segmento, lo que indica que, si bien está presente, la ropa y los accesorios no son necesariamente el enfoque estratégico principal.","[{'name': 'modg-Q125-10-Q', 'url': 'https://storage.googleapis.com/reflexivity-documents-prod/edgar/filing/10-q/modg-Q125-10-Q.html'}, {'name': 'modg-Q324-10-Q', 'url': 'https://storage.googleapis.com/reflexivity-documents-prod/edgar/filing/10-q/modg-Q324-10-Q.html'}, {'name': 'modg-FY24-10-K', 'url': 'https://storage.googleapis.com/reflexivity-documents-prod/edgar/filing/10-k/modg-FY24-10-K.html'}]",6808,USD,MODG,SMART,STK,True,CL2
consumer and retail,clothing_and_accessories,US93403J1060,WARBY PARKER INC-CLASS A,60,"Ofrece una gama de gafas graduadas, gafas de sol y lentes de contacto, contribuyendo a los segmentos de moda y accesorios personales dentro del tema más amplio de Ropa y Accesorios.","El negocio de Warby Parker está significativamente ligado al tema de Ropa y Accesorios, ya que la empresa genera ingresos principalmente a través de la venta de productos de óptica, incluyendo gafas graduadas y de sol, con y sin graduación. Estos productos de óptica se diseñan internamente y son un importante motor de ingresos para la empresa. Además, Warby Parker introduce constantemente nuevas colecciones de monturas y mejoras en las lentes, lo que destaca la importancia estratégica de la óptica para su modelo de negocio; también han lanzado colaboraciones con marcas de streetwear, lo que demuestra un mayor compromiso con el mercado de la ropa y los accesorios.","[{'name': 'wrby-Q125-10-Q', 'url': 'https://storage.googleapis.com/reflexivity-documents-prod/edgar/filing/10-q/wrby-Q125-10-Q.html'}, {'name': 'wrby-FY24-10-K', 'url': 'https://storage.googleapis.com/reflexivity-documents-prod/edgar/filing/10-k/wrby-FY24-10-K.html'}]",517203799,USD,WRBY,SMART,STK,False,CL2
consumer and retail,clothing_and_accessories,US7415111092,PRICESMART INC,61,Ofrece una selección de ropa y accesorios como parte de su surtido general de mercancías dentro de su formato de club de almacén.,,,4816971,USD,PSMT,SMART,STK,True,CL2
