type,link_type,key,name,rank,description,evidence,evidenceSources,conid,currency,symbol,exchange,assetType,navigable,theme_id
consumer and retail,clothing_and_accessories,US6541061031,NIKE INC -CL B,1,"Diseña, desarrolla, comercializa y vende calzado deportivo, ropa, equipamiento y accesorios a nivel mundial, estableciéndose como una marca líder en la industria de la ropa y los accesorios.","La participación de NIKE en el tema de Ropa y Accesorios es evidente a través de sus operaciones globales, donde diseña, desarrolla, comercializa y vende ropa y accesorios deportivos. La empresa se enfoca en crear productos innovadores y codiciados para atletas específicos, con ejemplos como la Colección de Firma de A'ja Wilson que demuestran el éxito en esta área. El compromiso de NIKE se extiende a reequilibrar las líneas de ropa deportiva y de rendimiento y a escalar la producción para satisfacer la creciente demanda del mercado, solidificando aún más su posición en el mercado de ropa y accesorios.","[{'name': 'nke-Q125-10-Q', 'url': 'https://storage.googleapis.com/reflexivity-documents-prod/edgar/filing/10-q/nke-Q125-10-Q.html'}, {'name': 'nke-Q225-10-Q', 'url': 'https://storage.googleapis.com/reflexivity-documents-prod/edgar/filing/10-q/nke-Q225-10-Q.html'}, {'name': 'nke-FY25-10-K', 'url': 'https://storage.googleapis.com/reflexivity-documents-prod/edgar/filing/10-k/nke-FY25-10-K.html'}]",10291,USD,NKE,SMART,STK,True,CL2
consumer and retail,clothing_and_accessories,US5500211090,LULULEMON ATHLETICA INC,2,"Diseña, fabrica y vende ropa y accesorios deportivos, ofreciendo una amplia gama de productos para yoga, running, entrenamiento y otras actividades a un mercado global.","El negocio de Lululemon se centra fundamentalmente en ropa y accesorios, ya que la empresa es principalmente un diseñador, distribuidor y minorista de ropa deportiva técnica, calzado y accesorios. La empresa ofrece una línea completa de ropa y accesorios comercializados bajo la marca Lululemon, que incluye artículos como pantalones, shorts, tops y chaquetas diseñados para diversas actividades. Lululemon destaca constantemente la importancia de la innovación de productos y la novedad en su surtido de ropa y accesorios para impulsar el crecimiento, enfatizando líneas de productos específicas y nuevos lanzamientos.","[{'name': 'lulu-FY24-10-K', 'url': 'https://storage.googleapis.com/reflexivity-documents-prod/edgar/filing/10-k/lulu-FY24-10-K.html'}, {'name': 'lulu-Q324-10-Q', 'url': 'https://storage.googleapis.com/reflexivity-documents-prod/edgar/filing/10-q/lulu-Q324-10-Q.html'}, {'name': 'lulu-Q224-10-Q', 'url': 'https://storage.googleapis.com/reflexivity-documents-prod/edgar/filing/10-q/lulu-Q224-10-Q.html'}]",45157951,USD,LULU,SMART,STK,True,CL2
consumer and retail,clothing_and_accessories,US9182041080,VF CORP,3,"Diseña, fabrica y comercializa una cartera diversa de ropa, calzado y accesorios de estilo de vida de marca, contribuyendo significativamente al mercado mundial de ropa y accesorios.","El negocio de VF Corporation está significativamente ligado a la industria de la Ropa y los Accesorios, como lo demuestra su diversa cartera de marcas reconocidas como The North Face, Vans, Timberland y Dickies, que ofrecen una amplia gama de prendas de vestir, calzado y accesorios en sus segmentos Outdoor, Active y Work. La empresa reconoce explícitamente la importancia de la demanda de los consumidores por estos productos y se enfoca en la innovación de productos, particularmente en la ropa de estilo de vida, para impulsar el crecimiento de la marca. Además, el enfoque estratégico de VF en mujeres y jóvenes, ejemplificado por la respuesta positiva a productos como las Vans Super Low Pro, subraya aún más su participación en el mercado de la ropa y los accesorios.","[{'name': 'vfc-Q126-10-Q', 'url': 'https://storage.googleapis.com/reflexivity-documents-prod/edgar/filing/10-q/vfc-Q126-10-Q.html'}, {'name': 'vfc-Q325-10-Q', 'url': 'https://storage.googleapis.com/reflexivity-documents-prod/edgar/filing/10-q/vfc-Q325-10-Q.html'}, {'name': 'vfc-Q225-10-Q', 'url': 'https://storage.googleapis.com/reflexivity-documents-prod/edgar/filing/10-q/vfc-Q225-10-Q.html'}, {'name': 'vfc-FY25-10-K', 'url': 'https://storage.googleapis.com/reflexivity-documents-prod/edgar/filing/10-k/vfc-FY25-10-K.html'}]",13440,USD,VFC,SMART,STK,True,CL2
consumer and retail,clothing_and_accessories,US6936561009,PVH CORP,4,"Opera como una empresa de moda global, propietaria y comercializadora de una cartera diversa de marcas icónicas de ropa y accesorios que marcan tendencias y elecciones de los consumidores en todo el mundo.","La participación de PVH en el tema de Ropa y Accesorios es sustancial, como lo demuestra el modelo de negocio principal de la empresa centrado en el diseño, distribución y venta de una amplia gama de prendas de vestir y productos relacionados. PVH genera ventas netas de la distribución mayorista de ropa deportiva de marca, jeans, ropa de rendimiento, lencería, ropa interior, trajes de baño, camisas de vestir, bolsos, accesorios y calzado. Las marcas icónicas globales de estilo de vida de la empresa, TOMMY HILFIGER y Calvin Klein, generan juntas una parte significativa de los ingresos de PVH, con categorías específicas como ropa interior y mezclilla para Calvin Klein y estilos icónicos para Tommy Hilfiger impulsando el rendimiento. El enfoque estratégico de la empresa en estas categorías de productos, junto con diseños innovadores y campañas de marketing, subraya la importancia de la ropa y los accesorios para el negocio general de PVH.","[{'name': 'pvh-Q224-10-Q', 'url': 'https://storage.googleapis.com/reflexivity-documents-prod/edgar/filing/10-q/pvh-Q224-10-Q.html'}, {'name': 'pvh-Q324-10-Q', 'url': 'https://storage.googleapis.com/reflexivity-documents-prod/edgar/filing/10-q/pvh-Q324-10-Q.html'}, {'name': 'pvh-FY24-10-K', 'url': 'https://storage.googleapis.com/reflexivity-documents-prod/edgar/filing/10-k/pvh-FY24-10-K.html'}, {'name': 'pvh-Q125-10-Q', 'url': 'https://storage.googleapis.com/reflexivity-documents-prod/edgar/filing/10-q/pvh-Q125-10-Q.html'}]",90794895,USD,PVH,SMART,STK,True,CL2
consumer and retail,clothing_and_accessories,FR0000121014,LVMH MOET HENNESSY LOUIS VUI,5,"Abarca numerosas marcas prestigiosas especializadas en ropa de alta gama, artículos de cuero y accesorios de moda, posicionándose como un conglomerado de lujo líder a nivel mundial que da forma significativamente al mercado.",,,29612150,EUR,MC,SMART,STK,False,CL2
consumer and retail,clothing_and_accessories,ES0148396007,INDUSTRIA DE DISENO TEXTIL,6,"Se dedica al diseño, producción y distribución de textiles para indumentaria y accesorios, sirviendo a un mercado global.",,,162084958,EUR,ITX,SMART,STK,False,CL2
consumer and retail,clothing_and_accessories,US52736R1023,LEVI STRAUSS & CO- CLASS A,7,"Opera como un diseñador y comercializador global de ropa y accesorios de marca, particularmente conocido por sus productos de mezclilla, que son fundamentales para el sector de la ropa y los accesorios.","Levi Strauss & Co. está fuertemente involucrada en la industria de la ropa y los accesorios, diseñando, comercializando y vendiendo una amplia gama de prendas para hombres, mujeres y niños bajo marcas como Levi’s®, Dockers® y Beyond Yoga®. La gama de productos de la empresa incluye jeans, pantalones, ropa deportiva, tops y accesorios. Levi's está evolucionando más allá de sus raíces de mezclilla para convertirse en una marca de estilo de vida de ropa de pies a cabeza, impulsando el crecimiento en categorías como tops, vestidos y ropa de abrigo, con un enfoque particular en la expansión de sus ofertas para mujeres, que ahora representan una parte significativa de los ingresos netos.","[{'name': 'levi-Q125-10-Q', 'url': 'https://storage.googleapis.com/reflexivity-documents-prod/edgar/filing/10-q/levi-Q125-10-Q.html'}, {'name': 'levi-Q225-10-Q', 'url': 'https://storage.googleapis.com/reflexivity-documents-prod/edgar/filing/10-q/levi-Q225-10-Q.html'}, {'name': 'levi-FY24-10-K', 'url': 'https://storage.googleapis.com/reflexivity-documents-prod/edgar/filing/10-k/levi-FY24-10-K.html'}]",358053635,USD,LEVI,SMART,STK,False,CL2
consumer and retail,clothing_and_accessories,FR0000121485,KERING,8,"Opera como un grupo de lujo global que abarca casas de renombre que diseñan, fabrican y distribuyen ropa, artículos de cuero y otros accesorios.",,,29612178,EUR,KER,SMART,STK,False,CL2
consumer and retail,clothing_and_accessories,VGG1890L1076,CAPRI HOLDINGS LTD,9,"Se enfoca en la creación y venta de ropa, calzado y accesorios de lujo a través de su cartera de marcas globales de renombre.","Capri Holdings, un grupo mundial de moda de lujo, demuestra su enfoque en el tema de Ropa y Accesorios a través de sus marcas icónicas: Versace, Jimmy Choo y Michael Kors. Estas marcas generan ingresos a través de la venta de prêt-à-porter, accesorios y calzado. La empresa diseña productos excepcionales e innovadores, que cubren todo el espectro de categorías de moda de lujo, incluidas líneas de productos específicas como bolsos y colecciones de prêt-à-porter para Michael Kors y Jimmy Choo.","[{'name': 'cpri-Q126-10-Q', 'url': 'https://storage.googleapis.com/reflexivity-documents-prod/edgar/filing/10-q/cpri-Q126-10-Q.html'}, {'name': 'cpri-Q325-10-Q', 'url': 'https://storage.googleapis.com/reflexivity-documents-prod/edgar/filing/10-q/cpri-Q325-10-Q.html'}, {'name': 'cpri-FY25-10-K', 'url': 'https://storage.googleapis.com/reflexivity-documents-prod/edgar/filing/10-k/cpri-FY25-10-K.html'}, {'name': 'cpri-Q225-10-Q', 'url': 'https://storage.googleapis.com/reflexivity-documents-prod/edgar/filing/10-q/cpri-Q225-10-Q.html'}]",347409760,USD,CPRI,SMART,STK,True,CL2
consumer and retail,clothing_and_accessories,US7512121010,RALPH LAUREN CORP,10,"Diseña, comercializa y distribuye productos de estilo de vida premium, incluyendo ropa, accesorios y fragancias, estableciéndose como un actor global prominente dentro de la industria de la moda.","El compromiso de Ralph Lauren con el tema de Ropa y Accesorios es evidente a través de su liderazgo mundial en el diseño, marketing y distribución de estos productos, que se mencionan explícitamente como parte de su oferta de estilo de vida de lujo. Los productos principales de la compañía, incluidos artículos icónicos como las camisas Polo de malla, los suéteres de punto trenzado y las gorras Polo, representan una parte importante de su negocio. Además, Ralph Lauren interactúa activamente con los consumidores a través de la moda, patrocinios de celebridades e inversiones estratégicas de marketing, enfatizando el estilo atemporal y la autenticidad de la marca. Este compromiso se ve reforzado por las prioridades estratégicas de la compañía, que incluyen impulsar las ventas de productos principales y expandirse a categorías de alto potencial como la ropa de mujer y los bolsos.","[{'name': 'rl-Q126-10-Q', 'url': 'https://storage.googleapis.com/reflexivity-documents-prod/edgar/filing/10-q/rl-Q126-10-Q.html'}, {'name': 'rl-Q325-10-Q', 'url': 'https://storage.googleapis.com/reflexivity-documents-prod/edgar/filing/10-q/rl-Q325-10-Q.html'}, {'name': 'rl-Q225-10-Q', 'url': 'https://storage.googleapis.com/reflexivity-documents-prod/edgar/filing/10-q/rl-Q225-10-Q.html'}, {'name': 'rl-FY25-10-K', 'url': 'https://storage.googleapis.com/reflexivity-documents-prod/edgar/filing/10-k/rl-FY25-10-K.html'}]",92306678,USD,RL,SMART,STK,True,CL2
consumer and retail,clothing_and_accessories,DE000A1EWWW0,ADIDAS AG,11,"Diseña, fabrica y comercializa una amplia gama de indumentaria, calzado y accesorios deportivos y de estilo de vida, dando forma significativamente a las tendencias e impulsando la innovación dentro del mercado global de ropa y accesorios.",,,79780521,EUR,ADS,SMART,STK,False,CL2
consumer and retail,clothing_and_accessories,US8725401090,TJX COMPANIES INC,12,"Opera como un minorista líder de precios bajos, ofreciendo una amplia gama de ropa y accesorios de marca a los consumidores a través de su extensa red de tiendas.","La conexión de TJX con el tema de Ropa y Accesorios es evidente a través de su modelo de negocio principal como el minorista líder de moda de ropa y hogar a precios reducidos. La compañía vende un surtido de ropa en rápida evolución, lo que contribuye significativamente a sus ingresos, con un crecimiento de las ventas comparables de ropa que generalmente se alinea con los aumentos generales de las ventas. Este enfoque se ve aún más enfatizado por la inversión de TJX en BFL (Brands for Less), un importante minorista de ropa de marca a precios reducidos, y la presentación constante de un crecimiento positivo de las ventas comparables en las categorías de ropa.","[{'name': 'tjx-Q325-10-Q', 'url': 'https://storage.googleapis.com/reflexivity-documents-prod/edgar/filing/10-q/tjx-Q325-10-Q.html'}, {'name': 'tjx-Q126-10-Q', 'url': 'https://storage.googleapis.com/reflexivity-documents-prod/edgar/filing/10-q/tjx-Q126-10-Q.html'}, {'name': 'tjx-FY25-10-K', 'url': 'https://storage.googleapis.com/reflexivity-documents-prod/edgar/filing/10-k/tjx-FY25-10-K.html'}]",12814,USD,TJX,SMART,STK,True,CL2
consumer and retail,clothing_and_accessories,US3647601083,GAP INC/THE,13,"Opera un negocio minorista global centrado en el diseño, marketing y venta de una amplia gama de ropa y accesorios.","El negocio de Gap Inc. se centra en gran medida en la industria de la ropa y los accesorios, como lo demuestra su cartera de marcas, que incluyen Old Navy, Gap, Banana Republic y Athleta, todas ellas que ofrecen ropa y accesorios para hombres, mujeres y niños. La empresa enfatiza la importancia de estas líneas de productos, con Old Navy reconocida como la marca y minorista de ropa especializada número 1 en los EE. UU. Gap Inc. también ostenta la posición del negocio de comercio electrónico de ropa número 1 en los EE. UU. El enfoque de la empresa se demuestra aún más mediante iniciativas estratégicas como el refinamiento de la estética del producto en Banana Republic y el enfoque en categorías clave como la mezclilla y la ropa deportiva en múltiples marcas.","[{'name': 'gap-Q125-10-Q', 'url': 'https://storage.googleapis.com/reflexivity-documents-prod/edgar/filing/10-q/gap-Q125-10-Q.html'}, {'name': 'gap-FY24-10-K', 'url': 'https://storage.googleapis.com/reflexivity-documents-prod/edgar/filing/10-k/gap-FY24-10-K.html'}, {'name': 'gap-Q224-10-Q', 'url': 'https://storage.googleapis.com/reflexivity-documents-prod/edgar/filing/10-q/gap-Q224-10-Q.html'}, {'name': 'gap-Q324-10-Q', 'url': 'https://storage.googleapis.com/reflexivity-documents-prod/edgar/filing/10-q/gap-Q324-10-Q.html'}]",7765,USD,GAP,SMART,STK,True,CL2
consumer and retail,clothing_and_accessories,US55616P1049,MACYS INC,14,Ofrece una amplia selección de ropa y accesorios en sus canales minoristas.,"Macy's está activamente involucrada con el tema de Ropa y Accesorios, como lo demuestra el rendimiento superior de las ventas comparables en ropa contemporánea y de carrera para mujeres, así como en ropa de sastrería para hombres. La empresa se enfoca en ofrecer nuevos productos en todas las categorías y proporcionar moda y valor atractivos en sus marcas privadas de ropa para mujeres, incluidas Charter Club y Style & Co. Macy's también está revitalizando su surtido al reducir la exposición a marcas menos relevantes y expandir las ofertas en marcas a las que sus clientes responden, mientras que Bloomingdale's ha tenido éxito con ropa contemporánea avanzada.","[{'name': 'm-Q324-10-Q', 'url': 'https://storage.googleapis.com/reflexivity-documents-prod/edgar/filing/10-q/m-Q324-10-Q.html'}, {'name': 'm-Q224-10-Q', 'url': 'https://storage.googleapis.com/reflexivity-documents-prod/edgar/filing/10-q/m-Q224-10-Q.html'}]",44475946,USD,M,SMART,STK,True,CL2
consumer and retail,clothing_and_accessories,US22266T1097,COUPANG INC,15,"Ofrece una amplia selección de ropa y accesorios a través de su plataforma de comercio electrónico, sirviendo como un importante canal minorista para los consumidores.","El compromiso de Coupang con el tema de Ropa y Accesorios está impulsado significativamente por su adquisición de Farfetch, un mercado global líder en moda de lujo. Esta adquisición se destaca en varias secciones y representa un énfasis estratégico en el segmento de la moda de lujo. La inclusión de Farfetch en el segmento de Ofertas en Desarrollo de Coupang, que aporta $1.7 mil millones en ingresos, y su impacto en el costo de ventas y los gastos operativos, subraya aún más el compromiso y la inversión de la empresa en esta industria.","[{'name': 'cpng-FY24-10-K', 'url': 'https://storage.googleapis.com/reflexivity-documents-prod/edgar/filing/10-k/cpng-FY24-10-K.html'}]",475686899,USD,CPNG,SMART,STK,False,CL2
consumer and retail,clothing_and_accessories,US87612E1064,TARGET CORP,16,"Ofrece una amplia gama de ropa y accesorios, sirviendo como un destino minorista clave para los consumidores que buscan estos productos.","El compromiso de Target con el tema de Ropa y Accesorios es evidente a través de varias estrategias clave y contribuciones financieras. La empresa enfatiza productos asequibles y de moda, como lo demuestran asociaciones exitosas como la colección Kate Spade, que fue su más exitosa en más de una década. La ropa y los accesorios representan consistentemente una parte significativa de las ventas de Target, representando el 16% de las ventas de mercancía. Si bien hubo caídas en las ventas en categorías discrecionales, incluida Ropa y Accesorios en 2023, Target continúa ofreciendo opciones de moda, como los jeans para mujer y la colaboración con Champion, lo que indica un enfoque continuo en esta categoría de productos.","[{'name': 'tgt-Q125-10-Q', 'url': 'https://storage.googleapis.com/reflexivity-documents-prod/edgar/filing/10-q/tgt-Q125-10-Q.html'}, {'name': 'tgt-Q324-10-Q', 'url': 'https://storage.googleapis.com/reflexivity-documents-prod/edgar/filing/10-q/tgt-Q324-10-Q.html'}, {'name': 'tgt-FY23-10-K', 'url': 'https://storage.googleapis.com/reflexivity-documents-prod/edgar/filing/10-k/tgt-FY23-10-K.html'}, {'name': 'tgt-Q224-10-Q', 'url': 'https://storage.googleapis.com/reflexivity-documents-prod/edgar/filing/10-q/tgt-Q224-10-Q.html'}]",6437,USD,TGT,SMART,STK,True,CL2
consumer and retail,clothing_and_accessories,US9311421039,WALMART INC,17,"Ofrece una amplia selección de ropa y accesorios, lo que contribuye significativamente a la accesibilidad y asequibilidad de la moda para una gran base de clientes.","El compromiso de Walmart con el tema de Ropa y Accesorios es evidente en sus ventas de mercancía general, que se vieron influenciadas positivamente por la ropa en todos los segmentos y categorías de EE. UU. El negocio de moda de la compañía ha experimentado un crecimiento significativo, atrayendo a un número creciente de clientes que ahora ven a Walmart como un destino de moda. Este crecimiento abarca varias categorías, incluyendo zapatos, ropa de mujer, hombre, niños y bebés.",,13824,USD,WMT,SMART,STK,True,CL2
consumer and retail,clothing_and_accessories,BMG812761002,SIGNET JEWELERS LTD,18,"Ofrece joyería para venta minorista, contribuyendo a la categoría de accesorios dentro del sector de Ropa y Accesorios.","La participación de Signet en el tema de Ropa y Accesorios es evidente a través de su enfoque en joyería de moda. La estrategia de la empresa incluye el lanzamiento de nuevas campañas de moda en Zales y Jared, la introducción de nuevos productos de moda en Kay y la expansión de las ofertas de servicios, todo lo cual está dirigido a construir valor de marca en la categoría de moda. Esto está respaldado además por la estrategia de la empresa 'Grow Brand Love', que implica alinear marcas y equilibrar la arquitectura del surtido tanto en novias como en moda. Signet destaca el impacto positivo de las nuevas ofertas de productos de moda en su Precio Unitario Promedio (AUR), con nuevos surtidos de moda impulsando las ventas y compensando la presión de precios competitivos.","[{'name': 'sig-Q325-10-Q', 'url': 'https://storage.googleapis.com/reflexivity-documents-prod/edgar/filing/10-q/sig-Q325-10-Q.html'}, {'name': 'sig-FY25-10-K', 'url': 'https://storage.googleapis.com/reflexivity-documents-prod/edgar/filing/10-k/sig-FY25-10-K.html'}, {'name': 'sig-Q126-10-Q', 'url': 'https://storage.googleapis.com/reflexivity-documents-prod/edgar/filing/10-q/sig-Q126-10-Q.html'}]",53747825,USD,SIG,SMART,STK,True,CL2
consumer and retail,clothing_and_accessories,NL0015000PB5,ERMENEGILDO ZEGNA NV,19,"Opera como una casa de moda de lujo líder, diseñando, fabricando y distribuyendo ropa y accesorios de alta gama para hombres a nivel mundial.","El enfoque de Zegna en el tema de Ropa y Accesorios es evidente en sus operaciones comerciales principales, ya que los ingresos, el beneficio bruto y el EBIT ajustado de la empresa se generan a través de los segmentos de moda Zegna, Thom Browne y Tom Ford, todos los cuales se centran principalmente en ropa y accesorios. Estas marcas se destacan aún más a través de desfiles de moda y colecciones, como el desfile de moda TOM FORD para el invierno del 25 en París y la colección Vellus Aureum para Zegna. La empresa produce activamente ropa y accesorios, enfatizando la evolución del producto y la variedad en las tiendas, con una parte significativa de la producción que ocurre en sus propias fábricas, mientras que las campañas de marketing, como la campaña Zegna Otoño/Invierno '25 con el 'traje Torino' y los 'zapatos Vetta', subrayan aún más el enfoque de la empresa en ropa y accesorios.",,532829500,USD,ZGN,SMART,STK,False,CL2
consumer and retail,clothing_and_accessories,GB0031743007,BURBERRY GROUP PLC,20,"Opera como una marca global de moda de lujo, especializada en el diseño, fabricación y venta minorista de ropa y accesorios de alta gama, incluyendo prendas de abrigo, prêt-à-porter, artículos de cuero y calzado.",,,15977601,GBP,BRBY,SMART,STK,False,CL2
consumer and retail,clothing_and_accessories,US1985161066,COLUMBIA SPORTSWEAR CO,21,"Diseña, fabrica y comercializa una amplia gama de ropa, calzado, accesorios y equipos para actividades al aire libre y estilo de vida activo.","El compromiso de Columbia Sportswear Company con el tema de Ropa y Accesorios es evidente a través de su gestión de líneas de productos en indumentaria, accesorios y equipamiento, ofrecidos bajo las marcas Columbia, Mountain Hardwear y prAna. La empresa diseña, desarrolla, comercializa y distribuye estos productos para actividades al aire libre, deportivas y de estilo de vida, con un enfoque en indumentaria y calzado. Esto se demuestra aún más con el lanzamiento de nuevas colecciones como la New Amaze Puff Insulated Jacket y la rediseñada Rock Band, así como iniciativas de marketing y la introducción de nuevas tecnologías como Insect Shield. La empresa también reconoce el impacto de los aranceles sobre la indumentaria y el calzado importados, lo que indica su participación activa en el mercado de la ropa y los accesorios.","[{'name': 'colm-FY24-10-K', 'url': 'https://storage.googleapis.com/reflexivity-documents-prod/edgar/filing/10-k/colm-FY24-10-K.html'}, {'name': 'colm-Q324-10-Q', 'url': 'https://storage.googleapis.com/reflexivity-documents-prod/edgar/filing/10-q/colm-Q324-10-Q.html'}, {'name': 'colm-Q125-10-Q', 'url': 'https://storage.googleapis.com/reflexivity-documents-prod/edgar/filing/10-q/colm-Q125-10-Q.html'}]",4728458,USD,COLM,SMART,STK,True,CL2
consumer and retail,clothing_and_accessories,US2435371073,DECKERS OUTDOOR CORP,22,"Desarrolla y comercializa una cartera diversa de marcas premium de calzado y ropa, contribuyendo significativamente al mercado global de ropa y accesorios.","El compromiso de la empresa con el tema de la industria de la ropa y los accesorios es evidente a través de su diseño, marketing y distribución de estos productos bajo sus marcas propias, incluidas UGG y HOKA. La marca UGG, en particular, presenta una línea resistente de ropa y accesorios de primera calidad con ofertas de productos durante todo el año, mientras que HOKA ofrece ropa y accesorios selectos. Este énfasis en la ropa y los accesorios, junto con el calzado, los posiciona como un componente clave de la cartera de productos de la empresa, atrayendo a una audiencia global en crecimiento.","[{'name': 'deck-Q225-10-Q', 'url': 'https://storage.googleapis.com/reflexivity-documents-prod/edgar/filing/10-q/deck-Q225-10-Q.html'}, {'name': 'deck-Q325-10-Q', 'url': 'https://storage.googleapis.com/reflexivity-documents-prod/edgar/filing/10-q/deck-Q325-10-Q.html'}, {'name': 'deck-FY25-10-K', 'url': 'https://storage.googleapis.com/reflexivity-documents-prod/edgar/filing/10-k/deck-FY25-10-K.html'}, {'name': 'deck-Q126-10-Q', 'url': 'https://storage.googleapis.com/reflexivity-documents-prod/edgar/filing/10-q/deck-Q126-10-Q.html'}]",268376,USD,DECK,SMART,STK,True,CL2
