industry_id,theme_id,symbol,industry,theme,isin_code,name,rank,description,evidence,evidenceSources,ib_conid,currency,exchange,assetType
TE,CON,RUM,technology,content_creation,US78137L1052,RUMBLE INC,30,"Proporciona una plataforma que permite a los creadores de contenido publicar y monetizar sus videos, fomentando un ecosistema diverso para los medios digitales.","La plataforma de Rumble está diseñada para ayudar a los creadores de contenido a gestionar, distribuir y monetizar su contenido conectándolos con marcas, editores y su audiencia. La empresa incurre en costos relacionados con la programación y el contenido, incluido el incentivo a los principales creadores de contenido para que se unan a la plataforma. Rumble tiene un motor de monetización en la economía de los creadores y se enfoca en localizar el producto Rumble Video en varios idiomas, incluido el uso de IA para localizar contenido. La empresa también está lanzando un nuevo programa para creadores.","[{'name': 'rum-Q225-10-Q', 'url': 'https://storage.googleapis.com/reflexivity-documents-prod/edgar/filing/10-q/rum-Q225-10-Q.html'}]",586264441,USD,SMART,STK
TE,CON,SNAP,technology,content_creation,US83304A1060,SNAP INC - A,31,"Proporciona una plataforma para que los usuarios creen y compartan diversas formas de contenido digital, incluyendo fotos, videos y experiencias de realidad aumentada.",,,268060148,USD,SMART,STK
TE,CON,SIRI,technology,content_creation,US8299331004,SIRIUS XM HOLDINGS INC,32,"Involucra la creación y distribución de una amplia gama de contenido de audio, incluyendo música exclusiva, programas de entrevistas y podcasts, para sus plataformas de radio satelital y de streaming.","El compromiso de SiriusXM con la creación de contenido es evidente a través de su énfasis en contenido único en vivo y curado por humanos para impulsar la audiencia y los ingresos. La empresa está expandiendo activamente su catálogo de contenido e invirtiendo en podcasting, incluido el lanzamiento de la suscripción de podcast Plus en múltiples canales. La solución Creator Connect de SiriusXM permite a los especialistas en marketing interactuar con las audiencias de los creadores a través de plataformas de audio, video y redes sociales, mientras que su red de podcasts alcanzó casi mil millones de descargas en el primer trimestre, lo que demuestra un compromiso con la creación de contenido en diversos medios.",,727785544,USD,SMART,STK
TE,CON,HAS,technology,content_creation,US4180561072,HASBRO INC,33,Participa en actividades que contribuyen al tema de Creación de Contenido.,,,754956,USD,SMART,STK
TE,CON,IPG,technology,content_creation,US4606901001,INTERPUBLIC GROUP OF COS INC,34,Impulsa la creación de contenido a través del desarrollo y ejecución de diversas campañas de marketing y publicidad para clientes en diversas plataformas de medios.,"La participación de IPG en la creación de contenido es evidente a través de sus capacidades que abarcan desde la ideación hasta la ejecución, incluyendo estrategia creativa, de medios y de marketing, así como la orquestación de campañas, contenido y canales. La compañía aprovecha Interact para la ideación creativa, la creación de contenido y las pruebas de mensajes, mejorando la eficiencia y la comprensión. Además, los equipos de IPG utilizan Interact para la comprensión del consumidor, el análisis de mercado y la automatización de flujos de trabajo de marketing complejos, capacitando a las agencias para ofrecer un mayor impacto a las marcas de los clientes.","[{'name': 'ipg-Q225-10-Q', 'url': 'https://storage.googleapis.com/reflexivity-documents-prod/edgar/filing/10-q/ipg-Q225-10-Q.html'}, {'name': 'ipg-Q324-10-Q', 'url': 'https://storage.googleapis.com/reflexivity-documents-prod/edgar/filing/10-q/ipg-Q324-10-Q.html'}, {'name': 'ipg-Q125-10-Q', 'url': 'https://storage.googleapis.com/reflexivity-documents-prod/edgar/filing/10-q/ipg-Q125-10-Q.html'}]",8514,USD,VALUE,STK
TE,CON,OMC,technology,content_creation,US6819191064,OMNICOM GROUP,35,"Impulsa la creación de contenido a través del extenso desarrollo y producción de materiales publicitarios, de marketing y de comunicación para su diversa clientela global.","La participación de Omnicom en la creación de contenido es evidente a través de sus estrategias impulsadas por IA y plataformas de automatización de contenido. La empresa aprovecha la IA para mejorar los conocimientos, aumentar la velocidad y el volumen de personalización del contenido y mejorar la efectividad de la segmentación de clientes. Esto se facilita a través de Omni AI, una plataforma de código abierto que utiliza modelos de IA generativa para diversos formatos de contenido, incluyendo texto, gráficos, video y audio. Solidificando aún más su posición, Omnicom ha sido reconocida como líder en los informes Wave de Forrester para contenido, comercio y medios, destacando el éxito de su plataforma de automatización de contenido, ArtBot.",,10811,USD,SMART,STK
TE,CON,HUBS,technology,content_creation,US4435731009,HUBSPOT INC,36,"Facilita el desarrollo y la distribución de contenido de marketing a través de su plataforma de software integrada, permitiendo a las empresas atraer y captar audiencias.","La participación de HubSpot en el tema de Creación de Contenido es evidente en sus centros de interacción impulsados por IA, que incluyen un Centro de Contenido dedicado, y su plataforma de clientes, que admite la creación, distribución y diversificación de contenido en diversas plataformas. HubSpot está ayudando activamente a los clientes a crecer a través del contenido, particularmente con herramientas como Content Agent, que ha ayudado a más de 12.000 clientes en el último año, algunos de los cuales generan la mayoría de su contenido utilizando IA. La empresa también se enfoca en adaptarse al panorama cambiante del contenido, asegurando que el contenido esté optimizado para redes sociales, podcasts, boletines informativos y respuestas de LLM, y está innovando en Content Hub, que incluye la remezcla de contenido y la remezcla de podcasts.","[{'name': 'hubs-FY24-10-K', 'url': 'https://storage.googleapis.com/reflexivity-documents-prod/edgar/filing/10-k/hubs-FY24-10-K.html'}]",169544810,USD,SMART,STK
TE,CON,IAC,technology,content_creation,US44891N2080,IAC INC,37,Contribuye al tema de Creación de Contenido mediante el desarrollo y la difusión de una variedad de contenido a través de sus segmentos operativos.,"El compromiso de IAC con el tema de Creación de Contenido es evidente a través de su subsidiaria, Dotdash Meredith, una de las mayores editoriales digitales y de impresión de Estados Unidos. People Inc., un segmento de Dotdash Meredith, se enfoca en producir contenido hecho por personas para personas, enfatizando la experiencia de escritores y probadores de productos para crear contenido que deleita, enseña, inspira y entretiene. Este compromiso se extiende a las regalías de licencias de contenido obtenidas de plataformas como Apple News+ y la utilización de contenido en actividades relacionadas con la IA, lo que indica un enfoque en la distribución de contenido y acuerdos de licencia de marca con varios socios. El contenido de marca de Dotdash Meredith también dirige a los consumidores a los sitios web de socios comerciales, demostrando aún más su papel en la creación de contenido.","[{'name': 'iac-FY24-10-K', 'url': 'https://storage.googleapis.com/reflexivity-documents-prod/edgar/filing/10-k/iac-FY24-10-K.html'}, {'name': 'iac-Q125-10-Q', 'url': 'https://storage.googleapis.com/reflexivity-documents-prod/edgar/filing/10-q/iac-Q125-10-Q.html'}, {'name': 'iac-Q225-10-Q', 'url': 'https://storage.googleapis.com/reflexivity-documents-prod/edgar/filing/10-q/iac-Q225-10-Q.html'}, {'name': 'iac-Q324-10-Q', 'url': 'https://storage.googleapis.com/reflexivity-documents-prod/edgar/filing/10-q/iac-Q324-10-Q.html'}]",491653063,USD,SMART,STK
TE,CON,DUOL,technology,content_creation,US26603R1068,DUOLINGO,38,"Impulsa el tema de Creación de Contenido a través de su desarrollo continuo de lecciones educativas, historias y ejercicios para la adquisición de idiomas.",,,505002183,USD,SMART,STK
TE,CON,ZD,technology,content_creation,US48123V1026,ZIFF DAVIS INC,39,"Implica la producción y distribución de contenido digital a través de varias plataformas, contribuyendo al panorama más amplio de los medios en línea.","La compañía demuestra su compromiso con la creación de contenido a través de la provisión de contenido, herramientas y servicios en diversos sectores, incluyendo tecnología, compras, juegos, entretenimiento, salud, bienestar y conectividad. Un enfoque principal de los programas de monetización de plataformas de la compañía es ofrecer contenido significativo diseñado para informar y dar forma a la intención de compra del consumidor. Además, la compañía aprovecha sus activos de marca y editoriales para desarrollar plataformas de suscripción, que generan tráfico a sus sitios web, aplicaciones y plataformas de terceros, monetizando posteriormente este tráfico a través de servicios de publicidad.","[{'name': 'zd-Q225-10-Q', 'url': 'https://storage.googleapis.com/reflexivity-documents-prod/edgar/filing/10-q/zd-Q225-10-Q.html'}, {'name': 'zd-FY24-10-K', 'url': 'https://storage.googleapis.com/reflexivity-documents-prod/edgar/filing/10-k/zd-FY24-10-K.html'}]",98538357,USD,SMART,STK
TE,CON,PTON,technology,content_creation,US70614W1009,PELOTON INTERACTIVE INC-A,40,"Crea una vasta biblioteca de clases de fitness interactivas, que incluyen sesiones en vivo y bajo demanda, con instructores profesionales y producción de alta calidad para atraer a una base global de suscriptores.","El compromiso de Peloton con la Creación de Contenido es evidente en su plataforma basada en suscripción, que combina hardware, software y contenido exclusivo. La empresa incurre en costos relacionados con la creación y transmisión de contenido, lo que refleja una dedicación a esta área. Como componente central de su servicio, Peloton crea contenido de fitness para su plataforma, enfatizando el contenido exclusivo como un elemento clave.","[{'name': 'pton-Q325-10-Q', 'url': 'https://storage.googleapis.com/reflexivity-documents-prod/edgar/filing/10-q/pton-Q325-10-Q.html'}]",385087203,USD,SMART,STK
TE,CON,DLB,technology,content_creation,US25659T1079,DOLBY LABORATORIES INC-CL A,41,Proporciona tecnologías avanzadas de audio e imagen que son integrales para la creación y producción de contenido de alta calidad en diversas plataformas de medios.,"La participación de Dolby en el tema Creación de Contenido es evidente a través de sus asociaciones e integraciones de productos, particularmente en el sector de dispositivos móviles. La compañía enfatiza la importancia de la creación de contenido, destacando colaboraciones como el smartphone RedNote X8 de OPPO con Dolby Vision Capture para contenido generado por el usuario, así como Motorola lanzando su primer smartphone con Dolby Vision Capture. Además, las tecnologías de Dolby se integran en plataformas populares de redes sociales, especialmente en China, con Dolby Vision admitido por plataformas como Xiaohongshu, Kuaishou y Bilibili, y más del 90% de los artistas de Billboard 100 grabando en Dolby Atmos.",,33205673,USD,SMART,STK
TE,CON,TGNA,technology,content_creation,US87901J1051,TEGNA INC,42,"Se dedica a la creación de contenido de noticias locales, deportes y entretenimiento para su transmisión a través de sus estaciones de televisión.","El compromiso de TEGNA con la Creación de Contenido es evidente en su papel como un importante productor de noticias locales, generando más de 1.700 horas de contenido semanalmente, y su énfasis en 'contenido atractivo' para servir a las comunidades locales. La creación de contenido de la empresa se extiende a la transmisión de contenido deportivo popular, incluyendo deportes profesionales y universitarios y los Juegos Olímpicos, y la propiedad de redes multicast como True Crime Network y Quest. Además, TEGNA licencia contenido para su redistribución, lo que resalta aún más su actividad en la creación de contenido.","[{'name': 'tgna-Q324-10-Q', 'url': 'https://storage.googleapis.com/reflexivity-documents-prod/edgar/filing/10-q/tgna-Q324-10-Q.html'}, {'name': 'tgna-FY24-10-K', 'url': 'https://storage.googleapis.com/reflexivity-documents-prod/edgar/filing/10-k/tgna-FY24-10-K.html'}, {'name': 'tgna-Q225-10-Q', 'url': 'https://storage.googleapis.com/reflexivity-documents-prod/edgar/filing/10-q/tgna-Q225-10-Q.html'}]",196887976,USD,SMART,STK
TE,CON,NXST,technology,content_creation,US65336K1034,NEXSTAR MEDIA GROUP INC,43,"Se dedica a la producción y distribución de diversos contenidos mediáticos, incluyendo noticias, entretenimiento y otras programaciones, para sus plataformas de difusión y digitales.","El compromiso de Nexstar con la creación de contenido es evidente a través de la operación de 200 estaciones de televisión de potencia completa y una estación de radio AM, junto con su participación en The CW y NewsNation. Los equipos de noticias locales y nacionales de la compañía brindan reportajes e información de 113 salas de redacción, empleando a casi 6.000 periodistas. Este compromiso con el contenido se demuestra aún más al incluir los costos de creación de contenido como uno de sus gastos operativos principales, junto con la programación de noticias, producción y promoción.","[{'name': 'nxst-Q324-10-Q', 'url': 'https://storage.googleapis.com/reflexivity-documents-prod/edgar/filing/10-q/nxst-Q324-10-Q.html'}, {'name': 'nxst-FY24-10-K', 'url': 'https://storage.googleapis.com/reflexivity-documents-prod/edgar/filing/10-k/nxst-FY24-10-K.html'}]",26904818,USD,SMART,STK
TE,CON,IMAX,technology,content_creation,CA45245E1097,IMAX CORP,44,Proporciona tecnología cinematográfica avanzada y plataformas de exhibición que permiten a los cineastas crear y presentar contenido visual inmersivo.,"El compromiso de IMAX con la creación de contenido es evidente en su papel como plataforma tecnológica global para el entretenimiento y los eventos. La empresa proporciona una solución integral, aprovechando software propietario, arquitectura de auditorio, propiedad intelectual patentada y equipos especializados para crear experiencias de contenido inmersivas. Los principales cineastas y estudios utilizan la tecnología de IMAX, y el proceso de remasterización de películas de IMAX mejora la calidad de imagen y la resolución, lo que demuestra aún más la participación de la empresa en la creación de contenido.",,4813359,USD,SMART,STK
TE,CON,SEMR,technology,content_creation,US81686C1045,SEMRUSH HOLDINGS INC-A,45,"Proporciona herramientas y análisis que ayudan en la investigación, optimización y seguimiento del rendimiento del contenido digital, apoyando así estrategias efectivas de creación de contenido.","La plataforma de Semrush se centra en el marketing de contenidos, lo que permite a las empresas identificar e interactuar con su público objetivo a través de estrategias de contenido optimizadas. La plataforma de la empresa incluye marketing de contenidos, que ayuda a los clientes a analizar, mejorar y medir la navegación y el rendimiento del sitio web, la relevancia y autoridad del contenido, y los intereses generales de los clientes potenciales. La plataforma utiliza datos e inteligencia, rodeada de centros interconectados impulsados por IA, con un enfoque específico en el marketing de contenidos, lo que permite a las empresas identificar y llegar a la audiencia adecuada para su contenido.","[{'name': 'semr-Q225-10-Q', 'url': 'https://storage.googleapis.com/reflexivity-documents-prod/edgar/filing/10-q/semr-Q225-10-Q.html'}]",478483413,USD,SMART,STK
TE,CON,TEAM,technology,content_creation,US0494681010,ATLASSIAN CORP-CL A,46,"Facilita la creación, colaboración y gestión de diversos tipos de contenido a través de sus soluciones de software basadas en equipos.",,,589316251,USD,SMART,STK
TE,CON,SRAD,technology,content_creation,CH1134239669,SPORTRADAR GROUP AG-A,47,Genera contenido relevante para el sector deportivo.,,,513610886,USD,SMART,STK
TE,CON,WLY,technology,content_creation,US9682232064,WILEY (JOHN) & SONS-CLASS A,48,"Participa en la creación y publicación de contenido académico, científico y profesional, sirviendo a las comunidades educativas y de investigación a nivel mundial.","La participación de Wiley en la creación de contenido se demuestra a través de su posición como una importante editorial global en investigación y aprendizaje, adaptando contenido, servicios y plataformas para satisfacer las necesidades de diversos clientes. La empresa está produciendo activamente investigaciones revisadas por pares y escalando contenido digital y material didáctico de alto valor. Además, Wiley ejecutó un proyecto de derechos de contenido de $21 millones para entrenar modelos de lenguaje grandes de GenAI, con una parte de los ingresos reconocida en el segmento de Aprendizaje, y también reconoció $9 millones en ingresos de GenAI debido a la expansión de un proyecto de licencia de contenido ejecutado previamente para entrenamiento.","[{'name': 'wly-Q325-10-Q', 'url': 'https://storage.googleapis.com/reflexivity-documents-prod/edgar/filing/10-q/wly-Q325-10-Q.html'}, {'name': 'wly-Q225-10-Q', 'url': 'https://storage.googleapis.com/reflexivity-documents-prod/edgar/filing/10-q/wly-Q225-10-Q.html'}, {'name': 'wly-Q125-10-Q', 'url': 'https://storage.googleapis.com/reflexivity-documents-prod/edgar/filing/10-q/wly-Q125-10-Q.html'}, {'name': 'wly-FY25-10-K', 'url': 'https://storage.googleapis.com/reflexivity-documents-prod/edgar/filing/10-k/wly-FY25-10-K.html'}]",276049,USD,SMART,STK
TE,CON,CXM,technology,content_creation,US85208T1079,SPRINKLR INC-A,49,"Proporciona una plataforma unificada que permite a las empresas crear, gestionar y publicar contenido para la experiencia del cliente y la interacción en redes sociales a través de diversos canales digitales.","La participación de Sprinklr en la Creación de Contenido es evidente en su enfoque en la entrega de contenido y experiencias al cliente en diversos mercados. La empresa equipa a los equipos de servicio al cliente y redes sociales con flujos de trabajo impulsados por IA y una gobernanza mejorada, lo que ayuda a transformar la entrega de contenido. La plataforma de Sprinklr ofrece capacidades de publicación de primer nivel y apoya el crecimiento futuro en servicio al cliente, publicidad y escucha. La empresa también reconoce la importancia de los avances en IA, comercio social, experiencias de contenido inmersivas y estrategias de contenido multifuncionales en las redes sociales.",,498661804,USD,SMART,STK
TE,CON,LLYVK.OLD,technology,content_creation,US5312297220,LIBERTY MEDIA CORP-LIBERTY-C,50,Participa en operaciones asociadas con el tema de Creación de Contenido.,,,646249551,USD,VALUE,STK
TE,CON,BOX,technology,content_creation,US10316T1043,BOX INC - CLASS A,51,Contribuye al tema de Creación de Contenido.,,,181158987,USD,SMART,STK
TE,CON,MGNI,technology,content_creation,US55955D1000,MAGNITE INC,52,Apoya a los creadores de contenido al proporcionar una plataforma para monetizar su contenido digital a través de publicidad programática.,"Magnite está aprovechando la IA para categorizar automáticamente el inventario de CTV en segmentos contextuales, mejorando la dirigibilidad del contenido y el alcance de las campañas. Esto implica analizar el contenido de video para mejorar la orientación y monetización de anuncios, lo que facilita una mejor organización del contenido. Sin embargo, el papel de Magnite en la creación de contenido se centra principalmente en mejorar la categorización del contenido para fines publicitarios.",,430755197,USD,SMART,STK
