industry_id,theme_id,symbol,industry,theme,isin_code,name,rank,description,evidence,evidenceSources,ib_conid,currency,exchange,assetType
TE,CON,ADBE,technology,content_creation,US00724F1012,ADOBE INC,1,"Proporciona software y servicios en la nube estándar de la industria que permiten a los profesionales creativos y a las empresas diseñar, editar y publicar una amplia gama de contenido digital en diversos medios.","La participación de Adobe en el tema de Creación de Contenido es evidente a través de su completa plataforma creativa, que se extiende desde la ideación hasta la entrega. Las ofertas de Creative Cloud de la empresa, incluidas aplicaciones insignia como Photoshop, Illustrator, Premiere Pro y After Effects, proporcionan herramientas de escritorio, aplicaciones móviles y servicios basados en la nube para diseñar, crear y publicar contenido enriquecido. Adobe Firefly, una herramienta de IA creativa, aumenta estas aplicaciones y atrae a nuevos usuarios, con un crecimiento significativo de suscriptores por primera vez. Además, Adobe Express ayuda a las organizaciones a escalar la creación de contenido manteniendo la coherencia de la marca, lo que refleja la estrategia de Adobe para hacer que la creatividad sea más accesible e impactante.","[{'name': 'adbe-Q324-10-Q', 'url': 'https://storage.googleapis.com/reflexivity-documents-prod/edgar/filing/10-q/adbe-Q324-10-Q.html'}, {'name': 'adbe-Q125-10-Q', 'url': 'https://storage.googleapis.com/reflexivity-documents-prod/edgar/filing/10-q/adbe-Q125-10-Q.html'}, {'name': 'adbe-Q225-10-Q', 'url': 'https://storage.googleapis.com/reflexivity-documents-prod/edgar/filing/10-q/adbe-Q225-10-Q.html'}, {'name': 'adbe-FY24-10-K', 'url': 'https://storage.googleapis.com/reflexivity-documents-prod/edgar/filing/10-k/adbe-FY24-10-K.html'}]",265768,USD,SMART,STK
TE,CON,NFLX,technology,content_creation,US64110L1061,NETFLIX INC,2,"Produce a nivel mundial una biblioteca vasta y diversa de películas, series y documentales originales, sirviendo como un impulsor principal de contenido de entretenimiento para su base de suscriptores en todo el mundo.","Netflix demuestra un fuerte enfoque en la creación de contenido a través de diversas iniciativas. La empresa invierte fuertemente en contenido global y original, como se refleja en importantes amortizaciones de contenido y pagos de activos. Netflix produce contenido original en numerosos países, asociándose con talento local y aprovechando la IA para mejorar la creación de contenido, incluido el uso de herramientas de IA para efectos visuales y otros aspectos de producción. Este compromiso se extiende a apoyar a los creadores y mejorar continuamente la experiencia del miembro a través de contenido atractivo.","[{'name': 'nflx-FY24-10-K', 'url': 'https://storage.googleapis.com/reflexivity-documents-prod/edgar/filing/10-k/nflx-FY24-10-K.html'}, {'name': 'nflx-Q324-10-Q', 'url': 'https://storage.googleapis.com/reflexivity-documents-prod/edgar/filing/10-q/nflx-Q324-10-Q.html'}]",15124833,USD,SMART,STK
TE,CON,WBD,technology,content_creation,US9344231041,WARNER BROS DISCOVERY INC,3,"Desarrolla, produce y distribuye una vasta cartera de películas, series de televisión y programación fáctica a nivel mundial, lo que la convierte en un contribuyente significativo a la industria de creación de contenido.","La participación de Warner Bros. Discovery en la Creación de Contenidos es evidente en su papel como empresa líder mundial de medios y entretenimiento, creando y distribuyendo una cartera diversa de contenidos a través de varias plataformas, incluidas la televisión, el cine, el streaming y los videojuegos. La empresa enfatiza la narración de alta calidad e invierte en sus estudios para producir contenido tanto para plataformas internas como externas, aprovechando su propiedad intelectual para construir franquicias globales como DC y Harry Potter. Con equipos creativos dedicados a la creación de contenido, incluidos los de HBO, Warner Bros. Television y DC Studios, la empresa aspira a ser la mejor empresa de narración, centrándose en los activos propios y las estrategias diferenciadas.","[{'name': 'wbd-Q125-10-Q', 'url': 'https://storage.googleapis.com/reflexivity-documents-prod/edgar/filing/10-q/wbd-Q125-10-Q.html'}, {'name': 'wbd-Q224-10-Q', 'url': 'https://storage.googleapis.com/reflexivity-documents-prod/edgar/filing/10-q/wbd-Q224-10-Q.html'}, {'name': 'wbd-Q324-10-Q', 'url': 'https://storage.googleapis.com/reflexivity-documents-prod/edgar/filing/10-q/wbd-Q324-10-Q.html'}, {'name': 'wbd-FY24-10-K', 'url': 'https://storage.googleapis.com/reflexivity-documents-prod/edgar/filing/10-k/wbd-FY24-10-K.html'}]",554208351,USD,SMART,STK
TE,CON,DIS,technology,content_creation,US2546871060,WALT DISNEY CO/THE,4,"Es un creador global líder de contenido de entretenimiento, que produce películas, programas de televisión y otros medios que cautivan a audiencias en todo el mundo.","La empresa demuestra un fuerte compromiso con la Creación de Contenidos, como lo demuestra su importante inversión tanto en contenido producido como en programación licenciada, con gastos que reflejan aproximadamente $23 mil millones. Esta inversión es integral para el segmento de Entretenimiento, que genera ingresos a través de la producción y distribución de películas, series y otros contenidos en diversas líneas de negocio, incluidas redes lineales, plataformas directas al consumidor y ventas/licencias de contenido. El enfoque de la empresa en el contenido se destaca aún más por las menciones frecuentes de los costos de producción y programación de contenido en sus presentaciones.","[{'name': 'dis-Q125-10-Q', 'url': 'https://storage.googleapis.com/reflexivity-documents-prod/edgar/filing/10-q/dis-Q125-10-Q.html'}, {'name': 'dis-FY24-10-K', 'url': 'https://storage.googleapis.com/reflexivity-documents-prod/edgar/filing/10-k/dis-FY24-10-K.html'}]",6459,USD,SMART,STK
TE,CON,AMZN,technology,content_creation,US0231351067,AMAZON.COM INC,5,"Participa ampliamente en la creación de contenido en video, audio y publicación, produciendo programación original y proporcionando plataformas que empoderan a los creadores independientes para llegar a audiencias globales.","La participación de Amazon en la creación de contenido es evidente a través de su producción de contenido multimedia, que se ofrece a través de sus tiendas junto con otras mercancías. Esta actividad requiere una fuerza laboral dedicada involucrada en la curación y exhibición de estos productos y servicios dentro de las tiendas en línea de Amazon. Además, los flujos de efectivo operativos de Amazon se derivan de una base de clientes diversa que incluye creadores de contenido, lo que indica que Amazon apoya a los creadores de contenido.","[{'name': 'amzn-Q125-10-Q', 'url': 'https://storage.googleapis.com/reflexivity-documents-prod/edgar/filing/10-q/amzn-Q125-10-Q.html'}, {'name': 'amzn-FY24-10-K', 'url': 'https://storage.googleapis.com/reflexivity-documents-prod/edgar/filing/10-k/amzn-FY24-10-K.html'}]",3691937,USD,SMART,STK
TE,CON,GOOGL,technology,content_creation,US02079K3059,ALPHABET INC-CL A,6,"Proporciona amplias plataformas y herramientas que permiten a los creadores producir, distribuir y monetizar una gran variedad de contenido digital en diversos formatos.",,,208813719,USD,SMART,STK
TE,CON,META,technology,content_creation,US30303M1027,META PLATFORMS INC-CLASS A,7,"Ofrece amplias plataformas y herramientas que permiten a los creadores producir y distribuir una amplia gama de contenido digital, fomentando la participación y proporcionando vías de monetización.","El enfoque de Meta en la creación de contenido se ve significativamente mejorado por la IA, con inversiones en herramientas para ayudar a los creadores a producir contenido original. Mark Zuckerberg destacó que la IA permite la creación de mejor contenido, ayudando a los usuarios a producir y compartir contenido, y generando contenido personalizado directamente. Meta está invirtiendo en herramientas para ayudar a los creadores a producir contenido original en sus plataformas, incluido el lanzamiento de la aplicación independiente Edits, que apoya todo el proceso creativo para los creadores de video e incluye herramientas de IA generativa. La empresa también está mejorando los sistemas de recomendación para aumentar el tiempo de permanencia en sus plataformas y amplió el acceso a la expansión de video a Facebook Reels y lanzó la generación de imágenes a todos los anunciantes elegibles.",,107113386,USD,SMART,STK
TE,CON,AAPL,technology,content_creation,US0378331005,APPLE INC,8,"Ofrece herramientas y plataformas que facilitan la creación y distribución de contenido diverso, apoyando tanto la producción de medios individual como profesional.",,,265598,USD,SMART,STK
TE,CON,CMCSA,technology,content_creation,US20030N1019,COMCAST CORP-CLASS A,9,"Crea y produce una amplia gama de contenido de entretenimiento, noticias y deportes a través de sus plataformas de estudio, red y streaming, contribuyendo significativamente al panorama de la creación de contenido.","El compromiso de Comcast con la Creación de Contenido es evidente a través de sus significativos costos de programación y producción, particularmente dentro de los segmentos de Contenido y Experiencias, que abarcan tanto las divisiones de Medios como de Estudios. El segmento de Estudios genera ingresos activamente al licenciar contenido, mientras que el segmento de Medios incurre en costos asociados con el contenido en redes de televisión de entretenimiento de marca Sky. Además, los ingresos por licencias de contenido de la empresa se ven afectados por eventos como los Juegos Olímpicos y los paros laborales que involucran al Gremio de Escritores y SAG, lo que demuestra aún más la importancia de la creación de contenido para las operaciones de Comcast.","[{'name': 'cmcsa-FY24-10-K', 'url': 'https://storage.googleapis.com/reflexivity-documents-prod/edgar/filing/10-k/cmcsa-FY24-10-K.html'}, {'name': 'cmcsa-Q324-10-Q', 'url': 'https://storage.googleapis.com/reflexivity-documents-prod/edgar/filing/10-q/cmcsa-Q324-10-Q.html'}]",267748,USD,SMART,STK
TE,CON,6758,technology,content_creation,JP3435000009,SONY GROUP CORP,10,"Participa en la creación y distribución de una amplia gama de contenidos de entretenimiento, incluyendo videojuegos, películas, programas de televisión y música, al tiempo que proporciona herramientas profesionales para creadores de contenido.",,,13905705,JPY,SMART,STK
TE,CON,RBLX,technology,content_creation,US7710491033,ROBLOX CORP -CLASS A,11,"Proporciona una plataforma que permite a los usuarios crear, compartir y monetizar experiencias y juegos inmersivos, fomentando una comunidad grande y activa de creadores de contenido.","La plataforma de Roblox está significativamente moldeada por su enfoque en permitir la creación de contenido, como lo demuestra su activa inversión en herramientas y recursos para su comunidad de creadores. La empresa enfatiza la creación de condiciones para el crecimiento impulsado por su comunidad de creadores, proporcionando herramientas como Roblox Studio y la Creator Store. Roblox está desarrollando activamente herramientas avanzadas como la generación de código, la generación de objetos 3D y funciones impulsadas por IA para mejorar la creación de contenido, incluida la capacidad de crear escenas 3D completas y generación 4D, así como moderación impulsada por IA para la seguridad del contenido.","[{'name': 'rblx-FY24-10-K', 'url': 'https://storage.googleapis.com/reflexivity-documents-prod/edgar/filing/10-k/rblx-FY24-10-K.html'}]",476026060,USD,SMART,STK
TE,CON,EA,technology,content_creation,US2855121099,ELECTRONIC ARTS INC,12,"Desarrolla y publica entretenimiento digital interactivo, contribuyendo significativamente al panorama de la creación de contenido de videojuegos.","La participación de EA en la creación de contenido es evidente a través de varias iniciativas, incluida la fusión de contenido cinematográfico con su experiencia interactiva de F1, una colaboración que amplificó la emoción y extendió el alcance de EA SPORTS F1 25. La compañía también permite a los fanáticos amplificar los momentos destacados a través de herramientas para creadores. Además, EA planea lanzar skate. como una plataforma impulsada por creadores arraigada en la cultura callejera, lo que indica una inversión continua en la creación de contenido.",,268995,USD,SMART,STK
TE,CON,U,technology,content_creation,US91332U1016,UNITY SOFTWARE INC,13,"Proporciona una plataforma y herramientas líderes para el desarrollo y la operación de contenido 3D en tiempo real, permitiendo a los creadores de las industrias de videojuegos, cine y otras industrias interactivas.","El enfoque de la empresa en la creación de contenido es evidente en su segmento Create, que proporciona herramientas y software, particularmente para el desarrollo de juegos. Están transformando el desarrollo y soporte de software, con una re dedicación a la calidad y una mejor experiencia del desarrollador que impulsan los resultados financieros. La empresa también está aumentando las inversiones en talento y desarrollo de productos, planeando aumentar el papel de la IA en la experiencia central de creación de contenido de Unity, utilizando datos de aplicaciones desarrolladas por Unity para predecir las necesidades de los desarrolladores y transformar la creación de contenido.",,445423543,USD,SMART,STK
TE,CON,SPOT,technology,content_creation,LU1778762911,SPOTIFY TECHNOLOGY SA,14,"Proporciona una plataforma líder para creadores de contenido de audio, permitiendo la distribución y monetización de música y podcasts a una audiencia global.","El compromiso de Spotify con la creación de contenido es evidente en su estrategia para aumentar la participación del usuario mediante la expansión de sus formatos de contenido, especialmente los podcasts de video, que han experimentado un crecimiento sustancial en el consumo. La compañía apoya a los creadores de contenido a través del Spotify Partner Program y agregando nuevos formatos al servicio. Spotify se enfoca en la maximización del catálogo para impulsar una mayor participación y está invirtiendo en podcasts de audio y video. Además, Spotify está invirtiendo en herramientas y plataformas para apoyar la creación de contenido, incluidas herramientas impulsadas por IA, capacidades de video para creadores de música y asociaciones como ElevenLabs para audiolibros.",,312496724,USD,SMART,STK
TE,CON,FOXA,technology,content_creation,US35137L1052,FOX CORP - CLASS A,15,"Participa en la creación y distribución de una amplia gama de contenidos de noticias, deportes y entretenimiento a través de diversas plataformas.","Fox Corporation demuestra su participación en la creación de contenido a través de sus diversos segmentos de negocio. El segmento de Programación de Redes de Cable se enfoca en producir y licenciar contenido de noticias y deportes, mientras que el segmento de Televisión produce, adquiere, comercializa y distribuye programación a través de plataformas como la red de transmisión FOX y Tubi, que ha crecido a más de 300.000 títulos de películas y televisión. Además, el segmento de Televisión incluye varias compañías de producción que producen contenido tanto para la empresa como para terceros, lo que contribuye a aumentar los ingresos por contenido.","[{'name': 'foxa-Q125-10-Q', 'url': 'https://storage.googleapis.com/reflexivity-documents-prod/edgar/filing/10-q/foxa-Q125-10-Q.html'}, {'name': 'foxa-Q325-10-Q', 'url': 'https://storage.googleapis.com/reflexivity-documents-prod/edgar/filing/10-q/foxa-Q325-10-Q.html'}, {'name': 'foxa-FY24-10-K', 'url': 'https://storage.googleapis.com/reflexivity-documents-prod/edgar/filing/10-k/foxa-FY24-10-K.html'}]",356858008,USD,SMART,STK
TE,CON,NYT,technology,content_creation,US6501111073,NEW YORK TIMES CO-A,16,Se enfoca en la creación y distribución de contenido periodístico de alta calidad a través de diversas plataformas.,"The New York Times Company está profundamente comprometida con la creación de contenido, como lo demuestra su enfoque en producir y distribuir noticias e información de alta calidad. Este compromiso se refleja en su inversión en periodismo y experiencias de producto, con esfuerzos para mejorar la accesibilidad a través de formatos de video y audio, así como la creación de nuevos programas, funciones y juegos. El costo de los ingresos de la compañía incluye todos los costos relacionados con la creación de contenido, enfatizando aún más su papel central en sus operaciones, con el objetivo de hacer que cada uno de sus productos sea más valioso.","[{'name': 'nyt-Q324-10-Q', 'url': 'https://storage.googleapis.com/reflexivity-documents-prod/edgar/filing/10-q/nyt-Q324-10-Q.html'}, {'name': 'nyt-FY24-10-K', 'url': 'https://storage.googleapis.com/reflexivity-documents-prod/edgar/filing/10-k/nyt-FY24-10-K.html'}]",755883,USD,SMART,STK
TE,CON,BIDU,technology,content_creation,US0567521085,BAIDU INC - SPON ADR,17,Contribuye a la industria de Creación de Contenidos.,,,35359385,USD,SMART,STK
TE,CON,TKO,technology,content_creation,US87256C1018,TKO GROUP HOLDINGS INC,18,"Crea y distribuye un volumen significativo de contenido deportivo y de entretenimiento en vivo y televisado a través de sus marcas globales líderes, contribuyendo ampliamente al panorama de la creación de contenido.","TKO Group Holdings demuestra su participación en la creación de contenido a través de diversas vías, principalmente a través de sus subsidiarias UFC, WWE e IMG. Las capacidades de producción global de IMG se destacan constantemente, y la empresa ofrece miles de horas de cobertura deportiva para eventos importantes, incluido un fin de semana singular en el que más de 1.000 miembros del equipo produjeron contenido en tres continentes. WWE también contribuye creando oportunidades para que los fanáticos interactúen con contenido auxiliar, como acceso detrás de escena y documentales. TKO monetiza sus propiedades de medios y contenido a través de derechos de medios, producción y distribución de contenido, lo que indica su papel activo en la generación de contenido visual, escrito y multimedia para diversas plataformas de medios.","[{'name': 'tko-Q125-10-Q', 'url': 'https://storage.googleapis.com/reflexivity-documents-prod/edgar/filing/10-q/tko-Q125-10-Q.html'}]",652841542,USD,SMART,STK
TE,CON,035420,technology,content_creation,KR7035420009,NAVER CORP,19,El tema de la industria de creación de contenido representa un área central de sus operaciones comerciales.,,,36834734,KRW,KSE,STK
TE,CON,NWSA,technology,content_creation,US65249B1098,NEWS CORP - CLASS A,20,"Produce y distribuye una amplia gama de contenido de noticias, información y entretenimiento, contribuyendo significativamente al panorama de los medios.","La participación de News Corp en la Creación de Contenido se realiza principalmente a través de sus segmentos de Medios de Noticias y Publicaciones de Libros. Dentro del segmento de Medios de Noticias, Storyful opera como una agencia de contenido de redes sociales. Además, el segmento de Publicaciones de Libros incluye HarperCollins, una importante editorial de libros a nivel mundial con operaciones en numerosos países, lo que indica el papel de la empresa en la creación y distribución de contenido diverso.","[{'name': 'nwsa-Q225-10-Q', 'url': 'https://storage.googleapis.com/reflexivity-documents-prod/edgar/filing/10-q/nwsa-Q225-10-Q.html'}, {'name': 'nwsa-Q325-10-Q', 'url': 'https://storage.googleapis.com/reflexivity-documents-prod/edgar/filing/10-q/nwsa-Q325-10-Q.html'}]",129348126,USD,SMART,STK
TE,CON,9888,technology,content_creation,KYG070341048,BAIDU INC-CLASS A,21,"Opera dentro del tema Creación de Contenido, lo que indica la participación en varios aspectos de la generación y distribución de contenido.",,,476787454,HKD,SEHK,STK
TE,CON,WMG,technology,content_creation,US9345502036,WARNER MUSIC GROUP CORP-CL A,22,"Participa en la creación, producción y distribución de contenido musical a nivel mundial, abarcando una amplia gama de artistas y géneros.",,,424890313,USD,SMART,STK
TE,CON,ROKU,technology,content_creation,US77543R1023,ROKU INC,23,"Se dedica a la producción de contenido original para su plataforma de streaming, expandiendo así la oferta disponible dentro de la industria de creación de contenido.","El compromiso de Roku con la creación de contenido es evidente en el costo de los ingresos de su plataforma, que incluye los costos de amortización de contenido tanto para contenido licenciado como producido. Esto indica que la creación y licencia de contenido son estratégicamente importantes para la plataforma. Roku genera ingresos de la plataforma a partir de la distribución de servicios de streaming, incluidas las participaciones en los ingresos por suscripción y transacciones, así como la venta de suscripciones premium. La empresa incurre en costos de amortización de contenido tanto para contenido licenciado como producido, lo que sugiere un nivel de inversión y asignación de recursos en esta área.","[{'name': 'roku-Q125-10-Q', 'url': 'https://storage.googleapis.com/reflexivity-documents-prod/edgar/filing/10-q/roku-Q125-10-Q.html'}, {'name': 'roku-FY24-10-K', 'url': 'https://storage.googleapis.com/reflexivity-documents-prod/edgar/filing/10-k/roku-FY24-10-K.html'}]",290651477,USD,SMART,STK
TE,CON,RDDT,technology,content_creation,US75734B1008,REDDIT INC-CL A,24,"Sirve como una plataforma destacada para contenido generado por el usuario, permitiendo a diversas comunidades crear y compartir información, discusiones y medios.","La conexión de Reddit con el tema de Creación de Contenido es evidente a través de varios aspectos de su negocio. La empresa genera ingresos de acuerdos de licencia de contenido y avatares coleccionables, y tiene la intención de abrir canales de monetización adicionales al proporcionar a los usuarios y creadores las herramientas e incentivos para impulsar la creación continua de contenido, mejoras y comercio. Además, Reddit se enfoca en facilitar la contribución a las comunidades, trabajando en formatos de medios más enriquecidos y agilizando el proceso de contribución para los usuarios. La plataforma también invierte en hacer que el contenido creativo sea más fácil, portátil y optimizado, incluida la integración de IA para identificar las mejores variantes creativas.","[{'name': 'rddt-Q125-10-Q', 'url': 'https://storage.googleapis.com/reflexivity-documents-prod/edgar/filing/10-q/rddt-Q125-10-Q.html'}, {'name': 'rddt-FY24-10-K', 'url': 'https://storage.googleapis.com/reflexivity-documents-prod/edgar/filing/10-k/rddt-FY24-10-K.html'}, {'name': 'rddt-Q225-10-Q', 'url': 'https://storage.googleapis.com/reflexivity-documents-prod/edgar/filing/10-q/rddt-Q225-10-Q.html'}]",692025016,USD,SMART,STK
TE,CON,PUB,technology,content_creation,FR0000130577,PUBLICIS GROUPE,25,"Desarrolla y produce una amplia gama de contenidos creativos para campañas publicitarias, de marketing y de comunicación en diversas plataformas para sus clientes globales.",,,1254581,EUR,SMART,STK
TE,CON,WPP,technology,content_creation,JE00B8KF9B49,WPP PLC,26,"Se enfoca en el desarrollo y producción de contenido publicitario, de marketing y de relaciones públicas para una clientela global.",,,119773886,GBP,SMART,STK
TE,CON,WIX,technology,content_creation,IL0011301780,WIX.COM LTD,27,"Ofrece una plataforma integral con herramientas intuitivas que permiten a los usuarios diseñar, construir y publicar sitios web, facilitando directamente diversas formas de creación de contenido.","Wix está significativamente involucrado con el tema de Creación de Contenido, impulsado por su enfoque en avances impulsados por IA que reducen las barreras para la creación digital, permitiendo a los usuarios producir proyectos sofisticados con mayor velocidad y facilidad. Esto se refleja en la creciente demanda de creación en línea impulsada por IA y la fortaleza observada de Wix en su embudo de incorporación de IA, junto con una mayor adopción de IA en toda su plataforma. La empresa reconoce el cambio fundamental en la creación de contenido en línea y el papel crítico de la IA en la expansión de las posibilidades para los usuarios.",,137867351,USD,SMART,STK
TE,CON,PSON,technology,content_creation,GB0006776081,PEARSON PLC,28,"Desarrolla y publica una amplia gama de contenidos educativos, plataformas de aprendizaje digital y materiales de evaluación utilizados a nivel mundial para la enseñanza y el aprendizaje.",,,909170,GBP,SMART,STK
TE,CON,VMEO,technology,content_creation,US92719V1008,VIMEO INC,29,"Proporciona herramientas y plataformas para que los usuarios creen, alojen y distribuyan contenido de video, apoyando a diversos creadores de contenido.","La plataforma de Vimeo se centra en transformar la forma en que las personas crean y comparten videos, ofreciendo un conjunto integral de herramientas de video entregadas a través de un modelo SaaS. Su enfoque incluye proporcionar capacidades intuitivas de creación y edición de video, con el objetivo de eliminar las barreras para el uso de video. Este compromiso se refleja en la provisión de productos de vanguardia que unen la tecnología con la innovación creativa, abordando las necesidades esenciales de video y solidificando su papel en la habilitación de la creación de contenido.","[{'name': 'vmeo-FY24-10-K', 'url': 'https://storage.googleapis.com/reflexivity-documents-prod/edgar/filing/10-k/vmeo-FY24-10-K.html'}]",491665421,USD,VALUE,STK
