type,link_type,key,name,rank,description,evidence,evidenceSources,conid,currency,symbol,exchange,assetType,navigable
defense and aerospace,defense_drones,US50077B2079,KRATOS DEFENSE & SECURITY,1,Un desarrollador y fabricante principal de sistemas aéreos no tripulados avanzados y tecnologías de drones para operaciones de defensa y seguridad.,"Kratos tiene una presencia significativa en la industria de drones de defensa, como lo demuestra el hecho de que los sistemas de drones aéreos no tripulados propulsados por jet son una de sus principales áreas de negocio. Esto se ve respaldado además por la participación de Kratos en el negocio de drones tácticos, incluido el dron Valkyrie, que se está convirtiendo en un programa de registro para el Cuerpo de Marines de EE. UU., así como por la asociación de Airbus con Kratos para una misión europea centrada en Valkyrie. Kratos también está licitando activamente en grandes oportunidades de drones y expandiendo su capacidad de fabricación de drones jet no tripulados, lo que demuestra un fuerte compromiso con esta área.","[{'name': 'ktos-Q225-10-Q', 'url': 'https://storage.googleapis.com/reflexivity-documents-prod/edgar/filing/10-q/ktos-Q225-10-Q.html'}, {'name': 'ktos-Q125-10-Q', 'url': 'https://storage.googleapis.com/reflexivity-documents-prod/edgar/filing/10-q/ktos-Q125-10-Q.html'}, {'name': 'ktos-FY24-10-K', 'url': 'https://storage.googleapis.com/reflexivity-documents-prod/edgar/filing/10-k/ktos-FY24-10-K.html'}, {'name': 'ktos-Q324-10-Q', 'url': 'https://storage.googleapis.com/reflexivity-documents-prod/edgar/filing/10-q/ktos-Q324-10-Q.html'}]",68492173,USD,KTOS,SMART,STK,True
defense and aerospace,defense_drones,US5398301094,LOCKHEED MARTIN CORP,2,"Desarrolla y suministra una amplia gama de sistemas aéreos no tripulados avanzados para aplicaciones de defensa, contribuyendo significativamente a las capacidades militares modernas.","El segmento de negocio de Aeronáutica de Lockheed Martin contribuye significativamente al tema de Drones de Defensa a través de su participación en la investigación, diseño, desarrollo, fabricación, integración, sostenimiento, soporte y mejora de aeronaves militares avanzadas, incluidos vehículos aéreos no tripulados. Esta participación resalta la importancia estratégica y la inversión de la empresa en vehículos aéreos no tripulados, aunque la extensión del personal dedicado y la contribución de ingresos sigue sin estar clara. Si bien la empresa exhibe una singularidad moderada en su enfoque de drones de defensa, sus actividades explícitas en esta área demuestran un compromiso notable con el tema.","[{'name': 'lmt-FY24-10-K', 'url': 'https://storage.googleapis.com/reflexivity-documents-prod/edgar/filing/10-k/lmt-FY24-10-K.html'}]",611191,USD,LMT,SMART,STK,True
defense and aerospace,defense_drones,US6668071029,NORTHROP GRUMMAN CORP,3,Desarrolla y proporciona sistemas aéreos no tripulados avanzados y tecnologías relacionadas para aplicaciones de defensa.,"La participación de la empresa en el tema de Drones de Defensa es evidente a través de su segmento de Sistemas de Aeronáutica, que se enfoca en el diseño, desarrollo, producción, integración, sostenimiento y modernización de sistemas de aeronaves militares. Un aspecto clave de este segmento es la producción de sistemas de aeronaves autónomas no tripuladas, incluidos sistemas estratégicos de inteligencia, vigilancia y reconocimiento (ISR) de gran altitud y larga duración (HALE), que se identifican como productos principales para la Fuerza Aérea de EE. UU., la Armada de EE. UU., otras agencias del gobierno de EE. UU. y clientes internacionales.","[{'name': 'noc-FY24-10-K', 'url': 'https://storage.googleapis.com/reflexivity-documents-prod/edgar/filing/10-k/noc-FY24-10-K.html'}]",10376,USD,NOC,SMART,STK,True
defense and aerospace,defense_drones,US0080731088,AEROVIRONMENT INC,4,"Desarrolla y suministra sistemas avanzados de aeronaves no tripuladas, que son críticos para las operaciones de defensa y seguridad a nivel mundial.","La participación de AeroVironment en el tema de Drones de Defensa es evidente a través de su diverso portafolio de Sistemas No Tripulados (UxS), que incluyen Sistemas Aéreos Pequeños No Tripulados (SUAS), Sistemas Aéreos Medianos No Tripulados (MUAS) y Vehículos Terrestres No Tripulados (UGV). El segmento LMS de la compañía y la familia de soluciones Switchblade impulsan un crecimiento expansivo, respaldado por importantes adjudicaciones de contratos y una fuerte demanda internacional. AeroVironment se enfoca en capacidades de ataque de precisión y contra-UAS, ejemplificadas por la familia Switchblade, el dron de ataque unidireccional Red Dragon y el sistema de defensa antimisiles de próxima generación contra-UAS FE-1, siendo Red Dragon una solución con capacidad totalmente autónoma diseñada para entornos con GPS denegado y que aborda directamente las necesidades del Departamento de Defensa de EE. UU.","[{'name': 'avav-Q125-10-Q', 'url': 'https://storage.googleapis.com/reflexivity-documents-prod/edgar/filing/10-q/avav-Q125-10-Q.html'}, {'name': 'avav-Q325-10-Q', 'url': 'https://storage.googleapis.com/reflexivity-documents-prod/edgar/filing/10-q/avav-Q325-10-Q.html'}, {'name': 'avav-Q225-10-Q', 'url': 'https://storage.googleapis.com/reflexivity-documents-prod/edgar/filing/10-q/avav-Q225-10-Q.html'}]",42464367,USD,AVAV,SMART,STK,True
defense and aerospace,defense_drones,US75513E1010,RTX CORP,5,Desarrolla y suministra sistemas aéreos no tripulados avanzados y tecnologías relacionadas para aplicaciones de defensa.,"La participación de RTX en la industria de drones de defensa se demuestra a través de sus programas y sistemas de Sistemas de Aeronaves No Tripuladas (C-UAS), como el Coyote counter-UAS, que se considera una prioridad clave y una solución probada en batalla. Además, LTAMDS mejora la protección contra amenazas, incluidos los sistemas de aeronaves no tripuladas. Los aumentos en las ventas han sido impulsados por programas de sistemas de defensa terrestre y aérea, incluidos los programas C-UAS, lo que indica la participación de la empresa en la tecnología de drones de defensa.","[{'name': 'rtx-Q324-10-Q', 'url': 'https://storage.googleapis.com/reflexivity-documents-prod/edgar/filing/10-q/rtx-Q324-10-Q.html'}]",415342104,USD,RTX,SMART,STK,True
defense and aerospace,defense_drones,GB0002634946,BAE SYSTEMS PLC,6,"Se dedica al diseño, fabricación y despliegue de vehículos aéreos no tripulados y sistemas relacionados para operaciones de defensa.",,,908964,GBP,BA.,SMART,STK,False
defense and aerospace,defense_drones,US69608A1088,PALANTIR TECHNOLOGIES INC-A,7,Ofrece plataformas fundamentales de inteligencia artificial e integración de datos esenciales para el despliegue estratégico y el análisis de operaciones de drones de defensa.,,,444857009,USD,PLTR,SMART,STK,True
defense and aerospace,defense_drones,US46269C1027,IRIDIUM COMMUNICATIONS INC,8,"Permite la comunicación satelital segura y confiable para drones de defensa, facilitando su comando, control y transmisión de datos en áreas operativas vastas y remotas.","La participación de Iridium en la industria de drones de defensa se refleja en su asociación a largo plazo con el gobierno de EE. UU., incluido un contrato EMSS con el DoD, que garantiza una cobertura global confiable de voz y datos. El trabajo de la empresa con la Agencia de Desarrollo Espacial (SDA) para desarrollar infraestructura terrestre para una nueva red de combatientes ilustra aún más su conexión con aplicaciones de defensa. Si bien los servicios de tiempo y ubicación satelital de Iridium se están integrando en varias soluciones, y existe interés en abordar los problemas del GPS, la empresa también reconoce la presencia de competidores como Starlink y Star Shield en el mercado en general.",,69195736,USD,IRDM,SMART,STK,True
defense and aerospace,defense_drones,US8832031012,TEXTRON INC,9,"Desarrolla y suministra sistemas avanzados de aeronaves no tripuladas para aplicaciones de defensa, contribuyendo a las capacidades de inteligencia, vigilancia y reconocimiento.","La participación de Textron en drones de defensa se destaca por la venta por parte de Textron Systems de la primera embarcación TSUNAMI, un vehículo autónomo de superficie no tripulado, a la Marina de los EE. UU. La experiencia de la empresa se extiende al mercado de UAS del Grupo 3, y el Nuuva V300 está bajo consideración para aplicaciones militares. Estas actividades indican la asignación de recursos de Textron hacia drones de defensa.",,13101,USD,TXT,SMART,STK,True
defense and aerospace,defense_drones,FR0000121329,THALES SA,10,"Desarrolla y proporciona sistemas avanzados de drones y tecnologías relacionadas para aplicaciones de defensa, contribuyendo a las capacidades de vigilancia, reconocimiento y combate.",,,917799,EUR,HO,SMART,STK,False
defense and aerospace,defense_drones,IT0003856405,LEONARDO SPA,11,"Desarrolla y suministra sistemas aéreos no tripulados avanzados y tecnologías relacionadas para aplicaciones de defensa, mejorando las capacidades autónomas en operaciones militares.",,,35162453,EUR,LDO,SMART,STK,False
defense and aerospace,defense_drones,US92552V1008,VIASAT INC,12,"Permite una conectividad robusta y segura para sistemas de drones de defensa, mejorando sus capacidades operativas a través de soluciones avanzadas de comunicación y redes.","La participación de Viasat en drones de defensa es evidente a través de las posibles aplicaciones de su forma de onda TrellisWare en vehículos aéreos y terrestres no tripulados, aprovechando las características beneficiosas para aplicaciones de radio. La utilidad de TrellisWare se extiende a plataformas aéreas, sistemas de armas y drones dentro del marco del Internet de las Cosas. Además, Viasat reconoce el potencial de crecimiento en vehículos no tripulados en aire, tierra y mar, destacando particularmente las ventajas de las bandas L y S para plataformas más pequeñas en entornos marítimos y de aviación.",,6746554,USD,VSAT,SMART,STK,True
defense and aerospace,defense_drones,US5024311095,L3HARRIS TECHNOLOGIES INC,13,"Proporciona sistemas de misión avanzados, sensores y tecnologías de comunicación cruciales para mejorar las capacidades y la efectividad operativa de los drones de defensa.",,,371886040,USD,LHX,SMART,STK,True
defense and aerospace,defense_drones,US8793601050,TELEDYNE TECHNOLOGIES INC,14,"Suministra sistemas electrónicos, de detección e imagen avanzados que son integrales para la funcionalidad y el rendimiento de los drones de defensa.","La participación de Teledyne en el tema de drones de defensa es evidente a través de su sólida cartera de sistemas aéreos no tripulados, incluidos los nano-drones Black Hornet, que están experimentando un crecimiento de ingresos y adopción en numerosos países. La dedicación de la empresa a esta área se demuestra aún más con el desarrollo de drones armados y el aumento de las ventas de sistemas aéreos no tripulados, así como el contexto histórico de la construcción de los primeros drones no tripulados durante la guerra de Vietnam. Teledyne FLIR Defense también contribuye a este tema a través de ventas de defensa internacionales y sistemas aéreos no tripulados completos.","[{'name': 'tdy-Q324-10-Q', 'url': 'https://storage.googleapis.com/reflexivity-documents-prod/edgar/filing/10-q/tdy-Q324-10-Q.html'}, {'name': 'tdy-Q225-10-Q', 'url': 'https://storage.googleapis.com/reflexivity-documents-prod/edgar/filing/10-q/tdy-Q225-10-Q.html'}, {'name': 'tdy-FY24-10-K', 'url': 'https://storage.googleapis.com/reflexivity-documents-prod/edgar/filing/10-k/tdy-FY24-10-K.html'}]",6340773,USD,TDY,SMART,STK,True
defense and aerospace,defense_drones,US3695501086,GENERAL DYNAMICS CORP,15,"Desarrolla e integra sistemas avanzados de drones y tecnologías relacionadas para aplicaciones de defensa, mejorando las capacidades de vigilancia, reconocimiento y combate para operaciones militares.","El grupo de Tecnologías de GD participa en el tema de Drones de Defensa a través de su enfoque en tecnología avanzada que permite plataformas autónomas. Este enfoque, junto con las inversiones en plataformas no tripuladas por parte de Sistemas de Misión, contribuye a la demanda de las soluciones avanzadas de IA, nube, ciberseguridad, 5G y cuántica del grupo. La empresa está invirtiendo en áreas como las plataformas no tripuladas.",,7496,USD,GD,SMART,STK,True
defense and aerospace,defense_drones,US0970231058,BOEING CO/THE,16,"Desarrolla y fabrica sistemas avanzados de aeronaves no tripuladas para aplicaciones de defensa, contribuyendo a las capacidades de vigilancia, reconocimiento y combate para operaciones militares.",,,4762,USD,BA,SMART,STK,True
defense and aerospace,defense_drones,US5253271028,LEIDOS HOLDINGS INC,17,"Proporciona soluciones y servicios tecnológicos avanzados que respaldan el desarrollo, despliegue y operación de drones de defensa para diversas aplicaciones militares.","Leidos está activamente involucrada en la industria de drones de defensa a través de sus capacidades de vanguardia contra drones, validadas por financiación adicional al Departamento de Seguridad Nacional. Los Marines de EE. UU. están interesados en aumentar la producción del Sea Specter de Leidos, un vehículo de superficie no tripulado pequeño y de bajo perfil, para la guerra expedicionaria. Además, un cliente clasificado ha contratado con Leidos para adquirir Sea Darts, un vehículo submarino no tripulado de bajo costo y prescindible.",,134280621,USD,LDOS,SMART,STK,True
defense and aerospace,defense_drones,SE0021921269,SAAB AB-B,18,"Desarrolla y suministra sistemas aéreos no tripulados avanzados para aplicaciones militares, contribuyendo a los avances en la tecnología de drones de defensa y las capacidades operativas.",,,696509467,SEK,SAAB.B,SMART,STK,False
defense and aerospace,defense_drones,US52661A1088,LEONARDO DRS INC,19,Contribuye al sector de drones de defensa mediante el desarrollo e integración de sistemas y tecnologías avanzadas.,"La participación de DRS en el tema de drones de defensa es evidente a través de la integración de sistemas de contramedidas contra vehículos aéreos no tripulados (C-UAS) en vehículos terrestres para defensa aérea de corto alcance y protección de fuerzas. Los sistemas de defensa aérea de corto alcance de la compañía incorporan equipos de guerra electrónica (EW), sistemas de reconocimiento y vigilancia, torretas modulares para vehículos de combate y suites de sensores estabilizados, junto con contramedidas cinéticas y de energía dirigida. Además, DRS desarrolla radares tácticos para C-UAS, lo que contribuye al crecimiento de los ingresos dentro de su cartera de detección avanzada a través de programas de computación táctica y la expansión de radares tácticos C-UAS.","[{'name': 'drs-Q225-10-Q', 'url': 'https://storage.googleapis.com/reflexivity-documents-prod/edgar/filing/10-q/drs-Q225-10-Q.html'}, {'name': 'drs-Q125-10-Q', 'url': 'https://storage.googleapis.com/reflexivity-documents-prod/edgar/filing/10-q/drs-Q125-10-Q.html'}]",478483396,USD,DRS,SMART,STK,False
defense and aerospace,defense_drones,US08975B1098,BIGBEAR.AI HOLDINGS INC,20,Proporciona soluciones de inteligencia artificial y aprendizaje automático relevantes para aplicaciones de drones de defensa.,"El compromiso de BigBear.ai con el tema de los drones de defensa es evidente a través de su trabajo con el DoD en letalidad de enjambres de drones, incluido un contrato asegurado en asociación con Hardy Dynamics. Su ConductorOS apoya los esfuerzos de desarrollo de formación de drones del DoD, alineándose con los 16 mil millones de dólares en fondos de autonomía de IA militar dentro de OB3 para escalar sistemas aéreos no tripulados enjambres. Esta alineación demuestra la inversión de BigBear.ai en la habilitación de la autonomía dentro del sector de defensa.",,530965695,USD,BBAI,SMART,STK,False
defense and aerospace,defense_drones,US1271903049,CACI INTERNATIONAL INC -CL A,21,Apoya las operaciones de defensa mediante la provisión de tecnologías y servicios avanzados relacionados con sistemas aéreos no tripulados.,,,267197,USD,CACI,SMART,STK,True
defense and aerospace,defense_drones,US68236H2040,ONDAS HOLDINGS INC,22,Contribuye al avance y despliegue de tecnologías de drones de defensa y soluciones relacionadas.,"La participación de Ondas en la industria de drones de defensa es evidente a través de su unidad de negocios OAS, que desarrolla e integra soluciones basadas en drones para aplicaciones gubernamentales y de defensa. El sistema Iron Drone Raider de la compañía está operativo en un entorno de combate real y ha asegurado pedidos de entidades de defensa y gubernamentales, lo que demuestra sus capacidades como plataforma contra UAS. Ondas también se enfoca en expandir su presencia con nuevos clientes de defensa y seguridad nacional en Europa, Medio Oriente y EE. UU., comercializando soluciones integrales basadas en drones basadas en sus plataformas disponibles comercialmente como el Optimus System y Iron Drone Raider.","[{'name': 'onds-Q125-10-Q', 'url': 'https://storage.googleapis.com/reflexivity-documents-prod/edgar/filing/10-q/onds-Q125-10-Q.html'}, {'name': 'onds-Q225-10-Q', 'url': 'https://storage.googleapis.com/reflexivity-documents-prod/edgar/filing/10-q/onds-Q225-10-Q.html'}]",455415330,USD,ONDS,SMART,STK,False
defense and aerospace,defense_drones,US4464131063,HUNTINGTON INGALLS INDUSTRIE,23,Contribuye al tema de los drones de defensa.,,,86033355,USD,HII,SMART,STK,True
defense and aerospace,defense_drones,US3696043013,GENERAL ELECTRIC,24,Proporciona sistemas de propulsión y gestión de energía críticos para la operación de drones de defensa.,"GE Aerospace demuestra su compromiso con los drones de defensa a través de sus esfuerzos colaborativos con Kratos para avanzar en las tecnologías de propulsión para sistemas aéreos no tripulados asequibles. Además, GE Aerospace trabaja con clientes gubernamentales en el desarrollo de productos avanzados, incluidas aplicaciones no tripuladas. Esto incluye proyectos clasificados y no clasificados, lo que indica un interés y una inversión sostenidos en el sector de los sistemas aéreos no tripulados.","[{'name': 'ge-FY24-10-K', 'url': 'https://storage.googleapis.com/reflexivity-documents-prod/edgar/filing/10-k/ge-FY24-10-K.html'}]",498843743,USD,GE,SMART,STK,True
defense and aerospace,defense_drones,US05464C1018,AXON ENTERPRISE INC,25,"Desarrolla tecnología de drones centrada en la seguridad pública, que puede ofrecer capacidades adaptables relevantes para aplicaciones de drones de defensa.","La participación de Axon en el tema de Drones de Defensa es evidente a través de su conjunto de soluciones, que incluye seguridad con drones y robótica, y su segmento de Dispositivos Conectados, que presenta drones como parte de sus ofertas de productos de hardware. Las Soluciones de Plataforma de la compañía abarcan drones y equipos antidrones, con aumentos de ingresos impulsados por equipos antidrones, particularmente a través de la adquisición de Dedrone, líder en tecnología antidrones. El enfoque de Axon en soluciones antidrones aborda la creciente importancia de los drones en la guerra y la creciente demanda en varios sectores, incluidas las agencias de defensa y federales, garantizando cielos seguros para los drones y abordando nuevas amenazas.","[{'name': 'aaxn-FY24-10-K', 'url': 'https://storage.googleapis.com/reflexivity-documents-prod/edgar/filing/10-k/aaxn-FY24-10-K.html'}, {'name': 'axon-Q225-10-Q', 'url': 'https://storage.googleapis.com/reflexivity-documents-prod/edgar/filing/10-q/axon-Q225-10-Q.html'}, {'name': 'aaxn-Q324-10-Q', 'url': 'https://storage.googleapis.com/reflexivity-documents-prod/edgar/filing/10-q/aaxn-Q324-10-Q.html'}, {'name': 'aaxn-Q125-10-Q', 'url': 'https://storage.googleapis.com/reflexivity-documents-prod/edgar/filing/10-q/aaxn-Q125-10-Q.html'}]",272104927,USD,AXON,SMART,STK,True
defense and aerospace,defense_drones,US0239391016,AMENTUM HOLDINGS INC,26,Apoya a la industria de Drones de Defensa a través de su participación en servicios gubernamentales y de defensa.,"La conexión de Amentum con el tema de Drones de Defensa se refleja en su creciente inversión en tecnologías avanzadas, específicamente sistemas no tripulados, lo que se alinea con las prioridades del gobierno federal y las naciones aliadas. Si bien la empresa reconoce este creciente enfoque, la inversión en sistemas no tripulados, incluidos los drones de defensa, indica una asignación de recursos a esta área. Sin embargo, la ausencia de detalles específicos sobre tecnología propietaria o contribuciones de ingresos sugiere que la participación de Amentum, aunque presente, no ocupa una posición única en el panorama de los drones de defensa.","[{'name': 'amtm-Q125-10-Q', 'url': 'https://storage.googleapis.com/reflexivity-documents-prod/edgar/filing/10-q/amtm-Q125-10-Q.html'}, {'name': 'amtm-FY24-10-K', 'url': 'https://storage.googleapis.com/reflexivity-documents-prod/edgar/filing/10-k/amtm-FY24-10-K.html'}]",729362584,USD,AMTM,SMART,STK,True
defense and aerospace,defense_drones,US55405Y1001,MACOM TECHNOLOGY SOLUTIONS H,27,Ofrece soluciones y componentes tecnológicos que contribuyen a las capacidades de los sistemas de drones de defensa.,"MACOM da soporte a una gama de aplicaciones, incluyendo electrónica de drones a bordo y sistemas de defensa anti-drones de energía dirigida. El segmento Industrial y de Defensa de la empresa está impulsado por las actualizaciones de sistemas del Departamento de Defensa de EE. UU. e internacionales en radar, EW y sistemas de comunicación, con sistemas de radar que se renuevan en múltiples plataformas para abordar amenazas relacionadas con drones. Las oportunidades de MACOM en electrónica de defensa se ven mejoradas por la necesidad de frecuencias más altas, niveles de potencia e integración.",,104158272,USD,MTSI,SMART,STK,True
