symbol,industry,theme,isin_code,name,rank,description,evidence,evidenceSources,ib_conid,currency,exchange,assetType,navigable,theme_id
JOBY,automotive,electric_vehicles,KYG651631007,JOBY AVIATION INC,21,"Desarrolla aeronaves de despegue y aterrizaje vertical eléctrico (eVTOL), contribuyendo al avance de la movilidad eléctrica en el sector aeroespacial.","El enfoque de Joby en Vehículos Eléctricos es evidente en su negocio principal, que gira en torno al diseño, prueba y operación de aeronaves eléctricas de despegue y aterrizaje vertical (eVTOL). La empresa ha dedicado más de una década a este esfuerzo, con el objetivo de proporcionar un servicio de transporte aéreo rápido, silencioso y conveniente en entornos urbanos. La aeronave, optimizada para rutas urbanas con una autonomía objetivo de hasta 100 millas con una sola carga, aprovecha un tren motriz totalmente eléctrico para minimizar el ruido e integrarse sin problemas en los entornos urbanos. Si bien la empresa reconoce la competencia del transporte terrestre y el impacto potencial de factores como el rendimiento y la autonomía de los eVTOL, su compromiso con el desarrollo de aeronaves totalmente eléctricas subraya la centralidad de la tecnología de vehículos eléctricos en sus operaciones.","[{'name': 'joby-Q225-10-Q', 'url': 'https://storage.googleapis.com/reflexivity-documents-prod/edgar/filing/10-q/joby-Q225-10-Q.html'}]",507188246,USD,SMART,STK,False,ELE
MPWR,automotive,electric_vehicles,US6098391054,MONOLITHIC POWER SYSTEMS INC,22,Proporciona soluciones de gestión de energía esenciales para el funcionamiento eficiente y el rendimiento de los vehículos eléctricos.,,,32106121,USD,SMART,STK,True,ELE
MCHP,automotive,electric_vehicles,US5950171042,MICROCHIP TECHNOLOGY INC,23,"Proporciona soluciones de semiconductores esenciales para vehículos eléctricos, permitiendo sistemas electrónicos críticos para su funcionamiento y funcionalidades avanzadas.","La participación de Microchip con el tema de Vehículos Eléctricos es evidente a través de su cartera de productos sinérgica, que potencia las tendencias de crecimiento disruptivas, incluyendo vehículos eléctricos y movilidad eléctrica. Esta cartera atiende mercados finales clave como automotriz, aeroespacial, defensa, comunicaciones, electrodomésticos, centros de datos y computación, e industrial. Si bien la compañía destaca los vehículos eléctricos como un área de crecimiento, la ausencia de detalles específicos sobre recursos dedicados o contribuciones de ingresos sugiere un nivel de importancia secundario.","[{'name': 'mchp-Q225-10-Q', 'url': 'https://storage.googleapis.com/reflexivity-documents-prod/edgar/filing/10-q/mchp-Q225-10-Q.html'}, {'name': 'mchp-Q126-10-Q', 'url': 'https://storage.googleapis.com/reflexivity-documents-prod/edgar/filing/10-q/mchp-Q126-10-Q.html'}, {'name': 'mchp-Q325-10-Q', 'url': 'https://storage.googleapis.com/reflexivity-documents-prod/edgar/filing/10-q/mchp-Q325-10-Q.html'}]",271568,USD,SMART,STK,True,ELE
ST,automotive,electric_vehicles,GB00BFMBMT84,SENSATA TECHNOLOGIES HOLDING,24,"Proporciona soluciones avanzadas de detección y control que son integrales para la gestión de energía, la seguridad de la batería y la eficiencia operativa general de los vehículos eléctricos.","Sensata Technologies enfatiza la importancia del mercado de Vehículos de Nueva Energía (NEV) en rápido crecimiento en China, destacando la necesidad de tener éxito en esta región para mantener y aumentar su cuota de mercado global. La compañía está buscando activamente oportunidades de contenido tanto en plataformas ICE como EV, con un enfoque particular en aplicaciones de alto voltaje en NEV, que ofrecen oportunidades de contenido incremental en comparación con el negocio tradicional de ICE. Sensata ha asegurado premios de negocio con fabricantes de equipos originales (OEM) de vehículos eléctricos locales líderes en el mercado en China y está experimentando una aceleración de proyectos en torno a plataformas y aplicaciones de vehículos eléctricos, particularmente con el lanzamiento de vehículos eléctricos de segunda generación.",,311458442,USD,SMART,STK,True,ELE
MVST,automotive,electric_vehicles,US59516C1062,MICROVAST HOLDINGS INC,25,"Desarrolla y fabrica sistemas de baterías de alto rendimiento y carga rápida, que son componentes esenciales para los vehículos eléctricos, apoyando su adopción generalizada y sus demandas operativas.","El enfoque de Microvast en el tema de Vehículos Eléctricos es evidente en su especialización en el diseño, desarrollo y fabricación de componentes y sistemas de baterías principalmente para vehículos comerciales eléctricos. La misión de la empresa es acelerar la transición global hacia la electrificación mediante la entrega de soluciones de baterías innovadoras que apoyen la adopción de vehículos eléctricos, con un enfoque estratégico clave en liderar la producción nacional de baterías en Estados Unidos. Este compromiso se demuestra por su importante tracción en el sector de vehículos comerciales, particularmente en EMEA, y la expansión a Europa y Estados Unidos para capitalizar los mercados de vehículos eléctricos en rápido crecimiento, con varios clientes que utilizan las baterías de Microvast en sus plataformas de autobuses eléctricos.","[{'name': 'mvst-Q225-10-Q', 'url': 'https://storage.googleapis.com/reflexivity-documents-prod/edgar/filing/10-q/mvst-Q225-10-Q.html'}, {'name': 'mvst-Q125-10-Q', 'url': 'https://storage.googleapis.com/reflexivity-documents-prod/edgar/filing/10-q/mvst-Q125-10-Q.html'}, {'name': 'mvst-FY24-10-K', 'url': 'https://storage.googleapis.com/reflexivity-documents-prod/edgar/filing/10-k/mvst-FY24-10-K.html'}]",504717050,USD,SMART,STK,False,ELE
ADI,automotive,electric_vehicles,US0326541051,ANALOG DEVICES INC,26,"Proporciona circuitos integrados analógicos y de señal mixta críticos esenciales para la gestión de energía de vehículos eléctricos, el control de baterías y sistemas automotrices avanzados.",,,4157,USD,SMART,STK,True,ELE
PSNY.OLD,automotive,electric_vehicles,US7311052010,POLESTAR AUTOMOTIVE-CL A ADS,27,"Fabrica una gama de vehículos eléctricos premium, contribuyendo al avance y la adopción de soluciones de movilidad sostenible a nivel mundial.","El negocio de Polestar se centra en los vehículos eléctricos, con modelos como el Polestar 3 y 4 impulsando el crecimiento de los ingresos, y el Polestar 4 representa el 49% del volumen total en el primer trimestre. El compromiso de la empresa con el sector de los vehículos eléctricos se ve subrayado por sus ambiciosos objetivos de crecimiento del 30% al 35% anual entre 2025 y 2027 y su identidad como la primera y única startup de vehículos eléctricos puros de Europa centrada en el diseño, la sostenibilidad y el rendimiento. El CEO ha declarado explícitamente que el futuro de la movilidad es libre de emisiones y eléctrico, razón por la cual se fundó Polestar.",,569833086,USD,SMART,STK,False,ELE
AMAT,automotive,electric_vehicles,US0382221051,APPLIED MATERIALS INC,28,Proporciona equipos críticos de fabricación de semiconductores esenciales para la producción de los chips avanzados y dispositivos de potencia utilizados en vehículos eléctricos.,La empresa reconoce los vehículos eléctricos y autónomos como impulsores emergentes del mercado final que contribuyen a la próxima ola de crecimiento para la industria de semiconductores. Su segmento de Sistemas de Semiconductores atiende a clientes cuyos productos se integran en vehículos eléctricos y autónomos. La empresa suministra equipos utilizados para fabricar chips semiconductores que se utilizan en la industria de vehículos eléctricos.,"[{'name': 'amat-FY24-10-K', 'url': 'https://storage.googleapis.com/reflexivity-documents-prod/edgar/filing/10-k/amat-FY24-10-K.html'}, {'name': 'amat-Q225-10-Q', 'url': 'https://storage.googleapis.com/reflexivity-documents-prod/edgar/filing/10-q/amat-Q225-10-Q.html'}, {'name': 'amat-Q125-10-Q', 'url': 'https://storage.googleapis.com/reflexivity-documents-prod/edgar/filing/10-q/amat-Q125-10-Q.html'}]",266093,USD,SMART,STK,True,ELE
MOD,automotive,electric_vehicles,US6078281002,MODINE MANUFACTURING CO,29,Participa en el mercado de Vehículos Eléctricos a través de sus operaciones.,"La conexión de Modine con el tema de los Vehículos Eléctricos es evidente a través de su segmento de Tecnologías de Rendimiento, que ofrece soluciones térmicas avanzadas destinadas a mejorar la autonomía de la batería y la vida útil del vehículo para vehículos comerciales de cero emisiones e híbridos. Aunque Modine tenía planes de apoyar su negocio de sistemas de vehículos eléctricos en su planta de Franklin, Wisconsin, y ha visto contribuciones de la adquisición de CDI, que apoyó fábricas de baterías para vehículos eléctricos, la empresa está cambiando su enfoque, considerando la transición de la planta de Franklin a la producción de centros de datos. Además, Modine está experimentando retrasos en el lanzamiento y la puesta en marcha de programas de vehículos eléctricos, lo que lleva a menores expectativas de crecimiento a corto plazo en este sector, y está experimentando descensos en las ventas de sistemas de vehículos eléctricos y EVantage.","[{'name': 'mod-Q126-10-Q', 'url': 'https://storage.googleapis.com/reflexivity-documents-prod/edgar/filing/10-q/mod-Q126-10-Q.html'}, {'name': 'mod-FY25-10-K', 'url': 'https://storage.googleapis.com/reflexivity-documents-prod/edgar/filing/10-k/mod-FY25-10-K.html'}]",271952,USD,SMART,STK,False,ELE
APH,automotive,electric_vehicles,US0320951017,AMPHENOL CORP-CL A,30,Tiene presencia en el mercado de vehículos eléctricos.,,,4493,USD,SMART,STK,True,ELE
MP,automotive,electric_vehicles,US5533681012,MP MATERIALS CORP,31,"Proporciona materiales críticos de tierras raras esenciales para los imanes permanentes utilizados en los motores de vehículos eléctricos, apoyando el crecimiento y desarrollo de la industria de los VE.","La participación de MP Materials en el tema de los vehículos eléctricos es evidente a través de su papel como proveedor de materiales críticos. La empresa enfatiza que las tierras raras son esenciales para los imanes utilizados en motores y generadores eléctricos que impulsan vehículos híbridos y eléctricos, y su objetivo es capitalizar la creciente tendencia de la electrificación. Esto está respaldado aún más por su producción de imanes de grado automotriz específicamente para aplicaciones de motores de transmisión de vehículos eléctricos y sus acuerdos de suministro con los principales fabricantes de automóviles mundiales, incluido un acuerdo a largo plazo con GM para suministrar materiales y imanes de origen estadounidense para motores eléctricos en numerosos modelos de GM. Además, MP Materials está desarrollando una instalación de fabricación de metales, aleaciones e imanes de tierras raras, lo que demuestra un compromiso con el mercado de vehículos eléctricos.","[{'name': 'mp-Q225-10-Q', 'url': 'https://storage.googleapis.com/reflexivity-documents-prod/edgar/filing/10-q/mp-Q225-10-Q.html'}, {'name': 'mp-FY24-10-K', 'url': 'https://storage.googleapis.com/reflexivity-documents-prod/edgar/filing/10-k/mp-FY24-10-K.html'}, {'name': 'mp-Q125-10-Q', 'url': 'https://storage.googleapis.com/reflexivity-documents-prod/edgar/filing/10-q/mp-Q125-10-Q.html'}, {'name': 'mp-Q324-10-Q', 'url': 'https://storage.googleapis.com/reflexivity-documents-prod/edgar/filing/10-q/mp-Q324-10-Q.html'}]",455592408,USD,SMART,STK,True,ELE
SEDG,automotive,electric_vehicles,US83417M1045,SOLAREDGE TECHNOLOGIES INC,32,"Desarrolla soluciones de carga para vehículos eléctricos, a menudo integradas con sistemas de energía solar, para facilitar la adopción sostenible y eficiente de vehículos eléctricos.","La participación de la empresa en el tema de Vehículos Eléctricos se refleja en sus capacidades de carga de VE, ofrecidas como parte de su línea de productos diversificada dentro del segmento solar, y en el inversor Energy Hub, que admite la conexión al cargador inteligente de VE de la empresa. Sin embargo, la empresa ha descontinuado su actividad de e-Movilidad de vehículos comerciales ligeros (LCV), trasladando su actividad restante de e-movilidad, incluidas las aplicaciones fotovoltaicas, al segmento solar. Si bien la empresa tuvo ofertas de productos para el mercado de la e-movilidad en años anteriores, la descontinuación de la actividad de e-Movilidad de LCV indica un cambio estratégico.","[{'name': 'sedg-Q324-10-Q', 'url': 'https://storage.googleapis.com/reflexivity-documents-prod/edgar/filing/10-q/sedg-Q324-10-Q.html'}, {'name': 'sedg-Q125-10-Q', 'url': 'https://storage.googleapis.com/reflexivity-documents-prod/edgar/filing/10-q/sedg-Q125-10-Q.html'}, {'name': 'sedg-Q225-10-Q', 'url': 'https://storage.googleapis.com/reflexivity-documents-prod/edgar/filing/10-q/sedg-Q225-10-Q.html'}]",188625650,USD,SMART,STK,True,ELE
FCX,automotive,electric_vehicles,US35671D8570,FREEPORT-MCMORAN INC,33,"Suministra cobre, un material crítico esencial para la fabricación de vehículos eléctricos y su infraestructura de carga.","La exposición de Freeport-McMoRan (fcx) al tema de los Vehículos Eléctricos es evidente en su reconocimiento del papel fundamental del cobre en la transición global hacia la energía renovable, los vehículos eléctricos y otras iniciativas de reducción de carbono. La empresa reconoce que la creciente demanda de cobre está respaldada por la creciente adopción de vehículos eléctricos, así como por los requisitos sustanciales para la infraestructura energética, la electrificación y las nuevas tecnologías. Si bien Freeport-McMoRan reconoce la importancia de los vehículos eléctricos para la demanda de cobre, no es una prioridad estratégica de primer nivel.","[{'name': 'fcx-Q324-10-Q', 'url': 'https://storage.googleapis.com/reflexivity-documents-prod/edgar/filing/10-q/fcx-Q324-10-Q.html'}, {'name': 'fcx-Q225-10-Q', 'url': 'https://storage.googleapis.com/reflexivity-documents-prod/edgar/filing/10-q/fcx-Q225-10-Q.html'}, {'name': 'fcx-Q125-10-Q', 'url': 'https://storage.googleapis.com/reflexivity-documents-prod/edgar/filing/10-q/fcx-Q125-10-Q.html'}, {'name': 'fcx-FY23-10-K', 'url': 'https://storage.googleapis.com/reflexivity-documents-prod/edgar/filing/10-k/fcx-FY23-10-K.html'}]",7089,USD,SMART,STK,True,ELE
ENPH,automotive,electric_vehicles,US29355A1079,ENPHASE ENERGY INC,34,"Proporciona sistemas de gestión de energía que integran la carga de vehículos eléctricos con soluciones de almacenamiento de energía solar y baterías residenciales, apoyando la adopción generalizada de vehículos eléctricos.","La participación de Enphase en el tema de Vehículos Eléctricos se demuestra a través de sus ventas de soluciones de carga para vehículos eléctricos, que generan ingresos para la empresa. Su línea de productos incluye cargadores para vehículos eléctricos compatibles con la mayoría de los vehículos eléctricos en América del Norte, compatibles con conectores J1772 y NACS, y cargadores inteligentes IQ para vehículos eléctricos con Wi-Fi que se integran con sus sistemas solares y de baterías. Además, ofrecen el cargador CS-100 para vehículos eléctricos, que proporciona hasta 19,2 kW de potencia continua para vehículos eléctricos de flotas comerciales en los Estados Unidos y Canadá.","[{'name': 'enph-FY24-10-K', 'url': 'https://storage.googleapis.com/reflexivity-documents-prod/edgar/filing/10-k/enph-FY24-10-K.html'}, {'name': 'enph-Q324-10-Q', 'url': 'https://storage.googleapis.com/reflexivity-documents-prod/edgar/filing/10-q/enph-Q324-10-Q.html'}]",105368327,USD,SMART,STK,True,ELE
AMPX,automotive,electric_vehicles,US03214Q1085,AMPRIUS TECHNOLOGIES INC,35,Desarrolla tecnologías avanzadas de baterías diseñadas para mejorar el rendimiento y la autonomía de los vehículos eléctricos.,"Amprius desarrolla, fabrica y comercializa baterías de ánodo de silicio para aplicaciones de movilidad eléctrica, dirigidas explícitamente a la industria de vehículos eléctricos, junto con la aviación y los vehículos eléctricos ligeros. Si bien actualmente no produce baterías específicamente para vehículos eléctricos, Amprius cree que su tecnología de silicio puede mejorar significativamente la autonomía de conducción y las capacidades de carga rápida, abordando las limitaciones de las baterías de vehículos eléctricos existentes. Las baterías de la empresa tienen aplicaciones en todos los segmentos de la movilidad eléctrica, incluidos los vehículos eléctricos, y sus ánodos de silicio están diseñados como un reemplazo directo de los ánodos de grafito en las baterías de iones de litio tradicionales. Amprius está trabajando activamente para mejorar la vida útil de la batería y la densidad de energía para facilitar una mayor adopción en el espacio de los vehículos eléctricos, reconociendo la naturaleza de rápido crecimiento y competitiva de la industria.","[{'name': 'ampx-Q225-10-Q', 'url': 'https://storage.googleapis.com/reflexivity-documents-prod/edgar/filing/10-q/ampx-Q225-10-Q.html'}, {'name': 'ampx-Q125-10-Q', 'url': 'https://storage.googleapis.com/reflexivity-documents-prod/edgar/filing/10-q/ampx-Q125-10-Q.html'}]",585323053,USD,SMART,STK,False,ELE
SLDP,automotive,electric_vehicles,US83422N1054,SOLID POWER INC,36,"Desarrolla tecnología de baterías de estado sólido, un componente crítico para mejorar el rendimiento y la adopción generalizada de vehículos eléctricos.","La participación de Solid Power en el tema de Vehículos Eléctricos es evidente a través de su enfoque estratégico en el mercado de vehículos eléctricos de batería, impulsado por la demanda de tecnología de baterías de próxima generación. La comercialización y el crecimiento futuro de la empresa están estrechamente ligados a la adopción de vehículos eléctricos por parte de los consumidores. Esto se ve aún más ejemplificado por la integración de las celdas de Solid Power y la tecnología de baterías de estado sólido de Solid Power en su vehículo de prueba i7 por parte de BMW Group, lo que demuestra una aplicación directa de su tecnología dentro del sector de los vehículos eléctricos.","[{'name': 'sldp-Q125-10-Q', 'url': 'https://storage.googleapis.com/reflexivity-documents-prod/edgar/filing/10-q/sldp-Q125-10-Q.html'}, {'name': 'sldp-Q225-10-Q', 'url': 'https://storage.googleapis.com/reflexivity-documents-prod/edgar/filing/10-q/sldp-Q225-10-Q.html'}]",531693453,USD,SMART,STK,False,ELE
VFS,automotive,electric_vehicles,SGXZ55111462,VINFAST AUTO LTD,37,Se enfoca en la producción y distribución global de vehículos eléctricos.,"El compromiso de VinFast con el tema de los Vehículos Eléctricos es significativo, ya que la compañía aspira a ser un líder mundial en movilidad eléctrica. Esto se evidencia en la entrega de 35,837 unidades de vehículos eléctricos en el segundo trimestre de 2025, lo que representa un aumento interanual del 172%, y 72,167 unidades en la primera mitad de 2025. El enfoque de la compañía en la adopción de vehículos eléctricos está respaldado aún más por sus inversiones estratégicas en I+D, incentivos al cliente y el desarrollo de plataformas de vehículos eléctricos de próxima generación, junto con el establecimiento de nuevas fábricas en Vietnam, India e Indonesia para aumentar la capacidad de producción y el lanzamiento de nuevos modelos de vehículos eléctricos. VinFast también ha logrado casi el 40% de participación de mercado de las ventas totales de automóviles en Vietnam durante el primer trimestre de 2025, liderando el mercado automotriz con más de 35,100 vehículos entregados.",,648093140,USD,SMART,STK,False,ELE
JBL,automotive,electric_vehicles,US4663131039,JABIL INC,38,Proporciona soluciones y componentes de fabricación que apoyan la producción y el desarrollo de vehículos eléctricos.,"La participación de Jabil en el tema de los Vehículos Eléctricos se caracteriza por un enfoque cauteloso en medio de las fluctuaciones del mercado. Si bien la empresa reconoce una desaceleración en el crecimiento de los vehículos eléctricos de batería y una debilidad continua en el mercado de vehículos eléctricos que afecta a su segmento de Industrias Reguladas, mantiene una perspectiva positiva a largo plazo y está gestionando posibles vientos en contra. Jabil se está adaptando a los cambios regulatorios y las presiones comerciales, centrándose en programas y tecnologías independientes del vehículo, como los vehículos definidos por software y ADAS, al tiempo que incorpora nuevos clientes y colabora con empresas como AVL para codesarrollar diseños y soluciones de fabricación para el mercado automotriz y de transporte. El negocio de la empresa en China en el espacio de los vehículos eléctricos está funcionando bien y continúan monitoreando el impacto potencial de la legislación inminente de EE. UU. en estos mercados finales.",,4457282,USD,SMART,STK,True,ELE
UBER,automotive,electric_vehicles,US90353T1007,UBER TECHNOLOGIES INC,39,El tema de Vehículos Eléctricos representa un área de relevancia operativa y estratégica para la empresa.,"El compromiso de Uber con el tema de Vehículos Eléctricos se destaca por su asociación con Lucid, un fabricante líder de vehículos eléctricos. Esta colaboración es estratégicamente importante para que Uber construya su base de aprendizaje y recopile datos para interactuar con socios financieros. Además, Uber está invirtiendo en actores de software y hardware para avanzar en la tecnología de vehículos autónomos, reconociendo la importancia de las plataformas de hardware para la implementación escalable y asequible de vehículos autónomos. Estas asociaciones e inversiones demuestran el compromiso de Uber de integrar vehículos eléctricos en su plataforma.",,365207014,USD,SMART,STK,True,ELE
CTS,automotive,electric_vehicles,US1265011056,CTS CORP,40,Un enfoque en Vehículos Eléctricos.,"La participación de CTS en el mercado de vehículos eléctricos se produce principalmente a través de su producto e-brake, que ofrece ventajas de peso y costo y continúa generando interés de los OEM, aunque a un ritmo más lento debido a que los OEM están recalibrando sus inversiones en vehículos eléctricos. La empresa está logrando avances en la electrificación, incluida la incorporación de un nuevo cliente en esta área para una aplicación de seguridad pasiva. Si bien las tasas de penetración de vehículos eléctricos se han suavizado en algunas regiones, los productos de vehículos ligeros de CTS son en su mayoría agnósticos a la tecnología del tren motriz, lo que hace que las tasas de crecimiento a corto plazo para ICE frente a vehículos eléctricos e híbridos sean menos preocupantes.",,6190,USD,SMART,STK,True,ELE
ULS,automotive,electric_vehicles,US9037311076,UL SOLUTIONS INC - CLASS A,41,Es importante para el tema de la industria de Vehículos Eléctricos.,"La empresa demuestra su enfoque en el tema de los vehículos eléctricos a través de inversiones y expansiones estratégicas. Específicamente, la empresa está desarrollando un laboratorio avanzado de compatibilidad electromagnética automotriz en Toyota City, Japón, para abordar el creciente mercado de pruebas de EMC automotriz. Para solidificar aún más este enfoque, la empresa lanzó su laboratorio avanzado de pruebas de baterías en Europa en Aachen, Alemania, lo que demuestra un compromiso para ayudar al sector automotriz a innovar en el almacenamiento de baterías y posicionarse estratégicamente cerca de clientes automotrices clave en Europa. La adquisición de Certification Entity for Renewable Energies, S.L. (CERE), una empresa centrada en las energías renovables y la adopción de vehículos eléctricos, subraya aún más la participación de la empresa en este tema.","[{'name': 'uls-FY24-10-K', 'url': 'https://storage.googleapis.com/reflexivity-documents-prod/edgar/filing/10-k/uls-FY24-10-K.html'}]",696016914,USD,SMART,STK,False,ELE
FLEX,automotive,electric_vehicles,SG9999000020,FLEX LTD,42,Proporciona soluciones de fabricación y cadena de suministro que respaldan la producción y el desarrollo de componentes y sistemas de vehículos eléctricos.,,,4596077,USD,SMART,STK,True,ELE
CBT,automotive,electric_vehicles,US1270551013,CABOT CORP,43,Tiene una participación identificada en el tema de Vehículos Eléctricos.,"El compromiso de Cabot con el tema de los Vehículos Eléctricos es evidente en su estrategia de Materiales para Baterías, que aborda la bifurcada industria de baterías en China y el resto del mundo, donde el crecimiento está impulsado por la penetración de los vehículos eléctricos. La empresa se enfoca en establecer posiciones con clientes de baterías que establecen plantas de fabricación en economías occidentales, anticipando el crecimiento de la adopción de vehículos eléctricos e híbridos. Además, la demanda de Productos Químicos de Rendimiento está impulsada por el sector automotriz, incluidas las ventas a baterías para vehículos eléctricos, lo que destaca la importancia del tema para la estrategia a largo plazo de la empresa.","[{'name': 'cbt-FY24-10-K', 'url': 'https://storage.googleapis.com/reflexivity-documents-prod/edgar/filing/10-k/cbt-FY24-10-K.html'}]",5480,USD,SMART,STK,True,ELE
