symbol,industry,theme,isin_code,name,rank,description,evidence,evidenceSources,ib_conid,currency,exchange,assetType,navigable,theme_id
ROG,automotive,electric_vehicles,US7751331015,ROGERS CORP,68,Opera dentro de la industria de Vehículos Eléctricos.,"Rogers Corporation se enfoca en capitalizar las oportunidades de crecimiento en la creciente electrificación de vehículos, particularmente en el mercado de vehículos eléctricos/híbridos (EV/HEV), donde el análisis de terceros proyecta un crecimiento significativo. La empresa cree que sus almohadillas avanzadas para celdas de batería y sus sustratos cerámicos brindan múltiples oportunidades de contenido para capitalizar este crecimiento, y su tecnología de silicona ha sido seleccionada por un OEM europeo líder para su uso en inversores para el mercado de vehículos eléctricos/híbridos (EV/HEV). Sin embargo, la empresa ha experimentado menores ventas netas de vehículos eléctricos/híbridos (EV/HEV) debido a que los clientes gestionan los niveles de inventario y se ajustan a una demanda del mercado final más débil, y el negocio AES curamik se ha visto afectado por el mercado de vehículos eléctricos (EV) en rápida evolución, lo que ha llevado a ajustes en su estrategia y capacidad de fabricación.","[{'name': 'rog-Q225-10-Q', 'url': 'https://storage.googleapis.com/reflexivity-documents-prod/edgar/filing/10-q/rog-Q225-10-Q.html'}, {'name': 'rog-Q125-10-Q', 'url': 'https://storage.googleapis.com/reflexivity-documents-prod/edgar/filing/10-q/rog-Q125-10-Q.html'}, {'name': 'rog-FY24-10-K', 'url': 'https://storage.googleapis.com/reflexivity-documents-prod/edgar/filing/10-k/rog-FY24-10-K.html'}, {'name': 'rog-Q324-10-Q', 'url': 'https://storage.googleapis.com/reflexivity-documents-prod/edgar/filing/10-q/rog-Q324-10-Q.html'}]",756433,USD,SMART,STK,True,ELE
GRAB,automotive,electric_vehicles,KYG4124C1096,GRAB HOLDINGS LTD - CL A,69,Incorpora elementos del tema de Vehículos Eléctricos dentro de su alcance operativo.,"La participación de Grab en vehículos eléctricos se realiza principalmente a través de sus iniciativas de vehículos autónomos, como lo demuestra el lanzamiento y la prueba piloto de autobuses lanzadera eléctricos autónomos en Singapur. Estos proyectos, desarrollados en colaboración con empresas como A2Z, representan la inversión de Grab en tecnología de vehículos eléctricos. Si bien estas iniciativas indican una presencia en el espacio de los vehículos eléctricos, no se destacan como un enfoque estratégico central para la empresa.",,530319709,USD,SMART,STK,False,ELE
CSIQ,automotive,electric_vehicles,CA1366351098,CANADIAN SOLAR INC,70,Contribuye al ecosistema más amplio de vehículos eléctricos al proporcionar soluciones de energía renovable que pueden alimentar la infraestructura de carga.,,,41498671,USD,SMART,STK,False,ELE
ES,automotive,electric_vehicles,US30040W1080,EVERSOURCE ENERGY,71,Participa en el tema de los Vehículos Eléctricos.,,,182880167,USD,SMART,STK,True,ELE
PCG,automotive,electric_vehicles,US69331C1080,P G & E CORP,72,Incorpora consideraciones relacionadas con los vehículos eléctricos dentro de su planificación operativa.,,,2586035,USD,SMART,STK,True,ELE
TER,automotive,electric_vehicles,US8807701029,TERADYNE INC,73,Proporciona soluciones de prueba críticas para componentes y sistemas utilizados en la industria de vehículos eléctricos.,,,12729,USD,SMART,STK,True,ELE
KLIC,automotive,electric_vehicles,US5012421013,KULICKE & SOFFA INDUSTRIES,74,Proporciona equipos de empaquetado de semiconductores y pantallas avanzadas críticos para la fabricación de electrónica de potencia y otros componentes esenciales utilizados en vehículos eléctricos.,"La participación de Kulicke & Soffa en el tema de los vehículos eléctricos es evidente a través de su tecnología de ensamblaje de semiconductores, en particular sus equipos de unión por hilo. El aumento de los ingresos en este segmento se atribuye a mayores compras de clientes dentro del mercado automotriz, impulsado por la mayor adopción de vehículos eléctricos en ciertas regiones. La participación de la empresa se extiende al mercado de semiconductores de potencia, donde el crecimiento de los vehículos eléctricos y la energía sostenible está aumentando la complejidad de las aplicaciones de control de potencia. Esto ha llevado al lanzamiento de nuevos sistemas de soldadura diseñados para aplicaciones de semiconductores de potencia, alineándose con la creciente demanda global en estos sectores.","[{'name': 'klic-Q125-10-Q', 'url': 'https://storage.googleapis.com/reflexivity-documents-prod/edgar/filing/10-q/klic-Q125-10-Q.html'}, {'name': 'klic-Q225-10-Q', 'url': 'https://storage.googleapis.com/reflexivity-documents-prod/edgar/filing/10-q/klic-Q225-10-Q.html'}]",270963,USD,SMART,STK,True,ELE
POWI,automotive,electric_vehicles,US7392761034,POWER INTEGRATIONS INC,75,Contribuye al tema de vehículos eléctricos.,"La participación de Power Integrations en el tema de Vehículos Eléctricos es evidente a través de sus IC de fuente de alimentación utilizados para la conversión de energía de alto voltaje en VE. La empresa ha introducido productos calificados para automoción dirigidos al mercado de VE y anticipa que las aplicaciones de automoción se convertirán en una parte importante de su SAM. Además, están desarrollando tecnologías GaN para módulos de conmutación de potencia en trenes motrices de VE, con el objetivo de obtener una mayor potencia de salida y competitividad en costos en comparación con las soluciones de carburo de silicio, con expectativas de un rápido crecimiento de los ingresos de automoción en 2025.","[{'name': 'powi-Q324-10-Q', 'url': 'https://storage.googleapis.com/reflexivity-documents-prod/edgar/filing/10-q/powi-Q324-10-Q.html'}, {'name': 'powi-Q225-10-Q', 'url': 'https://storage.googleapis.com/reflexivity-documents-prod/edgar/filing/10-q/powi-Q225-10-Q.html'}, {'name': 'powi-FY24-10-K', 'url': 'https://storage.googleapis.com/reflexivity-documents-prod/edgar/filing/10-k/powi-FY24-10-K.html'}, {'name': 'powi-Q125-10-Q', 'url': 'https://storage.googleapis.com/reflexivity-documents-prod/edgar/filing/10-q/powi-Q125-10-Q.html'}]",4816793,USD,SMART,STK,True,ELE
