symbol,industry,theme,isin_code,name,rank,description,evidence,evidenceSources,ib_conid,currency,exchange,assetType,navigable,theme_id
MKSI,automotive,electric_vehicles,US55306N1046,MKS INC,44,Contribuye al tema de Vehículos Eléctricos.,"MKS Instruments aborda el mercado de vehículos eléctricos a través de su segmento industrial, que incluye químicas para recubrimientos funcionales, acabado de superficies y resistencia al desgaste en la industria automotriz. La empresa desarrolla nuevos productos diseñados para abordar las tendencias de la industria, incluida la transición de vehículos de combustión interna a eléctricos. MKS también apoya la migración a nuevas clases de materiales, capas ultrafinas y estructuras 3D utilizadas en la fabricación de geometrías pequeñas relevantes para la transición de vehículos eléctricos, lo que indica una inversión continua en esta área.","[{'name': 'mksi-Q324-10-Q', 'url': 'https://storage.googleapis.com/reflexivity-documents-prod/edgar/filing/10-q/mksi-Q324-10-Q.html'}, {'name': 'mksi-Q225-10-Q', 'url': 'https://storage.googleapis.com/reflexivity-documents-prod/edgar/filing/10-q/mksi-Q225-10-Q.html'}, {'name': 'mksi-FY24-10-K', 'url': 'https://storage.googleapis.com/reflexivity-documents-prod/edgar/filing/10-k/mksi-FY24-10-K.html'}, {'name': 'mksi-Q125-10-Q', 'url': 'https://storage.googleapis.com/reflexivity-documents-prod/edgar/filing/10-q/mksi-Q125-10-Q.html'}]",4814955,USD,SMART,STK,True,ELE
LFUS,automotive,electric_vehicles,US5370081045,LITTELFUSE INC,45,Apoya el sector de Vehículos Eléctricos.,"La participación de Littelfuse en el tema de Vehículos Eléctricos es evidente a través de su participación tanto en los mercados de vehículos eléctricos como en los de vehículos ICE tradicionales, con un énfasis notable en los vehículos eléctricos debido a su mayor contenido y potencial de aumento de la cuota en dólares. La empresa reconoce el impacto de la continua electronificación y electrificación de los vehículos en su negocio de productos para automóviles de pasajeros. Sin embargo, la unidad de informes de Controles y Sensores Industriales de la empresa se enfrenta a riesgos potenciales debido a una demanda menor a la esperada en el mercado de vehículos eléctricos, lo que indica que, si bien los vehículos eléctricos son importantes, no están exentos de desafíos.","[{'name': 'lfus-Q324-10-Q', 'url': 'https://storage.googleapis.com/reflexivity-documents-prod/edgar/filing/10-q/lfus-Q324-10-Q.html'}, {'name': 'lfus-FY23-10-K', 'url': 'https://storage.googleapis.com/reflexivity-documents-prod/edgar/filing/10-k/lfus-FY23-10-K.html'}]",271184,USD,SMART,STK,True,ELE
LAD,automotive,electric_vehicles,US5367971034,LITHIA MOTORS INC,46,Contribuye al tema de Vehículos Eléctricos.,,,6608116,USD,SMART,STK,True,ELE
ALSN,automotive,electric_vehicles,US01973R1014,ALLISON TRANSMISSION HOLDING,47,El tema de Vehículos Eléctricos se integra en el ámbito operativo de la empresa.,"El compromiso de Allison Transmission con el tema de Vehículos Eléctricos se destaca por su participación en el programa Next Generation Electrified Transmission (NGET), también conocido como eGen Force, a través de un contrato multimillonario con el Ejército de EE. UU. Esta iniciativa se centra en mejorar el sistema de e-máquina e inversor para crear sistemas de propulsión que superen las demandas de rendimiento y eficiencia de los vehículos de combate blindados modernos. La segunda fase de este programa tiene como objetivo mejorar el sistema eGen Force, demostrando la inversión de Allison en tecnología de vehículos eléctricos para aplicaciones militares.",,104054141,USD,SMART,STK,False,ELE
QRVO,automotive,electric_vehicles,US74736K1016,QORVO INC,48,Las actividades de la empresa abarcan aspectos relacionados con el tema de los vehículos eléctricos.,,,179002152,USD,SMART,STK,True,ELE
DTE,automotive,electric_vehicles,US2333311072,DTE ENERGY COMPANY,49,Apoya la expansión de los vehículos eléctricos a través de inversiones en infraestructura de carga e iniciativas de modernización de la red.,"DTE Energy reconoce que el aumento de la adopción de vehículos eléctricos impulsará una necesidad continua de inversiones sustanciales en la red a largo plazo, y su estrategia incluye inversiones para apoyar esta tendencia. La empresa anticipa un crecimiento a largo plazo en las ventas relacionadas con la electrificación de vehículos, aunque no espera impactos significativos a corto plazo. Además, DTE Energy menciona que el aumento de la adopción de vehículos eléctricos impulsará una necesidad continua de inversiones sustanciales en la red a largo plazo.","[{'name': 'dte-Q125-10-Q', 'url': 'https://storage.googleapis.com/reflexivity-documents-prod/edgar/filing/10-q/dte-Q125-10-Q.html'}, {'name': 'dte-Q324-10-Q', 'url': 'https://storage.googleapis.com/reflexivity-documents-prod/edgar/filing/10-q/dte-Q324-10-Q.html'}, {'name': 'dte-Q225-10-Q', 'url': 'https://storage.googleapis.com/reflexivity-documents-prod/edgar/filing/10-q/dte-Q225-10-Q.html'}, {'name': 'dte-FY24-10-K', 'url': 'https://storage.googleapis.com/reflexivity-documents-prod/edgar/filing/10-k/dte-FY24-10-K.html'}]",6585,USD,SMART,STK,True,ELE
ALGM,automotive,electric_vehicles,US01749D1054,ALLEGRO MICROSYSTEMS INC,50,La empresa tiene relevancia dentro del tema de Vehículos Eléctricos.,"El compromiso de Allegro MicroSystems con el tema de los vehículos eléctricos es evidente a través de su enfoque estratégico en soluciones de movilidad electrónica. La empresa se centra en sensores de corriente para aplicaciones xEV, como inversores de tracción de alto voltaje y cargadores a bordo, y está innovando con nuevos sensores de corriente ASIL-C diseñados específicamente para inversores xEV. Este énfasis se demuestra aún más por la aceleración de las ventas de Allegro en el mercado de la movilidad electrónica, que presenta una oportunidad sustancial de SAM de 5 mil millones de dólares, y el hecho de que las ventas de movilidad electrónica constituyen una parte importante de sus ingresos automotrices. La empresa también está asegurando victorias de diseño, particularmente en China, y muestreando drivers de puerta aislados de alto voltaje para sistemas de potencia basados en carburo de silicio en aplicaciones de movilidad electrónica, lo que subraya su compromiso con este sector en crecimiento.","[{'name': 'algm-Q125-10-Q', 'url': 'https://storage.googleapis.com/reflexivity-documents-prod/edgar/filing/10-q/algm-Q125-10-Q.html'}, {'name': 'algm-Q325-10-Q', 'url': 'https://storage.googleapis.com/reflexivity-documents-prod/edgar/filing/10-q/algm-Q325-10-Q.html'}, {'name': 'algm-Q225-10-Q', 'url': 'https://storage.googleapis.com/reflexivity-documents-prod/edgar/filing/10-q/algm-Q225-10-Q.html'}]",452380681,USD,SMART,STK,True,ELE
DAN,automotive,electric_vehicles,US2358252052,DANA INC,51,"Desarrolla y suministra sistemas de propulsión, gestión térmica y soluciones de sellado esenciales para la propulsión y eficiencia de vehículos eléctricos en diversas aplicaciones.","La participación de Dana en el tema de Vehículos Eléctricos es multifacética. La empresa suministra motores, inversores de potencia y sistemas de control para vehículos eléctricos, y su contenido vehicular es mayor en vehículos híbridos y eléctricos. Dana tiene como objetivo acelerar la electrificación de vehículos a través de tecnologías centrales y adquisiciones estratégicas, posicionándose para liderar en este mercado. Sin embargo, también están respondiendo a la dinámica del mercado, incluyendo retrasos en la adopción de vehículos eléctricos, alineando los gastos de ingeniería y consolidando las instalaciones de fabricación, y cambiando la estrategia relacionada con el negocio de vehículos eléctricos.","[{'name': 'dan-Q324-10-Q', 'url': 'https://storage.googleapis.com/reflexivity-documents-prod/edgar/filing/10-q/dan-Q324-10-Q.html'}, {'name': 'dan-Q125-10-Q', 'url': 'https://storage.googleapis.com/reflexivity-documents-prod/edgar/filing/10-q/dan-Q125-10-Q.html'}, {'name': 'dan-Q225-10-Q', 'url': 'https://storage.googleapis.com/reflexivity-documents-prod/edgar/filing/10-q/dan-Q225-10-Q.html'}, {'name': 'dan-FY24-10-K', 'url': 'https://storage.googleapis.com/reflexivity-documents-prod/edgar/filing/10-k/dan-FY24-10-K.html'}]",49260419,USD,SMART,STK,True,ELE
LEA,automotive,electric_vehicles,US5218652049,LEAR CORP,52,Tiene una presencia establecida dentro del tema de la industria de Vehículos Eléctricos.,"La participación de Lear en el tema de los vehículos eléctricos es evidente en su alineación estratégica con la electrificación, ya que la empresa está transformando su negocio de E-Systems para capitalizar la evolución de la arquitectura del vehículo. Esto se ve reforzado por el enfoque de Lear en el diseño y la fabricación de sistemas completos de distribución y conexión eléctrica, incluidos productos de distribución de energía de alto voltaje y unidades de desconexión de batería (BDU) específicamente para trenes motrices electrificados. Lear también ha asegurado importantes adjudicaciones de cableado de conquista con los principales fabricantes mundiales de vehículos eléctricos, con una parte significativa de las adjudicaciones de E-Systems atribuida a negocios de conquista en el sector de vehículos eléctricos, que se acercan a los mil millones de dólares en ventas anuales.","[{'name': 'lea-Q125-10-Q', 'url': 'https://storage.googleapis.com/reflexivity-documents-prod/edgar/filing/10-q/lea-Q125-10-Q.html'}, {'name': 'lea-FY24-10-K', 'url': 'https://storage.googleapis.com/reflexivity-documents-prod/edgar/filing/10-k/lea-FY24-10-K.html'}, {'name': 'lea-Q324-10-Q', 'url': 'https://storage.googleapis.com/reflexivity-documents-prod/edgar/filing/10-q/lea-Q324-10-Q.html'}]",70152668,USD,SMART,STK,True,ELE
PNW,automotive,electric_vehicles,US7234841010,PINNACLE WEST CAPITAL,53,Soporta la creciente adopción de vehículos eléctricos proporcionando infraestructura y servicios eléctricos esenciales para satisfacer las necesidades de carga.,"APS apoya la adopción de vehículos eléctricos a través de varias iniciativas, incluido el programa Take Charge AZ, que facilitó el despliegue de estaciones de carga de vehículos eléctricos de Nivel 2 para diversos segmentos de clientes, lo que resultó en 829 puertos energizados en 197 ubicaciones a diciembre de 2024. La empresa también opera estaciones de carga rápida de corriente continua en todo Arizona. Además, APS lanzó el Piloto de Gestión de la Demanda de Carga de Vehículos Eléctricos y otros programas dentro de su Plan de Implementación de Gestión de la Demanda (DSM), como APS SmartCharge y Servicios de Asesoramiento de Flotas, para gestionar la creciente demanda de carga de vehículos eléctricos, además de apoyar el plan estatal de electrificación del transporte con el objetivo de 450.000 vehículos eléctricos ligeros en su área de servicio para 2030.","[{'name': 'pnw-Q324-10-Q', 'url': 'https://storage.googleapis.com/reflexivity-documents-prod/edgar/filing/10-q/pnw-Q324-10-Q.html'}, {'name': 'pnw-FY24-10-K', 'url': 'https://storage.googleapis.com/reflexivity-documents-prod/edgar/filing/10-k/pnw-FY24-10-K.html'}, {'name': 'pnw-Q125-10-Q', 'url': 'https://storage.googleapis.com/reflexivity-documents-prod/edgar/filing/10-q/pnw-Q125-10-Q.html'}]",11257,USD,SMART,STK,True,ELE
XEL,automotive,electric_vehicles,US98389B1008,XCEL ENERGY INC,54,Proporciona la infraestructura eléctrica y el suministro de energía necesarios para respaldar la adopción y el funcionamiento de vehículos eléctricos.,"La participación de Xcel Energy en el tema de los vehículos eléctricos es evidente a través de su previsión de una fuerte demanda de energía derivada de la electrificación del transporte. Esto está respaldado por la existencia de Planes de Electrificación del Transporte dentro de PSCo y SPS, que facilitan la recuperación de costos asociados con las inversiones en infraestructura de electrificación del transporte. Además, la compañía reconoce el aumento de la demanda eléctrica debido a la adopción de vehículos eléctricos en sus territorios de servicio, y están invirtiendo capital para satisfacer las necesidades de electrificación de sus clientes.","[{'name': 'xel-FY24-10-K', 'url': 'https://storage.googleapis.com/reflexivity-documents-prod/edgar/filing/10-k/xel-FY24-10-K.html'}]",10517,USD,SMART,STK,True,ELE
THRM,automotive,electric_vehicles,US37253A1034,GENTHERM INC,55,"Desarrolla y suministra soluciones de gestión térmica, incluida la gestión térmica de baterías y sistemas de control climático, que mejoran el rendimiento, la autonomía y el confort de los pasajeros de los vehículos eléctricos.","Gentherm reconoce los posibles impactos adversos de la volatilidad o la debilidad en los mercados de vehículos híbridos o eléctricos. La empresa cree que sus productos ofrecen ventajas para los vehículos híbridos y eléctricos, incluida una mejor eficiencia energética, lo que los posiciona bien para resistir los cambios en la mezcla de volúmenes entre vehículos impulsados por motores de combustión interna y vehículos híbridos y otros vehículos eléctricos. Sin embargo, la empresa no especifica si estos son productos estrella.","[{'name': 'thrm-Q324-10-Q', 'url': 'https://storage.googleapis.com/reflexivity-documents-prod/edgar/filing/10-q/thrm-Q324-10-Q.html'}, {'name': 'thrm-Q125-10-Q', 'url': 'https://storage.googleapis.com/reflexivity-documents-prod/edgar/filing/10-q/thrm-Q125-10-Q.html'}, {'name': 'thrm-FY24-10-K', 'url': 'https://storage.googleapis.com/reflexivity-documents-prod/edgar/filing/10-k/thrm-FY24-10-K.html'}]",113306104,USD,SMART,STK,True,ELE
VST,automotive,electric_vehicles,US92840M1027,VISTRA CORP,56,Suministra electricidad que alimenta vehículos eléctricos y su infraestructura de carga.,"Vistra reconoce la creciente demanda de electricidad debido a fuentes emergentes como los vehículos eléctricos, que están contribuyendo a un crecimiento de carga más rápido en las regiones a las que presta servicio. La empresa reconoce la construcción de carga de vehículos eléctricos como un impulsor emergente de la demanda de electricidad, junto con el auge de los centros de datos a gran escala y la electrificación de las operaciones de campos petroleros. Si bien los vehículos eléctricos se mencionan como un factor que influye en la demanda de electricidad y un impulsor de un crecimiento modesto, no se identifican como un enfoque estratégico principal.","[{'name': 'vst-Q125-10-Q', 'url': 'https://storage.googleapis.com/reflexivity-documents-prod/edgar/filing/10-q/vst-Q125-10-Q.html'}, {'name': 'vst-Q324-10-Q', 'url': 'https://storage.googleapis.com/reflexivity-documents-prod/edgar/filing/10-q/vst-Q324-10-Q.html'}, {'name': 'vst-Q225-10-Q', 'url': 'https://storage.googleapis.com/reflexivity-documents-prod/edgar/filing/10-q/vst-Q225-10-Q.html'}, {'name': 'vst-FY24-10-K', 'url': 'https://storage.googleapis.com/reflexivity-documents-prod/edgar/filing/10-k/vst-FY24-10-K.html'}]",254457731,USD,SMART,STK,True,ELE
GT,automotive,electric_vehicles,US3825501014,GOODYEAR TIRE & RUBBER CO,57,Desarrolla y suministra neumáticos especializados diseñados para cumplir con los requisitos de rendimiento únicos de los vehículos eléctricos.,"La participación de Goodyear en el tema de Vehículos Eléctricos es evidente a través de su enfoque en productos para vehículos eléctricos, particularmente en la región de Asia-Pacífico, donde experimentaron un crecimiento de volumen del 25% en productos nuevos de lujo y para vehículos eléctricos. Este crecimiento está respaldado además por un aumento en las unidades de neumáticos de equipo original (OE), lo que refleja un aumento en los equipamientos para vehículos eléctricos, especialmente en China. Goodyear también se enfoca en la introducción de líneas eléctricas en nuevos productos de lujo y para vehículos eléctricos, y está asegurando equipamientos en vehículos eléctricos, incluidos modelos como el Chevy Silverado, Dodge Ram y Ford F-150, lo que contribuye al crecimiento de la cuota de mercado en el segmento de OE.","[{'name': 'gt-FY24-10-K', 'url': 'https://storage.googleapis.com/reflexivity-documents-prod/edgar/filing/10-k/gt-FY24-10-K.html'}, {'name': 'gt-Q324-10-Q', 'url': 'https://storage.googleapis.com/reflexivity-documents-prod/edgar/filing/10-q/gt-Q324-10-Q.html'}]",7830,USD,SMART,STK,True,ELE
EXC,automotive,electric_vehicles,US30161N1019,EXELON CORP,58,Apoya el ecosistema de vehículos eléctricos gestionando y mejorando la infraestructura de red necesaria para la carga y la adopción generalizada.,"Exelon demuestra su compromiso con el tema de Vehículos Eléctricos a través de las iniciativas de ComEd, en particular su proyecto centrado en el despliegue de tecnologías de red para apoyar el crecimiento tanto de los vehículos solares como de los eléctricos. Este proyecto, recomendado para un premio importante, tiene como objetivo desplegar tecnologías de red de próxima generación e iniciativas piloto de capacitación de la fuerza laboral relacionadas con la transición hacia la energía limpia. Además, Exelon está evaluando programas y considerando oportunidades para solicitar financiación relacionada con la infraestructura de carga de vehículos eléctricos proporcionada por la Ley de Inversión en Infraestructura y Empleos (IIJA).","[{'name': 'exc-Q324-10-Q', 'url': 'https://storage.googleapis.com/reflexivity-documents-prod/edgar/filing/10-q/exc-Q324-10-Q.html'}, {'name': 'exc-Q125-10-Q', 'url': 'https://storage.googleapis.com/reflexivity-documents-prod/edgar/filing/10-q/exc-Q125-10-Q.html'}, {'name': 'exc-FY24-10-K', 'url': 'https://storage.googleapis.com/reflexivity-documents-prod/edgar/filing/10-k/exc-FY24-10-K.html'}, {'name': 'exc-Q225-10-Q', 'url': 'https://storage.googleapis.com/reflexivity-documents-prod/edgar/filing/10-q/exc-Q225-10-Q.html'}]",11000,USD,SMART,STK,True,ELE
BLBD,automotive,electric_vehicles,US0953061068,BLUE BIRD CORP,59,"Fabrica autobuses escolares eléctricos, contribuyendo a la adopción del transporte de cero emisiones en el sector educativo.","La participación de Blue Bird en el tema de Vehículos Eléctricos es evidente a través de su liderazgo en el mercado de ofertas de productos con energía alternativa, incluidos los autobuses escolares totalmente eléctricos. La empresa ha vendido un número significativo de unidades de vehículos eléctricos, con una cartera de pedidos sustancial y una perspectiva optimista a largo plazo. Las subvenciones y subsidios gubernamentales desempeñan un papel crucial para compensar el mayor precio de los autobuses eléctricos, lo que enfatiza aún más la importancia estratégica de este sector para la empresa. El enfoque de la empresa en las ventas de vehículos eléctricos, los objetivos de producción y el impacto de los aranceles en los componentes de los vehículos eléctricos resaltan su compromiso e inversión en el mercado de vehículos eléctricos.","[{'name': 'blbd-Q225-10-Q', 'url': 'https://storage.googleapis.com/reflexivity-documents-prod/edgar/filing/10-q/blbd-Q225-10-Q.html'}, {'name': 'blbd-Q325-10-Q', 'url': 'https://storage.googleapis.com/reflexivity-documents-prod/edgar/filing/10-q/blbd-Q325-10-Q.html'}]",185200225,USD,SMART,STK,False,ELE
LYFT,automotive,electric_vehicles,US55087P1049,LYFT INC-A,60,Facilita la integración y adopción de vehículos eléctricos dentro de su ecosistema de transporte compartido al alentar a los conductores a usar vehículos eléctricos y ofrecer opciones de viajes eléctricos a los pasajeros.,"La participación de Lyft en el tema de los vehículos eléctricos está impulsada principalmente por el cumplimiento normativo y los objetivos de sostenibilidad. La compañía tiene la intención de invertir más en vehículos eléctricos para cumplir con mandatos como el California Clean Miles Standard, que tiene como objetivo que el 90% de las millas de viajes compartidos en California sean en vehículos eléctricos para 2030. Objetivos similares en Massachusetts, la ciudad de Nueva York y Toronto también contribuyen al compromiso de Lyft de transicionar a vehículos eléctricos.","[{'name': 'lyft-Q125-10-Q', 'url': 'https://storage.googleapis.com/reflexivity-documents-prod/edgar/filing/10-q/lyft-Q125-10-Q.html'}, {'name': 'lyft-FY24-10-K', 'url': 'https://storage.googleapis.com/reflexivity-documents-prod/edgar/filing/10-k/lyft-FY24-10-K.html'}]",359130923,USD,SMART,STK,False,ELE
CDNS,automotive,electric_vehicles,US1273871087,CADENCE DESIGN SYS INC,61,Desempeña un papel en la industria de los vehículos eléctricos.,"La plataforma de diseño de PCB Allegro X impulsada por IA de Cadence está siendo adoptada por múltiples clientes en el sector de vehículos eléctricos, lo que indica que estos clientes están aprovechando la productividad y las capacidades de próxima generación de la plataforma. Esta proliferación de la plataforma entre los clientes de vehículos eléctricos sugiere una relevancia estratégica general para Cadence. Sin embargo, la participación de la empresa en el tema de los vehículos eléctricos parece menor, ya que representa solo un sector entre otros, incluidos la aeroespacial y defensa, y la hiperescala.",,5552,USD,SMART,STK,True,ELE
GNRC,automotive,electric_vehicles,US3687361044,GENERAC HOLDINGS INC,62,"Ofrece soluciones de gestión de energía y sistemas de energía de respaldo que respaldan la infraestructura de carga para vehículos eléctricos, mejorando la resiliencia de la red y la accesibilidad de la carga.",,,72529783,USD,SMART,STK,True,ELE
VC,automotive,electric_vehicles,US92839U2069,VISTEON CORP,63,Proporciona soluciones de cabina digital y electrónica avanzada que son integrales para la arquitectura en evolución y la experiencia del usuario de los vehículos eléctricos.,"Las plataformas de Visteon están diseñadas para permitir la evolución digital, eléctrica y autónoma de sus clientes automotrices, y la empresa proporciona soluciones de hardware y software para apoyar este cambio. Las plataformas de la empresa aprovechan soluciones de hardware y software que permiten la evolución digital, eléctrica y autónoma de sus clientes automotrices globales y su amplia cartera de productos de electrónica de cabina digital y electrificación los posiciona para apoyar estas macrotendencias en la industria automotriz. Se espera que el mercado de movilidad automotriz crezca más rápido que los volúmenes de producción de vehículos subyacentes a medida que el vehículo pasa de analógico a digital y hacia vehículos conectados a dispositivos y en la nube, vehículos eléctricos y vehículos con funciones de seguridad más avanzadas. Visteon suministra electrónica de cabina para vehículos eléctricos y fabrica sistemas de gestión de baterías (BMS), y el cambio a la electrificación sigue siendo una tendencia central en todos los principales mercados.","[{'name': 'vc-Q125-10-Q', 'url': 'https://storage.googleapis.com/reflexivity-documents-prod/edgar/filing/10-q/vc-Q125-10-Q.html'}, {'name': 'vc-Q225-10-Q', 'url': 'https://storage.googleapis.com/reflexivity-documents-prod/edgar/filing/10-q/vc-Q225-10-Q.html'}, {'name': 'vc-Q324-10-Q', 'url': 'https://storage.googleapis.com/reflexivity-documents-prod/edgar/filing/10-q/vc-Q324-10-Q.html'}, {'name': 'vc-FY24-10-K', 'url': 'https://storage.googleapis.com/reflexivity-documents-prod/edgar/filing/10-k/vc-FY24-10-K.html'}]",79565601,USD,SMART,STK,True,ELE
LKQ,automotive,electric_vehicles,US5018892084,LKQ CORP,64,"Aborda la demanda cambiante de piezas y servicios en el mercado de vehículos eléctricos, integrándolos en su red de distribución más amplia.",,,26345312,USD,SMART,STK,True,ELE
LSCC,automotive,electric_vehicles,US5184151042,LATTICE SEMICONDUCTOR CORP,65,Mantiene una presencia en la industria de Vehículos Eléctricos.,,,271320,USD,SMART,STK,True,ELE
CC,automotive,electric_vehicles,US1638511089,CHEMOURS CO/THE,66,"Proporciona productos químicos especializados esenciales y materiales avanzados críticos para componentes de vehículos eléctricos, incluidas baterías, sistemas de gestión térmica y soluciones de aligeramiento.","El crecimiento de Chemours en el segmento de Materiales de Alto Rendimiento se ve impulsado por la creciente demanda de vehículos eléctricos, con fluoropolímeros desempeñando un papel fundamental en la electrificación de vehículos. Los fluoropolímeros son esenciales para mejorar el rendimiento de las baterías, aumentar la seguridad de los pasajeros y optimizar los controles de emisiones tanto en vehículos eléctricos como en vehículos de alto rendimiento y bajas emisiones. Se espera que la creciente adopción de vehículos eléctricos, impulsada por la evolución de las regulaciones de rendimiento de emisiones, aumente aún más el uso de fluoropolímeros en la industria automotriz, al tiempo que apoya la generación de hidrógeno limpio y el almacenamiento de energía.","[{'name': 'cc-Q225-10-Q', 'url': 'https://storage.googleapis.com/reflexivity-documents-prod/edgar/filing/10-q/cc-Q225-10-Q.html'}, {'name': 'cc-Q324-10-Q', 'url': 'https://storage.googleapis.com/reflexivity-documents-prod/edgar/filing/10-q/cc-Q324-10-Q.html'}]",196682709,USD,SMART,STK,True,ELE
SNA,automotive,electric_vehicles,US8330341012,SNAP-ON INC,67,"Proporciona herramientas y equipos especializados necesarios para el servicio y mantenimiento de vehículos eléctricos, apoyando el crecimiento del mercado de vehículos eléctricos.",,,12259,USD,SMART,STK,True,ELE
