industry_id,theme_id,symbol,industry,theme,isin_code,name,rank,description,evidence,evidenceSources,ib_conid,currency,exchange,assetType
RE,CO1,KRC,real estate,estate,US49427F1084,KILROY REALTY CORP,62,"Opera adquiriendo, desarrollando y gestionando una cartera de propiedades inmobiliarias comerciales, sirviendo como participante directo en el mercado de tenencias inmobiliarias.","El negocio de la empresa se centra en las carteras inmobiliarias, ya que posee, desarrolla, adquiere y gestiona propiedades de primer nivel principalmente en Los Ángeles, San Diego, el Área de la Bahía de San Francisco, Seattle y Austin. Como REIT autoadministrado, los activos inmobiliarios de la empresa incluyen propiedades de oficinas, ciencias de la vida y de uso mixto. La empresa se enfoca en mercados que se cree que tienen ventajas estratégicas y fuertes barreras de entrada, y evalúa oportunidades para la posible disposición de propiedades no centrales.","[{'name': 'krc-Q225-10-Q', 'url': 'https://storage.googleapis.com/reflexivity-documents-prod/edgar/filing/10-q/krc-Q225-10-Q.html'}, {'name': 'krc-Q125-10-Q', 'url': 'https://storage.googleapis.com/reflexivity-documents-prod/edgar/filing/10-q/krc-Q125-10-Q.html'}]",2586128,USD,SMART,STK
RE,CO1,HHH,real estate,estate,US44267T1025,HOWARD HUGHES HOLDINGS INC,63,"Se enfoca en la propiedad, el desarrollo y la gestión de una cartera diversa de activos inmobiliarios, incluidas comunidades planificadas y propiedades de uso mixto.","La participación de Howard Hughes Holdings en Bienes Raíces es central para sus operaciones, demostrada por su diversa cartera que abarca Comunidades Planificadas Maestras, edificios de oficinas, espacios comerciales y propiedades multifamiliares. El enfoque estratégico de la empresa en bienes raíces se ve aún más subrayado por la inversión de $900 millones de Pershing Square, destinada a evolucionar Howard Hughes de una entidad puramente de bienes raíces. El sólido desempeño en MPC EBT, impulsado por las ventas de terrenos, y el NOI récord en la cartera multifamiliar, junto con una guía anual completa aumentada debido a una sólida actividad de arrendamiento, resaltan el compromiso y el éxito de la empresa en la gestión de sus activos inmobiliarios.",,647324601,USD,SMART,STK
RE,CO1,VTR,real estate,estate,US92276F1003,VENTAS INC.,64,"Se centra en la adquisición, propiedad y gestión de una cartera diversificada de propiedades inmobiliarias relacionadas con la atención médica.","Ventas, como fideicomiso de inversión inmobiliaria, mantiene un enfoque sustancial en las tenencias inmobiliarias, gestionando una cartera diversa que incluye comunidades de viviendas para personas mayores, edificios médicos ambulatorios, centros de investigación, hospitales e instalaciones de atención médica ubicadas en América del Norte y el Reino Unido. Con inversiones en 1.387 propiedades, Ventas gestiona y optimiza activamente su cartera para generar ingresos y crear valor para los accionistas, centrándose en maximizar el rendimiento y realizar inversiones que creen valor en viviendas para personas mayores.","[{'name': 'vtr-FY24-10-K', 'url': 'https://storage.googleapis.com/reflexivity-documents-prod/edgar/filing/10-k/vtr-FY24-10-K.html'}]",4044062,USD,SMART,STK
RE,CO1,NLY,real estate,estate,US0357108390,ANNALY CAPITAL MANAGEMENT IN,65,"Gestiona una cartera que consiste principalmente en activos relacionados con bienes raíces, incluidos valores respaldados por hipotecas y otras inversiones inmobiliarias.","El compromiso de Annaly con el tema de las tenencias inmobiliarias es evidente a través de su propiedad de una cartera diversa de inversiones relacionadas con bienes raíces. Esta cartera abarca certificados hipotecarios, obligaciones hipotecarias colateralizadas, valores de transferencia de riesgo crediticio y otros valores respaldados por carteras de préstamos hipotecarios, préstamos hipotecarios residenciales y derechos de servicio de hipotecas. La empresa declara explícitamente que posee esta cartera, lo que destaca la importancia estratégica y la exposición principal a las tenencias inmobiliarias.","[{'name': 'nly-Q125-10-Q', 'url': 'https://storage.googleapis.com/reflexivity-documents-prod/edgar/filing/10-q/nly-Q125-10-Q.html'}, {'name': 'nly-Q225-10-Q', 'url': 'https://storage.googleapis.com/reflexivity-documents-prod/edgar/filing/10-q/nly-Q225-10-Q.html'}]",585013481,USD,SMART,STK
RE,CO1,REXR,real estate,estate,US76169C1009,REXFORD INDUSTRIAL REALTY IN,66,"Se enfoca en la adquisición, propiedad y gestión de propiedades inmobiliarias industriales, participando directamente en el mercado de tenencias inmobiliarias.",,,131219465,USD,SMART,STK
RE,CO1,EPR,real estate,estate,US26884U1097,EPR PROPERTIES,67,"Se enfoca en la propiedad y gestión de una cartera diversificada de activos inmobiliarios, generando ingresos a través del arrendamiento de propiedades a diversos inquilinos.","El enfoque de EPR Properties en las tenencias inmobiliarias es evidente a través de su modelo de negocio principal, que se centra en la propiedad y gestión de propiedades experienciales y educativas. La importante cartera de inversiones de la empresa, valorada en aproximadamente $6.9 mil millones, incluye la propiedad e hipotecas a largo plazo sobre estas propiedades. Con activos totales de aproximadamente $5.6 mil millones y propiedades ubicadas en 44 estados y Canadá, las operaciones de EPR están profundamente arraigadas en el sector inmobiliario.","[{'name': 'epr-FY24-10-K', 'url': 'https://storage.googleapis.com/reflexivity-documents-prod/edgar/filing/10-k/epr-FY24-10-K.html'}]",116776441,USD,SMART,STK
RE,CO1,OHI,real estate,estate,US6819361006,OMEGA HEALTHCARE INVESTORS,68,"Se enfoca en la propiedad e inversión en bienes raíces, particularmente dentro del sector de la salud.","El negocio de Omega Healthcare Investors se centra en las propiedades inmobiliarias, específicamente propiedades relacionadas con la atención médica en los EE. UU. y el Reino Unido, lo que constituye su único segmento informable. Esto se demuestra aún más por su gestión activa y expansión de su cartera a través de adquisiciones, inversiones de capital y asignación estratégica de capital, incluida la finalización de 423 millones de dólares en nuevas inversiones inmobiliarias en el primer trimestre de 2025. Estos activos inmobiliarios, que incluyen comunidades de viviendas para personas mayores y residencias de ancianos, se alquilan a operadores bajo acuerdos a largo plazo y son un motor principal de los ingresos y el rendimiento financiero de la empresa.","[{'name': 'ohi-Q324-10-Q', 'url': 'https://storage.googleapis.com/reflexivity-documents-prod/edgar/filing/10-q/ohi-Q324-10-Q.html'}]",10754,USD,SMART,STK
RE,CO1,SBRA,real estate,estate,US78573L1061,SABRA HEALTH CARE REIT INC,69,"Es un fideicomiso de inversión inmobiliaria que posee e invierte en propiedades relacionadas con la atención médica, contribuyendo al mercado más amplio de carteras inmobiliarias.",,,80712681,USD,SMART,STK
RE,CO1,PECO,real estate,estate,US71844V2016,PHILLIPS EDISON & COMPANY IN,70,"Se enfoca en la adquisición, propiedad y gestión de propiedades inmobiliarias.","La estrategia comercial de Phillips Edison & Company se basa en gran medida en sus tenencias inmobiliarias, como lo demuestra su propiedad de participaciones accionariales en un gran número de centros comerciales en varios estados; al 30 de junio de 2025, la empresa poseía participaciones en 327 centros comerciales que comprenden aproximadamente 36.6 millones de pies cuadrados. La propiedad, operación y gestión de bienes raíces bien ocupados y anclados a supermercados omnicanal se declara explícitamente como una parte central de su estrategia comercial, y monitorean activamente el mercado de bienes raíces comerciales en busca de propiedades con potencial de crecimiento futuro. Esta extensa cartera y enfoque proactivo resaltan el papel significativo de las tenencias inmobiliarias en las operaciones y la estrategia de inversión de la empresa.","[{'name': 'peco-Q225-10-Q', 'url': 'https://storage.googleapis.com/reflexivity-documents-prod/edgar/filing/10-q/peco-Q225-10-Q.html'}, {'name': 'peco-FY24-10-K', 'url': 'https://storage.googleapis.com/reflexivity-documents-prod/edgar/filing/10-k/peco-FY24-10-K.html'}, {'name': 'peco-Q324-10-Q', 'url': 'https://storage.googleapis.com/reflexivity-documents-prod/edgar/filing/10-q/peco-Q324-10-Q.html'}]",502056059,USD,SMART,STK
RE,CO1,NSA,real estate,estate,US6378701063,NATIONAL STORAGE AFFILIATES,71,"Posee y gestiona una cartera de propiedades inmobiliarias, centrándose principalmente en instalaciones de autoalmacenamiento.","El enfoque de la empresa en la propiedad, operación y adquisición de propiedades de autoalmacenamiento, predominantemente dentro de las 100 principales áreas estadísticas metropolitanas de los Estados Unidos, destaca la importancia de las propiedades inmobiliarias para la empresa. Al 30 de septiembre de 2024, la empresa mantenía una cartera geográficamente diversificada de 811 propiedades de autoalmacenamiento, ubicadas en 38 estados y Puerto Rico, que comprenden aproximadamente 52.0 millones de pies cuadrados alquilables, configurados en aproximadamente 407,000 unidades de almacenamiento.","[{'name': 'nsa-Q324-10-Q', 'url': 'https://storage.googleapis.com/reflexivity-documents-prod/edgar/filing/10-q/nsa-Q324-10-Q.html'}]",191674687,USD,SMART,STK
RE,CO1,LADR,real estate,estate,US5057431042,LADDER CAPITAL CORP-REIT,72,Implica la inversión y gestión de una cartera diversa de activos inmobiliarios.,"La participación de Ladder Capital en Inversiones Inmobiliarias es evidente a través de sus actividades de propiedad y operación de bienes raíces comerciales, incluidas propiedades comerciales con arrendamiento neto. La empresa invierte en una cartera diversa de bienes raíces comerciales y activos relacionados con bienes raíces, con un enfoque en activos garantizados de primer orden. La cartera inmobiliaria de Ladder Capital, que consta principalmente de propiedades de arrendamiento neto con arrendamientos a largo plazo, generó $12.2 millones de ingresos operativos netos durante el primer trimestre, lo que demuestra la capacidad de la cartera para generar ingresos estables.","[{'name': 'ladr-Q225-10-Q', 'url': 'https://storage.googleapis.com/reflexivity-documents-prod/edgar/filing/10-q/ladr-Q225-10-Q.html'}, {'name': 'ladr-FY24-10-K', 'url': 'https://storage.googleapis.com/reflexivity-documents-prod/edgar/filing/10-k/ladr-FY24-10-K.html'}]",143731062,USD,SMART,STK
RE,CO1,KRG,real estate,estate,US49803T3005,KITE REALTY GROUP TRUST,73,"Se dedica a la propiedad, operación, gestión y desarrollo de activos inmobiliarios, centrándose principalmente en centros comerciales al aire libre.","El compromiso de la empresa con las Inversiones Inmobiliarias es significativo, como lo demuestra su importante cartera, que incluye participaciones en 179 propiedades minoristas operativas que suman aproximadamente 27,7 millones de pies cuadrados y una propiedad de oficinas. Esta extensa cartera, que incluye propiedades minoristas con componentes de oficinas, resalta el enfoque de inversión y gestión de la empresa en el sector inmobiliario.","[{'name': 'krg-Q324-10-Q', 'url': 'https://storage.googleapis.com/reflexivity-documents-prod/edgar/filing/10-q/krg-Q324-10-Q.html'}]",161703135,USD,SMART,STK
RE,CO1,NNN,real estate,estate,US6374171063,NNN REIT INC,74,"Opera como un fideicomiso de inversión inmobiliaria, centrado principalmente en la propiedad y gestión de una cartera diversificada de bienes inmuebles.","El negocio de NNN se centra en las tenencias inmobiliarias, ya que sus activos incluyen principalmente activos inmobiliarios. La empresa adquiere, posee, invierte y desarrolla activamente propiedades de alta calidad, arrendándolas principalmente a inquilinos bajo arrendamientos netos a largo plazo. A 30 de junio de 2025, NNN poseía 3.663 propiedades en 50 estados, lo que demuestra aún más su importante inversión en bienes raíces.","[{'name': 'nnn-Q225-10-Q', 'url': 'https://storage.googleapis.com/reflexivity-documents-prod/edgar/filing/10-q/nnn-Q225-10-Q.html'}, {'name': 'nnn-Q125-10-Q', 'url': 'https://storage.googleapis.com/reflexivity-documents-prod/edgar/filing/10-q/nnn-Q125-10-Q.html'}]",39042404,USD,SMART,STK
RE,CO1,OWL,real estate,estate,US09581B1035,BLUE OWL CAPITAL INC,75,Opera dentro del dominio de Holdings Inmobiliarios.,"Blue Owl demuestra un enfoque significativo en las tenencias inmobiliarias, respaldado por un sustancial AUM de Activos Reales de $71.5 mil millones, que incluye $40.0 mil millones en AUM de Net Lease y $15.8 mil millones en AUM de Crédito Inmobiliario. La dedicación de la empresa se ve aún más destacada por su estrategia insignia de net lease, donde han experimentado un crecimiento considerable, triplicando el tamaño del negocio en solo 3.5 años, y su reconocimiento como el tercer mayor recaudador de capital inmobiliario a nivel mundial. Este compromiso también es evidente en su despliegue activo de capital dentro de su estrategia de net lease, beneficiándose de un entorno en el que las empresas buscan la optimización del balance.","[{'name': 'owl-Q225-10-Q', 'url': 'https://storage.googleapis.com/reflexivity-documents-prod/edgar/filing/10-q/owl-Q225-10-Q.html'}, {'name': 'owl-FY24-10-K', 'url': 'https://storage.googleapis.com/reflexivity-documents-prod/edgar/filing/10-k/owl-FY24-10-K.html'}]",491635677,USD,SMART,STK
