industry,theme,isin_code,name,rank,description,evidence,evidenceSources,ib_conid,currency,symbol,exchange,assetType,navigable,theme_id
transportation and logistics,innovation_in_logistics,US80689H1023,SCHNEIDER NATIONAL INC-CL B,37,Impulsa avances en logística a través de la integración tecnológica y la optimización de procesos para mejorar la eficiencia y la fiabilidad en la gestión de la cadena de suministro.,"El compromiso de Schneider con la innovación logística es evidente en sus operaciones de corretaje de carga, que funcionan como un centro de innovación de activos ligeros. Esta correduría se enfoca en análisis predictivos, automatización de procesos y generación de nuevas relaciones con clientes, impulsando el crecimiento dentro del segmento de logística. Si bien la empresa reconoce la importancia de la innovación en logística, no hay una mención explícita de la contribución a los ingresos.","[{'name': 'sndr-FY24-10-K', 'url': 'https://storage.googleapis.com/reflexivity-documents-prod/edgar/filing/10-k/sndr-FY24-10-K.html'}]",271857752,USD,SNDR,SMART,STK,True,LO1
transportation and logistics,innovation_in_logistics,US1264081035,CSX CORP,38,"Mejora la eficiencia y fiabilidad de la cadena de suministro a través de operaciones ferroviarias avanzadas y soluciones intermodales, contribuyendo a la innovación logística general.",,,6150,USD,CSX,SMART,STK,True,LO1
transportation and logistics,innovation_in_logistics,IL0065100930,ZIM INTEGRATED SHIPPING SERV,39,Impulsa avances en el transporte marítimo mundial de contenedores mediante la implementación de nuevas tecnologías y procesos operativos optimizados para mejorar la eficiencia y la prestación de servicios.,,,468091282,USD,ZIM,SMART,STK,False,LO1
transportation and logistics,innovation_in_logistics,US03064D1081,AMERICOLD REALTY TRUST INC,40,"Mejora la eficiencia y la fiabilidad en las cadenas de suministro con temperatura controlada a través de su infraestructura y soluciones especializadas, contribuyendo así a la innovación logística.",,,302902503,USD,COLD,SMART,STK,False,LO1
transportation and logistics,innovation_in_logistics,US0536111091,AVERY DENNISON CORP,41,"Apoya los avances en la eficiencia y el seguimiento de la cadena de suministro a través de sus soluciones de ciencia de materiales e identificación, integrales para las operaciones logísticas modernas.",,,4694,USD,AVY,SMART,STK,True,LO1
transportation and logistics,innovation_in_logistics,JE00BJ1F3079,AMCOR PLC,42,"Contribuye a optimizar la eficiencia de la cadena de suministro mediante el desarrollo de soluciones de embalaje que mejoran los procesos de transporte, almacenamiento y manipulación de diversos productos.","El compromiso de Amcor con la Innovación Logística se refleja en sus esfuerzos por mejorar las cadenas de suministro de las principales empresas a nivel mundial. La empresa trabaja para mejorar las cadenas de suministro, lo que sugiere una participación en la logística. Sin embargo, no hay una indicación explícita de procesos únicos o tecnología propietaria en innovación logística, ni se menciona específicamente la innovación logística como una prioridad estratégica principal o ninguna contribución explícita de ingresos de la misma.","[{'name': 'amcr-Q225-10-Q', 'url': 'https://storage.googleapis.com/reflexivity-documents-prod/edgar/filing/10-q/amcr-Q225-10-Q.html'}, {'name': 'amcr-Q125-10-Q', 'url': 'https://storage.googleapis.com/reflexivity-documents-prod/edgar/filing/10-q/amcr-Q125-10-Q.html'}]",364845429,USD,AMCR,SMART,STK,True,LO1
transportation and logistics,innovation_in_logistics,US89679E3009,TRIUMPH FINANCIAL INC,43,Permite a las empresas buscar avances en Innovación Logística al proporcionar servicios financieros adaptados al sector.,"La participación de Triumph Financial en la Innovación Logística es evidente a través de su plataforma TriumphPay, que agiliza los procesos de facturación de transporte al conectar corredores, cargadores, factores y transportistas. Esto se ve reforzado por sus adquisiciones estratégicas de Greenscreens AI, una solución de precios que proporciona inteligencia del mercado de carga, e Isometric Technologies Inc., una empresa de tecnología de carga, para mejorar la toma de decisiones y la automatización. El segmento de Inteligencia de la empresa aprovecha los datos de transporte para proporcionar información procesable, lo que demuestra su compromiso de mejorar la eficiencia y la rentabilidad de los proveedores de servicios logísticos. TriumphPay también proporciona herramientas y servicios para aumentar la automatización, mitigar el fraude, crear eficiencia en la oficina y mejorar la experiencia de pago.","[{'name': 'tfin-Q125-10-Q', 'url': 'https://storage.googleapis.com/reflexivity-documents-prod/edgar/filing/10-q/tfin-Q125-10-Q.html'}, {'name': 'tfin-FY24-10-K', 'url': 'https://storage.googleapis.com/reflexivity-documents-prod/edgar/filing/10-k/tfin-FY24-10-K.html'}, {'name': 'tfin-Q225-10-Q', 'url': 'https://storage.googleapis.com/reflexivity-documents-prod/edgar/filing/10-q/tfin-Q225-10-Q.html'}]",172935478,USD,TFIN,SMART,STK,True,LO1
transportation and logistics,innovation_in_logistics,BMG3922B1072,GENPACT LTD,44,Impulsa la transformación digital y las iniciativas de optimización de procesos dentro de las operaciones logísticas para mejorar la eficiencia y crear cadenas de suministro más ágiles.,,,45411028,USD,G,SMART,STK,True,LO1
transportation and logistics,innovation_in_logistics,US2772761019,EASTGROUP PROPERTIES INC,45,Se relaciona con el tema de Innovación Logística dentro de su ámbito operativo.,"La participación de la empresa en la Innovación Logística es evidente a través de su adaptación estratégica a las cadenas logísticas en evolución, identificadas como una tendencia beneficiosa a largo plazo. Esto se ve reforzado aún más por su construcción proactiva de oficinas especulativas diseñadas para una rápida ocupación por parte de los inquilinos, especialmente atractivas para los proveedores de logística de terceros y otras empresas que requieren opciones de mudanza rápida. Si bien la empresa reconoce y se beneficia de estas tendencias logísticas, su compromiso se refleja en su voluntad de invertir en espacios de oficinas especulativos para satisfacer las necesidades de los inquilinos relacionados con la logística.",,6747,USD,EGP,SMART,STK,True,LO1
transportation and logistics,innovation_in_logistics,US3119001044,FASTENAL CO,46,Aborda la continua evolución y mejora de las prácticas logísticas para sus operaciones.,,,269120,USD,FAST,SMART,STK,True,LO1
transportation and logistics,innovation_in_logistics,US14149Y1082,CARDINAL HEALTH INC,47,Impulsa la eficiencia en la gestión de la cadena de suministro de atención médica a través de la optimización continua de sus extensas redes de logística y distribución de productos farmacéuticos y médicos.,,,5407,USD,CAH,SMART,STK,True,LO1
transportation and logistics,innovation_in_logistics,US03073E1055,CENCORA INC,48,"Aprovecha las innovaciones logísticas para optimizar sus servicios de abastecimiento y distribución farmacéutica, garantizando una gestión eficiente de la cadena de suministro.",,,1714996,USD,COR,SMART,STK,True,LO1
transportation and logistics,innovation_in_logistics,US48138M1053,JUMIA TECHNOLOGIES AG-ADR,49,Participa en el desarrollo y despliegue de innovaciones logísticas para mejorar su eficiencia operativa y sus capacidades de entrega para su plataforma de comercio electrónico.,,,360310571,USD,JMIA,SMART,STK,False,LO1
transportation and logistics,innovation_in_logistics,CH1300646267,BUNGE GLOBAL SA,50,Se centra en la optimización de su cadena de suministro agrícola global a través de avances en logística.,"El compromiso de Bunge con la Innovación Logística es evidente a través de la implementación de eficiencias logísticas y de transporte destinadas a reducir gastos y optimizar su red de procesamiento y logística. La empresa aprovecha el análisis de datos para mejorar la transparencia de la cadena de suministro, la planificación logística, la eficiencia del procesamiento, la gestión de riesgos y el soporte para la toma de decisiones. Además, Bunge integra eficiencias logísticas y utiliza información combinada para gestionar mejor el riesgo y mejorar la transparencia de la cadena de suministro, lo que demuestra un compromiso con la innovación en sus operaciones logísticas.",,663174498,USD,BG,SMART,STK,True,LO1
