symbol,industry,theme,isin_code,name,rank,description,evidence,evidenceSources,ib_conid,currency,exchange,assetType,navigable,theme_id
CAT,materials and mining,mining_services,US1491231015,CATERPILLAR INC,1,"Proporciona un conjunto integral de maquinaria pesada, equipos y servicios integrados cruciales para optimizar y sostener las operaciones mineras en todo el mundo.","La participación de Caterpillar en Servicios de Minería es evidente a través de su sector de Industrias de Recursos, que muestra fuertes tasas de pedidos y crecimiento de la cartera, particularmente para camiones mineros grandes. Si bien las ventas de minería experimentaron ligeros contratiempos debido al momento de las entregas de camiones todoterreno, las ventas a usuarios en los sectores de construcción pesada, canteras y agregados tuvieron un mejor desempeño de lo esperado. La participación de la compañía en la minería también se caracteriza por la desinversión de una entidad minera no estadounidense, junto con un beneficio fiscal discreto registrado en el primer trimestre de 2025, junto con ventas totales de $12.389 mil millones en 2024 para Industrias de Recursos.","[{'name': 'cat-Q125-10-Q', 'url': 'https://storage.googleapis.com/reflexivity-documents-prod/edgar/filing/10-q/cat-Q125-10-Q.html'}, {'name': 'cat-FY24-10-K', 'url': 'https://storage.googleapis.com/reflexivity-documents-prod/edgar/filing/10-k/cat-FY24-10-K.html'}]",5437,USD,SMART,STK,True,MI3
SAND,materials and mining,mining_services,SE0000667891,SANDVIK AB,2,"Ofrece una cartera integral de equipos, herramientas y servicios que son fundamentales para optimizar la productividad y la seguridad en las operaciones mineras a nivel mundial.",,,8769361,SEK,SMART,STK,False,MI3
ORI,materials and mining,mining_services,AU000000ORI1,ORICA LTD,3,"Proporciona una amplia gama de productos y servicios críticos para las operaciones mineras globales, apoyando la eficiencia y la productividad en todo el sector.",,,4109681,AUD,SMART,STK,False,MI3
EPI.A,materials and mining,mining_services,SE0015658109,EPIROC AB-A,4,"Proporciona equipos, tecnología y servicios esenciales que respaldan y mejoran la productividad en la industria minera global.",,,490627944,SEK,SMART,STK,False,MI3
FLR,materials and mining,mining_services,US3434121022,FLUOR CORP,5,"Proporciona servicios integrales de ingeniería, adquisición y construcción para proyectos mineros a gran escala a nivel mundial, apoyando el desarrollo y la optimización de las operaciones mineras.","La participación de Fluor en la industria de servicios de minería es evidente a través de varios proyectos, incluido el proyecto de minería de cobre y oro Reko Diq. El segmento de Soluciones Urbanas de la empresa incluye un gran proyecto minero, con aumentos de ingresos en 2024 y 2025 atribuidos al aumento de las actividades de ejecución en proyectos mineros. Además, las ganancias antes de impuestos mejoraron significativamente en 2024 debido al aumento de las actividades de ejecución en proyectos mineros recientemente adjudicados.","[{'name': 'flr-Q225-10-Q', 'url': 'https://storage.googleapis.com/reflexivity-documents-prod/edgar/filing/10-q/flr-Q225-10-Q.html'}, {'name': 'flr-FY24-10-K', 'url': 'https://storage.googleapis.com/reflexivity-documents-prod/edgar/filing/10-k/flr-FY24-10-K.html'}]",11218575,USD,SMART,STK,True,MI3
WOR,materials and mining,mining_services,AU000000WOR2,WORLEY LTD,6,"Proporciona servicios esenciales de gestión de ingeniería, adquisición y construcción para la industria minera mundial, apoyando proyectos críticos desde el concepto inicial hasta la operación.",,,28109231,AUD,SMART,STK,False,MI3
KBR,materials and mining,mining_services,US48242W1062,KBR INC,7,"Ofrece soluciones críticas de ingeniería, adquisición y construcción que apoyan el desarrollo, la expansión y la optimización de operaciones mineras en todo el mundo.",,,41552939,USD,SMART,STK,True,MI3
CMI,materials and mining,mining_services,US2310211063,CUMMINS INC,8,"Proporciona soluciones de energía, motores y componentes relacionados esenciales para equipos pesados e infraestructura dentro de la industria de servicios mineros.","Cummins participa en el tema de Servicios para la Minería a través de su segmento de Sistemas de Potencia, que proporciona motores y generadores de energía para aplicaciones industriales, incluida la minería. El aumento de las ventas industriales se atribuye a una mayor demanda en los mercados mineros globales, incluidas las mayores ventas de posventa. La empresa diseña, fabrica y vende motores para diversas aplicaciones industriales como la minería, el petróleo, el gas, la marina y el ferrocarril.","[{'name': 'cmi-Q324-10-Q', 'url': 'https://storage.googleapis.com/reflexivity-documents-prod/edgar/filing/10-q/cmi-Q324-10-Q.html'}]",6207,USD,SMART,STK,True,MI3
TEX,materials and mining,mining_services,US8807791038,TEREX CORP,9,Contribuye al sector de Servicios de Minería proporcionando equipos y soluciones esenciales para diversas operaciones mineras.,,,12732,USD,SMART,STK,True,MI3
DOW,materials and mining,mining_services,AU000000DOW2,DOWNER EDI LTD,10,Proporciona servicios y soporte integrales esenciales para las operaciones y el desarrollo del sector minero.,,,12888945,AUD,SMART,STK,False,MI3
PRN,materials and mining,mining_services,AU0000061897,PERENTI LTD,11,Proporciona servicios integrales de perforación esenciales para diversas operaciones mineras a nivel mundial.,,,389038703,AUD,SMART,STK,False,MI3
TRMB,materials and mining,mining_services,US8962391004,TRIMBLE INC,12,"Ofrece tecnologías avanzadas de posicionamiento, topografía y gestión de flotas para mejorar la eficiencia y la productividad dentro del sector minero.",,,275294,USD,SMART,STK,True,MI3
KMT,materials and mining,mining_services,US4891701009,KENNAMETAL INC,13,Proporciona herramientas y materiales avanzados cruciales para diversas aplicaciones dentro del sector de servicios de minería.,"La participación de Kennametal en la industria de servicios mineros es evidente a través de varios aspectos de su negocio. Los polvos metalúrgicos y de desgaste de la empresa son utilizados por productores y proveedores en operaciones mineras intensivas en equipos. Además, la empresa ha reconocido el impacto de las presiones mineras en sus ventas de Earthworks, con disminuciones en las ventas en América atribuidas a una menor actividad minera y cierres de minas de clientes, mientras que una menor actividad minera en Asia Pacífico y América también afectó a la empresa. Adicionalmente, las ventas de Earthworks disminuyeron debido a una menor actividad minera derivada de los menores precios del carbón en América y Asia Pacífico.","[{'name': 'kmt-Q225-10-Q', 'url': 'https://storage.googleapis.com/reflexivity-documents-prod/edgar/filing/10-q/kmt-Q225-10-Q.html'}, {'name': 'kmt-Q125-10-Q', 'url': 'https://storage.googleapis.com/reflexivity-documents-prod/edgar/filing/10-q/kmt-Q125-10-Q.html'}, {'name': 'kmt-Q325-10-Q', 'url': 'https://storage.googleapis.com/reflexivity-documents-prod/edgar/filing/10-q/kmt-Q325-10-Q.html'}]",8879,USD,SMART,STK,True,MI3
FLS,materials and mining,mining_services,US34354P1057,FLOWSERVE CORP,14,Contribuye a la industria de servicios mineros.,"El compromiso de Flowserve con el tema de Servicios Mineros es evidente a través de su adquisición de Mogas, lo que amplía las ofertas de Flowserve en los mercados finales de minería y minerales. Se espera que los productos de válvulas diferenciados de MOGAS mejoren la base instalada de Flowserve y creen oportunidades de posventa, aprovechando la marca, el legado y la experiencia técnica de MOGAS dentro de la creciente industria minera. Si bien la minería se incluye en la categoría de ""industrias generales"" de Flowserve, que en conjunto representó aproximadamente el 26% de los pedidos de la empresa en 2024 y 2023, la empresa tiene visibilidad de pedidos de proyectos elevados durante los próximos 12 meses.","[{'name': 'fls-FY24-10-K', 'url': 'https://storage.googleapis.com/reflexivity-documents-prod/edgar/filing/10-k/fls-FY24-10-K.html'}, {'name': 'fls-Q324-10-Q', 'url': 'https://storage.googleapis.com/reflexivity-documents-prod/edgar/filing/10-q/fls-Q324-10-Q.html'}]",6477749,USD,SMART,STK,True,MI3
WAB,materials and mining,mining_services,US9297401088,WABTEC CORP,15,Contribuye a la industria de servicios mineros.,,,661633,USD,SMART,STK,True,MI3
ALSN,materials and mining,mining_services,US01973R1014,ALLISON TRANSMISSION HOLDING,16,Proporciona transmisiones esenciales para equipos y vehículos de servicio pesado que operan dentro de la industria de servicios de minería.,"La participación de Alsn en el tema de Servicios de Minería se refleja en sus ventas netas globales fuera de carretera, que se han visto afectadas por la fluctuante demanda del sector minero, particularmente fuera de América del Norte. Específicamente, la disminución de la demanda de los sectores de energía, minería y construcción contribuyó a una reducción de las ventas netas tanto en el primer como en el segundo trimestre de 2025, así como para el año finalizado el 31 de diciembre de 2024. Estas caídas indican que la empresa proporciona servicios o productos a la industria minera, aunque la minería no sea necesariamente un enfoque estratégico principal.","[{'name': 'alsn-Q125-10-Q', 'url': 'https://storage.googleapis.com/reflexivity-documents-prod/edgar/filing/10-q/alsn-Q125-10-Q.html'}, {'name': 'alsn-FY24-10-K', 'url': 'https://storage.googleapis.com/reflexivity-documents-prod/edgar/filing/10-k/alsn-FY24-10-K.html'}, {'name': 'alsn-Q225-10-Q', 'url': 'https://storage.googleapis.com/reflexivity-documents-prod/edgar/filing/10-q/alsn-Q225-10-Q.html'}]",104054141,USD,SMART,STK,False,MI3
FELE,materials and mining,mining_services,US3535141028,FRANKLIN ELECTRIC CO INC,17,"Proporciona soluciones esenciales para el manejo de agua y combustible dentro de las operaciones mineras, apoyando la infraestructura crítica y la eficiencia operativa.","La participación de Franklin Electric en la industria de Servicios Mineros se demuestra a través de su negocio de deshidratación y la adquisición de PumpEng Pty Ltd, una empresa con sede en Australia especializada en el diseño, fabricación y servicio de bombas sumergibles para el sector minero. Franklin reconoce su enfoque en recursos mineros, particularmente a través de la deshidratación, y está integrando empresas adquiridas como Minetuff y PumpEng en América del Norte. La empresa ha sido reconocida como más impulsada por recursos mineros en comparación con algunos de sus competidores.","[{'name': 'fele-Q225-10-Q', 'url': 'https://storage.googleapis.com/reflexivity-documents-prod/edgar/filing/10-q/fele-Q225-10-Q.html'}]",269208,USD,SMART,STK,True,MI3
POWL,materials and mining,mining_services,US7391281067,POWELL INDUSTRIES INC,18,Contribuye a la industria de servicios mineros.,"La participación de Powell en la industria de Servicios de Minería es evidente a través de varios proyectos, incluyendo un premio significativo por un gran proyecto minero en Canadá centrado en la producción de potasa. Este proyecto, valorado en aproximadamente $50 millones, destaca las capacidades y recursos de la empresa dedicados a servir al sector minero. Adicionalmente, la empresa reportó un aumento en la actividad minera, junto con otros mercados industriales, demostrando aún más su compromiso y asignación de recursos hacia esfuerzos relacionados con la minería.","[{'name': 'powl-Q325-10-Q', 'url': 'https://storage.googleapis.com/reflexivity-documents-prod/edgar/filing/10-q/powl-Q325-10-Q.html'}, {'name': 'powl-Q225-10-Q', 'url': 'https://storage.googleapis.com/reflexivity-documents-prod/edgar/filing/10-q/powl-Q225-10-Q.html'}]",273290,USD,SMART,STK,True,MI3
GVA,materials and mining,mining_services,US3873281071,GRANITE CONSTRUCTION INC,19,Proporciona servicios de construcción que apoyan el desarrollo y mantenimiento de infraestructura para operaciones mineras.,"La empresa participa en la industria de servicios de minería a través de la prestación de servicios como preparación del sitio, infraestructura y minería en sitios comerciales e industriales. Estos servicios se extienden a ferrocarriles, desarrollo residencial y desarrollo energético dentro del sector privado, lo que destaca la participación de la empresa en servicios de minería como parte de sus ofertas de servicios más amplias.","[{'name': 'gva-Q125-10-Q', 'url': 'https://storage.googleapis.com/reflexivity-documents-prod/edgar/filing/10-q/gva-Q125-10-Q.html'}, {'name': 'gva-Q225-10-Q', 'url': 'https://storage.googleapis.com/reflexivity-documents-prod/edgar/filing/10-q/gva-Q225-10-Q.html'}, {'name': 'gva-Q224-10-Q', 'url': 'https://storage.googleapis.com/reflexivity-documents-prod/edgar/filing/10-q/gva-Q224-10-Q.html'}, {'name': 'gva-FY24-10-K', 'url': 'https://storage.googleapis.com/reflexivity-documents-prod/edgar/filing/10-k/gva-FY24-10-K.html'}]",2743636,USD,SMART,STK,True,MI3
KWR,materials and mining,mining_services,US7473161070,QUAKER CHEMICAL CORPORATION,20,Contribuye al tema de la industria de servicios de minería.,"Quaker Houghton enfatiza su papel en la industria de servicios de minería al declarar explícitamente que su base de clientes incluye numerosas empresas mineras. La empresa identifica a estos clientes mineros como algunos de los más avanzados y especializados del mundo, lo que resalta la importancia de este sector para su negocio. Como líder mundial en fluidos de procesos industriales, Quaker Houghton atiende a clientes en diversas industrias, incluidas la del acero, aluminio, automotriz, aeroespacial, offshore, de envases y de metalurgia, y la minería se menciona constantemente entre estos sectores clave.","[{'name': 'kwr-Q125-10-Q', 'url': 'https://storage.googleapis.com/reflexivity-documents-prod/edgar/filing/10-q/kwr-Q125-10-Q.html'}, {'name': 'kwr-Q225-10-Q', 'url': 'https://storage.googleapis.com/reflexivity-documents-prod/edgar/filing/10-q/kwr-Q225-10-Q.html'}, {'name': 'kwr-FY24-10-K', 'url': 'https://storage.googleapis.com/reflexivity-documents-prod/edgar/filing/10-k/kwr-FY24-10-K.html'}, {'name': 'kwr-Q324-10-Q', 'url': 'https://storage.googleapis.com/reflexivity-documents-prod/edgar/filing/10-q/kwr-Q324-10-Q.html'}]",2009860,USD,SMART,STK,True,MI3
