type,link_type,key,name,rank,description,evidence,evidenceSources,conid,currency,symbol,exchange,assetType,navigable,theme_id
technology,network_security,US90353W1036,UBIQUITI INC,29,Desarrolla y suministra equipos de red que incluyen capacidades de seguridad integradas para salvaguardar entornos digitales.,"Las plataformas de productos empresariales de Ubiquiti incluyen pasarelas de seguridad, sistemas de control de acceso a puertas y otros productos WLAN, junto con una plataforma de software para el control de redes. La empresa desarrolla plataformas tecnológicas para el acceso a Internet distribuido de alta capacidad, la tecnología de la información unificada y la electrónica de consumo, dirigidas a los mercados empresariales y de proveedores de servicios a través de su Comunidad Ubiquiti. Si bien las pasarelas de seguridad forman parte de sus ofertas, se mencionan junto con otros productos como infraestructura WLAN, videovigilancia y soluciones de conmutación, lo que sugiere que la seguridad de la red es un componente de un conjunto más amplio de servicios.","[{'name': 'ui-FY25-10-K', 'url': 'https://storage.googleapis.com/reflexivity-documents-prod/edgar/filing/10-k/ui-FY25-10-K.html'}, {'name': 'ui-Q325-10-Q', 'url': 'https://storage.googleapis.com/reflexivity-documents-prod/edgar/filing/10-q/ui-Q325-10-Q.html'}]",379198868,USD,UI,SMART,STK,False,TE_NET
technology,network_security,US48242W1062,KBR INC,30,Incluye la Seguridad de Red como un área de su enfoque operativo.,"La participación de KBR en Seguridad de Redes se demuestra a través de sus contratos estratégicos con el Laboratorio de Investigación de la Fuerza Aérea bajo el entorno innovador de Evaluación de Amenazas de Infraestructura Cibernética (I-N-C-I-T-E). La empresa se está posicionando intencionalmente para capitalizar áreas de financiación prioritarias, incluida la ciberseguridad de la misión. Este enfoque tiene como objetivo brindar capacidades avanzadas al combatiente, impulsar el crecimiento de los ingresos y expandir los márgenes.",,41552939,USD,KBR,SMART,STK,True,TE_NET
technology,network_security,US20337X1090,COMMSCOPE HOLDING CO INC,31,Aborda aspectos de Seguridad de Red dentro de sus ofertas de productos y servicios.,"El compromiso de CommScope con la seguridad de red es evidente a través de su segmento NICS, que ofrece redes inalámbricas y aplicaciones de software y software como servicio que abordan las necesidades de seguridad. Además, RUCKUS Edge extiende RUCKUS One en la plataforma de aseguramiento de red convergente impulsada por IA de CommScope, implementando servicios de redes, seguridad, productividad y específicos de verticales industriales. La empresa también cerró un importante acuerdo con un cliente de educación superior que presenta RUCKUS Edge.",,137407031,USD,COMM,SMART,STK,False,TE_NET
technology,network_security,US0774541066,BELDEN INC,32,Ofrece soluciones de infraestructura de red diseñadas para mejorar la seguridad y la fiabilidad de la transmisión de datos.,"El enfoque de Belden en la seguridad de redes es evidente a través de la adquisición de Voleatech, una empresa alemana conocida por su firewall VT AIR Next Gen, que se informa dentro del segmento de Soluciones de Automatización. Esta adquisición amplía la cartera de productos de firewall de Belden y mejora su planificación general de seguridad en redes OT. Belden tiene como objetivo construir una base para un mundo digital que sea más simple, más inteligente y más seguro.","[{'name': 'bdc-Q324-10-Q', 'url': 'https://storage.googleapis.com/reflexivity-documents-prod/edgar/filing/10-q/bdc-Q324-10-Q.html'}, {'name': 'bdc-FY24-10-K', 'url': 'https://storage.googleapis.com/reflexivity-documents-prod/edgar/filing/10-k/bdc-FY24-10-K.html'}]",29863855,USD,BDC,SMART,STK,True,TE_NET
technology,network_security,US92552V1008,VIASAT INC,33,Refleja la importancia de la Seguridad de Red dentro de su ámbito operativo.,"El compromiso de Viasat con la seguridad de las redes es evidente a través de su negocio de InfoSec y ciberseguridad, la franquicia más grande dentro de su segmento DAT, que ha mostrado crecimiento en ingresos. La empresa se enfoca en la ciberseguridad para constelaciones basadas en el espacio, reconociendo la necesidad crítica de proteger estas grandes redes. Viasat también está buscando oportunidades en cifrado de próxima generación y está posicionada para contribuir al proyecto gubernamental Golden Dome, junto con iniciativas para la estandarización de enlaces ópticos intersatelitales, lo que demuestra su compromiso con el avance de las tecnologías de seguridad de redes.",,6746554,USD,VSAT,SMART,STK,True,TE_NET
