type,link_type,key,name,rank,description,evidence,evidenceSources,conid,currency,symbol,exchange,assetType,navigable,theme_id
other,optoelectronics,US55024U1097,LUMENTUM HOLDINGS INC,1,Desarrolla y fabrica productos y soluciones ópticos y fotónicos que son integrales para los avances de la industria optoelectrónica.,"El compromiso de Lumentum con el tema de la industria de la Optoelectrónica es evidente a través de su posición como proveedor líder de productos ópticos y fotónicos, incluyendo chips, componentes, módulos y subsistemas. El enfoque de la empresa se extiende a la habilitación de la infraestructura de IA de próxima generación con tecnologías como EML de 200 gigabits, transceptores de 1.6T, conmutadores de circuitos ópticos y láseres de ultra alta potencia para óptica empaquetada en cojunto, junto con su producción de EML, láseres CW, componentes coherentes y láseres de línea estrecha. Lumentum también está aumentando la producción de láseres CW para aplicaciones de transceptores de fotónica de silicio y enviando EML con velocidad de línea de 200 gigabits a múltiples clientes, demostrando EML de unidad diferencial que mejoran la integridad de la señal y la eficiencia energética.","[{'name': 'lite-Q325-10-Q', 'url': 'https://storage.googleapis.com/reflexivity-documents-prod/edgar/filing/10-q/lite-Q325-10-Q.html'}, {'name': 'lite-FY25-10-K', 'url': 'https://storage.googleapis.com/reflexivity-documents-prod/edgar/filing/10-k/lite-FY25-10-K.html'}, {'name': 'lite-Q225-10-Q', 'url': 'https://storage.googleapis.com/reflexivity-documents-prod/edgar/filing/10-q/lite-Q225-10-Q.html'}, {'name': 'lite-Q125-10-Q', 'url': 'https://storage.googleapis.com/reflexivity-documents-prod/edgar/filing/10-q/lite-Q125-10-Q.html'}]",201113895,USD,LITE,SMART,STK,True,OPT
other,optoelectronics,US19247G1076,COHERENT CORP,2,"Desarrolla y fabrica una amplia cartera de productos y soluciones optoelectrónicas avanzadas, cruciales para diversas aplicaciones de alta tecnología.","El compromiso de Coherent Corp con la optoelectrónica es evidente a través de su desarrollo, fabricación y comercialización de componentes y dispositivos optoelectrónicos, posicionándolos como un líder mundial en este espacio. Su amplia cartera de tecnologías fotónicas, incluidos los láseres EML y VCSEL, y la fotónica de silicio, se muestra por sus capacidades de fosfuro de indio durante más de 20 años. Esto se demuestra además por la introducción de nuevos productos y tecnologías de redes ópticas, como los diseños de transceptores 1.6T basados en diferentes tecnologías láser, lo que resalta su compromiso de proporcionar a los clientes la mejor tecnología para sus aplicaciones específicas, y sus ingresos del tercer trimestre aumentaron un 54% interanual debido a la fuerte demanda de centros de datos de IA.","[{'name': 'cohr-Q325-10-Q', 'url': 'https://storage.googleapis.com/reflexivity-documents-prod/edgar/filing/10-q/cohr-Q325-10-Q.html'}]",584127832,USD,COHR,SMART,STK,True,OPT
other,optoelectronics,US11135F1012,BROADCOM INC,3,Proporciona componentes y soluciones ópticas críticas que permiten la transmisión de datos de alta velocidad y la conectividad en centros de datos y entornos de red.,,,313130367,USD,AVGO,SMART,STK,True,OPT
other,optoelectronics,US0382221051,APPLIED MATERIALS INC,4,Facilita los procesos de desarrollo y fabricación dentro del sector Optoelectrónico.,"La participación de Applied Materials en la optoelectrónica es evidente a través de su enfoque en las inflexiones de la arquitectura de dispositivos futuros, particularmente la fotónica de silicio, que la empresa identifica como un área clave en la que tiene una posición de liderazgo. Esto está respaldado además por la participación de la empresa en la fotónica de silicio, siendo la fotónica de silicio una de las principales innovaciones arquitectónicas en dispositivos de lógica, computación, memoria, empaquetado y energía. Adicionalmente, una parte del negocio de 200 mm de la empresa está relacionada con la electrónica de potencia, un área conectada a la optoelectrónica.",,266093,USD,AMAT,SMART,STK,True,OPT
other,optoelectronics,JP3435000009,SONY GROUP CORP,5,"Desarrolla y fabrica sensores de imagen avanzados para diversas aplicaciones, junto con tecnologías de discos ópticos y componentes de visualización, contribuyendo significativamente a la industria optoelectrónica.",,,13905705,JPY,6758,SMART,STK,False,OPT
other,optoelectronics,DE000LED4000,OSRAM LICHT AG,6,Se dedica al desarrollo y producción de componentes y sistemas para optoelectrónica.,,,130526820,EUR,OSR,VALUE,STK,False,OPT
other,optoelectronics,US2193501051,CORNING INC,7,"Desarrolla y fabrica fibra óptica avanzada y vidrio especial, sirviendo como un habilitador crítico para la transmisión de luz, tecnologías de visualización y diversas otras aplicaciones optoelectrónicas.",,,7655,USD,GLW,SMART,STK,True,OPT
other,optoelectronics,US5738741041,MARVELL TECHNOLOGY INC,8,"Desempeña un papel fundamental dentro de la industria optoelectrónica, influyendo en sus avances tecnológicos y aplicaciones de mercado.","El compromiso de Marvell con la optoelectrónica es evidente en su cartera de interconexiones electroópticas, que es un motor clave para los ingresos de los centros de datos, particularmente para aplicaciones de IA y nube. La empresa está innovando activamente en este espacio, como lo demuestra el desarrollo de motores de luz de fotónica de silicio que escalan hasta 6,4 T y módulos ópticos enchufables de accionamiento lineal de 1,6 T. Marvell también se enfoca en la transición de interconexiones de cobre a fibra óptica para escalar clústeres de IA, como lo destaca su plataforma de óptica copackaged que integra motores de luz de fotónica de silicio en aceleradores de IA personalizados y DSP PAM de 1,6 T por carril de 200 gig de próxima generación.","[{'name': 'mrvl-Q325-10-Q', 'url': 'https://storage.googleapis.com/reflexivity-documents-prod/edgar/filing/10-q/mrvl-Q325-10-Q.html'}]",483492393,USD,MRVL,SMART,STK,False,OPT
other,optoelectronics,US91347P1057,UNIVERSAL DISPLAY CORP,9,"Desarrolla y comercializa tecnologías y materiales patentados de diodos orgánicos emisores de luz (OLED), que son componentes críticos para pantallas y iluminación avanzadas en la industria optoelectrónica.","El compromiso de Universal Display Corporation con el tema de la Optoelectrónica es evidente en su papel de liderazgo en la investigación, el desarrollo y la comercialización de tecnologías y materiales de diodos orgánicos emisores de luz (OLED). El enfoque de la empresa en los OLED, que son dispositivos de estado sólido delgados, livianos y eficientes energéticamente que emiten luz, la posiciona como un actor clave en las aplicaciones de pantallas e iluminación de estado sólido. Además, la idoneidad de los OLED para la fabricación tanto en sustratos flexibles como rígidos subraya la importante asignación de recursos de la empresa a la optoelectrónica.","[{'name': 'oled-Q125-10-Q', 'url': 'https://storage.googleapis.com/reflexivity-documents-prod/edgar/filing/10-q/oled-Q125-10-Q.html'}, {'name': 'oled-FY24-10-K', 'url': 'https://storage.googleapis.com/reflexivity-documents-prod/edgar/filing/10-k/oled-FY24-10-K.html'}]",4816201,USD,OLED,SMART,STK,True,OPT
other,optoelectronics,US17275R1023,CISCO SYSTEMS INC,10,"Integra componentes optoelectrónicos avanzados en sus soluciones de infraestructura de redes, facilitando la transmisión de datos de alta velocidad e impulsando avances en las tecnologías de comunicación por fibra óptica.","La participación de Cisco en la optoelectrónica se demuestra a través del despliegue de sus Cisco 8000, ópticas Silicon One y sistemas ópticos por parte de los principales webscalers en sus redes de entrenamiento de back-end. La oportunidad de IA de Cisco incluye infraestructura de entrenamiento de IA para clientes webscale. Además, Cisco ofrece ópticas integradas, ópticas independientes, sistemas ópticos y silicio a estos webscalers, destacando su papel en el suministro de componentes esenciales para infraestructura de red avanzada.",,268084,USD,CSCO,SMART,STK,True,OPT
other,optoelectronics,US44980X1090,IPG PHOTONICS CORP,11,"Desarrolla y fabrica láseres de fibra de alta potencia y amplificadores, que son componentes optoelectrónicos fundamentales ampliamente utilizados en el procesamiento de materiales, aplicaciones médicas y avanzadas.","La participación de IPG Photonics en el tema de la Optoelectrónica es evidente en su fabricación de componentes clave, incluidos diodos semiconductores y preformas de fibra óptica. La empresa desarrolla, fabrica y vende láseres de fibra y láseres de diodo de alto rendimiento utilizados en diversas aplicaciones, principalmente en el procesamiento de materiales. Además, IPG Photonics está integrada verticalmente, diseñando y fabricando la mayoría de los componentes clave utilizados en sus productos terminados, desde diodos semiconductores hasta láseres de fibra terminados y productos complementarios como cables de entrega óptica y acopladores de fibra.","[{'name': 'ipgp-Q125-10-Q', 'url': 'https://storage.googleapis.com/reflexivity-documents-prod/edgar/filing/10-q/ipgp-Q125-10-Q.html'}, {'name': 'ipgp-Q324-10-Q', 'url': 'https://storage.googleapis.com/reflexivity-documents-prod/edgar/filing/10-q/ipgp-Q324-10-Q.html'}, {'name': 'ipgp-FY24-10-K', 'url': 'https://storage.googleapis.com/reflexivity-documents-prod/edgar/filing/10-k/ipgp-FY24-10-K.html'}]",41891895,USD,IPGP,SMART,STK,True,OPT
other,optoelectronics,US1717793095,CIENA CORP,12,Se enfoca en soluciones de redes ópticas que son integrales para el avance y despliegue de tecnologías optoelectrónicas para la comunicación de datos de alta velocidad.,"El compromiso de Ciena con la optoelectrónica es evidente en su enfoque estratégico en soluciones de conectividad de alta velocidad, que son cruciales para escalar la IA a medida que los datos pasan de electrones a fotones. La inversión de la empresa en sistemas ópticos coherentes e interconexiones subraya aún más su compromiso con esta área. Ciena enfatiza que su tecnología es central para la escalabilidad de la IA, destacando la importancia de las soluciones ópticas en las interconexiones de centros de datos y la infraestructura de IA.",,41045553,USD,CIEN,SMART,STK,True,OPT
other,optoelectronics,US4824801009,KLA CORP,13,Proporciona soluciones avanzadas de control de procesos e inspección que son críticas para la fabricación y el aseguramiento de la calidad de los dispositivos optoelectrónicos.,"KLA proporciona soluciones tecnológicas avanzadas para la fabricación de diodos emisores de luz (LED), que son componentes de la industria optoelectrónica. Si bien KLA ofrece estas soluciones, también atiende a varios otros sectores, incluidos los PCB, los dispositivos semiconductores especializados, el empaquetado avanzado, los dispositivos de potencia, los semiconductores compuestos y el almacenamiento de datos, así como la investigación general de materiales. Las soluciones de la empresa abordan las necesidades de fabricación de la industria de los LED, lo que sugiere un enfoque secundario pero presente en la optoelectrónica.","[{'name': 'klac-FY25-10-K', 'url': 'https://storage.googleapis.com/reflexivity-documents-prod/edgar/filing/10-k/klac-FY25-10-K.html'}]",270957,USD,KLAC,SMART,STK,True,OPT
other,optoelectronics,US49338L1035,KEYSIGHT TECHNOLOGIES IN,14,"Proporciona soluciones avanzadas de prueba y medición esenciales para la investigación, el desarrollo y la fabricación de componentes y sistemas optoelectrónicos.","El compromiso de Keysight con la optoelectrónica es evidente en sus inversiones estratégicas y soluciones destinadas a mejorar los flujos de trabajo de I+D y abordar los requisitos de integridad de la señal y rendimiento. El enfoque de la empresa en la fotónica de silicio se demuestra a través de la colaboración con clientes y la entrega de soluciones avanzadas de capa física. Estas iniciativas están impulsadas por las crecientes demandas de los centros de datos de IA, donde las soluciones de Keysight abordan las limitaciones de rendimiento relacionadas con la latencia, el ancho de banda y la energía. Además, las capacidades de Keysight en pilas de protocolos eléctricos, ópticos y de línea cableada la posicionan para permitir la innovación continua en computación de alto rendimiento, memoria y redes.",,170167160,USD,KEYS,SMART,STK,True,OPT
other,optoelectronics,JP3982800009,ROHM CO LTD,15,"Es un importante desarrollador y proveedor de componentes optoelectrónicos, contribuyendo a los avances dentro de la industria de la optoelectrónica.",,,14019584,JPY,6963,SMART,STK,False,OPT
other,optoelectronics,US9255501051,VIAVI SOLUTIONS INC,16,"Desarrolla soluciones avanzadas de prueba y medición críticas para el diseño, despliegue y mantenimiento de componentes y sistemas optoelectrónicos en diversas industrias.","La participación de Viavi en el tema de la Optoelectrónica es evidente a través de sus productos de comunicación por fibra óptica, que dependen en gran medida de la optoelectrónica y están experimentando una fuerte demanda por parte de los centros de datos y los proveedores de servicios. La empresa destaca una demanda significativa dentro del ecosistema de los centros de datos, que involucra a los principales proveedores de semiconductores, desarrolladores de módulos ópticos y fabricantes de equipos, particularmente en regiones como China, Tailandia y Vietnam, donde se fabrican módulos ópticos, switches y productos. Además, Viavi ha ampliado su liderazgo al lanzar la solución de prueba de segunda generación de 1,6 terabits y es líder en tecnologías de procesamiento óptico, incluidas aplicaciones en sectores como la lucha contra la falsificación, la detección 3D, la aeroespacial, la automotriz y la industrial.","[{'name': 'viav-FY25-10-K', 'url': 'https://storage.googleapis.com/reflexivity-documents-prod/edgar/filing/10-k/viav-FY25-10-K.html'}]",201113049,USD,VIAV,SMART,STK,True,OPT
other,optoelectronics,US55306N1046,MKS INC,17,"Proporciona componentes y soluciones críticas esenciales para diversas aplicaciones optoelectrónicas, apoyando procesos industriales y de fabricación avanzada.","El compromiso de MKS Instruments con la industria de la optoelectrónica es evidente a través de su División de Soluciones Fotónicas (PSD), que ofrece una gama de soluciones que incluyen instrumentos fotónicos, componentes optomecánicos y elementos ópticos. Las ofertas de PSD se extienden a láseres, medición y perfilado de haces, control de movimiento de precisión, sistemas de aislamiento de vibraciones y sistemas basados en láser para el procesamiento de PCB y la fabricación de PCB de interconexión de alta densidad. Además, los productos VSD de MKS incorporan detección de temperatura y posición por fibra óptica, lo que demuestra aún más la participación de la empresa en tecnologías optoelectrónicas.","[{'name': 'mksi-Q125-10-Q', 'url': 'https://storage.googleapis.com/reflexivity-documents-prod/edgar/filing/10-q/mksi-Q125-10-Q.html'}, {'name': 'mksi-Q324-10-Q', 'url': 'https://storage.googleapis.com/reflexivity-documents-prod/edgar/filing/10-q/mksi-Q324-10-Q.html'}, {'name': 'mksi-Q225-10-Q', 'url': 'https://storage.googleapis.com/reflexivity-documents-prod/edgar/filing/10-q/mksi-Q225-10-Q.html'}]",4814955,USD,MKSI,SMART,STK,True,OPT
other,optoelectronics,US55405Y1001,MACOM TECHNOLOGY SOLUTIONS H,18,"Desarrolla y fabrica una gama de componentes y soluciones optoelectrónicas cruciales para la comunicación de datos de alta velocidad, la detección y otras aplicaciones avanzadas.","La participación de la compañía en el tema de la Optoelectrónica es evidente a través de su diseño, desarrollo y fabricación de productos semiconductores ópticos y fotónicos. Una parte significativa de los ingresos de la compañía se deriva de la venta de estos productos, incluidos subsistemas y componentes ópticos. La compañía anticipa un aumento de los ingresos en los mercados de Centros de Datos y Telecomunicaciones debido a la creciente adopción de sus componentes ópticos y fotónicos de alta velocidad, particularmente con los despliegues de 5G y las redes de comunicación satelital. Además, la introducción de la línea de productos Opto-Amp, que presenta amplificadores totalmente ópticos, demuestra el compromiso continuo de la compañía con las tecnologías optoelectrónicas.","[{'name': 'mtsi-Q324-10-Q', 'url': 'https://storage.googleapis.com/reflexivity-documents-prod/edgar/filing/10-q/mtsi-Q324-10-Q.html'}, {'name': 'mtsi-Q125-10-Q', 'url': 'https://storage.googleapis.com/reflexivity-documents-prod/edgar/filing/10-q/mtsi-Q125-10-Q.html'}, {'name': 'mtsi-Q225-10-Q', 'url': 'https://storage.googleapis.com/reflexivity-documents-prod/edgar/filing/10-q/mtsi-Q225-10-Q.html'}, {'name': 'mtsi-FY24-10-K', 'url': 'https://storage.googleapis.com/reflexivity-documents-prod/edgar/filing/10-k/mtsi-FY24-10-K.html'}]",104158272,USD,MTSI,SMART,STK,True,OPT
other,optoelectronics,JP3359600008,SHARP CORP,19,Participa en el tema de la Optoelectrónica a través de sus actividades en tecnologías electrónicas basadas en la luz.,,,13905702,JPY,6753,SMART,STK,False,OPT
other,optoelectronics,JP3866800000,PANASONIC HOLDINGS CORP,20,"Contribuye al desarrollo y fabricación de diversos componentes y sistemas optoelectrónicos, incluidos los utilizados en aplicaciones avanzadas de imagen, detección y visualización.",,,13905699,JPY,6752,SMART,STK,False,OPT
other,optoelectronics,CA67000B1040,NOVANTA INC,21,"Desarrolla y proporciona componentes y subsistemas optoelectrónicos avanzados, críticos para aplicaciones industriales, médicas y científicas.","La participación de Novanta en la temática de Optoelectrónica es evidente a través de sus segmentos de Tecnologías Habilitadoras de Automatización y Medicina y Fabricación de Precisión, que participan en el diseño, fabricación y comercialización de diversas soluciones basadas en láser y fotónica. Estas incluyen componentes de entrega de haz láser, láseres de CO2, láseres de estado sólido, láseres ultrarrápidos, escaneo láser y productos de motores de luz óptica. Además, la empresa diseña y fabrica codificadores ópticos e inductivos, demostrando aún más sus actividades dentro del dominio de la optoelectrónica.","[{'name': 'novt-Q125-10-Q', 'url': 'https://storage.googleapis.com/reflexivity-documents-prod/edgar/filing/10-q/novt-Q125-10-Q.html'}, {'name': 'novt-Q324-10-Q', 'url': 'https://storage.googleapis.com/reflexivity-documents-prod/edgar/filing/10-q/novt-Q324-10-Q.html'}, {'name': 'novt-Q225-10-Q', 'url': 'https://storage.googleapis.com/reflexivity-documents-prod/edgar/filing/10-q/novt-Q225-10-Q.html'}]",233146666,USD,NOVT,SMART,STK,True,OPT
other,optoelectronics,US0326541051,ANALOG DEVICES INC,22,"Desarrolla circuitos integrados y soluciones que permiten la funcionalidad y el rendimiento de varios sistemas optoelectrónicos, incluidas aplicaciones de detección óptica, imagen y comunicación.",,,4157,USD,ADI,SMART,STK,True,OPT
other,optoelectronics,KYG3323L1005,FABRINET,23,"Proporciona servicios avanzados de encapsulación óptica y fabricación de precisión para una amplia gama de componentes y módulos optoelectrónicos, apoyando el desarrollo y la implementación de tecnologías de comunicación óptica y centros de datos.","La participación de Fabrinet en la optoelectrónica es evidente a través de su fabricación de componentes, módulos y subsistemas de comunicación óptica, con una parte significativa de sus ingresos, el 76,9% durante los nueve meses finalizados el 28 de marzo de 2025, derivada de productos de comunicación óptica. La experiencia de la empresa se extiende al empaque óptico avanzado y a los servicios de fabricación óptica de precisión para OEM, incluyendo el diseño y la fabricación de cristales, lentes, prismas, espejos y componentes láser específicos para cada aplicación. Además, Fabrinet ha estado involucrada en fotónica de silicio durante más de una década, con un crecimiento impulsado principalmente por transceptores coherentes ZR para aplicaciones DCI.","[{'name': 'fn-Q325-10-Q', 'url': 'https://storage.googleapis.com/reflexivity-documents-prod/edgar/filing/10-q/fn-Q325-10-Q.html'}, {'name': 'fn-Q125-10-Q', 'url': 'https://storage.googleapis.com/reflexivity-documents-prod/edgar/filing/10-q/fn-Q125-10-Q.html'}]",76615083,USD,FN,SMART,STK,True,OPT
other,optoelectronics,US03823U1025,APPLIED OPTOELECTRONICS INC,24,Desarrolla y fabrica componentes y sistemas optoelectrónicos para diversas aplicaciones en distintas industrias.,"La participación de Applied Optoelectronics en el tema de la Optoelectrónica está profundamente arraigada en su negocio principal, ya que la empresa diseña, fabrica y vende una gama de componentes optoelectrónicos, incluidos láseres, transceptores y amplificadores. AOI diseña, fabrica e integra sus propios láseres analógicos y digitales utilizando procesos propietarios como la Epitaxia de Haces Moleculares y la Deposición Química de Vapor Metal Orgánico para la fabricación de láseres, fabricando la mayoría de los chips láser y componentes ópticos utilizados en sus productos. Como proveedor verticalmente integrado de productos de redes de fibra óptica, la estrategia de la empresa incluye la mejora de los márgenes brutos mediante la utilización de sus propios chips láser y subcomponentes ópticos, lo que solidifica aún más su enfoque en la optoelectrónica.","[{'name': 'aaoi-FY24-10-K', 'url': 'https://storage.googleapis.com/reflexivity-documents-prod/edgar/filing/10-k/aaoi-FY24-10-K.html'}, {'name': 'aaoi-Q125-10-Q', 'url': 'https://storage.googleapis.com/reflexivity-documents-prod/edgar/filing/10-q/aaoi-Q125-10-Q.html'}]",135423662,USD,AAOI,SMART,STK,False,OPT
other,optoelectronics,US8825081040,TEXAS INSTRUMENTS INC,25,Proporciona componentes semiconductores que son integrales al diseño y la funcionalidad de una amplia gama de aplicaciones optoelectrónicas.,,,13096,USD,TXN,SMART,STK,True,OPT
other,optoelectronics,US9224171002,VEECO INSTRUMENTS INC,26,Proporciona equipos de fabricación avanzados esenciales para la producción de dispositivos optoelectrónicos.,"El compromiso de Veeco con la optoelectrónica es evidente a través de su enfoque en aplicaciones fotónicas dentro del mercado de semiconductores compuestos, utilizando tecnologías como Wet Processing, MOCVD, MBE e Ion Beam. La empresa está persiguiendo oportunidades fotónicas en áreas como la solar, impulsada por la demanda de satélites de órbita baja y MicroLEDs para aplicaciones como televisores de lujo, AR/VR y automoción. Si bien Veeco atiende a clientes en los mercados de semiconductores compuestos, almacenamiento de datos y científico y otros, su amplia cartera de tecnologías aborda el mercado de semiconductores compuestos para aplicaciones de electrónica de potencia, fotónica y RF 5G.","[{'name': 'veco-Q324-10-Q', 'url': 'https://storage.googleapis.com/reflexivity-documents-prod/edgar/filing/10-q/veco-Q324-10-Q.html'}, {'name': 'veco-Q125-10-Q', 'url': 'https://storage.googleapis.com/reflexivity-documents-prod/edgar/filing/10-q/veco-Q125-10-Q.html'}, {'name': 'veco-Q225-10-Q', 'url': 'https://storage.googleapis.com/reflexivity-documents-prod/edgar/filing/10-q/veco-Q225-10-Q.html'}, {'name': 'veco-FY24-10-K', 'url': 'https://storage.googleapis.com/reflexivity-documents-prod/edgar/filing/10-k/veco-FY24-10-K.html'}]",275708,USD,VECO,SMART,STK,True,OPT
other,optoelectronics,US8168501018,SEMTECH CORP,27,"Desarrolla y proporciona soluciones de semiconductores que son integrales para la comunicación óptica y la transmisión de datos, apoyando diversas aplicaciones optoelectrónicas.","El compromiso de Semtech con el tema de Optoelectrónica es evidente a través de su desarrollo y comercialización de productos de comunicación de datos ópticos, incluidos FiberEdge, TIAs (Amplificadores de Transimpedancia) y controladores láser LPO (Óptica Lineal Enchufable). Los TIAs de la compañía se consideran un estándar de oro y están integrados en casi todos los fabricantes de módulos, mientras que su demostración de LPO generó un interés significativo por parte de los clientes. Semtech anticipa una fuerte demanda continua de FiberEdge, impulsada por los clientes de módulos ópticos y respaldada por las crecientes previsiones de gasto de capital en centros de datos, y ha asegurado varias victorias de diseño de LPO con sus TIAs en transceptores de 400 gigabits y 800 gigabits.","[{'name': 'smtc-Q325-10-Q', 'url': 'https://storage.googleapis.com/reflexivity-documents-prod/edgar/filing/10-q/smtc-Q325-10-Q.html'}, {'name': 'smtc-Q126-10-Q', 'url': 'https://storage.googleapis.com/reflexivity-documents-prod/edgar/filing/10-q/smtc-Q126-10-Q.html'}]",3655896,USD,SMTC,SMART,STK,True,OPT
