industry,theme,isin_code,name,rank,description,evidence,evidenceSources,conid,currency,symbol,exchange,assetType,navigable,theme_id
real estate,real_estate_development,US88146M1018,TERRENO REALTY CORP,51,Se enfoca en el desarrollo inmobiliario.,"La empresa demuestra su participación en el desarrollo inmobiliario a través de la adquisición, propiedad y operación de bienes raíces industriales, incluida la búsqueda de oportunidades de desarrollo, redesarrollo, renovación y expansión. Como evidencia de esto, la empresa posee propiedades en desarrollo o redesarrollo, incluida tierra con permisos para desarrollo futuro. Los gastos de capital para desarrollo, redesarrollo, renovación y expansión fueron de $37.536 millones para los tres meses finalizados el 30 de septiembre de 2024, y $110.615 millones para los nueve meses finalizados el 30 de septiembre de 2024.","[{'name': 'trno-Q324-10-Q', 'url': 'https://storage.googleapis.com/reflexivity-documents-prod/edgar/filing/10-q/trno-Q324-10-Q.html'}, {'name': 'trno-FY24-10-K', 'url': 'https://storage.googleapis.com/reflexivity-documents-prod/edgar/filing/10-k/trno-FY24-10-K.html'}]",72086382,USD,TRNO,SMART,STK,True,REA
real estate,real_estate_development,US2527843013,DIAMONDROCK HOSPITALITY CO,52,"Participa en la adquisición, desarrollo y reurbanización de propiedades hoteleras, contribuyendo al crecimiento y modernización del sector inmobiliario hotelero.","La participación de DRH en el desarrollo inmobiliario es evidente a través de sus renovaciones y reposicionamiento de propiedades existentes, como la conversión de Orchards Inn a Cliffs at L'Auberge en Sedona. La compañía también está considerando oportunidades potenciales de desarrollo residencial frente al mar en Destin y Fort Lauderdale, junto con posibles expansiones en Chico Hot Springs en Montana. Estas actividades, incluida la reurbanización de propiedades y la exploración de futuras oportunidades de creación de valor, resaltan la participación de la compañía en el desarrollo inmobiliario, aunque no es un enfoque estratégico central.",,34532778,USD,DRH,SMART,STK,True,REA
real estate,real_estate_development,US49803T3005,KITE REALTY GROUP TRUST,53,Se dedica al desarrollo de propiedades inmobiliarias como actividad comercial principal.,"La participación de Kite Realty Group Trust en la industria del desarrollo inmobiliario es evidente a través de su participación en el desarrollo y la remodelación de centros comerciales al aire libre de alta calidad y activos de uso mixto. Esto se demuestra por su participación activa en proyectos como 'Carillon MOB', 'The Corner – IN' y 'One Loudoun Expansion', así como la propiedad de proyectos en desarrollo en construcción y propiedades con oportunidades de remodelación futuras. Las actividades comerciales principales de la empresa incluyen la propiedad, operación, adquisición, desarrollo y remodelación, lo que resalta la importancia de este tema para la organización.","[{'name': 'krg-Q324-10-Q', 'url': 'https://storage.googleapis.com/reflexivity-documents-prod/edgar/filing/10-q/krg-Q324-10-Q.html'}]",161703135,USD,KRG,SMART,STK,True,REA
real estate,real_estate_development,US1011211018,BXP INC,54,Se dedica al desarrollo de bienes inmuebles.,"La participación de BXP en el Desarrollo Inmobiliario es evidente a través de sus extensas actividades de desarrollo y redesarrollo. La empresa está procediendo con la construcción vertical completa de 343 Madison Avenue, un lugar de trabajo de primer nivel de 46 pisos y 930,000 pies cuadrados, y ha optado por adquirir la participación de su socio en el proyecto. La cartera de desarrollo de BXP consta de múltiples propiedades, lo que refleja una inversión significativa, y la empresa genera ingresos de negocios de desarrollo y construcción. Como fideicomiso de inversión inmobiliaria, BXP desarrolla lugares de trabajo de primer nivel, lo que demuestra un compromiso con el desarrollo inmobiliario.","[{'name': 'bxp-Q125-10-Q', 'url': 'https://storage.googleapis.com/reflexivity-documents-prod/edgar/filing/10-q/bxp-Q125-10-Q.html'}, {'name': 'bxp-FY24-10-K', 'url': 'https://storage.googleapis.com/reflexivity-documents-prod/edgar/filing/10-k/bxp-FY24-10-K.html'}]",5021340,USD,BXP,SMART,STK,True,REA
real estate,real_estate_development,US0042391096,ACADIA REALTY TRUST,55,"Se centra en el desarrollo de propiedades inmobiliarias, contribuyendo a la expansión y mejora de espacios comerciales y de uso mixto.","El enfoque de Acadia Realty Trust incluye el desarrollo de propiedades minoristas, una actividad estratégica central para la empresa. Esto se demuestra a través de su participación en actividades de desarrollo dentro de su Cartera Principal (Core Portfolio), incluida la adquisición de un terreno de desarrollo principal como parte del proyecto de desarrollo de Henderson Avenue en Dallas, Texas. Al 30 de septiembre de 2024, tenían un total de 10 proyectos consolidados en desarrollo o reurbanización, con el objetivo de maximizar el valor de las propiedades principales a través de oportunidades de desarrollo/reurbanización acumulativas y actividades de re-inquilinato.","[{'name': 'akr-Q324-10-Q', 'url': 'https://storage.googleapis.com/reflexivity-documents-prod/edgar/filing/10-q/akr-Q324-10-Q.html'}]",6607467,USD,AKR,SMART,STK,True,REA
real estate,real_estate_development,US43283X1054,HILTON GRAND VACATIONS INC,56,Participa en el desarrollo de resorts y propiedades de propiedad vacacional para respaldar su modelo de negocio de tiempo compartido.,"La participación de HGV en la industria del desarrollo inmobiliario es fundamental para su negocio como empresa global de tiempo compartido dedicada al desarrollo, comercialización, venta, gestión y operación de resorts de tiempo compartido. Desarrollan Intervalos de Propiedad Vacacional (VOIs) tanto directamente como a través de acuerdos con terceros, gestionando más de 200 propiedades en varios países, con una concentración significativa en regiones clave como Florida, Europa y Hawái. Esto se ve aún más respaldado por su obtención de VOIs a través de propiedades desarrolladas y acuerdos de servicios, con un valor de ventas de contratos estimado relacionado con el inventario disponible que alcanza los 13.300 millones de dólares.","[{'name': 'hgv-Q125-10-Q', 'url': 'https://storage.googleapis.com/reflexivity-documents-prod/edgar/filing/10-q/hgv-Q125-10-Q.html'}, {'name': 'hgv-Q324-10-Q', 'url': 'https://storage.googleapis.com/reflexivity-documents-prod/edgar/filing/10-q/hgv-Q324-10-Q.html'}, {'name': 'hgv-Q225-10-Q', 'url': 'https://storage.googleapis.com/reflexivity-documents-prod/edgar/filing/10-q/hgv-Q225-10-Q.html'}]",257939796,USD,HGV,SMART,STK,True,REA
real estate,real_estate_development,US46124J2015,INVENTRUST PROPERTIES CORP,57,"Participa en el desarrollo de propiedades inmobiliarias, contribuyendo al crecimiento de su cartera y a la diversificación de activos.","InvenTrust Properties participa en el desarrollo inmobiliario a través de sus actividades comerciales principales, que incluyen la remodelación, adquisición y gestión de centros de barrio y comunitarios anclados en supermercados. La empresa realiza inversiones de capital en proyectos de desarrollo y remodelación que mejoran el valor, lo que refleja un enfoque estratégico en estas actividades. Además, InvenTrust asigna capital para financiar el desarrollo, la remodelación, el mantenimiento y los gastos de capital, lo que destaca la importancia del desarrollo inmobiliario para la empresa.","[{'name': 'ivt-Q125-10-Q', 'url': 'https://storage.googleapis.com/reflexivity-documents-prod/edgar/filing/10-q/ivt-Q125-10-Q.html'}]",506993765,USD,IVT,SMART,STK,False,REA
real estate,real_estate_development,US32054K1034,FIRST INDUSTRIAL REALTY TR,58,"Se dedica al desarrollo y adquisición de propiedades industriales, contribuyendo a la expansión y modernización de la infraestructura logística y de distribución.","La empresa demuestra un fuerte enfoque en el desarrollo inmobiliario, como lo demuestra su objetivo estratégico de crecer a través del desarrollo de propiedades industriales de primera clase. Esto se ve reforzado por su participación activa en varios proyectos de desarrollo, incluido el inicio de la construcción de una instalación de 176,000 pies cuadrados en First Park 121 en el noroeste de Dallas y el comienzo del desarrollo especulativo de siete edificios industriales. La participación de la empresa se extiende a la adquisición de terrenos, ejemplificada por la compra de un sitio de 61.4 acres en Filadelfia para desarrollo futuro, e importantes inversiones de capital en proyectos en curso, con aproximadamente $ 280.4 millones asignados a ocho proyectos de desarrollo.","[{'name': 'fr-Q125-10-Q', 'url': 'https://storage.googleapis.com/reflexivity-documents-prod/edgar/filing/10-q/fr-Q125-10-Q.html'}, {'name': 'fr-Q225-10-Q', 'url': 'https://storage.googleapis.com/reflexivity-documents-prod/edgar/filing/10-q/fr-Q225-10-Q.html'}, {'name': 'fr-FY24-10-K', 'url': 'https://storage.googleapis.com/reflexivity-documents-prod/edgar/filing/10-k/fr-FY24-10-K.html'}]",7330,USD,FR,SMART,STK,True,REA
real estate,real_estate_development,US11120U1051,BRIXMOR PROPERTY GROUP INC,59,Lleva a cabo proyectos de desarrollo y reurbanización dentro de su cartera de propiedades minoristas para mejorar el valor de los activos y el atractivo para los inquilinos.,"La empresa demuestra su compromiso con el desarrollo inmobiliario a través de oportunidades de reinversión continua destinadas a mejorar sus centros con minoristas fuertes y aumentar la calidad de los inquilinos. Esto se evidencia en 37 proyectos en proceso, que incluyen la reposición de espacios ancla, la reurbanización y el desarrollo de parcelas exteriores, con un costo previsto de 374,3 millones de dólares. Además, la empresa ha identificado una cartera de futuros proyectos de reurbanización que pretende ejecutar en los próximos años, financiados a través de una combinación de efectivo, actividades operativas, ventas de activos y transacciones en los mercados de capitales.",,137494497,USD,BRX,SMART,STK,True,REA
real estate,real_estate_development,US1331311027,CAMDEN PROPERTY TRUST,60,Se dedica al desarrollo de propiedades inmobiliarias.,"La participación de Camden Property Trust en el Desarrollo Inmobiliario es evidente a través de sus actividades comerciales principales, que incluyen el desarrollo, la reposición, la reurbanización, la adquisición y la construcción de comunidades de apartamentos multifamiliares. La compañía desarrolla activamente nuevas comunidades y reurbaniza las existentes, con proyectos de construcción en curso y terrenos para futuras comunidades de apartamentos multifamiliares. Por ejemplo, Camden ha iniciado la construcción de nuevas comunidades de desarrollo como Camden Nations y está monitoreando activamente las condiciones del mercado para proyectos adicionales, lo que demuestra un enfoque continuo en la expansión de su cartera de desarrollo.","[{'name': 'cpt-FY24-10-K', 'url': 'https://storage.googleapis.com/reflexivity-documents-prod/edgar/filing/10-k/cpt-FY24-10-K.html'}, {'name': 'cpt-Q125-10-Q', 'url': 'https://storage.googleapis.com/reflexivity-documents-prod/edgar/filing/10-q/cpt-Q125-10-Q.html'}, {'name': 'cpt-Q225-10-Q', 'url': 'https://storage.googleapis.com/reflexivity-documents-prod/edgar/filing/10-q/cpt-Q225-10-Q.html'}, {'name': 'cpt-Q324-10-Q', 'url': 'https://storage.googleapis.com/reflexivity-documents-prod/edgar/filing/10-q/cpt-Q324-10-Q.html'}]",6004,USD,CPT,SMART,STK,True,REA
real estate,real_estate_development,US78573L1061,SABRA HEALTH CARE REIT INC,61,"Participa en el desarrollo y adquisición de propiedades inmobiliarias relacionadas con la atención médica, contribuyendo a la expansión de instalaciones para servicios médicos y atención a personas mayores.","La empresa demuestra su compromiso con el Desarrollo Inmobiliario a través de su objetivo estratégico de invertir directa o indirectamente en bienes raíces de atención médica, con un enfoque en el desarrollo de instalaciones de atención médica construidas a propósito junto con desarrolladores selectos. Esta estrategia se destaca como un medio para hacer crecer y diversificar la cartera de inversiones entre diferentes inquilinos, tipos de instalaciones y geografías dentro del sector de la atención médica. Si bien la empresa menciona constantemente sus planes para desarrollar estas instalaciones, no hay indicios de métodos de desarrollo únicos o una contribución significativa de ingresos de estas actividades.","[{'name': 'sbra-Q324-10-Q', 'url': 'https://storage.googleapis.com/reflexivity-documents-prod/edgar/filing/10-q/sbra-Q324-10-Q.html'}, {'name': 'sbra-FY24-10-K', 'url': 'https://storage.googleapis.com/reflexivity-documents-prod/edgar/filing/10-k/sbra-FY24-10-K.html'}]",80712681,USD,SBRA,SMART,STK,True,REA
real estate,real_estate_development,US78440X8873,SL GREEN REALTY CORP,62,Lleva a cabo actividades de Desarrollo Inmobiliario.,"SL Green demuestra su compromiso con el desarrollo inmobiliario a través de diversas actividades. La empresa participa en la propiedad, gestión, operación, adquisición, desarrollo, reurbanización, reposicionamiento y financiación de propiedades inmobiliarias comerciales, principalmente en Manhattan. Esto se ve respaldado además por su búsqueda activa de un nuevo sitio de desarrollo de alta calidad en Midtown, considerando tales proyectos como inversiones a largo plazo a pesar de las incertidumbres del mercado a corto plazo, y su compromiso de desarrollar nuevos sitios importantes en el centro de Manhattan. Además, SL Green participa en el diseño e implementación de programas de mejora para sus propiedades para aumentar los alquileres y atraer inquilinos, y posee propiedades de desarrollo/reurbanización y espera incurrir en millones en gastos de desarrollo o reurbanización.","[{'name': 'slg-Q324-10-Q', 'url': 'https://storage.googleapis.com/reflexivity-documents-prod/edgar/filing/10-q/slg-Q324-10-Q.html'}, {'name': 'slg-Q225-10-Q', 'url': 'https://storage.googleapis.com/reflexivity-documents-prod/edgar/filing/10-q/slg-Q225-10-Q.html'}, {'name': 'slg-Q125-10-Q', 'url': 'https://storage.googleapis.com/reflexivity-documents-prod/edgar/filing/10-q/slg-Q125-10-Q.html'}]",537789289,USD,SLG,SMART,STK,True,REA
real estate,real_estate_development,US2971781057,ESSEX PROPERTY TRUST INC,63,"Participa en la creación y mejora de propiedades inmobiliarias, contribuyendo a la expansión de su base de activos.","Essex participa en el desarrollo inmobiliario mediante la adquisición, desarrollo, redesarrollo y gestión de comunidades de apartamentos en la Costa Oeste. La cartera de desarrollo de la empresa incluye un proyecto de desarrollo consolidado y varios proyectos de predesarrollo. Un equipo de desarrollo dedicado evalúa numerosos sitios anualmente, lo que indica un esfuerzo constante para encontrar proyectos viables, aunque enfatizan la asignación disciplinada de capital y la cuidadosa selección de proyectos.","[{'name': 'ess-Q225-10-Q', 'url': 'https://storage.googleapis.com/reflexivity-documents-prod/edgar/filing/10-q/ess-Q225-10-Q.html'}, {'name': 'ess-Q125-10-Q', 'url': 'https://storage.googleapis.com/reflexivity-documents-prod/edgar/filing/10-q/ess-Q125-10-Q.html'}]",6946,USD,ESS,SMART,STK,True,REA
real estate,real_estate_development,US42226K1051,HEALTHCARE REALTY TRUST INC,64,Desarrolla propiedades inmobiliarias principalmente dentro del sector de la salud.,"La compañía demuestra su participación en el desarrollo inmobiliario a través de gastos de capital constantes destinados al desarrollo y la reurbanización de propiedades. Por ejemplo, la compañía asignó $76.4 millones a desarrollo y reurbanización activos, junto con $34.6 millones para proyectos completados durante un período de nueve meses. Además, la compañía incurrió en $75.4 millones en costos de capital para desarrollo y reurbanización durante un período de seis meses, y $33.4 millones durante un período de tres meses, lo que refleja una inversión continua en esta área. La compañía también reconoce los riesgos asociados con estas actividades e integra las propiedades recién desarrolladas en sus métricas de mismas tiendas, lo que indica que el desarrollo inmobiliario es un aspecto recurrente de sus operaciones.","[{'name': 'hr-Q324-10-Q', 'url': 'https://storage.googleapis.com/reflexivity-documents-prod/edgar/filing/10-q/hr-Q324-10-Q.html'}, {'name': 'hr-Q225-10-Q', 'url': 'https://storage.googleapis.com/reflexivity-documents-prod/edgar/filing/10-q/hr-Q225-10-Q.html'}, {'name': 'hr-Q125-10-Q', 'url': 'https://storage.googleapis.com/reflexivity-documents-prod/edgar/filing/10-q/hr-Q125-10-Q.html'}]",575088334,USD,HR,SMART,STK,True,REA
real estate,real_estate_development,US19247A1007,COHEN & STEERS INC,65,"Implica estrategias de inversión centradas en bienes raíces, incluidas empresas dedicadas al desarrollo inmobiliario.","La participación de Cohen & Steers en el tema de Desarrollo Inmobiliario es evidente a través de su cartera de REIT de CNS, que incluye centros comerciales, y sus ETFs activos en bienes raíces. Están trabajando activamente en una iniciativa privada de bienes raíces, buscando inversores ancla adicionales y colaborando con RIA, utilizando plataformas como Schwab, Pershing y Fidelity. Sus discusiones incluyen la anticipación de que el ciclo de bienes raíces comerciales toque fondo, el impacto de la nueva oferta en el crecimiento del alquiler y la dinámica de la oferta y la demanda de bienes raíces, lo que indica una conciencia de las tendencias de desarrollo inmobiliario.",,30350975,USD,CNS,SMART,STK,True,REA
real estate,real_estate_development,US59522J1034,MID-AMERICA APARTMENT COMM,66,"Participa en el desarrollo de comunidades de apartamentos, contribuyendo a la expansión del sector inmobiliario residencial dentro del sector.","MAA participa en el desarrollo inmobiliario, como lo demuestra su cartera activa. Tienen múltiples comunidades de desarrollo en construcción en las regiones del sureste, suroeste y Atlántico medio de EE. UU. Al 30 de junio de 2025, tenían ocho comunidades de desarrollo en construcción, que suman 2,648 unidades de apartamentos, con $ 616.3 millones ya incurridos. La compañía anticipa comenzar 3 a 4 nuevos desarrollos este año, incluido un desarrollo suburbano en Charleston, Carolina del Sur, que se espera que ofrezca un rendimiento estabilizado de NOI del 6.1%.","[{'name': 'maa-Q125-10-Q', 'url': 'https://storage.googleapis.com/reflexivity-documents-prod/edgar/filing/10-q/maa-Q125-10-Q.html'}, {'name': 'maa-Q225-10-Q', 'url': 'https://storage.googleapis.com/reflexivity-documents-prod/edgar/filing/10-q/maa-Q225-10-Q.html'}, {'name': 'maa-Q324-10-Q', 'url': 'https://storage.googleapis.com/reflexivity-documents-prod/edgar/filing/10-q/maa-Q324-10-Q.html'}, {'name': 'maa-FY24-10-K', 'url': 'https://storage.googleapis.com/reflexivity-documents-prod/edgar/filing/10-k/maa-FY24-10-K.html'}]",9317,USD,MAA,SMART,STK,True,REA
real estate,real_estate_development,US45781V1017,INNOVATIVE INDUSTRIAL PROPER,67,Facilita el desarrollo inmobiliario mediante la adquisición y remodelación de propiedades industriales especializadas para la industria regulada del cannabis.,"La participación de IIPR en el tema de desarrollo inmobiliario es evidente a través de su propiedad de 109 propiedades, que incluyen 666.000 pies cuadrados alquilables en desarrollo o reurbanización. Esto está respaldado además por las actividades de inversión de la empresa, con 82,6 millones de dólares asignados a compras de bienes raíces y financiación para mejoras y construcción. Si bien la empresa participa en estas actividades, no hay evidencia explícita que sugiera un enfoque único o especializado.","[{'name': 'iipr-FY24-10-K', 'url': 'https://storage.googleapis.com/reflexivity-documents-prod/edgar/filing/10-k/iipr-FY24-10-K.html'}]",255608245,USD,IIPR,SMART,STK,True,REA
real estate,real_estate_development,US2296631094,CUBESMART,68,"Se dedica al desarrollo y expansión de propiedades de autoalmacenamiento, contribuyendo al crecimiento y evolución del sector de desarrollo inmobiliario.","CubeSmart participa en el desarrollo inmobiliario, poseyendo capacidades internas que abarcan el diseño, desarrollo, adquisición, operación, arrendamiento y gestión de propiedades de autoalmacenamiento. La empresa se enfoca estratégicamente en el crecimiento interno, persiguiendo selectivamente adquisiciones y desarrollos dirigidos. Como empresa inmobiliaria integrada de autoalmacenamiento, las actividades de CubeSmart incluyen la finalización de desarrollos de nuevas tiendas.","[{'name': 'cube-Q324-10-Q', 'url': 'https://storage.googleapis.com/reflexivity-documents-prod/edgar/filing/10-q/cube-Q324-10-Q.html'}, {'name': 'cube-FY24-10-K', 'url': 'https://storage.googleapis.com/reflexivity-documents-prod/edgar/filing/10-k/cube-FY24-10-K.html'}, {'name': 'cube-Q125-10-Q', 'url': 'https://storage.googleapis.com/reflexivity-documents-prod/edgar/filing/10-q/cube-Q125-10-Q.html'}]",94153980,USD,CUBE,SMART,STK,True,REA
real estate,real_estate_development,US2772761019,EASTGROUP PROPERTIES INC,69,"Implica el desarrollo y la adquisición de propiedades industriales, contribuyendo a la expansión de la infraestructura logística y de distribución.","EastGroup participa en el desarrollo inmobiliario a través de la adquisición y operación de instalaciones de distribución. La compañía genera nuevos ingresos por arrendamiento a través de su programa de desarrollo y valor agregado, adquiriendo terrenos y construyendo nuevos proyectos. Por ejemplo, EastGroup adquirió 94.5 acres de terreno de desarrollo por más de $50 millones y comenzó la construcción de proyectos que contienen 731,000 pies cuadrados. Esta actividad está respaldada además por el programa de desarrollo de la compañía que consta de múltiples proyectos en varios mercados.","[{'name': 'egp-Q324-10-Q', 'url': 'https://storage.googleapis.com/reflexivity-documents-prod/edgar/filing/10-q/egp-Q324-10-Q.html'}, {'name': 'egp-Q125-10-Q', 'url': 'https://storage.googleapis.com/reflexivity-documents-prod/edgar/filing/10-q/egp-Q125-10-Q.html'}, {'name': 'egp-Q225-10-Q', 'url': 'https://storage.googleapis.com/reflexivity-documents-prod/edgar/filing/10-q/egp-Q225-10-Q.html'}, {'name': 'egp-FY24-10-K', 'url': 'https://storage.googleapis.com/reflexivity-documents-prod/edgar/filing/10-k/egp-FY24-10-K.html'}]",6747,USD,EGP,SMART,STK,True,REA
real estate,real_estate_development,US2227955026,COUSINS PROPERTIES INC,70,"Lleva a cabo el desarrollo de propiedades, desempeñando un papel en la configuración del entorno construido a través de nuevas construcciones e iniciativas estratégicas de reurbanización.","Cousins Properties demuestra una fuerte conexión con el desarrollo inmobiliario, derivada de su visión fundacional y su continuo enfoque estratégico. La compañía participa activamente en desarrollos selectivos, incluyendo construcción, reurbanización y adquisiciones oportunistas en los mercados del Cinturón del Sol. Este compromiso se evidencia aún más por los importantes compromisos de gasto de capital para mejoras de inquilinos y costos de construcción, junto con la participación en empresas conjuntas centradas en el desarrollo inmobiliario.","[{'name': 'cuz-Q125-10-Q', 'url': 'https://storage.googleapis.com/reflexivity-documents-prod/edgar/filing/10-q/cuz-Q125-10-Q.html'}, {'name': 'cuz-Q225-10-Q', 'url': 'https://storage.googleapis.com/reflexivity-documents-prod/edgar/filing/10-q/cuz-Q225-10-Q.html'}, {'name': 'cuz-Q324-10-Q', 'url': 'https://storage.googleapis.com/reflexivity-documents-prod/edgar/filing/10-q/cuz-Q324-10-Q.html'}, {'name': 'cuz-FY24-10-K', 'url': 'https://storage.googleapis.com/reflexivity-documents-prod/edgar/filing/10-k/cuz-FY24-10-K.html'}]",370528272,USD,CUZ,SMART,STK,True,REA
real estate,real_estate_development,US26884U1097,EPR PROPERTIES,71,"Implica la propiedad y gestión de bienes raíces, contribuyendo al desarrollo y la reurbanización de diversas propiedades.","EPR Properties demuestra su participación en el desarrollo inmobiliario a través de inversiones en desarrollos nuevos y redesarrollos dentro de su segmento Experiencial, específicamente en propiedades de Comer y Jugar y Fitness y Bienestar. La empresa asignó $44.715 millones a nuevos desarrollos de Comer y Jugar y $14.799 millones a proyectos de redesarrollo para los seis meses que finalizaron el 30 de junio de 2025. Además, EPR Properties se ha comprometido a financiar aproximadamente $119.1 millones en 14 proyectos de desarrollo, y adquiere activamente propiedades con una estrategia para desarrollar nuevas propiedades pre-arrendadas.","[{'name': 'epr-Q225-10-Q', 'url': 'https://storage.googleapis.com/reflexivity-documents-prod/edgar/filing/10-q/epr-Q225-10-Q.html'}]",116776441,USD,EPR,SMART,STK,True,REA
