industry,theme,isin_code,name,rank,description,evidence,evidenceSources,conid,currency,symbol,exchange,assetType,navigable,theme_id
real estate,real_estate_development,US59001A1025,MERITAGE HOMES CORP,25,Impulsa el desarrollo inmobiliario a través de su negocio principal de construcción y venta de viviendas.,"Meritage Homes demuestra un compromiso significativo con el tema de Desarrollo Inmobiliario, ya que este es un componente central de su negocio de construcción de viviendas. La empresa compra lotes, gasta en desarrollo de terrenos y comienza la construcción de viviendas, y también vende lotes o parcelas de terreno a otros constructores. Invirtieron $465 millones en adquisición y desarrollo de terrenos en el primer trimestre de 2025, un aumento interanual del 28%, y esperan que el gasto en terrenos para todo el año sea de alrededor de $2.500 millones; y compraron aproximadamente 13.900 lotes por $787,3 millones, gastaron $933,6 millones en desarrollo de terrenos y comenzaron la construcción de 12.259 viviendas durante los nueve meses finalizados el 30 de septiembre de 2024.","[{'name': 'mth-Q125-10-Q', 'url': 'https://storage.googleapis.com/reflexivity-documents-prod/edgar/filing/10-q/mth-Q125-10-Q.html'}, {'name': 'mth-FY24-10-K', 'url': 'https://storage.googleapis.com/reflexivity-documents-prod/edgar/filing/10-k/mth-FY24-10-K.html'}, {'name': 'mth-Q225-10-Q', 'url': 'https://storage.googleapis.com/reflexivity-documents-prod/edgar/filing/10-q/mth-Q225-10-Q.html'}, {'name': 'mth-Q324-10-Q', 'url': 'https://storage.googleapis.com/reflexivity-documents-prod/edgar/filing/10-q/mth-Q324-10-Q.html'}]",2586041,USD,MTH,SMART,STK,True,REA
real estate,real_estate_development,AU000000SCG8,SCENTRE GROUP,26,"Se dedica al desarrollo integral de proyectos inmobiliarios, contribuyendo a la expansión y modernización de su cartera de propiedades.",,,156106374,AUD,SCG,SMART,STK,False,REA
real estate,real_estate_development,US06417N1037,BANK OZK,27,"Juega un papel importante en la financiación de proyectos de desarrollo inmobiliario, contribuyendo al crecimiento y expansión del sector.",,,325898825,USD,OZK,SMART,STK,True,REA
real estate,real_estate_development,US64828T2015,RITHM CAPITAL CORP,28,"Proporciona capital e inversión estratégica para proyectos de desarrollo inmobiliario, contribuyendo a la creación y mejora de propiedades.","Rithm Capital, a través de su subsidiaria Genesis, se enfoca en originar y administrar préstamos hipotecarios a corto plazo para desarrolladores inmobiliarios. Estos préstamos están diseñados específicamente para financiar proyectos unifamiliares y multifamiliares, cubriendo necesidades de construcción, renovación y financiación puente. Esta especialización indica el papel de la empresa en el apoyo a proyectos de desarrollo inmobiliario a través de productos financieros dirigidos.","[{'name': 'ritm-Q225-10-Q', 'url': 'https://storage.googleapis.com/reflexivity-documents-prod/edgar/filing/10-q/ritm-Q225-10-Q.html'}]",169688387,USD,RITM,SMART,STK,False,REA
real estate,real_estate_development,US7901481009,ST JOE CO/THE,29,"Emprende la planificación, el desarrollo y la gestión de propiedades residenciales y comerciales, contribuyendo al crecimiento regional.","El negocio principal de St. Joe gira en torno al desarrollo inmobiliario, ya que la empresa se identifica como una empresa de desarrollo inmobiliario, gestión de activos y operaciones. Esto se ve aún más enfatizado por su estrategia para mejorar el ecosistema en el noroeste de Florida a través del desarrollo de comunidades residenciales, empresas hoteleras y arrendamiento comercial, utilizando activos existentes y buscando oportunidades de mayor valor. La dedicación de la empresa es evidente en su búsqueda activa de actividades de desarrollo en los sectores residencial, comercial y hotelero, así como en la planificación, gestión y posible venta de propiedades comerciales y forestales.","[{'name': 'joe-Q225-10-Q', 'url': 'https://storage.googleapis.com/reflexivity-documents-prod/edgar/filing/10-q/joe-Q225-10-Q.html'}, {'name': 'joe-Q125-10-Q', 'url': 'https://storage.googleapis.com/reflexivity-documents-prod/edgar/filing/10-q/joe-Q125-10-Q.html'}, {'name': 'joe-FY24-10-K', 'url': 'https://storage.googleapis.com/reflexivity-documents-prod/edgar/filing/10-k/joe-FY24-10-K.html'}, {'name': 'joe-Q324-10-Q', 'url': 'https://storage.googleapis.com/reflexivity-documents-prod/edgar/filing/10-q/joe-Q324-10-Q.html'}]",12170,USD,JOE,SMART,STK,True,REA
real estate,real_estate_development,US22002T1088,COPT DEFENSE PROPERTIES,30,"Se enfoca en el desarrollo de propiedades inmobiliarias, particularmente aquellas que sirven al sector de defensa.",,,6607758,USD,CDP,SMART,STK,True,REA
real estate,real_estate_development,US3137451015,FEDERAL REALTY INVS TRUST,31,Lleva a cabo actividades de desarrollo inmobiliario como un componente central de su estrategia de inversión.,,,535271300,EUR,QM1,VALUE,STK,True,REA
real estate,real_estate_development,US0240131047,AMERICAN ASSETS TRUST INC,32,"Desarrolla varios tipos de propiedades inmobiliarias, contribuyendo a la expansión y mejora de los paisajes comerciales y residenciales.","La participación de la empresa en la industria de desarrollo inmobiliario es evidente a través de su desarrollo activo de propiedades minoristas, de oficinas, multifamiliares y de uso mixto, así como de su propiedad de terrenos clasificados como mantenidos para desarrollo y construcción en curso. La empresa tiene la intención de llevar a cabo proyectos en su cartera de desarrollo, incluidas futuras fases de Lloyd Portfolio y remodelaciones en Waikele Center. El desarrollo y la remodelación de propiedades se consideran una estrategia clave para el crecimiento de los ingresos, los fondos de operaciones y los flujos de efectivo.","[{'name': 'aat-Q125-10-Q', 'url': 'https://storage.googleapis.com/reflexivity-documents-prod/edgar/filing/10-q/aat-Q125-10-Q.html'}, {'name': 'aat-Q324-10-Q', 'url': 'https://storage.googleapis.com/reflexivity-documents-prod/edgar/filing/10-q/aat-Q324-10-Q.html'}]",82819360,USD,AAT,SMART,STK,True,REA
real estate,real_estate_development,US30225T1025,EXTRA SPACE STORAGE INC,33,"Se dedica a la adquisición, desarrollo y expansión de propiedades de autoalmacenamiento, contribuyendo al crecimiento y modernización de la infraestructura inmobiliaria.","La empresa demuestra su participación en el desarrollo inmobiliario a través de adquisiciones estratégicas, incluida la finalización de adquisiciones de propiedad total por valor de 153,8 millones de dólares, añadiendo 12 tiendas de alta calidad a su cartera. Estas adquisiciones implican propiedades que requieren arrendamiento y estabilización, con rendimientos iniciales que oscilan entre el 2,3 % y el 6,5 % y que se estabilizan en el rango superior del 6 % al 7 %. Además, la empresa está recomprando empresas conjuntas y tomando decisiones de asignación de capital para socios, al tiempo que observa una desaceleración en el flujo de desarrollo y una disminución de la demanda de nuevos desarrollos.",,30351205,USD,EXR,SMART,STK,True,REA
real estate,real_estate_development,US03064D1081,AMERICOLD REALTY TRUST INC,34,"Se enfoca en el desarrollo, adquisición y expansión de instalaciones de almacenes con temperatura controlada, apoyando la logística y la infraestructura crítica de la cadena de frío.",,,302902503,USD,COLD,SMART,STK,False,REA
real estate,real_estate_development,US50187T1060,LGI HOMES INC,35,"Se enfoca en el desarrollo y construcción de viviendas nuevas, contribuyendo a la expansión del sector inmobiliario residencial.","LGI Homes demuestra un compromiso significativo con el tema de la industria de Desarrollo Inmobiliario. La empresa ha estado en el negocio de desarrollo de terrenos residenciales desde mediados de la década de 1990, transformando terrenos en bruto en comunidades activas, un proceso que generalmente lleva de dos a tres años. Esto se evidencia aún más en sus importantes tenencias, que incluyen 67,792 lotes propios y controlados al 31 de marzo de 2025, y 37,374 lotes de terrenos en bruto o en desarrollo. La empresa también captura beneficios incrementales en lotes autodesarrollados, utiliza estratégicamente acuerdos de financiación de reserva de terrenos y se compromete a realizar ciertas actividades de desarrollo y construcción.","[{'name': 'lgih-Q125-10-Q', 'url': 'https://storage.googleapis.com/reflexivity-documents-prod/edgar/filing/10-q/lgih-Q125-10-Q.html'}, {'name': 'lgih-FY24-10-K', 'url': 'https://storage.googleapis.com/reflexivity-documents-prod/edgar/filing/10-k/lgih-FY24-10-K.html'}, {'name': 'lgih-Q324-10-Q', 'url': 'https://storage.googleapis.com/reflexivity-documents-prod/edgar/filing/10-q/lgih-Q324-10-Q.html'}, {'name': 'lgih-Q225-10-Q', 'url': 'https://storage.googleapis.com/reflexivity-documents-prod/edgar/filing/10-q/lgih-Q225-10-Q.html'}]",137937808,USD,LGIH,SMART,STK,True,REA
real estate,real_estate_development,US00766T1007,AECOM,36,"Contribuye al desarrollo inmobiliario al proporcionar servicios integrales de diseño, ingeniería y gestión de la construcción esenciales para la planificación y ejecución de diversos proyectos inmobiliarios.","La participación de AECOM en el tema de Desarrollo Inmobiliario es evidente a través de AECOM Capital (ACAP), que principalmente invierte y desarrolla proyectos inmobiliarios. ACAP obtiene sus ingresos de las ventas de desarrollo inmobiliario y las tarifas de gestión, lo que solidifica aún más su papel en este sector. Si bien AECOM proporciona una gama de servicios que incluyen asesoramiento, planificación, consultoría, diseño arquitectónico y de ingeniería, gestión de construcción y programas, los servicios de inversión y desarrollo, particularmente a través de ACAP, resaltan la participación de la empresa en el desarrollo inmobiliario.","[{'name': 'acm-FY24-10-K', 'url': 'https://storage.googleapis.com/reflexivity-documents-prod/edgar/filing/10-k/acm-FY24-10-K.html'}, {'name': 'acm-Q325-10-Q', 'url': 'https://storage.googleapis.com/reflexivity-documents-prod/edgar/filing/10-q/acm-Q325-10-Q.html'}, {'name': 'acm-Q125-10-Q', 'url': 'https://storage.googleapis.com/reflexivity-documents-prod/edgar/filing/10-q/acm-Q125-10-Q.html'}]",43980401,USD,ACM,SMART,STK,True,REA
real estate,real_estate_development,US76169C1009,REXFORD INDUSTRIAL REALTY IN,37,"Desarrolla activamente propiedades inmobiliarias industriales, mejorando y expandiendo su cartera para satisfacer las demandas del mercado.","El enfoque de Rexford Industrial Realty en poseer, operar, mejorar, reposicionar, redesarrollar, arrendar y administrar bienes raíces industriales, particularmente en los mercados de relleno del sur de California, destaca su participación en el desarrollo inmobiliario. La compañía mejora los rendimientos a través del reposicionamiento y las redesarrollos de valor agregado, adquiriendo propiedades con oportunidades para mejorar la funcionalidad y aumentar el flujo de caja, incluidas parcelas de tierra para proyectos de redesarrollo de nueva construcción. Rexford también busca propiedades a través de transacciones fuera del mercado, con el objetivo de agregar valor a través del reposicionamiento y las mejoras funcionales o físicas, con varias propiedades actualmente en proceso de reposicionamiento o redesarrollo.","[{'name': 'rexr-Q324-10-Q', 'url': 'https://storage.googleapis.com/reflexivity-documents-prod/edgar/filing/10-q/rexr-Q324-10-Q.html'}]",131219465,USD,REXR,SMART,STK,True,REA
real estate,real_estate_development,US0147521092,ALEXANDER'S INC,38,"Impulsa el crecimiento a través del desarrollo de activos inmobiliarios, mejorando su cartera y contribuyendo a la infraestructura urbana.","Alexander's está activamente involucrado en la industria del desarrollo inmobiliario, como lo demuestra su participación en el desarrollo y redesarrollo de propiedades. La empresa está explorando oportunidades de desarrollo para la propiedad Rego Park I e invirtiendo en construcción en curso y adiciones inmobiliarias. Vornado, que administra las propiedades de Alexander, también está involucrada en importantes proyectos de desarrollo, incluida la torre de 350 Park Avenue y posibles proyectos en el Distrito PENN.","[{'name': 'alx-Q225-10-Q', 'url': 'https://storage.googleapis.com/reflexivity-documents-prod/edgar/filing/10-q/alx-Q225-10-Q.html'}, {'name': 'alx-FY24-10-K', 'url': 'https://storage.googleapis.com/reflexivity-documents-prod/edgar/filing/10-k/alx-FY24-10-K.html'}]",4382,USD,ALX,SMART,STK,False,REA
real estate,real_estate_development,US87265H1095,TRI POINTE HOMES INC,39,"Se dedica al desarrollo y construcción de viviendas residenciales y comunidades, contribuyendo a la expansión de los mercados de vivienda en diversas regiones.","Tri Pointe Homes demuestra un compromiso significativo en el desarrollo inmobiliario a través de diversas actividades. La empresa enfatiza la necesidad sostenida de desarrollo de nuevas viviendas debido a la escasez de viviendas en los EE. UU. Esto está respaldado por sus importantes inversiones, que incluyen aproximadamente $ 250 millones en terrenos y desarrollo de terrenos durante el segundo trimestre, terminando con más de 34,000 lotes totales. Además, sus principales usos de capital incluyen la compra de terrenos, el desarrollo de terrenos y la construcción de viviendas, y se están expandiendo activamente a nuevos mercados, con planes de abrir 65 comunidades en 2025.","[{'name': 'tph-Q125-10-Q', 'url': 'https://storage.googleapis.com/reflexivity-documents-prod/edgar/filing/10-q/tph-Q125-10-Q.html'}, {'name': 'tph-Q225-10-Q', 'url': 'https://storage.googleapis.com/reflexivity-documents-prod/edgar/filing/10-q/tph-Q225-10-Q.html'}, {'name': 'tph-FY24-10-K', 'url': 'https://storage.googleapis.com/reflexivity-documents-prod/edgar/filing/10-k/tph-FY24-10-K.html'}, {'name': 'tph-Q324-10-Q', 'url': 'https://storage.googleapis.com/reflexivity-documents-prod/edgar/filing/10-q/tph-Q324-10-Q.html'}]",121560188,USD,TPH,SMART,STK,True,REA
real estate,real_estate_development,US1565043007,CENTURY COMMUNITIES INC,40,"Se enfoca en el desarrollo de comunidades residenciales, abarcando la adquisición de terrenos, la obtención de permisos y la construcción de viviendas en diversos mercados.","La participación de Century en el Desarrollo Inmobiliario es evidente a través de sus actividades comerciales principales. La empresa participa en el desarrollo, diseño, construcción, comercialización y venta de viviendas unifamiliares en varios estados. Además de construir viviendas, Century autoriza y desarrolla el terreno subyacente en muchos de sus proyectos, y también gestiona estratégicamente su cartera de lotes, terminando el trimestre con un inventario sustancial de lotes propios y controlados. Además, el segmento Century Living desarrolla, construye, gestiona y enajena activamente propiedades de alquiler multifamiliares, lo que demuestra un enfoque multifacético del desarrollo inmobiliario.","[{'name': 'ccs-Q125-10-Q', 'url': 'https://storage.googleapis.com/reflexivity-documents-prod/edgar/filing/10-q/ccs-Q125-10-Q.html'}, {'name': 'ccs-Q225-10-Q', 'url': 'https://storage.googleapis.com/reflexivity-documents-prod/edgar/filing/10-q/ccs-Q225-10-Q.html'}, {'name': 'ccs-Q324-10-Q', 'url': 'https://storage.googleapis.com/reflexivity-documents-prod/edgar/filing/10-q/ccs-Q324-10-Q.html'}]",156106386,USD,CCS,SMART,STK,True,REA
real estate,real_estate_development,US8666741041,SUN COMMUNITIES INC,41,"Se enfoca en el desarrollo y expansión de comunidades de viviendas prefabricadas, resorts de RV y marinas.","La empresa demuestra su participación en el desarrollo inmobiliario a través de la expansión de comunidades de casas móviles (MH) y vehículos recreativos (RV), una práctica que han mantenido desde 1975, y su propiedad y operación de 165 comunidades de RV. Si bien la empresa no está llevando a cabo nuevos proyectos de construcción en EE. UU. o el Reino Unido debido a un cambio estratégico que ha provocado cargos por deterioro, están expandiendo selectivamente propiedades utilizando terrenos propios y urbanizados, que incluyen 16.370 lotes de MH y RV aptos para el desarrollo futuro. Esta expansión implica costos de construcción de carreteras, actividades, comodidades y mejoras de sitios en sus comunidades de MH, RV y Reino Unido, y actualmente están evaluando un puñado de proyectos de expansión en EE. UU.","[{'name': 'sui-Q125-10-Q', 'url': 'https://storage.googleapis.com/reflexivity-documents-prod/edgar/filing/10-q/sui-Q125-10-Q.html'}]",12485,USD,SUI,SMART,STK,False,REA
real estate,real_estate_development,US95040Q1040,WELLTOWER INC,42,"Se enfoca en el desarrollo y adquisición de propiedades inmobiliarias de atención médica, incluidas comunidades de vida para personas mayores, centros de atención post-aguda y edificios de oficinas médicas.",,,207739931,USD,WELL,SMART,STK,True,REA
real estate,real_estate_development,US55305B1017,M/I HOMES INC,43,"Impulsa el desarrollo inmobiliario a través de la adquisición de terrenos, el diseño y la construcción de nuevas viviendas y comunidades residenciales.","M/I Homes está significativamente involucrada en el desarrollo inmobiliario, como lo demuestran sus sustanciales inversiones en adquisición y desarrollo de terrenos, incluyendo $472.9 millones en adquisiciones de terrenos y $646.0 millones en desarrollo de terrenos durante 2024. La empresa mantiene una sólida posición de terrenos, reflejada en su propiedad de aproximadamente 25,000 lotes y el control de 26,000 lotes adicionales a través de contratos de opción. Este compromiso se demuestra aún más por su gestión activa de comunidades, con un récord de 234 comunidades y esfuerzos continuos para aumentar su número de comunidades, respaldado por inversiones como los $241 millones gastados en un solo trimestre en compras y desarrollo de terrenos.","[{'name': 'mho-Q225-10-Q', 'url': 'https://storage.googleapis.com/reflexivity-documents-prod/edgar/filing/10-q/mho-Q225-10-Q.html'}, {'name': 'mho-Q125-10-Q', 'url': 'https://storage.googleapis.com/reflexivity-documents-prod/edgar/filing/10-q/mho-Q125-10-Q.html'}, {'name': 'mho-Q324-10-Q', 'url': 'https://storage.googleapis.com/reflexivity-documents-prod/edgar/filing/10-q/mho-Q324-10-Q.html'}, {'name': 'mho-FY24-10-K', 'url': 'https://storage.googleapis.com/reflexivity-documents-prod/edgar/filing/10-k/mho-FY24-10-K.html'}]",9594,USD,MHO,SMART,STK,True,REA
real estate,real_estate_development,US3927091013,GREEN BRICK PARTNERS INC,44,"Se centra en la adquisición, desarrollo y construcción de propiedades residenciales y de uso mixto, contribuyendo a la expansión de comunidades.","Green Brick Partners demuestra una fuerte conexión con el tema de Desarrollo Inmobiliario, principalmente a través de su énfasis estratégico en la adquisición y desarrollo de terrenos. El CEO enfatiza que la tierra es fundamental para su negocio y rentabilidad, lo que está respaldado por las importantes inversiones de la compañía en adquisición y desarrollo de terrenos, incluido un gasto proyectado de $300 millones para 2025. Con un equipo dedicado liderado por un vicepresidente ejecutivo enfocado en la estrategia de terrenos, Green Brick posee una cartera significativa de lotes y autodesarrolla casi todos ellos, lo que resalta el compromiso y control de la compañía sobre sus actividades de desarrollo inmobiliario.","[{'name': 'grbk-Q225-10-Q', 'url': 'https://storage.googleapis.com/reflexivity-documents-prod/edgar/filing/10-q/grbk-Q225-10-Q.html'}, {'name': 'grbk-Q324-10-Q', 'url': 'https://storage.googleapis.com/reflexivity-documents-prod/edgar/filing/10-q/grbk-Q324-10-Q.html'}, {'name': 'grbk-Q125-10-Q', 'url': 'https://storage.googleapis.com/reflexivity-documents-prod/edgar/filing/10-q/grbk-Q125-10-Q.html'}, {'name': 'grbk-FY24-10-K', 'url': 'https://storage.googleapis.com/reflexivity-documents-prod/edgar/filing/10-k/grbk-FY24-10-K.html'}]",172103160,USD,GRBK,SMART,STK,True,REA
real estate,real_estate_development,US5178341070,LAS VEGAS SANDS CORP,45,"Implica el desarrollo y la expansión de complejos turísticos integrados, que abarcan hoteles, casinos e instalaciones para convenciones.",,,32602412,USD,LVS,SMART,STK,True,REA
real estate,real_estate_development,US9831341071,WYNN RESORTS LTD,46,"Impulsa la construcción y expansión de propiedades de resorts de lujo integrados, incluyendo hoteles, casinos e instalaciones de entretenimiento.",,,16454492,USD,WYNN,SMART,STK,True,REA
real estate,real_estate_development,US49427F1084,KILROY REALTY CORP,47,"Implica el desarrollo de propiedades inmobiliarias, contribuyendo a la expansión y mejora de su base de activos.","Kilroy Realty Corporation participa en el desarrollo inmobiliario, como lo demuestra su propiedad, desarrollo, adquisición y gestión de activos inmobiliarios principalmente en mercados estratégicos como Los Ángeles, San Diego, el Área de la Bahía de San Francisco, Seattle y Austin. Se espera que el crecimiento a largo plazo de la empresa provenga de la finalización de proyectos de desarrollo y reurbanización en curso, con un enfoque en la identificación de nuevas oportunidades. Proyectos como Kilroy Oyster Point y el proyecto Flower Mart, este último siendo su mayor inversión individual en la cartera de desarrollo futuro, ejemplifican su participación en el diseño, rediseño y desarrollo de propiedades para diversos usos.","[{'name': 'krc-Q125-10-Q', 'url': 'https://storage.googleapis.com/reflexivity-documents-prod/edgar/filing/10-q/krc-Q125-10-Q.html'}, {'name': 'krc-Q324-10-Q', 'url': 'https://storage.googleapis.com/reflexivity-documents-prod/edgar/filing/10-q/krc-Q324-10-Q.html'}, {'name': 'krc-FY24-10-K', 'url': 'https://storage.googleapis.com/reflexivity-documents-prod/edgar/filing/10-k/krc-FY24-10-K.html'}, {'name': 'krc-Q225-10-Q', 'url': 'https://storage.googleapis.com/reflexivity-documents-prod/edgar/filing/10-q/krc-Q225-10-Q.html'}]",2586128,USD,KRC,SMART,STK,True,REA
real estate,real_estate_development,US85254J1025,STAG INDUSTRIAL INC,48,"La participación en el Desarrollo Inmobiliario se demuestra a través de la adquisición y desarrollo de propiedades industriales, contribuyendo a la expansión de su cartera.","La participación de STAG en el Desarrollo Inmobiliario es evidente a través de su plataforma de desarrollo, que abarca aproximadamente 3 millones de pies cuadrados en 12 edificios en los EE. UU., con una parte en construcción y el resto entregado y arrendado. Además, la empresa está construyendo un almacén cross-dock de 500,000 pies cuadrados en Louisville, Kentucky. STAG también participa en el desarrollo y la operación de propiedades inmobiliarias industriales a través de participaciones de capital en empresas conjuntas consolidadas.","[{'name': 'stag-FY24-10-K', 'url': 'https://storage.googleapis.com/reflexivity-documents-prod/edgar/filing/10-k/stag-FY24-10-K.html'}]",86792819,USD,STAG,SMART,STK,True,REA
real estate,real_estate_development,US49446R1095,KIMCO REALTY CORP,49,Participa en actividades de desarrollo inmobiliario.,"Kimco Realty Corporation se dedica al desarrollo inmobiliario a través de la propiedad, gestión, desarrollo y operación de centros comerciales al aire libre y activos de uso mixto. Esto incluye la búsqueda activa de oportunidades de reurbanización dentro de su cartera operativa, integrando componentes residenciales y de uso mixto para mejorar el valor de los activos atrayendo nuevos inquilinos. Además, Kimco reurbaniza proyectos y vuelve a alquilar propiedades para mantener su posición competitiva en el mercado, respaldada por fianzas de rendimiento y de cumplimiento para la construcción e infraestructura relacionadas con estos proyectos de desarrollo y reurbanización.",,8845,USD,KIM,SMART,STK,True,REA
real estate,real_estate_development,US0534841012,AVALONBAY COMMUNITIES INC,50,"Se dedica al desarrollo y redesarrollo de comunidades de apartamentos, contribuyendo a la expansión del sector inmobiliario residencial.","La participación de AvalonBay en el Desarrollo Inmobiliario es evidente a través de sus actividades comerciales principales, que incluyen el desarrollo, redesarrollo, adquisición, propiedad y operación de comunidades de apartamentos multifamiliares. La compañía tiene una inversión de capital significativa en proyectos de desarrollo, con $ 3 mil millones en curso y un objetivo de $ 1.7 mil millones para nuevos desarrollos. Este compromiso se demuestra aún más con la finalización de nueve comunidades de propiedad total y el inicio de la construcción de otras nueve, lo que refleja una importante dedicación de recursos al desarrollo inmobiliario.","[{'name': 'avb-Q324-10-Q', 'url': 'https://storage.googleapis.com/reflexivity-documents-prod/edgar/filing/10-q/avb-Q324-10-Q.html'}, {'name': 'avb-FY24-10-K', 'url': 'https://storage.googleapis.com/reflexivity-documents-prod/edgar/filing/10-k/avb-FY24-10-K.html'}, {'name': 'avb-Q225-10-Q', 'url': 'https://storage.googleapis.com/reflexivity-documents-prod/edgar/filing/10-q/avb-Q225-10-Q.html'}]",5026974,USD,AVB,SMART,STK,True,REA
