industry,theme,isin_code,name,rank,description,evidence,evidenceSources,conid,currency,symbol,exchange,assetType,navigable,theme_id
real estate,real_estate_development,US23331A1097,DR HORTON INC,1,"Ocupa la posición de liderazgo dentro del tema de Desarrollo Inmobiliario, lo que refleja su considerable influencia y contribución al crecimiento y las actividades de la industria.","La participación de D.R. Horton en el Desarrollo Inmobiliario es evidente a través de sus operaciones comerciales principales, que incluyen la construcción de viviendas, propiedades de alquiler y una participación mayoritaria en Forestar, una empresa de desarrollo de lotes residenciales. La empresa gestiona activamente inversiones en lotes, terrenos y desarrollo, asignando capital significativo a lotes terminados, desarrollo de terrenos y adquisición de terrenos. Además, D.R. Horton se enfoca estratégicamente en las relaciones con los desarrolladores de terrenos y aprovecha Forestar para mejorar la eficiencia del capital y la flexibilidad operativa, construyendo viviendas en lotes desarrollados por otros.","[{'name': 'dhi-Q325-10-Q', 'url': 'https://storage.googleapis.com/reflexivity-documents-prod/edgar/filing/10-q/dhi-Q325-10-Q.html'}, {'name': 'dhi-Q125-10-Q', 'url': 'https://storage.googleapis.com/reflexivity-documents-prod/edgar/filing/10-q/dhi-Q125-10-Q.html'}, {'name': 'dhi-FY24-10-K', 'url': 'https://storage.googleapis.com/reflexivity-documents-prod/edgar/filing/10-k/dhi-FY24-10-K.html'}, {'name': 'dhi-Q225-10-Q', 'url': 'https://storage.googleapis.com/reflexivity-documents-prod/edgar/filing/10-q/dhi-Q225-10-Q.html'}]",268627,USD,DHI,SMART,STK,True,REA
real estate,real_estate_development,US3462321015,FORESTAR GROUP INC,2,"Se concentra en el desarrollo de terrenos residenciales en lotes terminados para constructores de viviendas, impactando directamente la disponibilidad de nuevas viviendas y el crecimiento de áreas residenciales.","El negocio principal de Forestar Group gira en torno al desarrollo inmobiliario, específicamente el desarrollo de lotes residenciales, como lo demuestra su enfoque en la adquisición y desarrollo de terrenos para vender lotes residenciales unifamiliares terminados a constructores de viviendas. Su segmento inmobiliario genera sustancialmente todos los ingresos de la empresa a través de actividades como la adquisición de terrenos, la instalación de infraestructura y la gestión de la planificación de proyectos relacionados con el desarrollo comunitario y la venta de lotes residenciales. La empresa está expandiendo activamente sus operaciones, ingresando a nuevos mercados y aumentando su número de comunidades, con más del 80% de sus inversiones asignadas al desarrollo de terrenos. Forestar gestiona una posición sustancial de lotes y tiene como objetivo consolidar la cuota de mercado en la fragmentada industria del desarrollo de lotes, solidificando aún más su enfoque en el desarrollo inmobiliario.","[{'name': 'for-Q225-10-Q', 'url': 'https://storage.googleapis.com/reflexivity-documents-prod/edgar/filing/10-q/for-Q225-10-Q.html'}, {'name': 'for-Q325-10-Q', 'url': 'https://storage.googleapis.com/reflexivity-documents-prod/edgar/filing/10-q/for-Q325-10-Q.html'}]",290000402,USD,FOR,SMART,STK,False,REA
real estate,real_estate_development,US62944T1051,NVR INC,3,Impulsa el desarrollo inmobiliario a través de su negocio principal de construcción y venta de viviendas en diversos mercados.,"La participación de NVR en el desarrollo inmobiliario se centra principalmente en la adquisición de lotes terminados de desarrolladores externos; sin embargo, la empresa se dedica a actividades de desarrollo de terrenos en una medida limitada. En ciertas circunstancias estratégicas, NVR participa en acuerdos de empresa conjunta con desarrolladores de terrenos o adquiere directamente terrenos sin desarrollar ya zonificados para su uso previsto. NVR también puede contratar a un desarrollador para que desarrolle el terreno en su nombre. A 31 de marzo de 2025, la empresa poseía terrenos con un valor contable de aproximadamente $70,000 que pretende desarrollar en aproximadamente 2,900 lotes terminados.","[{'name': 'nvr-Q225-10-Q', 'url': 'https://storage.googleapis.com/reflexivity-documents-prod/edgar/filing/10-q/nvr-Q225-10-Q.html'}, {'name': 'nvr-Q125-10-Q', 'url': 'https://storage.googleapis.com/reflexivity-documents-prod/edgar/filing/10-q/nvr-Q125-10-Q.html'}, {'name': 'nvr-Q324-10-Q', 'url': 'https://storage.googleapis.com/reflexivity-documents-prod/edgar/filing/10-q/nvr-Q324-10-Q.html'}, {'name': 'nvr-FY24-10-K', 'url': 'https://storage.googleapis.com/reflexivity-documents-prod/edgar/filing/10-k/nvr-FY24-10-K.html'}]",755864,USD,NVR,SMART,STK,True,REA
real estate,real_estate_development,US5260571048,LENNAR CORP-A,4,"Principalmente dedicada al desarrollo y construcción de comunidades residenciales, incluyendo casas unifamiliares, casas adosadas y condominios, en diversos mercados.","La participación de Lennar en el desarrollo inmobiliario es evidente a través de sus actividades comerciales principales, incluida la adquisición de terrenos, la construcción y las ventas. La empresa estructura estratégicamente sus adquisiciones de terrenos utilizando métodos de ""justo a tiempo"", aprovechando las relaciones con bancos de terrenos y adquisiciones por fases para minimizar los costos de mantenimiento. Además, las actividades de Lennar se extienden tanto a la construcción de viviendas como a proyectos multifamiliares, con inversiones en entidades no consolidadas que adquieren y desarrollan terrenos. La escisión de Millrose Properties, diseñada como una fuente permanente de capital para la adquisición y el desarrollo de terrenos, subraya aún más el enfoque de Lennar en el desarrollo inmobiliario.","[{'name': 'len-FY24-10-K', 'url': 'https://storage.googleapis.com/reflexivity-documents-prod/edgar/filing/10-k/len-FY24-10-K.html'}, {'name': 'len-Q125-10-Q', 'url': 'https://storage.googleapis.com/reflexivity-documents-prod/edgar/filing/10-q/len-Q125-10-Q.html'}, {'name': 'len-Q324-10-Q', 'url': 'https://storage.googleapis.com/reflexivity-documents-prod/edgar/filing/10-q/len-Q324-10-Q.html'}]",9091,USD,LEN,SMART,STK,True,REA
real estate,real_estate_development,US44267T1025,HOWARD HUGHES HOLDINGS INC,5,"Lleva a cabo el desarrollo de propiedades inmobiliarias, contribuyendo a la expansión y evolución de los entornos construidos.","El compromiso de Howard Hughes con el tema de Desarrollo Inmobiliario es fundamental para su negocio, como lo demuestran sus Comunidades Planificadas (MPC) y proyectos de desarrollo estratégico, incluida la construcción de condominios y comerciales. El éxito de la empresa está estrechamente ligado a su segmento de negocio de desarrollo inmobiliario, con una importante cartera de condominios que representa 2.700 millones de dólares en ingresos futuros. Como evidencia de este compromiso, la empresa ha lanzado preventas de torres residenciales de lujo y tiene proyectos de construcción en curso, y la demanda de terrenos residenciales por parte de los constructores de viviendas sigue siendo sólida.","[{'name': 'hhh-Q225-10-Q', 'url': 'https://storage.googleapis.com/reflexivity-documents-prod/edgar/filing/10-q/hhh-Q225-10-Q.html'}, {'name': 'hhh-Q125-10-Q', 'url': 'https://storage.googleapis.com/reflexivity-documents-prod/edgar/filing/10-q/hhh-Q125-10-Q.html'}, {'name': 'hhh-FY24-10-K', 'url': 'https://storage.googleapis.com/reflexivity-documents-prod/edgar/filing/10-k/hhh-FY24-10-K.html'}]",647324601,USD,HHH,SMART,STK,False,REA
real estate,real_estate_development,CNE100001SR9,CHINA VANKE CO LTD-H,6,"Se dedica al desarrollo y venta de propiedades residenciales y comerciales, contribuyendo significativamente al desarrollo urbano y al suministro de viviendas.",,,157951173,HKD,2202,SEHK,STK,False,REA
real estate,real_estate_development,US7458671010,PULTE GROUP INC,7,Se dedica al desarrollo de bienes raíces a través de la construcción y venta de viviendas en diversas comunidades.,"PulteGroup demuestra un compromiso significativo en el desarrollo inmobiliario a través de sus actividades de adquisición y desarrollo de terrenos, que son integrales a sus operaciones de construcción de viviendas. La compañía invierte fuertemente en terrenos, con $1.3 mil millones gastados en el segundo trimestre de 2025 y un anticipo de $5 mil millones para el año, y gestiona una cartera de terrenos sustancial de aproximadamente 250,000 lotes. PulteGroup utiliza estratégicamente opciones de terrenos y gestiona activamente sus posiciones de terrenos, incluyendo renegociación de acuerdos y venta de parcelas a terceros, enfatizando aún más la importancia del desarrollo inmobiliario para su negocio.","[{'name': 'phm-Q225-10-Q', 'url': 'https://storage.googleapis.com/reflexivity-documents-prod/edgar/filing/10-q/phm-Q225-10-Q.html'}, {'name': 'phm-Q125-10-Q', 'url': 'https://storage.googleapis.com/reflexivity-documents-prod/edgar/filing/10-q/phm-Q125-10-Q.html'}, {'name': 'phm-Q324-10-Q', 'url': 'https://storage.googleapis.com/reflexivity-documents-prod/edgar/filing/10-q/phm-Q324-10-Q.html'}, {'name': 'phm-FY24-10-K', 'url': 'https://storage.googleapis.com/reflexivity-documents-prod/edgar/filing/10-k/phm-FY24-10-K.html'}]",11109,USD,PHM,SMART,STK,True,REA
real estate,real_estate_development,US74340W1036,PROLOGIS INC,8,"Se dedica al desarrollo de instalaciones de logística y distribución, ampliando su cartera de bienes raíces industriales para satisfacer las cambiantes demandas del mercado.",,,88819288,USD,PLD,SMART,STK,True,REA
real estate,real_estate_development,JP3893200000,MITSUI FUDOSAN CO LTD,9,"Impulsa el desarrollo de una amplia gama de propiedades inmobiliarias, incluidos proyectos residenciales, comerciales y de regeneración urbana, contribuyendo significativamente a la infraestructura urbana y regional.",,,13906000,JPY,8801,SMART,STK,False,REA
real estate,real_estate_development,US26154D1000,DREAM FINDERS HOMES INC - A,10,"Se enfoca en el desarrollo y construcción de propiedades residenciales, ampliando así las opciones de vivienda y contribuyendo al crecimiento de los mercados inmobiliarios.","El negocio principal de la empresa gira en torno al desarrollo inmobiliario, como lo demuestra su enfoque en el diseño, la construcción y la venta de viviendas en mercados de alto crecimiento. Esto está respaldado por su estrategia de adquisición de lotes con pocos activos, que incluye contratos de opción de lotes terminados y contratos de opción de reserva de terrenos, con inversiones significativas en depósitos de lotes. La empresa también expande sus operaciones a través de adquisiciones estratégicas, como la adquisición de los activos de construcción de viviendas de Green River Builders para expandirse en el mercado de Atlanta, y celebra acuerdos de desarrollo de terrenos con varias entidades.","[{'name': 'dfh-Q125-10-Q', 'url': 'https://storage.googleapis.com/reflexivity-documents-prod/edgar/filing/10-q/dfh-Q125-10-Q.html'}, {'name': 'dfh-Q324-10-Q', 'url': 'https://storage.googleapis.com/reflexivity-documents-prod/edgar/filing/10-q/dfh-Q324-10-Q.html'}, {'name': 'dfh-Q224-10-Q', 'url': 'https://storage.googleapis.com/reflexivity-documents-prod/edgar/filing/10-q/dfh-Q224-10-Q.html'}]",466860974,USD,DFH,SMART,STK,True,REA
real estate,real_estate_development,US0152711091,ALEXANDRIA REAL ESTATE EQUIT,11,Se especializa en el desarrollo de propiedades inmobiliarias.,,,6607487,USD,ARE,SMART,STK,True,REA
real estate,real_estate_development,HK0012000102,HENDERSON LAND DEVELOPMENT,12,Desarrolla propiedades inmobiliarias.,,,1616450,HKD,12,SEHK,STK,False,REA
real estate,real_estate_development,US8288061091,SIMON PROPERTY GROUP INC,13,"Participa en el desarrollo, redesarrollo y adquisición de bienes raíces comerciales de primer nivel, incluyendo centros comerciales, centros outlet y propiedades de uso mixto.","Simon Property Group participa activamente en el desarrollo inmobiliario a través de nuevos proyectos y la reurbanización de propiedades existentes, incluidos destinos de compras, restaurantes y de uso mixto de primer nivel. Estos proyectos, que incluyen la adición de anclas, grandes superficies, restaurantes, oficinas y usos residenciales, están en marcha en América del Norte, Europa y Asia. Simon desarrolla selectivamente nuevas propiedades en mercados no atendidos adecuadamente por puntos de venta minoristas existentes y ha abierto nuevas ubicaciones como Tulsa Premium Outlets y Jakarta Premium Outlets. Simon continúa la construcción de proyectos de reurbanización y desarrollo nuevo, asignando importantes gastos de capital a estas actividades, lo que demuestra un compromiso para mejorar la rentabilidad y la cuota de mercado a través del desarrollo inmobiliario.","[{'name': 'spg-Q125-10-Q', 'url': 'https://storage.googleapis.com/reflexivity-documents-prod/edgar/filing/10-q/spg-Q125-10-Q.html'}]",2009113,USD,SPG,SMART,STK,True,REA
real estate,real_estate_development,US8894781033,TOLL BROTHERS INC,14,"Se centra en el desarrollo y construcción de viviendas de lujo, contribuyendo al mercado inmobiliario residencial.","Toll Brothers demuestra una fuerte conexión con la industria de Desarrollo Inmobiliario a través de sus operaciones comerciales principales, que incluyen el diseño, construcción, comercialización y organización de financiamiento para comunidades residenciales de lujo en terrenos que desarrollan y mejoran. Las actividades de la empresa abarcan la adquisición de terrenos, el desarrollo y la construcción de viviendas, así como la venta de terrenos a constructores externos y empresas conjuntas. Esta participación se ve reforzada por el uso de efectivo por parte de la empresa para la adquisición y desarrollo de terrenos, lo que resalta la importancia estratégica del desarrollo inmobiliario para Toll Brothers.","[{'name': 'tol-Q324-10-Q', 'url': 'https://storage.googleapis.com/reflexivity-documents-prod/edgar/filing/10-q/tol-Q324-10-Q.html'}, {'name': 'tol-Q125-10-Q', 'url': 'https://storage.googleapis.com/reflexivity-documents-prod/edgar/filing/10-q/tol-Q125-10-Q.html'}, {'name': 'tol-Q225-10-Q', 'url': 'https://storage.googleapis.com/reflexivity-documents-prod/edgar/filing/10-q/tol-Q225-10-Q.html'}, {'name': 'tol-FY24-10-K', 'url': 'https://storage.googleapis.com/reflexivity-documents-prod/edgar/filing/10-k/tol-FY24-10-K.html'}]",12915,USD,TOL,SMART,STK,True,REA
real estate,real_estate_development,US4893981070,KENNEDY-WILSON HOLDINGS INC,15,"Participa significativamente en el sector de Desarrollo Inmobiliario, desempeñando un papel sustancial en la configuración y expansión de los mercados de propiedad.","Kennedy Wilson participa en el desarrollo inmobiliario a través de varios proyectos. La empresa está desarrollando activamente 288 unidades multifamiliares y tiene otro proyecto en fase de planificación, con una inversión adicional prevista de 20 millones de dólares totalmente financiada por un préstamo de construcción a nivel de propiedad. También están cerca de completar una cartera de desarrollo de 10 años por un total de 5.000 millones de dólares. Además, Kennedy Wilson adquirió un sitio de desarrollo industrial en el Reino Unido por 48 millones de dólares y se enfoca en apartamentos en mercados de relleno con oferta limitada.","[{'name': 'kw-Q225-10-Q', 'url': 'https://storage.googleapis.com/reflexivity-documents-prod/edgar/filing/10-q/kw-Q225-10-Q.html'}, {'name': 'kw-FY24-10-K', 'url': 'https://storage.googleapis.com/reflexivity-documents-prod/edgar/filing/10-k/kw-FY24-10-K.html'}, {'name': 'kw-Q125-10-Q', 'url': 'https://storage.googleapis.com/reflexivity-documents-prod/edgar/filing/10-q/kw-Q125-10-Q.html'}]",70298853,USD,KW,SMART,STK,True,REA
real estate,real_estate_development,JP3486800000,DAITO TRUST CONSTRUCT CO LTD,16,"Se dedica al desarrollo inmobiliario integral, abarcando la planificación, construcción y gestión de propiedades residenciales y comerciales.",,,14014672,JPY,1878,SMART,STK,False,REA
real estate,real_estate_development,US0477261046,ATLANTA BRAVES HOLDINGS IN-A,17,"Desarrolla y opera proyectos inmobiliarios de uso mixto a gran escala, integrando componentes de entretenimiento, comercio minorista, residencial y oficinas para crear vibrantes centros comerciales y comunitarios.",,,641665724,USD,BATRA,SMART,STK,False,REA
real estate,real_estate_development,US2538681030,DIGITAL REALTY TRUST INC.,18,Implica el desarrollo de propiedades especializadas de centros de datos para respaldar las crecientes necesidades de infraestructura digital.,"La participación de Digital Realty en el desarrollo inmobiliario es evidente a través del desarrollo de nuevas propiedades de centros de datos, la adquisición de terrenos para el desarrollo futuro y proyectos de construcción. La empresa se dirige a propiedades que pueden ser desarrolladas para uso como centros de datos y asigna importantes gastos de capital a proyectos de desarrollo. Esto incluye el desarrollo de espacio existente, la adquisición de nuevas propiedades y el mantenimiento de una cartera de desarrollo, lo que refleja el desarrollo inmobiliario como un componente importante de la estrategia de crecimiento de la empresa.","[{'name': 'dlr-Q324-10-Q', 'url': 'https://storage.googleapis.com/reflexivity-documents-prod/edgar/filing/10-q/dlr-Q324-10-Q.html'}]",31832526,USD,DLR,SMART,STK,True,REA
real estate,real_estate_development,US9026531049,UDR INC,19,Lleva a cabo actividades de Desarrollo Inmobiliario.,"UDR participa en el desarrollo inmobiliario como parte de su estrategia de asignación de capital, con actividades que van desde la adquisición de terrenos y la construcción hasta proyectos de reurbanización. Esto incluye el inicio del desarrollo de una comunidad de apartamentos de 300 viviendas en Riverside, California, con un costo total de desarrollo esperado de aproximadamente $134 millones y un rendimiento anticipado del 6%. La empresa también está evaluando inicios de desarrollo adicionales para finales de 2025 y principios de 2026, y está buscando activamente terrenos para el desarrollo con el fin de lograr un rendimiento del 6%, al tiempo que explora oportunidades de empresas conjuntas.",,43274444,USD,UDR,SMART,STK,True,REA
real estate,real_estate_development,US87724P1066,TAYLOR MORRISON HOME CORP,20,"Se enfoca en el desarrollo de comunidades residenciales, contribuyendo a la expansión de las opciones de vivienda y al crecimiento de los mercados inmobiliarios.","El negocio principal de Taylor Morrison es la construcción de viviendas residenciales y el desarrollo de comunidades de estilo de vida en 12 estados, incluido el desarrollo y la construcción de propiedades de uso mixto que consisten en espacios comerciales, minoristas y propiedades multifamiliares bajo la marca Urban Form. La empresa invirtió 612 millones de dólares en terrenos para la construcción de viviendas, con el 43% asignado al desarrollo de lotes, y anticipa una inversión total en terrenos para la construcción de viviendas de alrededor de 2.400 millones de dólares para el año completo. Una encuesta reciente también sugiere que más del 80% de sus compradores valoran las ofertas de la comunidad y los servicios al menos tanto como la vivienda real, lo que refuerza su fortaleza como desarrollador de comunidades.","[{'name': 'tmhc-Q125-10-Q', 'url': 'https://storage.googleapis.com/reflexivity-documents-prod/edgar/filing/10-q/tmhc-Q125-10-Q.html'}, {'name': 'tmhc-Q324-10-Q', 'url': 'https://storage.googleapis.com/reflexivity-documents-prod/edgar/filing/10-q/tmhc-Q324-10-Q.html'}, {'name': 'tmhc-Q225-10-Q', 'url': 'https://storage.googleapis.com/reflexivity-documents-prod/edgar/filing/10-q/tmhc-Q225-10-Q.html'}, {'name': 'tmhc-FY24-10-K', 'url': 'https://storage.googleapis.com/reflexivity-documents-prod/edgar/filing/10-k/tmhc-FY24-10-K.html'}]",125483759,USD,TMHC,SMART,STK,True,REA
real estate,real_estate_development,US48666K1097,KB HOME,21,"Se enfoca en el desarrollo y construcción de nuevas viviendas dentro de comunidades planificadas, contribuyendo a la expansión residencial en varios mercados.","KB Home demuestra un compromiso significativo en el desarrollo inmobiliario a través de inversiones constantes en terrenos y desarrollo de terrenos, que son cruciales para sus operaciones de construcción de viviendas. La empresa invierte estratégicamente en terrenos para respaldar el crecimiento futuro, con inversiones que aumentaron a $920.3 millones en el trimestre más reciente, un aumento del 57% interanual. KB Home finalizó 2024 con 258 comunidades activas y posee o controla más de 65.000 lotes, lo que refleja su enfoque proactivo para crear nuevas propiedades y dar forma a los paisajes urbanos. El enfoque de la empresa incluye no solo la adquisición de terrenos, sino también las actividades de desarrollo, con una estrategia para desarrollar lotes en fases más pequeñas para gestionar su inventario de lotes terminados.","[{'name': 'kbh-Q125-10-Q', 'url': 'https://storage.googleapis.com/reflexivity-documents-prod/edgar/filing/10-q/kbh-Q125-10-Q.html'}, {'name': 'kbh-Q324-10-Q', 'url': 'https://storage.googleapis.com/reflexivity-documents-prod/edgar/filing/10-q/kbh-Q324-10-Q.html'}, {'name': 'kbh-Q225-10-Q', 'url': 'https://storage.googleapis.com/reflexivity-documents-prod/edgar/filing/10-q/kbh-Q225-10-Q.html'}, {'name': 'kbh-FY24-10-K', 'url': 'https://storage.googleapis.com/reflexivity-documents-prod/edgar/filing/10-k/kbh-FY24-10-K.html'}]",8772,USD,KBH,SMART,STK,True,REA
real estate,real_estate_development,US78410G1040,SBA COMMUNICATIONS CORP,22,Participa en la adquisición y desarrollo de parcelas de terreno para construir y expandir su infraestructura de torres de comunicación inalámbrica.,"La empresa demuestra su compromiso con el tema de Desarrollo Inmobiliario a través de su estrategia de crecimiento de su cartera de activos mediante la construcción de nuevas torres, tanto a nivel nacional como internacional. La empresa participa en la construcción de nuevas torres y en la prestación de servicios de desarrollo de sitios, incluida la identificación de ubicaciones potenciales y la asistencia en la obtención de aprobaciones y permisos de zonificación. Su negocio de desarrollo de sitios ofrece servicios que incluyen la construcción de torres y sitios relacionados, y también ayudan a los proveedores de servicios inalámbricos a desarrollar sus redes, lo que implica la identificación de ubicaciones, la obtención de aprobaciones y la gestión de la construcción.","[{'name': 'sbac-Q324-10-Q', 'url': 'https://storage.googleapis.com/reflexivity-documents-prod/edgar/filing/10-q/sbac-Q324-10-Q.html'}, {'name': 'sbac-FY24-10-K', 'url': 'https://storage.googleapis.com/reflexivity-documents-prod/edgar/filing/10-k/sbac-FY24-10-K.html'}]",262397910,USD,SBAC,SMART,STK,True,REA
real estate,real_estate_development,US46590V1008,JBG SMITH PROPERTIES,23,"Lleva a cabo actividades de desarrollo inmobiliario, contribuyendo al crecimiento y la transformación de varios tipos de propiedades.",,,280803967,USD,JBGS,SMART,STK,True,REA
real estate,real_estate_development,US03762U1051,APOLLO COMMERCIAL REAL ESTAT,24,"Proporciona soluciones de financiación para proyectos de desarrollo inmobiliario comercial, facilitando el crecimiento y la expansión dentro del sector.","La empresa demuestra su participación en el desarrollo inmobiliario a través de su cartera de préstamos para la construcción, que incluye financiación para diversos tipos de propiedades como oficinas, hoteles y propiedades industriales. Esto se ejemplifica además con la financiación de la construcción asegurada para la propiedad Brooklyn Development, un desarrollo multifamiliar ubicado en el centro de Brooklyn, que poseen como bienes inmuebles en propiedad (REO). La empresa también tiene $179.7 millones de capacidad adicional en su financiación de construcción garantizada por su propiedad Brooklyn Development que está disponible para financiar futuros costos de construcción.","[{'name': 'ari-Q225-10-Q', 'url': 'https://storage.googleapis.com/reflexivity-documents-prod/edgar/filing/10-q/ari-Q225-10-Q.html'}, {'name': 'ari-Q324-10-Q', 'url': 'https://storage.googleapis.com/reflexivity-documents-prod/edgar/filing/10-q/ari-Q324-10-Q.html'}]",69052095,USD,ARI,SMART,STK,True,REA
