symbol,theme_id,industry,theme,isin_code,name,rank,description,evidence,evidenceSources,ib_conid,currency,exchange,assetType
AVB,RE2,real estate,residential_reit,US0534841012,AVALONBAY COMMUNITIES INC,1,"Se centra en el desarrollo, adquisición y gestión de comunidades de apartamentos, contribuyendo directamente al sector de REIT residenciales.","AvalonBay Communities se identifica explícitamente como un fideicomiso de inversión inmobiliaria (REIT) y se enfoca en el desarrollo, la reurbanización, la adquisición, la propiedad y la operación de comunidades de apartamentos multifamiliares. Los ingresos de la empresa se derivan principalmente de las operaciones de alquiler de apartamentos, y posee o tiene participaciones en numerosas comunidades en varios estados. AvalonBay también invierte significativamente en nuevas construcciones, enfatizando aún más su dedicación a las propiedades residenciales dentro de su estructura REIT, y discute los Fondos de Operaciones (FFO) y el FFO Central, lo que indica su operación como REIT.","[{'name': 'avb-Q225-10-Q', 'url': 'https://storage.googleapis.com/reflexivity-documents-prod/edgar/filing/10-q/avb-Q225-10-Q.html'}, {'name': 'avb-Q125-10-Q', 'url': 'https://storage.googleapis.com/reflexivity-documents-prod/edgar/filing/10-q/avb-Q125-10-Q.html'}, {'name': 'avb-FY24-10-K', 'url': 'https://storage.googleapis.com/reflexivity-documents-prod/edgar/filing/10-k/avb-FY24-10-K.html'}, {'name': 'avb-Q324-10-Q', 'url': 'https://storage.googleapis.com/reflexivity-documents-prod/edgar/filing/10-q/avb-Q324-10-Q.html'}]",5026974,USD,SMART,STK
EQR,RE2,real estate,residential_reit,US29476L1070,EQUITY RESIDENTIAL,2,"Se enfoca en la adquisición, desarrollo y gestión de propiedades de apartamentos residenciales, proporcionando soluciones de vivienda en mercados clave.","Equity Residential opera como un fideicomiso de inversión inmobiliaria con un enfoque dedicado a las propiedades residenciales. El modelo de negocio principal de la empresa se centra en la adquisición, desarrollo y gestión de estas propiedades, con operaciones realizadas a través de su participación en ERPOP. Este enfoque se demuestra aún más por el énfasis constante de la empresa en los alquileres de apartamentos, los ingresos por alquiler y las operaciones residenciales, y las operaciones residenciales representan una parte importante de los ingresos totales.","[{'name': 'eqr-FY24-10-K', 'url': 'https://storage.googleapis.com/reflexivity-documents-prod/edgar/filing/10-k/eqr-FY24-10-K.html'}, {'name': 'eqr-Q225-10-Q', 'url': 'https://storage.googleapis.com/reflexivity-documents-prod/edgar/filing/10-q/eqr-Q225-10-Q.html'}]",6917,USD,SMART,STK
VNA,RE2,real estate,residential_reit,DE000A1ML7J1,VONOVIA SE,3,"Opera como un fideicomiso de inversión inmobiliaria residencial, gestionando y desarrollando una cartera sustancial de unidades de vivienda para ingresos de alquiler.",,,130946869,EUR,SMART,STK
AMH,RE2,real estate,residential_reit,US02665T3068,AMERICAN HOMES 4 RENT- A,4,"Gestiona una cartera de viviendas de alquiler unifamiliares, contribuyendo significativamente al sector de fideicomisos de inversión inmobiliaria residencial a través de la adquisición, desarrollo y gestión profesional de propiedades.","American Homes 4 Rent (AMH) está firmemente integrada en la industria de REIT residenciales, como lo demuestra su identificación explícita como un REIT de Maryland especializado en viviendas unifamiliares. El modelo de negocio principal de la empresa gira en torno a la adquisición, desarrollo, renovación, arrendamiento y gestión de estas propiedades, con una cartera que comprende un número sustancial de viviendas unifamiliares. Este enfoque singular se destaca constantemente en diversas presentaciones y llamadas de resultados, donde las discusiones se centran en métricas financieras como el FFO básico, el crecimiento de los ingresos y las estrategias para la optimización de la cartera dentro del sector residencial, lo que solidifica aún más su posición dentro de esta industria.","[{'name': 'amh-FY24-10-K', 'url': 'https://storage.googleapis.com/reflexivity-documents-prod/edgar/filing/10-k/amh-FY24-10-K.html'}, {'name': 'amh-Q225-10-Q', 'url': 'https://storage.googleapis.com/reflexivity-documents-prod/edgar/filing/10-q/amh-Q225-10-Q.html'}, {'name': 'amh-Q324-10-Q', 'url': 'https://storage.googleapis.com/reflexivity-documents-prod/edgar/filing/10-q/amh-Q324-10-Q.html'}]",132221970,USD,SMART,STK
INVH,RE2,real estate,residential_reit,US46187W1071,INVITATION HOMES INC,5,"Opera como un fideicomiso de inversión inmobiliaria residencial líder, centrado en la adquisición, renovación y arrendamiento de viviendas unifamiliares en alquiler.","Invitation Homes opera como un fideicomiso de inversión inmobiliaria (REIT), con un modelo de negocio centrado en viviendas unifamiliares para alquiler. La empresa posee una cartera sustancial de viviendas unifamiliares y genera ingresos principalmente a través de operaciones de alquiler, alineándose con las actividades principales de un REIT residencial. Como REIT, Invitation Homes se enfoca en adquirir, administrar y arrendar viviendas unifamiliares, con discusiones sobre métricas financieras como FFO principal y AFFO que reflejan su desempeño operativo e iniciativas estratégicas destinadas a impulsar el valor para el accionista a largo plazo.","[{'name': 'invh-FY24-10-K', 'url': 'https://storage.googleapis.com/reflexivity-documents-prod/edgar/filing/10-k/invh-FY24-10-K.html'}, {'name': 'invh-Q324-10-Q', 'url': 'https://storage.googleapis.com/reflexivity-documents-prod/edgar/filing/10-q/invh-Q324-10-Q.html'}]",264405214,USD,SMART,STK
DWNI,RE2,real estate,residential_reit,DE000A0HN5C6,DEUTSCHE WOHNEN SE,6,"Opera como un importante fondo de inversión inmobiliaria residencial, centrándose en la adquisición, gestión y desarrollo de propiedades residenciales para generar ingresos por alquiler y valor a largo plazo.",,,40064795,EUR,SMART,STK
ELS,RE2,real estate,residential_reit,US29472R1086,EQUITY LIFESTYLE PROPERTIES,7,"Se centra en la propiedad y operación de una cartera de comunidades de casas prefabricadas, resorts para vehículos recreativos y marinas, proporcionando una diversa gama de opciones de propiedades residenciales y recreativas dentro del sector de los fideicomisos de inversión inmobiliaria.","El compromiso de la empresa con el tema de REIT Residenciales es sustancial, como lo demuestra su identificación explícita como un fideicomiso de inversión inmobiliaria autoadministrado y autogestionado con un enfoque en propiedades orientadas al estilo de vida. Estas propiedades consisten principalmente en comunidades de casas prefabricadas (MH) y vehículos recreativos (RV), con una cartera significativa de 455 propiedades que contienen 173.340 áreas desarrolladas individuales en los Estados Unidos y Canadá. La estrategia de la empresa incluye aumentar los propietarios de casas prefabricadas en su cartera principal, lo que se refleja en altas tasas de ocupación e ingresos sustanciales del alquiler base de MH, lo que demuestra un claro énfasis en las inversiones inmobiliarias residenciales.","[{'name': 'els-Q125-10-Q', 'url': 'https://storage.googleapis.com/reflexivity-documents-prod/edgar/filing/10-q/els-Q125-10-Q.html'}, {'name': 'els-Q225-10-Q', 'url': 'https://storage.googleapis.com/reflexivity-documents-prod/edgar/filing/10-q/els-Q225-10-Q.html'}, {'name': 'els-FY24-10-K', 'url': 'https://storage.googleapis.com/reflexivity-documents-prod/edgar/filing/10-k/els-FY24-10-K.html'}, {'name': 'els-Q324-10-Q', 'url': 'https://storage.googleapis.com/reflexivity-documents-prod/edgar/filing/10-q/els-Q324-10-Q.html'}]",9584,USD,SMART,STK
ESS,RE2,real estate,residential_reit,US2971781057,ESSEX PROPERTY TRUST INC,8,"Se enfoca en la propiedad, operación y desarrollo de propiedades residenciales multifamiliares, generando ingresos principalmente de viviendas de alquiler en mercados objetivo.","Essex opera como un REIT autoadministrado y autogestionado, centrándose en la adquisición, desarrollo, redesarrollo y gestión de comunidades de apartamentos principalmente en la costa oeste. El enfoque de la empresa en las comunidades de apartamentos, con intereses de propiedad en 259 comunidades de apartamentos operativas que comprenden 62.842 viviendas, destaca el negocio principal de la empresa como propiedades residenciales. Como REIT, el modelo de negocio de Essex gira fundamentalmente en torno a las propiedades residenciales.","[{'name': 'ess-Q225-10-Q', 'url': 'https://storage.googleapis.com/reflexivity-documents-prod/edgar/filing/10-q/ess-Q225-10-Q.html'}, {'name': 'ess-Q324-10-Q', 'url': 'https://storage.googleapis.com/reflexivity-documents-prod/edgar/filing/10-q/ess-Q324-10-Q.html'}, {'name': 'ess-FY24-10-K', 'url': 'https://storage.googleapis.com/reflexivity-documents-prod/edgar/filing/10-k/ess-FY24-10-K.html'}]",6946,USD,SMART,STK
SUI,RE2,real estate,residential_reit,US8666741041,SUN COMMUNITIES INC,9,"Se dedica a la adquisición, operación y desarrollo de comunidades residenciales como un fideicomiso de inversión inmobiliaria.","La empresa opera como un REIT totalmente integrado con una cartera significativa de propiedades desarrolladas, incluidas comunidades de casas móviles (MH) y vehículos recreativos (RV), en los EE. UU., Canadá y el Reino Unido. Dado que la empresa opera comunidades de MH y parques de vacaciones en el Reino Unido, su enfoque en comunidades de MH y RV, que son principalmente residenciales, la posiciona como un REIT residencial. La operación de comunidades de MH por parte de la empresa como un REIT se alinea directamente con la definición de un REIT residencial.","[{'name': 'sui-FY24-10-K', 'url': 'https://storage.googleapis.com/reflexivity-documents-prod/edgar/filing/10-k/sui-FY24-10-K.html'}]",12485,USD,SMART,STK
WELL,RE2,real estate,residential_reit,US95040Q1040,WELLTOWER INC,10,"Se especializa en la propiedad y gestión de viviendas para personas mayores y otras propiedades residenciales de atención médica, contribuyendo al sector de REIT residenciales al proporcionar soluciones de vida especializadas.","El enfoque de Welltower en las viviendas para personas mayores demuestra su participación en el tema de los REIT residenciales, ya que la empresa posee participaciones en propiedades concentradas en mercados importantes y de alto crecimiento que consisten en viviendas para personas mayores y comunidades de atención postaguda. La empresa invierte con operadores líderes de viviendas para personas mayores, proveedores de atención postaguda y sistemas de salud para financiar los bienes raíces y la infraestructura necesarios para escalar modelos innovadores de prestación de atención. Esta inversión en viviendas para personas mayores, un segmento del sector inmobiliario residencial, pone de relieve la importancia estratégica de Welltower para el sector de los REIT residenciales.","[{'name': 'well-Q324-10-Q', 'url': 'https://storage.googleapis.com/reflexivity-documents-prod/edgar/filing/10-q/well-Q324-10-Q.html'}, {'name': 'well-FY24-10-K', 'url': 'https://storage.googleapis.com/reflexivity-documents-prod/edgar/filing/10-k/well-FY24-10-K.html'}]",207739931,USD,SMART,STK
UDR,RE2,real estate,residential_reit,US9026531049,UDR INC,11,"Opera como un destacado fideicomiso de inversión inmobiliaria centrado en la adquisición, desarrollo y gestión de comunidades de apartamentos residenciales en diversos mercados.","UDR opera como un fideicomiso de inversión inmobiliaria (REIT) autoadministrado con un enfoque dedicado en comunidades de apartamentos multifamiliares. Las operaciones principales de la empresa incluyen la propiedad, operación, adquisición, renovación, desarrollo, redesarrollo, disposición y gestión de estas propiedades en mercados específicos de los Estados Unidos. Como REIT residencial, UDR deriva ingresos principalmente de alquileres de apartamentos, lo que convierte el tema de REIT residencial en central para su modelo de negocio y estrategia de inversión.","[{'name': 'udr-FY24-10-K', 'url': 'https://storage.googleapis.com/reflexivity-documents-prod/edgar/filing/10-k/udr-FY24-10-K.html'}, {'name': 'udr-Q324-10-Q', 'url': 'https://storage.googleapis.com/reflexivity-documents-prod/edgar/filing/10-q/udr-Q324-10-Q.html'}]",43274444,USD,SMART,STK
VTR,RE2,real estate,residential_reit,US92276F1003,VENTAS INC.,12,"Participa en la propiedad y gestión de activos inmobiliarios residenciales, contribuyendo al panorama de la industria de fideicomisos de inversión en bienes raíces residenciales.","Ventas, un fideicomiso de inversión inmobiliaria, tiene exposición al tema de REIT Residencial a través de sus inversiones en comunidades de viviendas para personas mayores, que constituyen una parte significativa de su cartera. La empresa opera una cartera operativa de viviendas para personas mayores (SHOP) e invierte en comunidades de viviendas para personas mayores en todo Estados Unidos y Canadá, contratando operadores para administrar estas comunidades. Si bien las comunidades de viviendas para personas mayores son una parte notable de su cartera, las inversiones de Ventas también incluyen edificios médicos ambulatorios, centros de investigación, hospitales e instalaciones de atención médica, lo que indica que los REIT residenciales son un enfoque secundario.","[{'name': 'vtr-Q324-10-Q', 'url': 'https://storage.googleapis.com/reflexivity-documents-prod/edgar/filing/10-q/vtr-Q324-10-Q.html'}, {'name': 'vtr-FY24-10-K', 'url': 'https://storage.googleapis.com/reflexivity-documents-prod/edgar/filing/10-k/vtr-FY24-10-K.html'}]",4044062,USD,SMART,STK
CPT,RE2,real estate,residential_reit,US1331311027,CAMDEN PROPERTY TRUST,13,"Opera como un fideicomiso de inversión inmobiliaria residencial, centrándose en la adquisición, desarrollo y gestión de comunidades de apartamentos multifamiliares.","Camden Property Trust opera como un REIT con un enfoque significativo en propiedades residenciales, específicamente comunidades de apartamentos multifamiliares. El negocio principal de la empresa implica la propiedad, gestión, desarrollo y adquisición de estas comunidades, con un énfasis crítico en el mantenimiento de la calificación REIT. Para mantener esta calificación, la empresa debe distribuir un mínimo del 90% de sus ingresos imponibles anuales a los accionistas en forma de dividendos actuales, lo que resalta aún más su alineación estratégica con los REIT residenciales.","[{'name': 'cpt-Q324-10-Q', 'url': 'https://storage.googleapis.com/reflexivity-documents-prod/edgar/filing/10-q/cpt-Q324-10-Q.html'}, {'name': 'cpt-FY24-10-K', 'url': 'https://storage.googleapis.com/reflexivity-documents-prod/edgar/filing/10-k/cpt-FY24-10-K.html'}]",6004,USD,SMART,STK
MAA,RE2,real estate,residential_reit,US59522J1034,MID-AMERICA APARTMENT COMM,14,"Opera como un fideicomiso de inversión inmobiliaria centrado en la adquisición, desarrollo y gestión de propiedades residenciales multifamiliares.","El enfoque de MAA en el tema de REIT Residencial es evidente a través de su operación como un fideicomiso de inversión inmobiliaria (REIT) autoadministrado y autogestionado centrado en multifamiliares. La compañía posee y opera 293 comunidades de apartamentos, ubicadas principalmente en las regiones del sureste, suroeste y Atlántico medio de los EE. UU., lo que demuestra una inversión significativa en propiedades residenciales. Dado que MAA es explícitamente un REIT centrado en multifamiliares, una parte sustancial de sus ingresos se deriva de propiedades residenciales.","[{'name': 'maa-FY24-10-K', 'url': 'https://storage.googleapis.com/reflexivity-documents-prod/edgar/filing/10-k/maa-FY24-10-K.html'}]",9317,USD,SMART,STK
NLY,RE2,real estate,residential_reit,US0357108390,ANNALY CAPITAL MANAGEMENT IN,15,"Opera dentro del sector de REIT residenciales, centrándose en inversiones inmobiliarias residenciales.","La estrategia de inversión de Annaly demuestra un enfoque en el tema de REIT residenciales a través de su cartera de inversiones relacionadas con bienes raíces, que incluyen préstamos hipotecarios residenciales, certificados de traspaso hipotecario y derechos de administración de hipotecas. La empresa invierte en valores respaldados por hipotecas de agencias garantizados por hipotecas residenciales, que están garantizados por Fannie Mae, Freddie Mac o Ginnie Mae. Además, Annaly ha optado por ser gravada como un fideicomiso de inversión inmobiliaria, lo que refuerza su alineación con el sector de REIT residenciales.","[{'name': 'nly-Q225-10-Q', 'url': 'https://storage.googleapis.com/reflexivity-documents-prod/edgar/filing/10-q/nly-Q225-10-Q.html'}]",585013481,USD,SMART,STK
SBRA,RE2,real estate,residential_reit,US78573L1061,SABRA HEALTH CARE REIT INC,16,"Invierte y gestiona una cartera de propiedades inmobiliarias relacionadas con la atención médica, incluidas residencias para personas mayores y centros de enfermería especializada, que son integrales para el sector de fideicomisos de inversión inmobiliaria residencial.","La cartera de inversiones de la empresa incluye comunidades tanto de Viviendas para Personas Mayores Arrendadas como Gestionadas, lo que indica su participación en el sector REIT residencial. Adquieren y gestionan activamente estas propiedades, como lo demuestra la adquisición de unidades adicionales dentro de sus comunidades de Viviendas para Personas Mayores Arrendadas y la adquisición de una comunidad de Viviendas para Personas Mayores Gestionadas. Además, la empresa genera ingresos a través de tarifas de residentes y servicios asociados con estas comunidades de viviendas para personas mayores, aunque esto es parte de una cartera más amplia centrada en la atención médica.","[{'name': 'sbra-Q324-10-Q', 'url': 'https://storage.googleapis.com/reflexivity-documents-prod/edgar/filing/10-q/sbra-Q324-10-Q.html'}, {'name': 'sbra-Q225-10-Q', 'url': 'https://storage.googleapis.com/reflexivity-documents-prod/edgar/filing/10-q/sbra-Q225-10-Q.html'}, {'name': 'sbra-Q125-10-Q', 'url': 'https://storage.googleapis.com/reflexivity-documents-prod/edgar/filing/10-q/sbra-Q125-10-Q.html'}]",80712681,USD,SMART,STK
NHI,RE2,real estate,residential_reit,US63633D1046,NATL HEALTH INVESTORS INC,17,Funciona como un fideicomiso de inversión inmobiliaria con una cartera que incluye propiedades residenciales.,"National Health Investors (NHI) opera como un REIT con un enfoque significativo en viviendas para personas mayores, incluidas las inversiones en residencias de vida independiente (ILF), residencias de vida asistida (ALF), comunidades de tarifa de entrada (EFC) y campus de vida para personas mayores (SLC). Las inversiones de NHI en viviendas para personas mayores se materializan a través de inversiones inmobiliarias, arrendamientos y notas por cobrar de hipotecas y otros. La empresa también está transicionando propiedades a estructuras de Cartera de Operaciones de Viviendas para Personas Mayores (SHOP), lo que demuestra un énfasis estratégico en las inversiones inmobiliarias residenciales dentro del sector de viviendas para personas mayores.","[{'name': 'nhi-Q125-10-Q', 'url': 'https://storage.googleapis.com/reflexivity-documents-prod/edgar/filing/10-q/nhi-Q125-10-Q.html'}, {'name': 'nhi-FY24-10-K', 'url': 'https://storage.googleapis.com/reflexivity-documents-prod/edgar/filing/10-k/nhi-FY24-10-K.html'}]",10245,USD,SMART,STK
LEG,RE2,real estate,residential_reit,DE000LEG1110,LEG IMMOBILIEN SE,18,"Se enfoca en la adquisición, gestión y alquiler de propiedades residenciales, contribuyendo al sector más amplio de fideicomisos de inversión inmobiliaria residencial.",,,121764205,EUR,SMART,STK
STWD,RE2,real estate,residential_reit,US85571B1052,STARWOOD PROPERTY TRUST INC,19,Opera dentro del sector de REIT Residenciales.,"La participación de la empresa en el tema de los REIT residenciales es evidente a través de su Segmento de Préstamos Comerciales y Residenciales, que se enfoca en originar, adquirir, financiar y administrar hipotecas comerciales y residenciales no respaldadas por agencias en EE. UU., Europa y Australia. Las inversiones de este segmento incluyen préstamos residenciales, junto con otras inversiones de deuda relacionadas con bienes raíces. Además, el Segmento de Propiedades Inmobiliarias adquiere y administra activamente participaciones de capital en bienes raíces comerciales estabilizados y por estabilizar, incluidas propiedades multifamiliares mantenidas para inversión.","[{'name': 'stwd-Q125-10-Q', 'url': 'https://storage.googleapis.com/reflexivity-documents-prod/edgar/filing/10-q/stwd-Q125-10-Q.html'}, {'name': 'stwd-Q225-10-Q', 'url': 'https://storage.googleapis.com/reflexivity-documents-prod/edgar/filing/10-q/stwd-Q225-10-Q.html'}]",67418868,USD,SMART,STK
LTC,RE2,real estate,residential_reit,US5021751020,LTC PROPERTIES INC,20,"Invierte y gestiona propiedades dentro del sector inmobiliario residencial, incluidas instalaciones de atención a largo plazo, contribuyendo a las necesidades de vivienda y atención de grupos demográficos específicos.","El enfoque de la empresa en viviendas para personas mayores, que incluyen comunidades de vida independiente, vida asistida y cuidado de la memoria, demuestra su inversión en propiedades residenciales. Una parte significativa de la cartera de inversión bruta de la empresa, aproximadamente el 99,4%, se asigna a propiedades de viviendas y atención médica para personas mayores. Esto incluye propiedades de viviendas para personas mayores de propiedad con 4.472 unidades y representa el 54,0% de las inversiones totales a 30 de junio de 2025. Como REIT, las actividades de la empresa en viviendas para personas mayores, que incluyen comunidades de vida asistida y vida independiente, enfatizan aún más su conexión con las propiedades residenciales.","[{'name': 'ltc-Q225-10-Q', 'url': 'https://storage.googleapis.com/reflexivity-documents-prod/edgar/filing/10-q/ltc-Q225-10-Q.html'}, {'name': 'ltc-Q324-10-Q', 'url': 'https://storage.googleapis.com/reflexivity-documents-prod/edgar/filing/10-q/ltc-Q324-10-Q.html'}, {'name': 'ltc-FY24-10-K', 'url': 'https://storage.googleapis.com/reflexivity-documents-prod/edgar/filing/10-k/ltc-FY24-10-K.html'}]",9240,USD,SMART,STK
KW,RE2,real estate,residential_reit,US4893981070,KENNEDY-WILSON HOLDINGS INC,21,Participa en negocios relevantes para la industria de REIT residenciales.,"El enfoque de la compañía en la vivienda de alquiler es evidente, ya que constituye el 66% de sus activos bajo gestión y es central para su estrategia comercial. Están expandiendo activamente sus plataformas de apartamentos en EE. UU. y de viviendas unifamiliares en Europa, complementadas por una sólida cartera de actividades centradas en la vivienda de alquiler. Además, la compañía es un importante prestamista de construcción en los sectores de viviendas multifamiliares y para estudiantes, con una importante cartera de coinversión ahora fuertemente inclinada hacia propiedades multifamiliares.",,70298853,USD,SMART,STK
IRT,RE2,real estate,residential_reit,US45378A1060,INDEPENDENCE REALTY TRUST IN,22,"Se dedica a la propiedad, operación y desarrollo de propiedades residenciales de alquiler, contribuyendo al suministro de unidades de vivienda dentro del sector de los fideicomisos de inversión inmobiliaria.","El modelo de negocio de IRT se centra en operar como un REIT, con un enfoque principal en la inversión en propiedades residenciales, específicamente comunidades de apartamentos multifamiliares. Esto es evidente en sus discusiones sobre ingresos, gastos y rendimiento operativo de la propiedad. La empresa enfatiza que el incumplimiento de los requisitos para calificar como REIT podría tener consecuencias adversas, lo que resalta aún más la importancia de esta estructura para sus operaciones.","[{'name': 'irt-FY24-10-K', 'url': 'https://storage.googleapis.com/reflexivity-documents-prod/edgar/filing/10-k/irt-FY24-10-K.html'}]",132629528,USD,SMART,STK
DHC,RE2,real estate,residential_reit,US25525P1075,DIVERSIFIED HEALTHCARE TRUST,23,Contribuye al sector de REIT residenciales mediante la propiedad y gestión de propiedades residenciales que generan ingresos.,,,397803941,USD,SMART,STK
DOC,RE2,real estate,residential_reit,US42250P1030,HEALTHPEAK PROPERTIES INC,24,Opera como un REIT Residencial.,,,389700396,USD,SMART,STK
EFC,RE2,real estate,residential_reit,US28852N1090,ELLINGTON FINANCIAL INC,25,"Opera como un REIT Residencial, enfocando sus estrategias de inversión en el mercado inmobiliario residencial.","Ellington Financial demuestra su conexión con el tema de los REIT Residenciales a través de sus diversificadas carteras de préstamos hipotecarios residenciales, que han sido una fuente confiable de crecimiento y rentabilidad. La empresa invierte estratégicamente en préstamos y activos inmobiliarios residenciales, incluidos préstamos no conformes (non-QM), préstamos de transición residencial y valores respaldados por hipotecas residenciales de agencias (RMBS), y también opera Longbridge Financial, una plataforma de originación de hipotecas inversas. Además, Ellington Financial participa activamente en operaciones de titulización dentro del sector hipotecario residencial, asegurando financiación a largo plazo en condiciones favorables.","[{'name': 'efc-Q324-10-Q', 'url': 'https://storage.googleapis.com/reflexivity-documents-prod/edgar/filing/10-q/efc-Q324-10-Q.html'}]",355090937,USD,SMART,STK
COV,RE2,real estate,residential_reit,FR0000064578,COVIVIO,26,"Implica la propiedad y gestión de propiedades inmobiliarias residenciales, generando ingresos principalmente a través de actividades de alquiler.",,,29855036,EUR,SMART,STK
