symbol,theme_id,industry,theme,isin_code,name,rank,description,evidence,evidenceSources,ib_conid,currency,exchange,assetType
UMH,RE2,real estate,residential_reit,US9030021037,UMH PROPERTIES INC,27,"Se enfoca en la propiedad y operación de propiedades inmobiliarias residenciales, contribuyendo al mercado más amplio de REIT residenciales.","UMH Properties opera como un fideicomiso de inversión inmobiliaria, obteniendo sus ingresos principalmente de operaciones de alquiler de bienes raíces dentro de comunidades de casas prefabricadas. El modelo de negocio de la empresa se centra en la operación de 141 comunidades de casas prefabricadas que abarcan aproximadamente 26,500 lotes desarrollados, incluyendo 10,400 casas de alquiler propiedad de la empresa. Este enfoque en las comunidades de casas prefabricadas, junto con el arrendamiento de espacios y casas prefabricadas, posiciona a UMH Properties como un REIT residencial.","[{'name': 'umh-Q125-10-Q', 'url': 'https://storage.googleapis.com/reflexivity-documents-prod/edgar/filing/10-q/umh-Q125-10-Q.html'}]",38615181,USD,SMART,STK
ABR,RE2,real estate,residential_reit,US0389231087,ARBOR REALTY TRUST INC,28,"Opera como un fideicomiso de inversión inmobiliaria centrado en propiedades residenciales, contribuyendo así al sector de REIT residenciales.",,,29661257,USD,SMART,STK
AHR,RE2,real estate,residential_reit,US3981823038,AMERICAN HEALTHCARE REIT INC,29,"Mantiene inversiones en propiedades residenciales, principalmente dentro del sector de la atención médica, alineándose con el tema de REIT residenciales.",,,682161364,USD,SMART,STK
VRE,RE2,real estate,residential_reit,US5544891048,VERIS RESIDENTIAL INC,30,"Se enfoca en la propiedad y gestión de propiedades inmobiliarias residenciales, operando como un fideicomiso de inversión inmobiliaria.","El negocio principal de Veris Residential gira en torno a operar como un REIT residencial, centrándose en propiedades multifamiliares y generando ingresos de alquileres, como lo demuestra su enfoque en el FFO principal y el crecimiento del NOI de las mismas tiendas. Esto está respaldado además por la gestión activa de su cartera y balance general para mejorar el rendimiento financiero y su enfoque en mantener el estatus de REIT. El rendimiento financiero de la compañía está ligado a los ingresos por alquileres y la venta de propiedades de alquiler multifamiliares, solidificando su especialización en el sector residencial.","[{'name': 'vre-Q324-10-Q', 'url': 'https://storage.googleapis.com/reflexivity-documents-prod/edgar/filing/10-q/vre-Q324-10-Q.html'}, {'name': 'vre-FY24-10-K', 'url': 'https://storage.googleapis.com/reflexivity-documents-prod/edgar/filing/10-k/vre-FY24-10-K.html'}]",5775,USD,SMART,STK
CTRE,RE2,real estate,residential_reit,US14174T1079,CARETRUST REIT INC,31,Sus operaciones se centran en la adquisición y gestión de propiedades residenciales.,,,152254614,USD,SMART,STK
DEI,RE2,real estate,residential_reit,US25960P1093,DOUGLAS EMMETT INC,32,Se enfoca en la propiedad y gestión de inmuebles dentro del sector de los fideicomisos de inversión inmobiliaria residencial.,"El enfoque de la empresa en propiedades multifamiliares es evidente a través de la operación de comunidades multifamiliares de primer nivel y la inversión en estas propiedades. Esto se demuestra aún más por la conversión de una torre de oficinas en apartamentos de alquiler por parte de la empresa y la presentación separada del desempeño financiero de sus propiedades multifamiliares. La cartera de la empresa incluye múltiples propiedades multifamiliares con miles de unidades, con altas tasas de arrendamiento a 30 de septiembre de 2024, lo que indica un enfoque estratégico en propiedades residenciales dentro de su estructura de REIT, y la empresa obtiene ingresos del alquiler de apartamentos.","[{'name': 'dei-FY24-10-K', 'url': 'https://storage.googleapis.com/reflexivity-documents-prod/edgar/filing/10-k/dei-FY24-10-K.html'}, {'name': 'dei-Q324-10-Q', 'url': 'https://storage.googleapis.com/reflexivity-documents-prod/edgar/filing/10-q/dei-Q324-10-Q.html'}]",41235770,USD,SMART,STK
AAT,RE2,real estate,residential_reit,US0240131047,AMERICAN ASSETS TRUST INC,33,Se centra en la propiedad y operación de propiedades residenciales dentro del sector de los fideicomisos de inversión inmobiliaria.,"La participación de la empresa en el tema de los REIT residenciales es evidente a través de su propiedad, operación, adquisición y desarrollo de propiedades multifamiliares. Su cartera incluye seis propiedades multifamiliares, y el segmento multifamiliar contribuyó con el 14,3% de los ingresos totales de la empresa para el año finalizado el 31 de diciembre de 2024. Como REIT, la empresa obtiene ingresos del alquiler de apartamentos, lo que indica un enfoque significativo en las inversiones inmobiliarias residenciales.","[{'name': 'aat-FY24-10-K', 'url': 'https://storage.googleapis.com/reflexivity-documents-prod/edgar/filing/10-k/aat-FY24-10-K.html'}, {'name': 'aat-Q324-10-Q', 'url': 'https://storage.googleapis.com/reflexivity-documents-prod/edgar/filing/10-q/aat-Q324-10-Q.html'}]",82819360,USD,SMART,STK
DX,RE2,real estate,residential_reit,US26817Q8868,DYNEX CAPITAL INC,34,"Invierte en valores respaldados por hipotecas residenciales de agencias, proporcionando capital y liquidez que respaldan el mercado de la vivienda residencial, un componente clave del sector más amplio de REIT residenciales.",,,370528221,USD,SMART,STK
