symbol,industry_id,theme_id,industry,theme,isin_code,name,rank,description,evidence,evidenceSources,ib_conid,currency,exchange,assetType
GOOGL,TE,SEA,technology,search_engine_services,US02079K3059,ALPHABET INC-CL A,1,"Es el principal proveedor de servicios de motores de búsqueda globales, sirviendo a miles de millones de usuarios y sustentando un vasto ecosistema de publicidad digital.","El compromiso de Google con los servicios de motores de búsqueda es sustancial, como lo demuestran los ingresos significativos generados a través de 'Google Search y otros', que abarcan los ingresos de las propiedades de búsqueda de Google y el tráfico de socios de distribución de búsqueda. El compromiso de la compañía se destaca aún más por el crecimiento de ingresos de dos dígitos en Búsqueda y la introducción continua de nuevas funciones de búsqueda. La integración de la IA, ejemplificada por las Descripciones generales de IA que llegan a miles de millones de usuarios y el desarrollo del Modo IA, subraya la importancia estratégica de los servicios de motores de búsqueda para el negocio general de Google y su dedicación a la innovación en esta área, con los modelos Gemini utilizando la búsqueda profundamente como una herramienta.","[{'name': 'googl-Q125-10-Q', 'url': 'https://storage.googleapis.com/reflexivity-documents-prod/edgar/filing/10-q/googl-Q125-10-Q.html'}, {'name': 'googl-Q225-10-Q', 'url': 'https://storage.googleapis.com/reflexivity-documents-prod/edgar/filing/10-q/googl-Q225-10-Q.html'}, {'name': 'googl-Q324-10-Q', 'url': 'https://storage.googleapis.com/reflexivity-documents-prod/edgar/filing/10-q/googl-Q324-10-Q.html'}, {'name': 'googl-FY24-10-K', 'url': 'https://storage.googleapis.com/reflexivity-documents-prod/edgar/filing/10-k/googl-FY24-10-K.html'}]",208813719,USD,SMART,STK
MSFT,TE,SEA,technology,search_engine_services,US5949181045,MICROSOFT CORP,2,"Opera Bing, un importante servicio de motor de búsqueda que proporciona capacidades de búsqueda web y se integra con sus diversas ofertas de software y hardware.","La participación de Microsoft en los servicios de motores de búsqueda es evidente a través de sus ingresos por publicidad de búsqueda y noticias. Estos ingresos han experimentado un crecimiento constante, impulsado por un mayor volumen de búsqueda e ingresos por búsqueda, así como por los beneficios de las asociaciones de terceros. La empresa también ha introducido el modo Copilot en Edge, integrando capacidades de búsqueda e IA en su navegador. Esta actividad indica el compromiso e inversión continuos de Microsoft en servicios de motores de búsqueda.","[{'name': 'msft-Q125-10-Q', 'url': 'https://storage.googleapis.com/reflexivity-documents-prod/edgar/filing/10-q/msft-Q125-10-Q.html'}, {'name': 'msft-FY25-10-K', 'url': 'https://storage.googleapis.com/reflexivity-documents-prod/edgar/filing/10-k/msft-FY25-10-K.html'}, {'name': 'msft-Q325-10-Q', 'url': 'https://storage.googleapis.com/reflexivity-documents-prod/edgar/filing/10-q/msft-Q325-10-Q.html'}, {'name': 'msft-Q225-10-Q', 'url': 'https://storage.googleapis.com/reflexivity-documents-prod/edgar/filing/10-q/msft-Q225-10-Q.html'}]",272093,USD,SMART,STK
9888,TE,SEA,technology,search_engine_services,KYG070341048,BAIDU INC-CLASS A,3,"Proporciona servicios líderes de motores de búsqueda, sirviendo como una puerta de entrada principal de información para una vasta base de usuarios.",,,476787454,HKD,SEHK,STK
BIDU,TE,SEA,technology,search_engine_services,US0567521085,BAIDU INC - SPON ADR,4,"Opera como un proveedor líder de servicios de motores de búsqueda, ofreciendo recuperación integral de información y acceso a contenido en línea a una vasta base de usuarios.",,,35359385,USD,SMART,STK
AMZN,TE,SEA,technology,search_engine_services,US0231351067,AMAZON.COM INC,5,"Proporciona un importante motor de búsqueda de productos dentro de su plataforma de comercio electrónico, facilitando el descubrimiento y la compra de bienes y ofreciendo oportunidades de publicidad basadas en consultas de búsqueda.",,,3691937,USD,SMART,STK
035420,TE,SEA,technology,search_engine_services,KR7035420009,NAVER CORP,6,Ofrece servicios de motor de búsqueda.,,,36834734,KRW,KSE,STK
SEMR,TE,SEA,technology,search_engine_services,US81686C1045,SEMRUSH HOLDINGS INC-A,7,"Proporciona una plataforma integral para la optimización de motores de búsqueda y el marketing digital, permitiendo a las empresas mejorar su visibilidad y rendimiento dentro de los servicios de motores de búsqueda.","La plataforma de Semrush se centra en gran medida en la optimización de motores de búsqueda, utilizando datos e inteligencia en su núcleo con centros dedicados impulsados por IA. La empresa tiene como objetivo ayudar a los clientes a mejorar su SEO y comprender la presencia de su marca en los resultados de búsqueda, particularmente en entornos de búsqueda impulsados por IA. Su solución de SEO empresarial ha crecido significativamente, convirtiéndose en el mayor contribuyente al crecimiento general de la empresa, y están desarrollando activamente capacidades de búsqueda con IA, creyendo que la IA está expandiendo la forma en que las personas buscan información. Con un enfoque tanto en los motores de búsqueda tradicionales como en la búsqueda emergente impulsada por IA, Semrush se está posicionando como un recurso clave para las empresas que buscan mejorar su visibilidad en línea.","[{'name': 'semr-Q125-10-Q', 'url': 'https://storage.googleapis.com/reflexivity-documents-prod/edgar/filing/10-q/semr-Q125-10-Q.html'}, {'name': 'semr-Q225-10-Q', 'url': 'https://storage.googleapis.com/reflexivity-documents-prod/edgar/filing/10-q/semr-Q225-10-Q.html'}]",478483413,USD,SMART,STK
ESTC,TE,SEA,technology,search_engine_services,NL0013056914,ELASTIC NV,8,Ofrece un potente motor de búsqueda y análisis que sirve como tecnología fundamental para diversas aplicaciones y servicios basados en búsquedas.,"Elastic se identifica como 'The Search AI Company', enfatizando su enfoque en los servicios de motores de búsqueda. Su plataforma combina la precisión de la búsqueda con la inteligencia artificial, con Elasticsearch en su núcleo. Esta plataforma es utilizada por los clientes para diversas aplicaciones, incluyendo comercio electrónico, gestión de grandes conjuntos de datos y soporte de búsqueda de texto completo y semántica, lo que demuestra el compromiso de la empresa con las tecnologías relacionadas con la búsqueda.",,335844146,USD,SMART,STK
BKNG,TE,SEA,technology,search_engine_services,US09857L1089,BOOKING HOLDINGS INC,9,Confía en los servicios de motores de búsqueda para adquirir clientes y dirigir tráfico a sus plataformas de reserva de viajes en línea.,"La estrategia de marketing de rendimiento de Booking Holdings se basa en motores de búsqueda en línea, principalmente Google, para generar tráfico y reservas en sus plataformas. Una gran mayoría de los gastos de marketing de la empresa se asignan a estos motores de búsqueda, junto con el marketing de afiliados, los metabuscadores y los canales de redes sociales. Esto indica una inversión significativa en servicios de motores de búsqueda, aunque la empresa no posee tecnología de motor de búsqueda propietaria.","[{'name': 'bkng-FY24-10-K', 'url': 'https://storage.googleapis.com/reflexivity-documents-prod/edgar/filing/10-k/bkng-FY24-10-K.html'}, {'name': 'bkng-Q225-10-Q', 'url': 'https://storage.googleapis.com/reflexivity-documents-prod/edgar/filing/10-q/bkng-Q225-10-Q.html'}]",308728373,USD,SMART,STK
PINS,TE,SEA,technology,search_engine_services,US72352L1061,PINTEREST INC- CLASS A,10,"Opera un motor de descubrimiento visual que permite a los usuarios buscar y guardar ideas y productos, sirviendo así como una plataforma especializada dentro del panorama de los servicios de motores de búsqueda.","La conexión de Pinterest con el tema de los Servicios de Motores de Búsqueda es evidente en su funcionalidad principal y dirección estratégica. La empresa se identifica como una plataforma de búsqueda y descubrimiento visual, invirtiendo fuertemente en capacidades de búsqueda visual impulsadas por IA para mejorar la experiencia del usuario y impulsar la monetización. Esto está respaldado además por su dependencia de motores de búsqueda como Google, Bing y Yahoo! para dirigir tráfico a su plataforma, y Pinterest aprovecha la IA para personalizar las experiencias de los usuarios y diferenciarse en el mercado.","[{'name': 'pins-Q225-10-Q', 'url': 'https://storage.googleapis.com/reflexivity-documents-prod/edgar/filing/10-q/pins-Q225-10-Q.html'}, {'name': 'pins-Q125-10-Q', 'url': 'https://storage.googleapis.com/reflexivity-documents-prod/edgar/filing/10-q/pins-Q125-10-Q.html'}]",360975915,USD,SMART,STK
YEXT,TE,SEA,technology,search_engine_services,US98585N1063,YEXT INC,11,Proporciona una plataforma de experiencia de búsqueda que permite a las empresas gestionar y optimizar su presencia digital en varios motores de búsqueda y directorios en línea.,"La plataforma de Yext está diseñada para gestionar y mejorar la visibilidad digital de las marcas, particularmente dentro del fragmentado mercado de búsqueda de consumidores. La plataforma de presencia digital de la empresa permite a las empresas estructurar y organizar su información, que luego se distribuye a través de una red de más de 200 proveedores de servicios y aplicaciones, incluidos los principales motores de búsqueda como Google y Bing. Los productos principales de Yext, incluidos Listings, Reviews, Pages y Search, están diseñados para ayudar a las marcas a gestionar su visibilidad digital y abordar los desafíos que presenta el cambiante panorama de la búsqueda. Al centrarse en la visibilidad de la marca y la correcta construcción de citas, Yext tiene como objetivo ayudar a las empresas a gestionar su presencia digital en el mercado de búsqueda.","[{'name': 'yext-Q126-10-Q', 'url': 'https://storage.googleapis.com/reflexivity-documents-prod/edgar/filing/10-q/yext-Q126-10-Q.html'}, {'name': 'yext-Q325-10-Q', 'url': 'https://storage.googleapis.com/reflexivity-documents-prod/edgar/filing/10-q/yext-Q325-10-Q.html'}]",272561934,USD,SMART,STK
EXPE,TE,SEA,technology,search_engine_services,US30212P3038,EXPEDIA GROUP INC,12,"Ofrece una extensa plataforma en línea para reservas e información de viajes, contribuyendo a la amplitud y utilidad de los servicios de motores de búsqueda al suministrar una amplia gama de contenido de viajes indexado y destinos para las consultas de los usuarios.","La conexión de Expedia Group con el tema de los servicios de motores de búsqueda es evidente a través de sus estrategias de marketing, que incluyen la búsqueda en Internet y la metabúsqueda. La empresa reconoce la influencia competitiva de las empresas de motores de búsqueda como Google y posee una participación mayoritaria en trivago, un sitio web de metabúsqueda de hoteles. Expedia también reconoce el creciente enfoque de las autoridades fiscales en los servicios digitales, lo que refleja la creciente importancia de las plataformas en línea y las actividades relacionadas con la búsqueda.","[{'name': 'expe-Q225-10-Q', 'url': 'https://storage.googleapis.com/reflexivity-documents-prod/edgar/filing/10-q/expe-Q225-10-Q.html'}]",98542021,USD,SMART,STK
035720,TE,SEA,technology,search_engine_services,KR7035720002,KAKAO CORP,13,"Ofrece servicios de motor de búsqueda como componente de su plataforma digital integrada, facilitando el descubrimiento de información para los usuarios.",,,36834724,KRW,KSE,STK
YELP,TE,SEA,technology,search_engine_services,US9858171054,YELP INC,14,"Proporciona una plataforma que permite a los usuarios buscar y conectarse con negocios locales, ofreciendo información detallada, reseñas y capacidades de reserva.","La función principal de Yelp gira en torno a su plataforma de búsqueda y descubrimiento local, donde los usuarios pueden encontrar negocios y servicios en su cercanía. La compañía genera ingresos a partir de productos publicitarios basados en el rendimiento al hacer coincidir anuncios con las búsquedas de negocios locales de los consumidores. Yelp invierte constantemente en mejorar sus capacidades de búsqueda, incluyendo mejoras en la experiencia del usuario, optimizaciones de backend e integración de IA para procesar consultas en lenguaje natural, todo ello con el objetivo de mejorar las conexiones entre consumidores y negocios. Estos esfuerzos incluyen la introducción de temas de tendencia y sugerencias para agilizar el proceso de búsqueda, lo que lleva a una mayor participación del usuario y visualizaciones de páginas de negocios.","[{'name': 'yelp-Q225-10-Q', 'url': 'https://storage.googleapis.com/reflexivity-documents-prod/edgar/filing/10-q/yelp-Q225-10-Q.html'}, {'name': 'yelp-FY24-10-K', 'url': 'https://storage.googleapis.com/reflexivity-documents-prod/edgar/filing/10-k/yelp-FY24-10-K.html'}, {'name': 'yelp-Q324-10-Q', 'url': 'https://storage.googleapis.com/reflexivity-documents-prod/edgar/filing/10-q/yelp-Q324-10-Q.html'}]",103518430,USD,SMART,STK
IAC,TE,SEA,technology,search_engine_services,US44891N2080,IAC INC,15,Opera varias plataformas digitales que utilizan y están conectadas al ecosistema de Servicios de Motores de Búsqueda.,"IAC participa en el tema de los Servicios de Motores de Búsqueda principalmente a través de su segmento de Búsqueda, que incluye Ask Media Group, una colección de sitios web que brindan servicios e información de búsqueda general. La empresa genera ingresos a través de la visualización de listados de pago en respuesta a consultas de búsqueda y ha renovado su contrato con Google para servicios relacionados con la búsqueda. Sin embargo, la empresa también discute el impacto de los resultados de búsqueda de Google y la IA en su tráfico e ingresos, y está diversificando activamente para alejarse de la dependencia del tráfico de búsqueda de Google, lo que indica una dinámica fluctuante dentro de este sector.","[{'name': 'iac-Q324-10-Q', 'url': 'https://storage.googleapis.com/reflexivity-documents-prod/edgar/filing/10-q/iac-Q324-10-Q.html'}, {'name': 'iac-Q125-10-Q', 'url': 'https://storage.googleapis.com/reflexivity-documents-prod/edgar/filing/10-q/iac-Q125-10-Q.html'}, {'name': 'iac-Q225-10-Q', 'url': 'https://storage.googleapis.com/reflexivity-documents-prod/edgar/filing/10-q/iac-Q225-10-Q.html'}, {'name': 'iac-FY24-10-K', 'url': 'https://storage.googleapis.com/reflexivity-documents-prod/edgar/filing/10-k/iac-FY24-10-K.html'}]",491653063,USD,SMART,STK
TRIP,TE,SEA,technology,search_engine_services,US8969452015,TRIPADVISOR INC,16,Confía en los servicios de motores de búsqueda para impulsar el tráfico de usuarios y la visibilidad de su plataforma de planificación y reserva de viajes.,,,98542026,USD,SMART,STK
AAPL,TE,SEA,technology,search_engine_services,US0378331005,APPLE INC,17,"Facilita el acceso a los servicios de motores de búsqueda a través de sus sistemas operativos y navegadores web, aprovechando a menudo las asociaciones para proporcionar opciones de búsqueda predeterminadas para sus usuarios.",,,265598,USD,SMART,STK
META,TE,SEA,technology,search_engine_services,US30303M1027,META PLATFORMS INC-CLASS A,18,"Proporciona funcionalidades de búsqueda interna dentro de sus plataformas de redes sociales, permitiendo a los usuarios descubrir contenido, perfiles y comunidades.",,,107113386,USD,SMART,STK
RDDT,TE,SEA,technology,search_engine_services,US75734B1008,REDDIT INC-CL A,19,Proporciona un vasto repositorio de contenido generado por el usuario y discusiones que sirven como una fuente significativa de información indexada y presentada por los servicios de motores de búsqueda.,"Reddit está trabajando activamente para convertirse en un destino de búsqueda prominente al unificar la búsqueda tradicional de Reddit con Reddit Answers, un producto de búsqueda basado en LLM, en una única experiencia de búsqueda. Esta iniciativa está respaldada por una base de usuarios sustancial, con 70 millones de usuarios semanales del producto de búsqueda principal y 6 millones de usuarios de Reddit Answers, que ha experimentado un crecimiento significativo. Reddit se enfoca en integrar la búsqueda de manera más profunda en la experiencia principal del usuario y expandir Reddit Answers a nivel mundial, enfatizando la importancia de la búsqueda para ayudar a los usuarios a encontrar información y descubrir comunidades dentro de la plataforma. Además, Reddit está invirtiendo en mejorar su funcionalidad de búsqueda y en integrarla en todo su producto, con el objetivo de agilizar el camino de la pregunta a la respuesta y crear una experiencia de búsqueda más intuitiva tanto para usuarios nuevos como existentes.",,692025016,USD,SMART,STK
CSGP,TE,SEA,technology,search_engine_services,US22160N1090,COSTAR GROUP INC,20,Refleja el compromiso de la empresa con los servicios de motores de búsqueda.,,,6726677,USD,SMART,STK
MDB,TE,SEA,technology,search_engine_services,US60937P1066,MONGODB INC,21,Soporta la infraestructura de datos subyacente para los servicios de motores de búsqueda.,"La participación de MongoDB con los servicios de motores de búsqueda es evidente a través de la inclusión nativa de capacidades como búsqueda y búsqueda vectorial dentro de sus ofertas de bases de datos. MongoDB Atlas, la base de datos multicloud como servicio alojada por la empresa, incorpora MongoDB Atlas Search como una característica, con Atlas Vector Search siendo aprovechado por plataformas como DevRev para la búsqueda semántica. Además, MongoDB ha ampliado la disponibilidad de Atlas Search Nodes en más regiones en la nube, proporcionando infraestructura dedicada para casos de uso de búsqueda, permitiendo a los clientes escalar de forma independiente.","[{'name': 'mdb-Q126-10-Q', 'url': 'https://storage.googleapis.com/reflexivity-documents-prod/edgar/filing/10-q/mdb-Q126-10-Q.html'}, {'name': 'mdb-Q325-10-Q', 'url': 'https://storage.googleapis.com/reflexivity-documents-prod/edgar/filing/10-q/mdb-Q325-10-Q.html'}, {'name': 'mdb-FY25-10-K', 'url': 'https://storage.googleapis.com/reflexivity-documents-prod/edgar/filing/10-k/mdb-FY25-10-K.html'}]",292833239,USD,SMART,STK
