symbol,industry_id,theme_id,industry,theme,isin_code,name,rank,description,evidence,ib_conid,currency,exchange,assetType,evidenceSources
SLB,EU,SHA,energy and utilities,shale_gas,AN8068571086,SLB LTD,1,"Proporciona tecnologías y servicios críticos esenciales para la exploración, el desarrollo y la producción de gas de esquisto, impactando significativamente las capacidades operativas de la industria.","La participación de SLB en el Gas de Esquistos es evidente a través de su participación en actividades de gas tanto convencionales como no convencionales, particularmente en Medio Oriente y Asia, donde estos recursos proporcionan un impulso para la actividad. El enfoque de la empresa en el gas se ve aún más subrayado por su ambición de hacer crecer su negocio de gas en un 40% para 2030, y el gas no convencional sigue siendo una prioridad. Esto incluye la actividad de gas natural no convencional en aumento en Arabia Saudita, lo que indica la exposición internacional de SLB al gas, incluidas las fuentes no convencionales.",12200,USD,SMART,STK,
EQT,EU,SHA,energy and utilities,shale_gas,US26884L1098,EQT CORP,2,"Opera como un productor de primer nivel en el sector del gas de esquisto, impactando significativamente el suministro y desarrollo de gas natural.","El enfoque de EQT en el gas de esquisto es evidente a través de sus operaciones en la Cuenca Apalache, que incluye importantes reservas de gas de esquisto. La adquisición de los activos de producción upstream de Olympus Energy, que comprenden una posición verticalmente integrada de 90,000 acres netos adyacentes a la superficie de EQT en el suroeste de los Apalaches, subraya aún más este enfoque, con una producción neta de aproximadamente 500 millones de pies cúbicos por día. Estos activos tienen más de 10 años de inventario principal de Marcellus, asumiendo niveles de actividad de mantenimiento, con 7 años adicionales de potencial de crecimiento de Utica, y EQT está en conversaciones con una docena de proyectos de energía propuestos en la región de los Apalaches, proporcionando un valor estratégico potencial a través de futuros acuerdos de suministro de gas.",57698865,USD,SMART,STK,
WMB,EU,SHA,energy and utilities,shale_gas,US9694571004,WILLIAMS COS INC,3,"Desempeña un papel fundamental en la infraestructura de transporte intermedio de gas de esquisto, facilitando su recolección, procesamiento y transporte desde las cuencas de producción hasta los mercados.","La participación de Williams en el Gas de Esquisto es evidente a través de sus operaciones de midstream, que abarcan la recolección, el procesamiento y el almacenamiento de gas natural en regiones clave de esquisto, incluidas las áreas de esquisto Marcellus, Utica, Eagle Ford y Haynesville. El compromiso de la empresa se destaca aún más por la construcción en curso de nuevos activos de recolección de gas natural que se espera que manejen 1.8 Bcf/d de gas natural de la cuenca de esquisto de Haynesville, con el objetivo de abastecer mercados premium y plantas de exportación de GNL. Esto está respaldado por gastos de capital de crecimiento asignados a proyectos dentro de la cuenca de esquisto de Haynesville, como la expansión del Louisiana Energy Gateway, que se anticipa que aumentará los volúmenes de esquisto de Haynesville y fortalecerá en general los volúmenes, lo que refleja su exposición a cuencas cruciales centradas en el gas natural.",13805,USD,SMART,STK,"[{'name': 'wmb-Q125-10-Q', 'url': 'https://storage.googleapis.com/reflexivity-documents-prod/edgar/filing/10-q/wmb-Q125-10-Q.html'}, {'name': 'wmb-FY24-10-K', 'url': 'https://storage.googleapis.com/reflexivity-documents-prod/edgar/filing/10-k/wmb-FY24-10-K.html'}]"
HAL,EU,SHA,energy and utilities,shale_gas,US4062161017,HALLIBURTON CO,4,"Proporciona tecnologías, equipos y servicios esenciales que permiten y optimizan la extracción y producción de gas de esquisto.",,7890,USD,SMART,STK,
CNX,EU,SHA,energy and utilities,shale_gas,US12653C1080,CNX RESOURCES CORP,5,"Impulsa la exploración, el desarrollo y la producción de recursos de gas de esquisto, desempeñando un papel crucial en la cadena de suministro de energía.","Las operaciones de CNX se centran en gran medida en la extracción de gas de esquisto, como lo demuestran sus informes de volúmenes de ventas de gas de esquisto y el rendimiento financiero de su segmento de Esquisto. La empresa perfora y completa activamente pozos en las formaciones de esquisto Utica y Marcellus. La Transacción Apex, que amplía la tenencia de arrendamientos no desarrollados de esquisto de CNX, demuestra aún más el compromiso estratégico de la empresa con el gas de esquisto. Esta transacción proporciona una huella de infraestructura existente que puede aprovecharse para el desarrollo futuro y fue el principal impulsor del aumento de los volúmenes totales de ventas de esquisto.",295296295,USD,SMART,STK,"[{'name': 'cnx-Q125-10-Q', 'url': 'https://storage.googleapis.com/reflexivity-documents-prod/edgar/filing/10-q/cnx-Q125-10-Q.html'}, {'name': 'cnx-Q324-10-Q', 'url': 'https://storage.googleapis.com/reflexivity-documents-prod/edgar/filing/10-q/cnx-Q324-10-Q.html'}, {'name': 'cnx-Q225-10-Q', 'url': 'https://storage.googleapis.com/reflexivity-documents-prod/edgar/filing/10-q/cnx-Q225-10-Q.html'}, {'name': 'cnx-FY24-10-K', 'url': 'https://storage.googleapis.com/reflexivity-documents-prod/edgar/filing/10-k/cnx-FY24-10-K.html'}]"
CVX,EU,SHA,energy and utilities,shale_gas,US1667641005,CHEVRON CORP,6,"Desempeña un papel fundamental en la industria del gas de esquisto, participando en la exploración y desarrollo de extensos recursos de esquisto para satisfacer la demanda energética mundial.","El compromiso de Chevron con el gas de esquisto es evidente a través de su significativa producción y gestión estratégica de activos. La cartera de petróleo de esquisto y petróleo apretado de la empresa, incluidas las operaciones en Permian, DJ y Bakken, representa el 40% de su producción total, lo que equivale a 1,6 millones de barriles por día. Chevron se centra en aplicar eficiencias de capital y operativas para mantener los niveles de producción y generar un flujo de caja sustancial de estos activos. Sin embargo, Chevron también está desinvirtiendo en algunos activos de esquisto, como lo demuestra la venta anunciada de su participación en los activos de esquisto de Duvernay.",5684,USD,SMART,STK,"[{'name': 'cvx-Q324-10-Q', 'url': 'https://storage.googleapis.com/reflexivity-documents-prod/edgar/filing/10-q/cvx-Q324-10-Q.html'}, {'name': 'cvx-Q125-10-Q', 'url': 'https://storage.googleapis.com/reflexivity-documents-prod/edgar/filing/10-q/cvx-Q125-10-Q.html'}]"
CRK,EU,SHA,energy and utilities,shale_gas,US2057683029,COMSTOCK RESOURCES INC,7,"Se enfoca en la exploración y producción de gas natural de formaciones de esquisto, contribuyendo significativamente a la industria del gas de esquisto.","Comstock Resources demuestra un fuerte enfoque en la extracción de gas de esquisto, principalmente dentro de las formaciones de esquisto Haynesville y Bossier, donde se concentran sus activos. La compañía ha invertido más de mil millones de dólares para desarrollar su yacimiento Western Haynesville, que incluye una posición de acreage significativa. Las operaciones de Comstock implican extensas actividades de perforación y completación en estas formaciones de esquisto, con un enfoque en la optimización de técnicas para maximizar la producción y los retornos de los pozos. Su experiencia se extiende a la perforación de algunos de los pozos horizontales de esquisto más profundos y de mayor presión, lo que destaca el compromiso y las capacidades de la compañía dentro de la industria del gas de esquisto.",241891174,USD,SMART,STK,"[{'name': 'crk-Q324-10-Q', 'url': 'https://storage.googleapis.com/reflexivity-documents-prod/edgar/filing/10-q/crk-Q324-10-Q.html'}, {'name': 'crk-Q225-10-Q', 'url': 'https://storage.googleapis.com/reflexivity-documents-prod/edgar/filing/10-q/crk-Q225-10-Q.html'}, {'name': 'crk-FY24-10-K', 'url': 'https://storage.googleapis.com/reflexivity-documents-prod/edgar/filing/10-k/crk-FY24-10-K.html'}, {'name': 'crk-Q125-10-Q', 'url': 'https://storage.googleapis.com/reflexivity-documents-prod/edgar/filing/10-q/crk-Q125-10-Q.html'}]"
EOG,EU,SHA,energy and utilities,shale_gas,US26875P1012,EOG RESOURCES INC,8,"Es un productor independiente líder con importantes actividades de exploración y desarrollo en importantes yacimientos de gas de esquisto, lo que contribuye sustancialmente al suministro de la industria.","EOG Resources demuestra su compromiso con el gas de esquisto a través de su énfasis en la experiencia en perforación horizontal y completación aplicada a yacimientos de gas natural no convencionales, con actividades centradas principalmente en las áreas de la Cuenca Delaware, Eagle Ford y Montañas Rocosas. El emergente yacimiento de gas seco Dorado en el sur de Texas de la compañía, junto con los yacimientos Powder River Basin y Utica Combo, contribuyen a la generación de flujo de caja libre. Además, EOG se está preparando para perforar un prospecto de arena de gas compacta no convencional en tierra en Bahréin y continúa suministrando al mercado de GNL de la Costa del Golfo de Texas a través de acuerdos de venta de gas con Cheniere.",6890,USD,SMART,STK,"[{'name': 'eog-FY24-10-K', 'url': 'https://storage.googleapis.com/reflexivity-documents-prod/edgar/filing/10-k/eog-FY24-10-K.html'}]"
COP,EU,SHA,energy and utilities,shale_gas,US20825C1045,CONOCOPHILLIPS,9,"Se centra en la exploración, el desarrollo y la producción significativos de gas natural a partir de formaciones de esquisto.","La participación de ConocoPhillips en la industria del gas de esquisto es evidente a través de sus yacimientos no convencionales ricos en recursos en América del Norte, incluidos los programas de desarrollo en la Cuenca Delaware, Eagle Ford, Cuenca Midland y Bakken. Las inversiones en tecnología de la empresa también se centran en el gas de esquisto, junto con yacimientos de petróleo convencional y de lutitas, arenas bituminosas, recuperación mejorada de petróleo y GNL. Si bien ConocoPhillips participa en la producción de gas natural en los 48 estados inferiores, sus actividades en gas de esquisto forman parte de una cartera más amplia de recursos y tecnologías energéticas.",10885,USD,SMART,STK,"[{'name': 'cop-Q125-10-Q', 'url': 'https://storage.googleapis.com/reflexivity-documents-prod/edgar/filing/10-q/cop-Q125-10-Q.html'}, {'name': 'cop-FY24-10-K', 'url': 'https://storage.googleapis.com/reflexivity-documents-prod/edgar/filing/10-k/cop-FY24-10-K.html'}]"
RRC,EU,SHA,energy and utilities,shale_gas,US75281A1097,RANGE RESOURCES CORP,10,"Opera como un productor significativo dentro de la industria del gas de esquisto, contribuyendo sustancialmente al suministro y desarrollo de recursos de gas natural.","Range Resources está fuertemente involucrada en la industria del gas de esquisto, como lo demuestra su enfoque en la exploración, desarrollo y adquisición de propiedades de gas natural y líquidos en la región de los Apalaches de los Estados Unidos, una región conocida por la producción de gas de esquisto. La cartera de inversiones de la empresa se centra en activos de gas natural y NGL de alta calidad en la Commonwealth de Pensilvania, que es conocida por la producción de gas de esquisto, y continúa consolidando sus posiciones de acreage en la zona de esquisto de Marcellus en Pensilvania. Además, la empresa reconoce el bajo costo y las bajas emisiones del gas de esquisto, destacando su importancia para respaldar el crecimiento de la demanda estructural de las exportaciones de gas natural licuado de los Estados Unidos, la demanda interna de gas industrial y la generación de energía.",6608450,USD,SMART,STK,"[{'name': 'rrc-Q225-10-Q', 'url': 'https://storage.googleapis.com/reflexivity-documents-prod/edgar/filing/10-q/rrc-Q225-10-Q.html'}, {'name': 'rrc-Q125-10-Q', 'url': 'https://storage.googleapis.com/reflexivity-documents-prod/edgar/filing/10-q/rrc-Q125-10-Q.html'}, {'name': 'rrc-FY24-10-K', 'url': 'https://storage.googleapis.com/reflexivity-documents-prod/edgar/filing/10-k/rrc-FY24-10-K.html'}, {'name': 'rrc-Q324-10-Q', 'url': 'https://storage.googleapis.com/reflexivity-documents-prod/edgar/filing/10-q/rrc-Q324-10-Q.html'}]"
OXY,EU,SHA,energy and utilities,shale_gas,US6745991058,OCCIDENTAL PETROLEUM CORP,11,Mantiene operaciones sustanciales en el desarrollo y producción de recursos de gas de esquisto.,"La participación de la empresa en el tema del Gas de Esquisto es evidente a través de sus operaciones en áreas ricas en esquisto como la Cuenca Pérmica, donde es el mayor poseedor de acreage. Esto incluye la extracción de gas natural de formaciones rocosas de esquisto y la aplicación de CO2 para la recuperación mejorada de petróleo. El enfoque de la empresa en activos no convencionales y su ampliada pista de aterrizaje no convencional en EE. UU., junto con la capacidad de agregar bancos secundarios y EOR, respaldan aún más su participación en la extracción de gas de esquisto.",10880,USD,SMART,STK,
AR,EU,SHA,energy and utilities,shale_gas,US03674X1063,ANTERO RESOURCES CORP,12,"Se enfoca en la exploración, desarrollo y producción de gas natural y líquidos de gas natural a partir de formaciones de esquisto, principalmente en la cuenca de los Apalaches.","El enfoque de la empresa en yacimientos no convencionales, específicamente formaciones de esquisto fracturadas, resalta la importancia del gas de esquisto para sus operaciones. Esto se ve respaldado además por el hecho de que las ventas de líquidos de gas natural constituyen una parte significativa (41,5%) de los ingresos totales de la empresa. El presupuesto de capital neto de la empresa para 2025, que asigna una cantidad sustancial para perforación y completación en la Cuenca de los Apalaches, refuerza su compromiso con el desarrollo de gas de esquisto.",135942630,USD,SMART,STK,"[{'name': 'ar-Q125-10-Q', 'url': 'https://storage.googleapis.com/reflexivity-documents-prod/edgar/filing/10-q/ar-Q125-10-Q.html'}, {'name': 'ar-FY24-10-K', 'url': 'https://storage.googleapis.com/reflexivity-documents-prod/edgar/filing/10-k/ar-FY24-10-K.html'}]"
CTRA,EU,SHA,energy and utilities,shale_gas,US1270971039,COTERRA ENERGY INC,13,"Es un productor y desarrollador significativo de recursos de gas de esquisto, desempeñando un papel clave en las actividades de exploración y producción de la industria.","El compromiso de Coterra Energy con el tema del gas de esquisto es evidente a través de sus operaciones en el esquisto de Marcellus, una importante región productora de gas de esquisto, donde la empresa ha reducido estratégicamente la producción de gas natural en respuesta a precios más débiles. Esta reducción resultó en una disminución estimada de 232 MMcf por día de producción neta entre agosto y noviembre de 2024. Si bien Coterra redujo los gastos de capital en el esquisto de Marcellus, también está aumentando la actividad en la región en $50 millones y observando estructuras de costos mejoradas con laterales más largos. Además, el proyecto Windham Row de la empresa incluye pozos Harkey, lo que indica un interés continuo, aunque potencialmente desafiado, en la extracción de gas de esquisto.",5946,USD,SMART,STK,"[{'name': 'ctra-Q324-10-Q', 'url': 'https://storage.googleapis.com/reflexivity-documents-prod/edgar/filing/10-q/ctra-Q324-10-Q.html'}, {'name': 'ctra-FY24-10-K', 'url': 'https://storage.googleapis.com/reflexivity-documents-prod/edgar/filing/10-k/ctra-FY24-10-K.html'}]"
DVN,EU,SHA,energy and utilities,shale_gas,US25179M1036,DEVON ENERGY CORP,14,"Participa en la exploración y producción de gas natural de formaciones de esquisto, contribuyendo al suministro general de gas de esquisto.","Devon Energy es una empresa de exploración y producción de petróleo y gas natural con operaciones centradas en tierra en los Estados Unidos, específicamente dentro de la Cuenca Delaware, Rockies, Eagle Ford y Anadarko. Si bien la producción de gas de la empresa incluye operaciones en áreas ricas en esquisto como las cuencas Delaware y Anadarko, los documentos no mencionan explícitamente 'gas de esquisto' o 'fracturación hidráulica'. Aunque la empresa participa en la producción de gas natural en cuencas de esquisto, no hay mención explícita de la contribución a los ingresos.",754442,USD,SMART,STK,"[{'name': 'dvn-Q125-10-Q', 'url': 'https://storage.googleapis.com/reflexivity-documents-prod/edgar/filing/10-q/dvn-Q125-10-Q.html'}, {'name': 'dvn-Q225-10-Q', 'url': 'https://storage.googleapis.com/reflexivity-documents-prod/edgar/filing/10-q/dvn-Q225-10-Q.html'}]"
BP.,EU,SHA,energy and utilities,shale_gas,GB0007980591,BP PLC,15,"Es un actor clave en el desarrollo y la producción de gas de esquisto, contribuyendo significativamente al suministro y la infraestructura energética global.",,228891,GBP,SMART,STK,
PTEN,EU,SHA,energy and utilities,shale_gas,US7034811015,PATTERSON-UTI ENERGY INC,16,Proporciona servicios de perforación y completación cruciales para la exploración y producción de recursos de gas de esquisto.,"La empresa demuestra su participación en la industria del gas de esquisto a través de sus servicios para la perforación de pozos horizontales en esquisto y otras áreas de recursos no convencionales. La empresa mejora las capacidades de su flota de perforación para satisfacer las necesidades de los clientes en la perforación de esquisto, con servicios de completamiento operando en cuencas activas como Marcellus Shale/Utica, Eagle Ford y Haynesville. Además, la empresa ha invertido en la preparación de su negocio para la próxima fase de desarrollo de esquisto, centrándose en servicios digitales y automatización para mejorar la eficiencia.",4817001,USD,SMART,STK,"[{'name': 'pten-Q324-10-Q', 'url': 'https://storage.googleapis.com/reflexivity-documents-prod/edgar/filing/10-q/pten-Q324-10-Q.html'}, {'name': 'pten-FY24-10-K', 'url': 'https://storage.googleapis.com/reflexivity-documents-prod/edgar/filing/10-k/pten-FY24-10-K.html'}]"
LBRT,EU,SHA,energy and utilities,shale_gas,US53115L1044,LIBERTY ENERGY INC,17,Proporciona servicios de fracturación hidráulica esenciales para la extracción y producción de recursos de gas de esquisto.,"El enfoque de la compañía en la prestación de servicios de fracturación hidráulica y tecnologías relacionadas a empresas de exploración y producción (E&P) de petróleo y gas natural en tierra, particularmente en cuencas de esquisto, subraya su participación en la extracción de gas de esquisto. Sus servicios se prestan principalmente en las principales cuencas de esquisto, incluidas la Cuenca Pérmica, la Cuenca Williston, Eagle Ford Shale, Haynesville Shale y la Cuenca Apalache (Marcellus Shale y Utica Shale). Las operaciones de la compañía también se extienden a algunas cuencas de esquisto más pequeñas, incluidas la Cuenca Uinta, la Cuenca Powder River y la Cuenca San Juan.",302202060,USD,SMART,STK,"[{'name': 'lbrt-FY24-10-K', 'url': 'https://storage.googleapis.com/reflexivity-documents-prod/edgar/filing/10-k/lbrt-FY24-10-K.html'}, {'name': 'lbrt-Q324-10-Q', 'url': 'https://storage.googleapis.com/reflexivity-documents-prod/edgar/filing/10-q/lbrt-Q324-10-Q.html'}]"
NFG,EU,SHA,energy and utilities,shale_gas,US6361801011,NATIONAL FUEL GAS CO,18,"Desempeña un papel importante en la exploración, producción y transporte de gas natural de formaciones de esquisto.","La empresa demuestra un enfoque en la industria del gas de esquisto a través de sus operaciones y desarrollo de infraestructura en la Cuenca Apalache. Específicamente, las actividades de exploración y producción de la empresa se concentran en los esquistos de Marcellus y Utica. Esto está respaldado además por el Proyecto Tioga Pathway, una iniciativa de expansión y modernización diseñada para transportar 190,000 Dth por día de suministros de gas de esquisto desde una nueva interconexión en el noroeste del condado de Tioga, Pensilvania, mejorando el acceso a los mercados del Atlántico Medio.",10199,USD,SMART,STK,"[{'name': 'nfg-Q325-10-Q', 'url': 'https://storage.googleapis.com/reflexivity-documents-prod/edgar/filing/10-q/nfg-Q325-10-Q.html'}, {'name': 'nfg-Q125-10-Q', 'url': 'https://storage.googleapis.com/reflexivity-documents-prod/edgar/filing/10-q/nfg-Q125-10-Q.html'}, {'name': 'nfg-Q225-10-Q', 'url': 'https://storage.googleapis.com/reflexivity-documents-prod/edgar/filing/10-q/nfg-Q225-10-Q.html'}, {'name': 'nfg-FY24-10-K', 'url': 'https://storage.googleapis.com/reflexivity-documents-prod/edgar/filing/10-k/nfg-FY24-10-K.html'}]"
HP,EU,SHA,energy and utilities,shale_gas,US4234521015,HELMERICH & PAYNE,19,"Proporciona soluciones y equipos de perforación avanzados esenciales para la extracción de gas de esquisto, apoyando las actividades de exploración y producción en cuencas no convencionales clave.","La participación de la empresa en el tema del gas de esquisto es evidente a través de sus operaciones en el mercado de esquisto de EE. UU. y su participación en la perforación de gas natural en las regiones de Haynesville y Marcellus. Si bien la empresa reconoce la importancia de la eficiencia del capital dentro del mercado de esquisto de EE. UU., también reconoce que esta necesidad se extiende más allá de este sector específico. La empresa también señala un repunte en las explotaciones de gas natural, particularmente en las áreas de Haynesville y Marcellus.",8097,USD,SMART,STK,
EQNR,EU,SHA,energy and utilities,shale_gas,NO0010096985,EQUINOR ASA,20,"Participa en la exploración, desarrollo y producción de recursos de gas de esquisto.",,12492456,NOK,SMART,STK,
NOV,EU,SHA,energy and utilities,shale_gas,US62955J1034,NOV INC,21,"Proporciona equipos y tecnología críticos para los procesos de perforación, completación y producción inherentes a la extracción de gas de esquisto.",,462100032,USD,SMART,STK,
TTE,EU,SHA,energy and utilities,shale_gas,FR0000120271,TOTALENERGIES SE,22,Contribuye al suministro de gas de esquisto a través de sus actividades de exploración y producción.,,29612193,EUR,SMART,STK,
MTDR,EU,SHA,energy and utilities,shale_gas,US5764852050,MATADOR RESOURCES CO,23,Participa en la exploración y producción de recursos de gas de esquisto.,"La empresa demuestra exposición al tema del Gas de Esquisto a través de su participación en la exploración, desarrollo, producción y adquisición de recursos de petróleo y gas natural, con un énfasis específico en esquistos de petróleo y gas natural y otras formaciones no convencionales. Sus operaciones se centran principalmente en las formaciones Wolfcamp y Bone Spring en la Cuenca Delaware, y también tienen operaciones en las formaciones Eagle Ford, Haynesville shale y Cotton Valley. La empresa también ha reservado las formaciones Cotton Valley por encima de Haynesville, estimando más de 200 mil millones de pies cúbicos de gas, a la espera de precios de gas más estables.",101694297,USD,SMART,STK,"[{'name': 'mtdr-Q225-10-Q', 'url': 'https://storage.googleapis.com/reflexivity-documents-prod/edgar/filing/10-q/mtdr-Q225-10-Q.html'}, {'name': 'mtdr-Q324-10-Q', 'url': 'https://storage.googleapis.com/reflexivity-documents-prod/edgar/filing/10-q/mtdr-Q324-10-Q.html'}, {'name': 'mtdr-FY24-10-K', 'url': 'https://storage.googleapis.com/reflexivity-documents-prod/edgar/filing/10-k/mtdr-FY24-10-K.html'}]"
MGY,EU,SHA,energy and utilities,shale_gas,US5596631094,MAGNOLIA OIL & GAS CORP - A,24,Opera dentro de la industria del gas de esquisto.,"La participación de Magnolia Oil & Gas en el tema del Gas de Esquisto es evidente en su enfoque operativo. Las propiedades de petróleo y gas natural de la empresa se encuentran principalmente en las áreas de Karnes y Giddings en el sur de Texas, donde se dirige a las formaciones Eagle Ford Shale y Austin Chalk. La empresa se dirige específicamente al Eagle Ford Shale, que es una formación de gas de esquisto bien conocida, lo que indica un énfasis estratégico en la producción de gas de esquisto.",327849712,USD,SMART,STK,"[{'name': 'mgy-Q324-10-Q', 'url': 'https://storage.googleapis.com/reflexivity-documents-prod/edgar/filing/10-q/mgy-Q324-10-Q.html'}, {'name': 'mgy-Q225-10-Q', 'url': 'https://storage.googleapis.com/reflexivity-documents-prod/edgar/filing/10-q/mgy-Q225-10-Q.html'}, {'name': 'mgy-FY24-10-K', 'url': 'https://storage.googleapis.com/reflexivity-documents-prod/edgar/filing/10-k/mgy-FY24-10-K.html'}]"
BKV,EU,SHA,energy and utilities,shale_gas,US05603J1088,BKV CORPORATION,25,Se centra en el desarrollo y la producción de gas natural a partir de formaciones de esquisto.,"El enfoque de BKV en el Gas de Esquisto es evidente a través de la adquisición de Bedrock Production, que posee los activos de Barnett Shale de Bedrock Energy Partners, añadiendo aproximadamente 97,000 acres netos a su cartera. Se espera que esta adquisición añada más de 100 millones de pies cúbicos equivalentes por día de producción y casi 1 Tcfe de reservas 1P a la cartera Barnett de BKV, extendiendo su posición de liderazgo en el esquisto Barnett. Además, BKV está aumentando su guía de producción para 2025 a un punto medio de 800 millones de pies cúbicos equivalentes por día, lo que destaca la importancia del gas de esquisto en la estrategia de producción general de la empresa.",731109568,USD,SMART,STK,"[{'name': 'bkv-Q225-10-Q', 'url': 'https://storage.googleapis.com/reflexivity-documents-prod/edgar/filing/10-q/bkv-Q225-10-Q.html'}]"
