symbol,industry_id,theme_id,industry,theme,isin_code,name,rank,description,evidence,ib_conid,currency,exchange,assetType,evidenceSources
GPOR,EU,SHA,energy and utilities,shale_gas,US4026355028,GULFPORT ENERGY CORP,26,"Se dedica a la exploración y producción de gas natural de formaciones de esquisto, contribuyendo al suministro general de gas de esquisto.","La exposición de Gulfport Resources al tema del Gas de Esquisto es evidente en su enfoque operativo y sus planes de perforación estratégicos. Las propiedades principales de la empresa se encuentran en el este de Ohio, apuntando específicamente a las formaciones de esquisto Utica y Marcellus, y sus planes de perforación reflejan este enfoque, incluyendo una plataforma Utica de 4 pozos de gas seco en 2025. Este movimiento estratégico para incluir la plataforma Utica, mientras se aplaza una plataforma Marcellus, demuestra la capacidad de respuesta de la empresa a las condiciones del mercado de materias primas. Además, la empresa completó la perforación de 13 pozos brutos en Ohio durante el primer trimestre, con 7 apuntando a Utica en Ohio.",491186703,USD,SMART,STK,"[{'name': 'gpor-FY24-10-K', 'url': 'https://storage.googleapis.com/reflexivity-documents-prod/edgar/filing/10-k/gpor-FY24-10-K.html'}]"
SM,EU,SHA,energy and utilities,shale_gas,US78454L1008,SM ENERGY CO,27,"Opera dentro de la industria del gas de esquisto, lo que refleja su enfoque estratégico en este sector energético.","El compromiso de la empresa con el tema del Gas de Esquisto es evidente a través de sus activos en el sur de Texas, que incluyen acreage en las formaciones Eagle Ford shale y Austin Chalk. Su posición de acreage en la cuenca de Maverick cubre una parte significativa del shale Eagle Ford occidental, y la empresa se centra en la producción de ambas formaciones, Austin Chalk y Eagle Ford shale. El recuento de pozos perforados pero no completados de la empresa incluye pozos en el shale Eagle Ford.",75472988,USD,SMART,STK,"[{'name': 'sm-Q324-10-Q', 'url': 'https://storage.googleapis.com/reflexivity-documents-prod/edgar/filing/10-q/sm-Q324-10-Q.html'}, {'name': 'sm-FY24-10-K', 'url': 'https://storage.googleapis.com/reflexivity-documents-prod/edgar/filing/10-k/sm-FY24-10-K.html'}]"
NOG,EU,SHA,energy and utilities,shale_gas,US6655313079,NORTHERN OIL AND GAS INC,28,"Se dedica a la adquisición, exploración y producción de petróleo y gas natural, incluidos los recursos de formaciones de esquisto.","Las operaciones de la compañía en la Cuenca Apalache, combinadas con su perforación activa y volúmenes récord de gas, indican su participación en la producción de gas de esquisto. La empresa conjunta Apalache, ahora en línea, contribuye significativamente a los volúmenes de gas de la compañía, con una producción que alcanza aproximadamente 343 mmcf por día. Además, la compañía está persiguiendo oportunidades de fusiones y adquisiciones relacionadas con el gas, lo que indica un interés estratégico en expandir sus operaciones de gas, a pesar de que el 'gas de esquisto' no se menciona explícitamente en el contexto de la empresa conjunta Apalache.",443378898,USD,SMART,STK,
WHD,EU,SHA,energy and utilities,shale_gas,US1272031071,CACTUS INC - A,29,Está vinculado a la industria del gas de esquisto.,"El compromiso de la empresa con el tema del Gas de Esquisto se deriva de que sus productos se venden y alquilan principalmente para pozos de petróleo y gas no convencionales en tierra, que se utilizan durante las fases de perforación, completación y producción. Debido a que los productos de control de presión de la empresa se utilizan durante las fases de perforación, completación y producción de pozos de gas de esquisto, una parte notable de sus ingresos está conectada a la producción de gas de esquisto. Sin embargo, no hay evidencia de especialización o tecnología patentada relacionada con la extracción de gas de esquisto.",305881950,USD,SMART,STK,"[{'name': 'whd-Q324-10-Q', 'url': 'https://storage.googleapis.com/reflexivity-documents-prod/edgar/filing/10-q/whd-Q324-10-Q.html'}, {'name': 'whd-FY24-10-K', 'url': 'https://storage.googleapis.com/reflexivity-documents-prod/edgar/filing/10-k/whd-FY24-10-K.html'}]"
AESI,EU,SHA,energy and utilities,shale_gas,US6420451089,ATLAS ENERGY SOLUTIONS INC,30,Proporciona soluciones esenciales de apuntalamiento que son críticas para los procesos de fracturación hidráulica utilizados en la extracción de gas de esquisto.,,656365592,USD,SMART,STK,
CHRD,EU,SHA,energy and utilities,shale_gas,US6742152076,CHORD ENERGY CORP,31,Está involucrado en la exploración y producción de gas natural de formaciones de esquisto.,"La participación de Enerplus en el tema del Gas de Esquisto se refleja en su volumen de producción de gas natural del Esquisto de Marcellus, que ascendió a 24.727 MMcf para el año finalizado el 31 de diciembre de 2024, y 10.508 MMcf y 14.272 MMcf para los tres y nueve meses finalizados el 30 de septiembre de 2024, respectivamente. Sin embargo, los intereses de la empresa en el Esquisto de Marcellus son limitados y no operativos, con la gran mayoría de sus activos de producción ubicados en la Cuenca de Williston en Dakota del Norte. Esto indica una participación menor en gas de esquisto.",456517746,USD,SMART,STK,"[{'name': 'chrd-Q324-10-Q', 'url': 'https://storage.googleapis.com/reflexivity-documents-prod/edgar/filing/10-q/chrd-Q324-10-Q.html'}, {'name': 'chrd-FY24-10-K', 'url': 'https://storage.googleapis.com/reflexivity-documents-prod/edgar/filing/10-k/chrd-FY24-10-K.html'}]"
AROC,EU,SHA,energy and utilities,shale_gas,US03957W1062,ARCHROCK INC,32,Opera dentro de la industria del Gas de Esquisto.,"Las operaciones de Archrock están estrechamente ligadas a la producción de gas de esquisto, ya que la empresa opera en importantes cuencas de petróleo y gas de esquisto, incluidas Permian, Eagle Ford, Haynesville, Marcellus y Rockies, brindando servicios de compresión necesarios para la extracción de gas natural de estas formaciones. El crecimiento de la producción de gas natural en estas cuencas de esquisto, impulsado por el aumento de las relaciones Gas-Petróleo (GOR), requiere inversiones sustanciales en infraestructura de transporte de gas natural, posicionando a Archrock como un socio de compresión clave. Además, la empresa destaca su papel en el apoyo a la producción de gas natural en estas importantes cuencas de esquisto y reconoce el aumento de la producción de gas natural en EE. UU. de fuentes no convencionales como un factor que contribuye al potencial de crecimiento de la industria de servicios de compresión de gas natural de EE. UU.",199914862,USD,SMART,STK,"[{'name': 'aroc-FY24-10-K', 'url': 'https://storage.googleapis.com/reflexivity-documents-prod/edgar/filing/10-k/aroc-FY24-10-K.html'}]"
USAC,EU,SHA,energy and utilities,shale_gas,US90290N1090,USA COMPRESSION PARTNERS LP,33,"Brinda servicios esenciales de compresión de gas natural que son cruciales para la recolección, el procesamiento y el transporte de gas de esquisto.","El negocio de USAC está estrechamente ligado a la industria del gas de esquisto, como lo demuestra su enfoque en servicios de compresión dentro de yacimientos de recursos no convencionales en todo EE. UU., incluidas las principales formaciones de esquisto como Utica, Marcellus, Haynesville y otras. Los servicios de la empresa se centran en gran medida en yacimientos de esquisto. Este enfoque en servicios de compresión en yacimientos de recursos no convencionales, especialmente en cuencas de gas de esquisto, resalta la dependencia de la empresa de la producción de gas de esquisto.",120420959,USD,SMART,STK,"[{'name': 'usac-FY24-10-K', 'url': 'https://storage.googleapis.com/reflexivity-documents-prod/edgar/filing/10-k/usac-FY24-10-K.html'}]"
KGS,EU,SHA,energy and utilities,shale_gas,US50012A1088,KODIAK GAS SERVICES INC,34,Apoya la producción de gas de esquisto a través de la prestación de servicios esenciales de compresión de gas.,,639336275,USD,SMART,STK,
