industry,theme,isin_code,name,rank,description,evidence,evidenceSources,conid,currency,symbol,exchange,assetType,navigable,theme_id
other,smart_phones,US25659T1079,DOLBY LABORATORIES INC-CL A,23,Contribuye con tecnologías avanzadas de audio y video que mejoran la experiencia multimedia en teléfonos inteligentes.,"El compromiso de Dolby con el tema de los teléfonos inteligentes es evidente a través de la integración de sus tecnologías de audio y video en los principales ecosistemas móviles. DD+ permite la experiencia de audio Dolby en teléfonos inteligentes, y la empresa promueve activamente la adopción de sus tecnologías, incluyendo Dolby Atmos y Dolby Vision, tanto en dispositivos Apple como Android. Esto se demuestra aún más con la inclusión de Dolby Vision Capture en iPhones y la expansión de Dolby Vision al ecosistema Android, con asociaciones y apoyo de fabricantes como Xiaomi, Honor, Lava Mobiles, Oppo, Realme y Transsion. Además, la empresa se enfoca en llevar la experiencia Dolby Atmos y Dolby Vision a todas las formas en que los consumidores disfrutan de contenido en sus teléfonos inteligentes, particularmente para contenido generado por el usuario en plataformas de redes sociales y videos cortos.","[{'name': 'dlb-Q225-10-Q', 'url': 'https://storage.googleapis.com/reflexivity-documents-prod/edgar/filing/10-q/dlb-Q225-10-Q.html'}, {'name': 'dlb-Q125-10-Q', 'url': 'https://storage.googleapis.com/reflexivity-documents-prod/edgar/filing/10-q/dlb-Q125-10-Q.html'}, {'name': 'dlb-FY24-10-K', 'url': 'https://storage.googleapis.com/reflexivity-documents-prod/edgar/filing/10-k/dlb-FY24-10-K.html'}, {'name': 'dlb-Q325-10-Q', 'url': 'https://storage.googleapis.com/reflexivity-documents-prod/edgar/filing/10-q/dlb-Q325-10-Q.html'}]",33205673,USD,DLB,SMART,STK,True,SMA
other,smart_phones,NL0009538784,NXP SEMICONDUCTORS NV,24,Contribuye con componentes y soluciones de semiconductores vitales para la operación y las características avanzadas de los teléfonos inteligentes.,"La participación de NXP en el tema de la industria de los teléfonos inteligentes se refleja en el rendimiento de su mercado final móvil, con ingresos que fluctúan en diferentes períodos. Si bien el mercado final móvil, que incluye componentes para teléfonos inteligentes, muestra contribuciones de ingresos como $331 millones en el segundo trimestre de 2025 y $1,497 millones para un año anterior, el crecimiento en los productos de billetera móvil ha sido un impulsor notable, compensando las caídas en otras áreas como los productos analógicos avanzados y de conectividad. La empresa anticipa un crecimiento en el segmento móvil, aunque esto no siempre es consistente, como lo demuestran algunos períodos de disminución de ingresos.","[{'name': 'nxpi-Q324-10-Q', 'url': 'https://storage.googleapis.com/reflexivity-documents-prod/edgar/filing/10-q/nxpi-Q324-10-Q.html'}, {'name': 'nxpi-Q225-10-Q', 'url': 'https://storage.googleapis.com/reflexivity-documents-prod/edgar/filing/10-q/nxpi-Q225-10-Q.html'}, {'name': 'nxpi-FY24-10-K', 'url': 'https://storage.googleapis.com/reflexivity-documents-prod/edgar/filing/10-k/nxpi-FY24-10-K.html'}, {'name': 'nxpi-Q125-10-Q', 'url': 'https://storage.googleapis.com/reflexivity-documents-prod/edgar/filing/10-q/nxpi-Q125-10-Q.html'}]",77791077,USD,NXPI,SMART,STK,True,SMA
other,smart_phones,US82982T1060,SITIME CORP,25,Proporciona soluciones de temporización esenciales que son integrales para la funcionalidad y el rendimiento de los teléfonos inteligentes.,,,392585451,USD,SITM,SMART,STK,True,SMA
other,smart_phones,KYG393871085,GLOBALFOUNDRIES INC,26,Proporciona servicios de fabricación de semiconductores esenciales para la producción de chips utilizados en teléfonos inteligentes.,"GF demuestra su participación en el tema de los teléfonos inteligentes a través de su liderazgo en el mercado de frontend de RF, respaldado por sus plataformas 8SW y 9SW. La compañía ha asegurado numerosas victorias de diseño en esta área, incluidas 36 en un solo trimestre con nueve de los diez principales actores de la industria, expandiendo tanto su base de clientes como su participación de mercado. GF también está cobrando impulso en transceptores 5G en su plataforma FinFET, asegurando ingresos comprometidos durante los próximos cuatro años con un cliente clave, y continúa ganando nuevos diseños en una amplia gama de aplicaciones, buscando capturar oportunidades de contenido dentro de los teléfonos, como audio, háptica, pantalla e imagen, particularmente en teléfonos inteligentes OLED Android.",,523222624,USD,GFS,SMART,STK,False,SMA
other,smart_phones,US55024U1097,LUMENTUM HOLDINGS INC,27,Contribuye a la industria de los teléfonos inteligentes.,,,201113895,USD,LITE,SMART,STK,True,SMA
other,smart_phones,US0326541051,ANALOG DEVICES INC,28,"Contribuye al rendimiento de los teléfonos inteligentes a través de sus circuitos integrados analógicos y de señal mixta, lo que admite funciones como la eficiencia energética, la calidad del audio y la comunicación inalámbrica.",,,4157,USD,ADI,SMART,STK,True,SMA
other,smart_phones,US8807701029,TERADYNE INC,29,Opera dentro del dominio del tema de la industria de los teléfonos inteligentes.,,,12729,USD,TER,SMART,STK,True,SMA
other,smart_phones,US7194051022,PHOTRONICS INC,30,"Proporciona soluciones críticas de fotomáscaras esenciales para la fabricación de dispositivos semiconductores y pantallas planas, que son componentes clave en los teléfonos inteligentes.","El rendimiento de Photronics en el mercado de pantallas planas (FPD) está influenciado por la industria de los teléfonos inteligentes, particularmente en lo que respecta al momento de los principales lanzamientos de diseño de teléfonos inteligentes. La empresa ha señalado que las tendencias estacionales en los teléfonos inteligentes premium impactan los ingresos de FPD, y anticipan una fuerte demanda continua de fotomáscaras AMOLED utilizadas en dispositivos móviles. Además, los ingresos de los clientes en Corea y China están impulsados significativamente por los lanzamientos de diseño de teléfonos inteligentes, y la empresa es optimista de que su tecnología avanzada de fotomáscaras les ayudará a ganar cuota de mercado en la era AMOLED G8.6.","[{'name': 'plab-Q224-10-Q', 'url': 'https://storage.googleapis.com/reflexivity-documents-prod/edgar/filing/10-q/plab-Q224-10-Q.html'}, {'name': 'plab-FY24-10-K', 'url': 'https://storage.googleapis.com/reflexivity-documents-prod/edgar/filing/10-k/plab-FY24-10-K.html'}]",273165,USD,PLAB,SMART,STK,True,SMA
other,smart_phones,US5949181045,MICROSOFT CORP,31,"Proporciona un conjunto de software y servicios en la nube que operan en plataformas de teléfonos inteligentes, lo que respalda la productividad y la conectividad móvil.",,,272093,USD,MSFT,SMART,STK,True,SMA
other,smart_phones,US8168501018,SEMTECH CORP,32,"Suministra una gama de soluciones de semiconductores analógicos y de señal mixta, incluidos productos de gestión de energía y conectividad, integrales para la funcionalidad de los teléfonos inteligentes.","La participación de Semtech en la industria de los teléfonos inteligentes es evidente en varias áreas clave. Sus productos de TVS para el consumidor se utilizan en teléfonos inteligentes para proteger pantallas e interfaces de alta velocidad, mientras que la tecnología de detección PerSe se implementa para la gestión inteligente de energía y la optimización del rendimiento de RF. Semtech participa activamente en discusiones de diseño con una amplia gama de clientes en el sector de los teléfonos inteligentes, apoyando tanto los diseños actuales como los próximos lanzamientos, y sus productos SurgeSwitch se están diseñando en teléfonos inteligentes. La empresa también reconoce la estacionalidad asociada con los aumentos en las unidades de teléfonos inteligentes y considera los teléfonos inteligentes como parte de su mercado de consumo de alta gama.","[{'name': 'smtc-FY25-10-K', 'url': 'https://storage.googleapis.com/reflexivity-documents-prod/edgar/filing/10-k/smtc-FY25-10-K.html'}, {'name': 'smtc-Q225-10-Q', 'url': 'https://storage.googleapis.com/reflexivity-documents-prod/edgar/filing/10-q/smtc-Q225-10-Q.html'}, {'name': 'smtc-Q126-10-Q', 'url': 'https://storage.googleapis.com/reflexivity-documents-prod/edgar/filing/10-q/smtc-Q126-10-Q.html'}]",3655896,USD,SMTC,SMART,STK,True,SMA
other,smart_phones,US55306N1046,MKS INC,33,Proporciona soluciones críticas de fabricación y control de procesos utilizadas en la producción de componentes y dispositivos esenciales para teléfonos inteligentes.,"La exposición de MKS Instruments al tema de los teléfonos inteligentes es evidente a través de varios factores. Los ingresos y los pedidos de equipos de la empresa se ven influenciados por las aplicaciones de IA en los sectores HDI y MLB, que son cruciales para la fabricación de teléfonos inteligentes, y han observado mejoras en los ingresos de química relacionados con la fabricación de teléfonos inteligentes. MKS Instruments también está desarrollando nuevos productos para abordar la creciente demanda de componentes más complejos en el mercado de teléfonos y tabletas. Además, la empresa anticipa un patrón cíclico típico en los mercados de consumo impulsado por la demanda de teléfonos inteligentes, con una aceleración en el segundo trimestre y un pico en el tercer trimestre.","[{'name': 'mksi-Q125-10-Q', 'url': 'https://storage.googleapis.com/reflexivity-documents-prod/edgar/filing/10-q/mksi-Q125-10-Q.html'}]",4814955,USD,MKSI,SMART,STK,True,SMA
other,smart_phones,US2545431015,DIODES INC,34,Contribuye con componentes semiconductores esenciales que permiten la funcionalidad de los teléfonos inteligentes modernos.,"Diodes Incorporated se enfoca en el mercado de las comunicaciones, que incluye teléfonos inteligentes, redes 5G y redes empresariales, lo que indica la importancia de este sector para la empresa. La empresa entrega productos semiconductores al mercado de las comunicaciones y presta servicios al mercado de las comunicaciones, incluidos los teléfonos inteligentes, lo que sugiere una asignación dedicada de recursos. Si bien los teléfonos inteligentes se identifican como un área clave dentro del mercado de las comunicaciones, no hay información específica sobre tecnología propietaria o posicionamiento único, y el mercado de las comunicaciones representa una parte notable de los ingresos por productos.","[{'name': 'diod-Q225-10-Q', 'url': 'https://storage.googleapis.com/reflexivity-documents-prod/edgar/filing/10-q/diod-Q225-10-Q.html'}, {'name': 'diod-Q125-10-Q', 'url': 'https://storage.googleapis.com/reflexivity-documents-prod/edgar/filing/10-q/diod-Q125-10-Q.html'}, {'name': 'diod-FY24-10-K', 'url': 'https://storage.googleapis.com/reflexivity-documents-prod/edgar/filing/10-k/diod-FY24-10-K.html'}]",754352,USD,DIOD,SMART,STK,True,SMA
other,smart_phones,US7751331015,ROGERS CORP,35,Se centra en el tema de la industria de los teléfonos inteligentes dentro de sus actividades de mercado.,"Rogers Corporation identifica oportunidades de crecimiento en la industria de la electrónica portátil, particularmente con el avance de los teléfonos inteligentes de próxima generación y 5G. La compañía tiene como objetivo capitalizar estas oportunidades como una organización impulsada por el mercado, centrándose en el crecimiento de los sistemas de comunicación dentro de este sector. Si bien los teléfonos inteligentes se reconocen como un motor de crecimiento, a menudo se mencionan junto con otras oportunidades como la aeroespacial y de defensa, y la energía renovable, lo que indica que, si bien son importantes, pueden no ser el enfoque estratégico principal.","[{'name': 'rog-Q324-10-Q', 'url': 'https://storage.googleapis.com/reflexivity-documents-prod/edgar/filing/10-q/rog-Q324-10-Q.html'}, {'name': 'rog-Q225-10-Q', 'url': 'https://storage.googleapis.com/reflexivity-documents-prod/edgar/filing/10-q/rog-Q225-10-Q.html'}, {'name': 'rog-FY24-10-K', 'url': 'https://storage.googleapis.com/reflexivity-documents-prod/edgar/filing/10-k/rog-FY24-10-K.html'}]",756433,USD,ROG,SMART,STK,True,SMA
other,smart_phones,US2935941078,ENOVIX CORP,36,Desarrolla y fabrica baterías avanzadas de ánodo de silicio diseñadas para mejorar el rendimiento y extender la vida útil de la batería para teléfonos inteligentes de próxima generación.,"El enfoque estratégico de Enovix en el mercado de los teléfonos inteligentes es evidente a través de múltiples acuerdos para proporcionar muestras de ingeniería y de prueba de concepto a varios clientes líderes del mercado de teléfonos inteligentes, con el objetivo principal de comercialización para 2025 siendo la producción en masa de baterías para estos clientes. La empresa ha ampliado sus compromisos para incluir a siete de los ocho principales fabricantes de equipos originales de teléfonos inteligentes y ya ha enviado muestras tempranas de EX-2M, logrando validaciones críticas de pruebas de seguridad y finalizando la química con dimensiones precisas de celda para un cliente principal. Enovix identifica a los teléfonos inteligentes como uno de sus sectores de mercado estratégicos principales, priorizando este segmento de alto valor donde la demanda de una mayor densidad de energía exige una prima.","[{'name': 'envx-Q125-10-Q', 'url': 'https://storage.googleapis.com/reflexivity-documents-prod/edgar/filing/10-q/envx-Q125-10-Q.html'}, {'name': 'envx-FY24-10-K', 'url': 'https://storage.googleapis.com/reflexivity-documents-prod/edgar/filing/10-k/envx-FY24-10-K.html'}]",502252061,USD,ENVX,SMART,STK,False,SMA
other,smart_phones,US0545402085,AXCELIS TECHNOLOGIES INC,37,Apoya la fabricación de componentes semiconductores cruciales para la tecnología de teléfonos inteligentes a través de su equipo especializado.,,,239037320,USD,ACLS,SMART,STK,True,SMA
other,smart_phones,US0320951017,AMPHENOL CORP-CL A,38,Está involucrada en la industria de los teléfonos inteligentes.,"La exposición de Amphenol al tema de los teléfonos inteligentes es evidente a través de su participación en el mercado de dispositivos móviles, donde la empresa diseña, fabrica y comercializa sistemas de conectores e interconexión, incluidas antenas, para su uso en estos dispositivos. El mercado de dispositivos móviles, incluidos los teléfonos inteligentes, contribuyó a una parte de las ventas de Amphenol, experimentando un crecimiento impulsado por la fortaleza en teléfonos inteligentes y computadoras portátiles. Este crecimiento en el mercado de dispositivos móviles, donde los teléfonos inteligentes son un componente, es un factor en el aumento general de las ventas de la empresa, particularmente dentro del segmento de Soluciones de Comunicación.","[{'name': 'aph-FY24-10-K', 'url': 'https://storage.googleapis.com/reflexivity-documents-prod/edgar/filing/10-k/aph-FY24-10-K.html'}, {'name': 'aph-Q225-10-Q', 'url': 'https://storage.googleapis.com/reflexivity-documents-prod/edgar/filing/10-q/aph-Q225-10-Q.html'}, {'name': 'aph-Q324-10-Q', 'url': 'https://storage.googleapis.com/reflexivity-documents-prod/edgar/filing/10-q/aph-Q324-10-Q.html'}]",4493,USD,APH,SMART,STK,True,SMA
other,smart_phones,US0865161014,BEST BUY CO INC,39,"Facilita la distribución y venta minorista de teléfonos inteligentes a los consumidores, contribuyendo así a su disponibilidad y adopción en el mercado.","El compromiso de Best Buy con el tema de los teléfonos inteligentes es evidente a través de su crecimiento de ventas reportado en teléfonos móviles y su contribución a los ingresos de los segmentos nacional e internacional. La compañía está implementando un nuevo modelo operativo en asociación con Verizon y AT&T, con el objetivo de mejorar la experiencia del cliente e impulsar el crecimiento de las ventas al proporcionar vendedores expertos y acceso directo a los sistemas de los operadores en la mayoría de sus tiendas. Los teléfonos móviles se mencionan explícitamente como un impulsor del crecimiento de las ventas comparables, particularmente dentro de la categoría de Computación y Teléfonos Móviles, que representa una parte significativa de los ingresos de Best Buy en ambos segmentos. Si bien las ventas de tabletas han disminuido, Best Buy se está enfocando en mejorar las experiencias en la tienda y la integración de sistemas tecnológicos para impulsar aún más las ventas de teléfonos móviles.","[{'name': 'bby-Q126-10-Q', 'url': 'https://storage.googleapis.com/reflexivity-documents-prod/edgar/filing/10-q/bby-Q126-10-Q.html'}, {'name': 'bby-Q225-10-Q', 'url': 'https://storage.googleapis.com/reflexivity-documents-prod/edgar/filing/10-q/bby-Q225-10-Q.html'}, {'name': 'bby-FY25-10-K', 'url': 'https://storage.googleapis.com/reflexivity-documents-prod/edgar/filing/10-k/bby-FY25-10-K.html'}]",4817,USD,BBY,SMART,STK,True,SMA
other,smart_phones,US47074L1052,JAMF HOLDING CORP,40,Facilita la implementación y gestión seguras de teléfonos inteligentes para empresas e instituciones educativas.,"La participación de Jamf en el tema de los teléfonos inteligentes es evidente a través de sus soluciones de gestión de dispositivos móviles, particularmente con la introducción del soporte de inscripción de Android para gestionar una flota móvil completa. Esto se ve reforzado por la oferta Jamf for Mobile de la empresa, que incluye soporte para dispositivos Android, defensa contra amenazas móviles y protecciones web. Si bien Jamf proporciona soluciones tanto para dispositivos iOS como Android, el enfoque no está exclusivamente en los teléfonos inteligentes, sino más bien en la gestión y seguridad de una gama más amplia de dispositivos móviles, así como en la gestión de dispositivos Apple para la estrategia móvil. Aunque la empresa admite dispositivos Android y ofrece funciones de seguridad, no sugiere capacidades especializadas ni avances únicos en la tecnología de teléfonos inteligentes en sí.",,435899603,USD,JAMF,SMART,STK,False,SMA
