type,link_type,key,name,rank,description,evidence,evidenceSources,conid,currency,symbol,exchange,assetType,navigable,theme_id
transportation and logistics,supply_chain_management,US9111631035,UNITED NATURAL FOODS INC,19,"Gestiona extensas operaciones de la cadena de suministro para productos naturales y orgánicos, garantizando una distribución eficiente desde los productores a varios canales minoristas.","El compromiso de UNFI con la Gestión de la Cadena de Suministro es evidente en sus iniciativas estratégicas para optimizar su red de distribución y mejorar la resiliencia de la cadena de suministro. La empresa se centra en optimizar su red de centros de distribución para crear una cadena de suministro más eficiente, lo que incluye la consolidación de volúmenes en instalaciones más grandes y modernas y la implementación de la Gestión Diaria Lean en sus centros de distribución para mejorar las métricas de rendimiento. Esto se ve respaldado además por su provisión de soluciones personalizadas de cadena de suministro para satisfacer las necesidades de los clientes e inversiones en automatización y plataformas tecnológicas para optimizar y expandir su red de distribución. Sin embargo, UNFI también reconoce posibles interrupciones en su cadena de suministro, lo que destaca la importancia de gestionar y mitigar estos riesgos.","[{'name': 'unfi-FY24-10-K', 'url': 'https://storage.googleapis.com/reflexivity-documents-prod/edgar/filing/10-k/unfi-FY24-10-K.html'}, {'name': 'unfi-Q125-10-Q', 'url': 'https://storage.googleapis.com/reflexivity-documents-prod/edgar/filing/10-q/unfi-Q125-10-Q.html'}]",6746248,USD,UNFI,SMART,STK,True,SUP
transportation and logistics,supply_chain_management,DK0060079531,DSV A/S,20,"Proporciona servicios integrales de transporte y logística a nivel mundial, optimizando y gestionando cadenas de suministro para empresas de diversas industrias.",,,44165865,DKK,DSV,SMART,STK,False,SUP
transportation and logistics,supply_chain_management,US4385161066,HONEYWELL INTERNATIONAL INC,21,"Ofrece soluciones avanzadas de automatización, software y análisis de datos que optimizan la logística, mejoran la visibilidad y aumentan la eficiencia operativa en cadenas de suministro complejas en diversas industrias.","Honeywell demuestra su compromiso con la Gestión de la Cadena de Suministro a través de varias estrategias clave. La compañía se enfoca en la simplificación de la cadena de suministro y la alineación con fuentes de suministro locales, empleando estrategias de mitigación para minimizar la escasez y la volatilidad de los precios. Para navegar la volatilidad del mercado global causada por conflictos, aranceles y disrupciones laborales, Honeywell colabora activamente con los proveedores para mitigar la escasez potencial y reducir la volatilidad de la oferta y los precios. Estas estrategias incluyen acciones de precios, doble abastecimiento, planificación a largo plazo para materiales restringidos, compromiso directo con proveedores clave y desarrollo de nuevos proveedores, asegurando un suministro confiable de componentes y materias primas.","[{'name': 'hon-Q225-10-Q', 'url': 'https://storage.googleapis.com/reflexivity-documents-prod/edgar/filing/10-q/hon-Q225-10-Q.html'}, {'name': 'hon-Q125-10-Q', 'url': 'https://storage.googleapis.com/reflexivity-documents-prod/edgar/filing/10-q/hon-Q125-10-Q.html'}, {'name': 'hon-Q324-10-Q', 'url': 'https://storage.googleapis.com/reflexivity-documents-prod/edgar/filing/10-q/hon-Q324-10-Q.html'}]",4350,USD,HON,SMART,STK,True,SUP
transportation and logistics,supply_chain_management,DE0007164600,SAP SE,22,"Proporciona soluciones de software de planificación de recursos empresariales y gestión de la cadena de suministro que permiten a las empresas optimizar las operaciones globales de la cadena de suministro, cubriendo la planificación, la adquisición, la logística y la gestión de inventario.",,,14204,EUR,SAP,SMART,STK,False,SUP
transportation and logistics,supply_chain_management,US68389X1054,ORACLE CORP,23,"Proporciona soluciones integrales de software basadas en la nube para la gestión de cadenas de suministro globales, permitiendo a las empresas optimizar las operaciones de planificación, logística, fabricación y adquisición.",,,272800,USD,ORCL,SMART,STK,True,SUP
transportation and logistics,supply_chain_management,US58733R1023,MERCADOLIBRE INC,24,"Opera una extensa red logística y centros de cumplimiento para gestionar el almacenamiento, envío y entrega de última milla en toda América Latina, optimizando la cadena de suministro del comercio electrónico.","MercadoLibre enfatiza la importancia de la logística como un habilitador clave para el crecimiento empresarial y está buscando activamente eficiencias dentro de sus operaciones logísticas. La compañía está implementando automatización en áreas como la incorporación, la compra y la fijación de precios para mejorar la economía y respaldar el crecimiento continuo. Este enfoque en la logística está impulsado por el deseo de garantizar una capacidad suficiente para satisfacer la demanda y mitigar los riesgos asociados con la gestión de la cadena de suministro.",,45602025,USD,MELI,SMART,STK,False,SUP
transportation and logistics,supply_chain_management,US9078181081,UNION PACIFIC CORP,25,"Proporciona servicios esenciales de transporte ferroviario, formando un eslabón crítico en el panorama más amplio de la gestión de la cadena de suministro para numerosas industrias.",,,13284,USD,UNP,SMART,STK,True,SUP
transportation and logistics,supply_chain_management,CH0025238863,KUEHNE + NAGEL INTL AG-REG,26,"Gestiona cadenas de suministro globales a través de soluciones logísticas integrales, garantizando el flujo eficiente de bienes e información para empresas de todo el mundo.",,,39106394,CHF,KNIN,SMART,STK,False,SUP
transportation and logistics,supply_chain_management,US3021301094,EXPEDITORS INTL WASH INC,27,"Gestiona operaciones globales de la cadena de suministro proporcionando servicios integrales de transitarios, corretaje de aduanas y distribución, optimizando así el movimiento de mercancías para empresas de todo el mundo.","La participación de Expeditors International of Washington en la Gestión de la Cadena de Suministro es evidente en la provisión de un conjunto integral de servicios de logística global. Estos servicios abarcan la consolidación de carga aérea y marítima, el corretaje de aduanas, el almacenamiento y la distribución, la gestión de órdenes de compra, la consolidación de proveedores y el monitoreo y seguimiento de carga especializada. La empresa se identifica explícitamente como que ofrece 'otras soluciones de cadena de suministro', lo que subraya el papel integral del tema en sus ofertas de servicios.","[{'name': 'expd-FY24-10-K', 'url': 'https://storage.googleapis.com/reflexivity-documents-prod/edgar/filing/10-k/expd-FY24-10-K.html'}, {'name': 'expd-Q125-10-Q', 'url': 'https://storage.googleapis.com/reflexivity-documents-prod/edgar/filing/10-q/expd-Q125-10-Q.html'}]",269082,USD,EXPD,SMART,STK,True,SUP
transportation and logistics,supply_chain_management,US0538071038,AVNET INC,28,"Gestiona la distribución y logística global de componentes electrónicos, desempeñando un papel fundamental en la optimización de las cadenas de suministro para numerosos fabricantes de tecnología.","Avnet enfatiza su papel en la cadena de suministro de tecnología al centrarse en fortalecer las relaciones con proveedores y clientes y demostrar el valor que aporta. La empresa se enfoca en gestionar la cadena de suministro de tecnología y aportarle resiliencia, lo que ayuda a resolver la creciente complejidad que enfrentan los clientes y proveedores. Para mitigar el impacto de los aranceles, Avnet emplea sistemas y medidas que incluyen la selección selectiva de la cadena de suministro, la logística y las acciones de precios.","[{'name': 'avt-FY25-10-K', 'url': 'https://storage.googleapis.com/reflexivity-documents-prod/edgar/filing/10-k/avt-FY25-10-K.html'}]",4691,USD,AVT,SMART,STK,True,SUP
transportation and logistics,supply_chain_management,US71377A1034,PERFORMANCE FOOD GROUP CO,29,"Opera una infraestructura crítica de cadena de suministro para la distribución de alimentos, optimizando los procesos de abastecimiento, almacenamiento y entrega para servir a una amplia base de clientes.","El compromiso de Performance Food Group con la Gestión de la Cadena de Suministro es evidente en su enfoque en impulsar la eficiencia para mejorar la satisfacción del cliente y la rentabilidad. La empresa aprovecha su escala para beneficiarse de las economías en compras y aprovisionamiento, y optimiza su cadena de suministro y red en todos los segmentos. PFG también proporciona servicios de valor agregado a los clientes, utilizando su conocimiento de la industria, escala y experiencia en la selección y adquisición de productos.",,208317027,USD,PFGC,SMART,STK,True,SUP
transportation and logistics,supply_chain_management,US87162W1009,TD SYNNEX CORP,30,"Gestiona y optimiza la cadena de suministro global de productos y soluciones tecnológicas, conectando a los proveedores con una vasta red de revendedores y usuarios finales.","El compromiso de TD SYNNEX con la Gestión de la Cadena de Suministro es evidente a través de la prestación de servicios de cadena de suministro, que contribuyeron al rendimiento superior de Hyve. La empresa está experimentando una mayor demanda de estos servicios, lo que resalta su importancia en la gestión de materias primas y el cumplimiento de los requisitos de los clientes, particularmente para las operaciones de Hyve que involucran racks. Este énfasis en una cadena de suministro fluida subraya su importancia para TD SYNNEX y sus clientes.",,26904835,USD,SNX,SMART,STK,True,SUP
transportation and logistics,supply_chain_management,JP3688370000,NIPPON EXPRESS HOLDINGS INC,31,"Desempeña un papel crucial en la gestión de la cadena de suministro global al proporcionar soluciones logísticas integrales, que incluyen transporte de carga internacional, almacenamiento y servicios de transporte, para optimizar el flujo de mercancías para empresas de todo el mundo.",,,531981186,JPY,9147,SMART,STK,False,SUP
transportation and logistics,supply_chain_management,US5150981018,LANDSTAR SYSTEM INC,32,Proporciona un conjunto integral de servicios de logística y transporte que son fundamentales para la gestión eficiente de la cadena de suministro.,"La participación de Landstar System en el tema de Gestión de la Cadena de Suministro es evidente a través de su papel como proveedor ligero en activos y habilitado por tecnología de soluciones integradas de gestión de transporte, que ofrece servicios de transporte seguros y especializados a una amplia gama de clientes. Los servicios de la empresa abarcan múltiples modos de transporte, desde la organización de envíos de carga individuales hasta la provisión de soluciones integrales de logística de terceros. Sin embargo, Landstar también identificó un fraude en la cadena de suministro relacionado con sus operaciones de transporte de carga internacional.","[{'name': 'lstr-Q324-10-Q', 'url': 'https://storage.googleapis.com/reflexivity-documents-prod/edgar/filing/10-q/lstr-Q324-10-Q.html'}, {'name': 'lstr-Q225-10-Q', 'url': 'https://storage.googleapis.com/reflexivity-documents-prod/edgar/filing/10-q/lstr-Q225-10-Q.html'}, {'name': 'lstr-FY24-10-K', 'url': 'https://storage.googleapis.com/reflexivity-documents-prod/edgar/filing/10-k/lstr-FY24-10-K.html'}]",271344,USD,LSTR,SMART,STK,True,SUP
transportation and logistics,supply_chain_management,US4433201062,HUB GROUP INC-CL A,33,"Proporciona soluciones integrales de logística y transporte, optimizando el flujo de bienes e información a través de complejas cadenas de suministro para diversas industrias.","La participación de Hub Group en la Gestión de la Cadena de Suministro es evidente a través de su autoidentificación como un proveedor líder de soluciones de cadena de suministro en América del Norte, que ofrece servicios integrales de gestión de transporte y logística. La estrategia de la empresa implica proporcionar soluciones multimodales de gestión de la cadena de suministro para fortalecer las relaciones con los clientes y ofrecer servicios rentables. Hub Group también se enfoca en gestionar el transporte hacia y desde las instalaciones e integrar ofertas de servicios como corretaje y soluciones de cross-docking, lo que demuestra su participación en la coordinación de diversos aspectos de la cadena de suministro.","[{'name': 'hubg-Q324-10-Q', 'url': 'https://storage.googleapis.com/reflexivity-documents-prod/edgar/filing/10-q/hubg-Q324-10-Q.html'}, {'name': 'hubg-Q225-10-Q', 'url': 'https://storage.googleapis.com/reflexivity-documents-prod/edgar/filing/10-q/hubg-Q225-10-Q.html'}, {'name': 'hubg-Q125-10-Q', 'url': 'https://storage.googleapis.com/reflexivity-documents-prod/edgar/filing/10-q/hubg-Q125-10-Q.html'}, {'name': 'hubg-FY24-10-K', 'url': 'https://storage.googleapis.com/reflexivity-documents-prod/edgar/filing/10-k/hubg-FY24-10-K.html'}]",4813067,USD,HUBG,SMART,STK,True,SUP
transportation and logistics,supply_chain_management,IE00B4BNMY34,ACCENTURE PLC-CL A,34,"Proporciona servicios integrales de consultoría, tecnología y externalización para ayudar a los clientes a diseñar, optimizar y gestionar cadenas de suministro resilientes y eficientes a nivel mundial.",,,67889930,USD,ACN,SMART,STK,True,SUP
transportation and logistics,supply_chain_management,US70959W1036,PENSKE AUTOMOTIVE GROUP INC,35,"Gestiona la distribución y venta al por menor de vehículos nuevos y usados, junto con las piezas y servicios asociados, desempeñando un papel crucial en la entrega final de la cadena de suministro automotriz a los consumidores.","Penske Automotive Group participa en la gestión de la cadena de suministro a través de su participación accionaria en Penske Transportation Solutions (PTS), que proporciona soluciones de cadena de suministro a sus clientes. PTS gestiona una gran flota de camiones en América del Norte y ofrece soluciones de transporte, cadena de suministro y tecnología. La empresa también gestiona inventario, piezas y logística, todos componentes de la gestión de la cadena de suministro, y mantiene un contacto estrecho con los socios OEM, con discusiones sobre el impacto de los aranceles en los envíos de productos que indican preocupación por la gestión de la cadena de suministro.","[{'name': 'pag-FY24-10-K', 'url': 'https://storage.googleapis.com/reflexivity-documents-prod/edgar/filing/10-k/pag-FY24-10-K.html'}]",45006145,USD,PAG,SMART,STK,True,SUP
transportation and logistics,supply_chain_management,US5018892084,LKQ CORP,36,"Gestiona una cadena de suministro global para la distribución de piezas de vehículos, optimizando el inventario y la logística para apoyar las industrias del mercado de repuestos automotrices y la reparación de colisiones.","La participación de LKQ en la Gestión de la Cadena de Suministro es evidente en varias iniciativas operativas. La empresa se enfoca en optimizar las operaciones y reducir costos a través de programas de racionalización de sistemas y back-office, junto con la gestión del flujo de bienes a través de su red de distribución. Los esfuerzos de racionalización de SKU en Europa tienen como objetivo reducir la complejidad y simplificar la red de distribución, lo que resulta en una reducción de más de 13.000 SKU. Para superar los desafíos, LKQ estableció un grupo de trabajo global sobre aranceles, compuesto por líderes de varios departamentos, para tomar decisiones informadas y optimizar la cadena de suministro.",,26345312,USD,LKQ,SMART,STK,True,SUP
transportation and logistics,supply_chain_management,US88160R1014,TESLA INC,37,"Gestiona una compleja cadena de suministro global de materias primas, componentes y vehículos eléctricos terminados y productos de energía, enfatizando la eficiencia y la resiliencia en la fabricación y distribución.",,,76792991,USD,TSLA,SMART,STK,True,SUP
transportation and logistics,supply_chain_management,US87151X1019,SYMBOTIC INC,38,"Desarrolla e implementa soluciones de robótica y automatización para optimizar las operaciones de almacén, mejorando significativamente la eficiencia y la resiliencia en toda la cadena de suministro.","Symbotic demuestra un fuerte enfoque en la gestión de la cadena de suministro, como lo demuestra su visión principal de mejorar las operaciones de la cadena de suministro a través de soluciones tecnológicas innovadoras. La empresa desarrolla e implementa soluciones tecnológicas integrales que mejoran drásticamente las operaciones de la cadena de suministro, automatizando procesos en grandes almacenes para las principales empresas minoristas. La cartera de productos de Symbotic abarca varios niveles de la cadena de suministro, con sistemas de automatización y estructuras de almacenamiento de próxima generación diseñados para mejorar el flujo de bienes, información y recursos. Este compromiso está respaldado además por una importante cartera de pedidos y la aplicación de sus soluciones de almacenamiento en varios aspectos de la cadena de suministro, desde centros de distribución hasta centros de comercio electrónico.","[{'name': 'sym-Q225-10-Q', 'url': 'https://storage.googleapis.com/reflexivity-documents-prod/edgar/filing/10-q/sym-Q225-10-Q.html'}, {'name': 'sym-FY24-10-K', 'url': 'https://storage.googleapis.com/reflexivity-documents-prod/edgar/filing/10-k/sym-FY24-10-K.html'}]",566188877,USD,SYM,SMART,STK,False,SUP
transportation and logistics,supply_chain_management,US80689H1023,SCHNEIDER NATIONAL INC-CL B,39,"Proporciona soluciones integrales de transporte y logística que son fundamentales para una gestión eficiente de la cadena de suministro, permitiendo a las empresas optimizar el movimiento de sus mercancías.","La participación de Schneider en la Gestión de la Cadena de Suministro es evidente a través de sus servicios de logística, que abarcan soluciones de cadena de suministro que incluyen 3PL, almacenamiento y servicios de importación/exportación. La compañía aprovecha su huella en América del Norte para ofrecer alternativas de cadena de suministro e impulsar el crecimiento de los clientes. Además, Schneider está integrando activamente Cowan Logistics para aprovechar las herramientas empresariales y eliminar redundancias, con el objetivo de mejorar los márgenes. Si bien la gestión de la cadena de suministro es integral para sus operaciones, la compañía también se enfoca en optimizar la asignación de capital y mejorar la resiliencia de su segmento de Carga Completa, lo que sugiere un enfoque equilibrado en varios impulsores de crecimiento estratégico.","[{'name': 'sndr-FY24-10-K', 'url': 'https://storage.googleapis.com/reflexivity-documents-prod/edgar/filing/10-k/sndr-FY24-10-K.html'}, {'name': 'sndr-Q125-10-Q', 'url': 'https://storage.googleapis.com/reflexivity-documents-prod/edgar/filing/10-q/sndr-Q125-10-Q.html'}, {'name': 'sndr-Q324-10-Q', 'url': 'https://storage.googleapis.com/reflexivity-documents-prod/edgar/filing/10-q/sndr-Q324-10-Q.html'}]",271857752,USD,SNDR,SMART,STK,True,SUP
transportation and logistics,supply_chain_management,US95082P1057,WESCO INTERNATIONAL INC,40,Proporciona servicios integrales de gestión de la cadena de suministro y soluciones de distribución que optimizan las operaciones para clientes de diversas industrias.,"Wesco está profundamente involucrada en la gestión de la cadena de suministro, ofreciendo servicios y soluciones de cadena de suministro de extremo a extremo como parte central de su negocio. La empresa gestiona activamente su cadena de suministro para mitigar el impacto de los aranceles globales, aprovechando su escala global para obtener productos localmente y optimizar la logística. Las soluciones innovadoras de Wesco abarcan la gestión de la cadena de suministro, la logística, el transporte, la adquisición, el almacenamiento y la gestión de inventario, lo que demuestra un enfoque integral para satisfacer las necesidades del cliente y navegar por los desafíos de la cadena de suministro global.","[{'name': 'wcc-Q125-10-Q', 'url': 'https://storage.googleapis.com/reflexivity-documents-prod/edgar/filing/10-q/wcc-Q125-10-Q.html'}, {'name': 'wcc-Q324-10-Q', 'url': 'https://storage.googleapis.com/reflexivity-documents-prod/edgar/filing/10-q/wcc-Q324-10-Q.html'}]",6608665,USD,WCC,SMART,STK,True,SUP
transportation and logistics,supply_chain_management,US78463M1071,SPS COMMERCE INC,41,"Ofrece soluciones integrales basadas en la nube que conectan a los socios comerciales, optimizan la gestión de pedidos y mejoran la visibilidad en toda la cadena de suministro.","SPS Commerce participa profundamente en la transformación de la cadena de suministro minorista global, ofreciendo un conjunto de productos y soluciones basados en la nube diseñados para fomentar la colaboración y optimizar las operaciones entre minoristas, supermercados, distribuidores, proveedores, fabricantes y empresas de logística. El compromiso de la empresa es evidente en sus esfuerzos por crear una comunidad más dinámica e interconectada donde los actores puedan conectarse y prosperar libremente. La cartera de productos de SPS Commerce, que incluye cumplimiento, análisis y facturación electrónica, tiene como objetivo mejorar el rendimiento de la cadena de suministro, optimizar los niveles de inventario, reducir los costos operativos y mejorar la visibilidad de los pedidos para sus clientes. La empresa tiene como objetivo explícito penetrar aún más en el mercado de gestión de la cadena de suministro, reforzando su enfoque estratégico y su inversión en esta área.","[{'name': 'spsc-FY24-10-K', 'url': 'https://storage.googleapis.com/reflexivity-documents-prod/edgar/filing/10-k/spsc-FY24-10-K.html'}, {'name': 'spsc-Q225-10-Q', 'url': 'https://storage.googleapis.com/reflexivity-documents-prod/edgar/filing/10-q/spsc-Q225-10-Q.html'}, {'name': 'spsc-Q125-10-Q', 'url': 'https://storage.googleapis.com/reflexivity-documents-prod/edgar/filing/10-q/spsc-Q125-10-Q.html'}, {'name': 'spsc-Q324-10-Q', 'url': 'https://storage.googleapis.com/reflexivity-documents-prod/edgar/filing/10-q/spsc-Q324-10-Q.html'}]",74685916,USD,SPSC,SMART,STK,True,SUP
transportation and logistics,supply_chain_management,JP3898400001,MITSUBISHI CORP,42,"Gestiona y optimiza complejas cadenas de suministro globales en una amplia gama de industrias, facilitando el movimiento de bienes y recursos en todo el mundo.",,,13905888,JPY,8058,SMART,STK,False,SUP
transportation and logistics,supply_chain_management,US7427181091,PROCTER & GAMBLE CO/THE,43,Gestiona una compleja cadena de suministro global para producir y distribuir eficientemente una vasta cartera de bienes de consumo a mercados de todo el mundo.,"Procter & Gamble enfatiza la gestión de la cadena de suministro mediante la optimización y el desarrollo de capacidades para mejorar la flexibilidad, agilidad, resiliencia y productividad. Esto incluye el mantenimiento de acuerdos clave de fabricación y suministro y la gestión de posibles interrupciones por factores económicos, políticos y ambientales. La compañía también ha anunciado un plan de cartera y productividad destinado a optimizar la organización y mejorar la estructura de costos, que se ejecutará en varias unidades de negocio.","[{'name': 'pg-FY25-10-K', 'url': 'https://storage.googleapis.com/reflexivity-documents-prod/edgar/filing/10-k/pg-FY25-10-K.html'}]",11054,USD,PG,SMART,STK,True,SUP
transportation and logistics,supply_chain_management,US03064D1081,AMERICOLD REALTY TRUST INC,44,"Proporciona infraestructura crítica de almacenamiento y logística con control de temperatura, que es esencial para el almacenamiento y distribución eficientes de productos perecederos a lo largo de la cadena de suministro.","El compromiso de Americold con la gestión de la cadena de suministro es evidente en sus iniciativas estratégicas para optimizar el movimiento de productos con temperatura controlada, ejemplificado por sus colaboraciones con CPKC y DP World para establecer soluciones logísticas de extremo a extremo. La empresa está gestionando activamente los niveles de inventario y adaptándose a las dificultades de la cadena de suministro, al tiempo que se centra en proporcionar soluciones únicas de cadena de frío a los clientes que buscan una rotación de inventario más rápida. Aunque los clientes están aprovechando su propia infraestructura debido a los bajos niveles de inventario en toda la cadena de suministro, Americold se centra en ofrecer valor más allá del simple precio por posición de paleta a través de asociaciones estratégicas y mejoras en la eficiencia de la cadena de suministro dentro de la cadena de suministro de alimentos de almacenamiento en frío a nivel mundial.",,302902503,USD,COLD,SMART,STK,False,SUP
transportation and logistics,supply_chain_management,US8725401090,TJX COMPANIES INC,45,"Se basa en sólidas estrategias de logística y gestión de inventario para obtener y distribuir eficientemente una amplia gama de mercancías, apoyando su modelo minorista de precios bajos en una red global.",,,12814,USD,TJX,SMART,STK,True,SUP
