type,link_type,key,name,rank,description,evidence,evidenceSources,conid,currency,symbol,exchange,assetType,navigable,theme_id
transportation and logistics,supply_chain_management,US3696043013,GENERAL ELECTRIC,69,Optimiza procesos complejos de logística y adquisiciones a nivel mundial en sus diversos segmentos industriales para garantizar operaciones y entregas eficientes.,"La participación de GE Aerospace en la Gestión de la Cadena de Suministro es evidente a través de sus medidas activas para mitigar interrupciones y mejorar el rendimiento de entrega. La empresa está invirtiendo en instalaciones de fabricación y revisión, y asociándose con proveedores para mejorar la entrada de materiales. También están utilizando FLIGHT DECK para abordar las limitaciones de la cadena de suministro y organizando simposios de proveedores para compartir perspectivas de crecimiento. Estos esfuerzos están dirigidos a aumentar la producción, fortalecer el rendimiento y mejorar la entrega a los clientes, al tiempo que abordan los desafíos relacionados con la disponibilidad global de materiales y el rendimiento de entrega de los proveedores.",,498843743,USD,GE,SMART,STK,True,SUP
transportation and logistics,supply_chain_management,US5007541064,KRAFT HEINZ CO/THE,70,"Gestiona una compleja cadena de suministro global para obtener materias primas, producir y distribuir eficientemente una amplia gama de productos de alimentos y bebidas a consumidores de todo el mundo.","El compromiso de Kraft Heinz con la Gestión de la Cadena de Suministro es evidente en su gestión activa de costos e iniciativas de eficiencia. La empresa experimentó una mayor estabilidad en los costos de insumos y de la cadena de suministro y se benefició de iniciativas de eficiencia, particularmente en adquisiciones y logística. Sin embargo, la empresa también enfrenta desafíos, incluidas presiones inflacionarias en regiones específicas y el impacto de los aranceles en su cadena de suministro integrada que abarca EE. UU. y Canadá, lo que genera mayores costos de cadena de suministro.","[{'name': 'khc-Q125-10-Q', 'url': 'https://storage.googleapis.com/reflexivity-documents-prod/edgar/filing/10-q/khc-Q125-10-Q.html'}, {'name': 'khc-Q324-10-Q', 'url': 'https://storage.googleapis.com/reflexivity-documents-prod/edgar/filing/10-q/khc-Q324-10-Q.html'}]",199169586,USD,KHC,SMART,STK,True,SUP
transportation and logistics,supply_chain_management,US94419L1017,WAYFAIR INC- CLASS A,71,"Integra y optimiza una compleja red global de proveedores, almacenes y socios logísticos para entregar eficientemente una vasta selección de artículos para el hogar directamente a los clientes.","El compromiso de Wayfair con la Gestión de la Cadena de Suministro es evidente en su red logística patentada, CastleGate, que abarca la logística de entrada, el almacenamiento y el cumplimiento de salida en múltiples continentes. La empresa ha invertido en CastleGate desde 2015, construyendo una red diseñada a medida para productos de la categoría del hogar frágiles, pesados y voluminosos. Esto ha resultado en un aumento sustancial del volumen total que utiliza las ofertas de CastleGate Forwarding y una expansión a nuevos mercados. Wayfair también trabaja con socios proveedores para desarrollar estrategias y planificar los costos incrementales de los aranceles, siendo CastleGate una de sus mejores soluciones, que ofrece entregas más rápidas y menores costos de cumplimiento que se reflejan directamente en precios minoristas más bajos.",,168812158,USD,W,SMART,STK,False,SUP
transportation and logistics,supply_chain_management,US74982T1034,RXO INC,72,Ofrece soluciones integrales de transporte de carga que son esenciales para optimizar la logística y garantizar el flujo eficiente de mercancías a lo largo de las cadenas de suministro globales.,"La participación de RXO en la Gestión de la Cadena de Suministro es evidente a través de sus servicios de transporte gestionado, que ofrecen soluciones ligeras en activos para expedidores que buscan confiabilidad, visibilidad y ahorro de costos. Estos servicios aprovechan la tecnología propietaria para mejorar la sinergia de ingresos al integrar el corretaje de camiones y las soluciones de última milla. El transporte gestionado de RXO incluye planificación y adquisición de cargas a medida, soluciones complejas adaptadas a desafíos específicos, monitoreo de rendimiento, ingeniería y análisis de datos. Además, la solución de torre de control de RXO utiliza un equipo dedicado enfocado en la mejora continua y proporciona visibilidad digital de puerta a puerta del estado del pedido y la carga en tránsito.","[{'name': 'rxo-Q324-10-Q', 'url': 'https://storage.googleapis.com/reflexivity-documents-prod/edgar/filing/10-q/rxo-Q324-10-Q.html'}, {'name': 'rxo-Q225-10-Q', 'url': 'https://storage.googleapis.com/reflexivity-documents-prod/edgar/filing/10-q/rxo-Q225-10-Q.html'}, {'name': 'rxo-FY24-10-K', 'url': 'https://storage.googleapis.com/reflexivity-documents-prod/edgar/filing/10-k/rxo-FY24-10-K.html'}]",592052137,USD,RXO,SMART,STK,True,SUP
transportation and logistics,supply_chain_management,US69608A1088,PALANTIR TECHNOLOGIES INC-A,73,"Ofrece plataformas avanzadas de integración y análisis de datos para mejorar la resiliencia de la cadena de suministro, optimizar la logística y aumentar la eficiencia operativa para diversas organizaciones.","El papel de Palantir en la gestión de la cadena de suministro se demuestra a través de sus asociaciones e implementaciones de software en diversas industrias. Por ejemplo, Rio Tinto amplió su asociación con Palantir, aprovechando AIP para mejorar la accesibilidad de los datos y abordar problemas complejos, lo que resultó en importantes ganancias de eficiencia para anticipar y responder a la escasez de suministro. De manera similar, Anduril experimentó un aumento sustancial en la eficiencia de la gestión de la cadena de suministro al utilizar el software de Palantir. Además, Palantir está ayudando a Panasonic Energy North America a optimizar la producción de baterías a través de una herramienta de asistencia de mantenimiento, y también está proporcionando servicios de equilibrio de carga y cumplimiento de recetas para una de las farmacias más grandes de Estados Unidos.",,444857009,USD,PLTR,SMART,STK,True,SUP
transportation and logistics,supply_chain_management,US0394831020,ARCHER-DANIELS-MIDLAND CO,74,"Gestiona una vasta red global para la originación, procesamiento y transporte de productos agrícolas, asegurando el flujo eficiente de productos alimenticios, para piensos e industriales esenciales a través de la cadena de suministro.","Archer-Daniels-Midland Company se identifica como un gestor y procesador esencial de la cadena de suministro agrícola mundial, enfatizando su papel en la seguridad alimentaria al conectar las necesidades locales con las capacidades globales. El pilar de productividad de la empresa se centra en optimizar los costos y mejorar los volúmenes de producción y el cumplimiento de la demanda en toda la empresa a través de asociaciones con equipos globales, incluyendo adquisiciones, cadena de suministro, operaciones y comercial. Dado que una parte significativa de los ingresos de la empresa proviene del segmento de Servicios Agrícolas y Semillas Oleaginosas, la posición de ADM como gestor de la cadena de suministro es una parte importante de su negocio.","[{'name': 'adm-FY24-10-K', 'url': 'https://storage.googleapis.com/reflexivity-documents-prod/edgar/filing/10-k/adm-FY24-10-K.html'}]",4165,USD,ADM,SMART,STK,True,SUP
transportation and logistics,supply_chain_management,US57686G1058,MATSON INC,75,Proporciona servicios de transporte marítimo y logística que son cruciales para operaciones eficientes de la cadena de suministro.,"El compromiso de Matson con la Gestión de la Cadena de Suministro es evidente a través de su segmento de Logística, donde gestiona el flujo de bienes, información y recursos. La empresa se identifica como un socio de confianza en la cadena de suministro, enfatizando un servicio confiable y adaptándose a las incertidumbres del comercio mundial. La gestión de la cadena de suministro contribuye constantemente a los ingresos operativos y los ingresos del segmento de Logística, a menudo compensando las pérdidas en otras áreas como la intermediación de transporte. Esta contribución se destaca en varios períodos, con aumentos atribuidos principalmente a mayores ingresos en el transporte de carga y la gestión de la cadena de suministro.","[{'name': 'matx-Q324-10-Q', 'url': 'https://storage.googleapis.com/reflexivity-documents-prod/edgar/filing/10-q/matx-Q324-10-Q.html'}, {'name': 'matx-Q125-10-Q', 'url': 'https://storage.googleapis.com/reflexivity-documents-prod/edgar/filing/10-q/matx-Q125-10-Q.html'}, {'name': 'matx-FY24-10-K', 'url': 'https://storage.googleapis.com/reflexivity-documents-prod/edgar/filing/10-k/matx-FY24-10-K.html'}]",108649896,USD,MATX,SMART,STK,True,SUP
