type,link_type,key,name,rank,description,evidence,evidenceSources,conid,currency,symbol,exchange,assetType,navigable,theme_id
transportation and logistics,supply_chain_management,US31428X1063,FEDEX CORPORATION,1,"Proporciona servicios integrales de transporte, comercio electrónico y empresariales que son fundamentales para las operaciones de la cadena de suministro global, permitiendo el movimiento eficiente de bienes e información a través de diversas industrias.","La participación de FedEx en la gestión de la cadena de suministro es evidente a través de su extensa red global, que conecta una parte significativa del comercio mundial. El gemelo digital de la empresa anticipa interrupciones y optimiza rutas, mientras que la plataforma de comercio FDX orquesta las cadenas de suministro de los clientes. FedEx Logistics proporciona soluciones integradas de gestión de la cadena de suministro, lo que enfatiza aún más el papel de la empresa en este dominio. Rajesh Subramaniam destaca el trabajo del equipo para hacer que las cadenas de suministro sean más inteligentes, y Best Buy utiliza las herramientas avanzadas de visibilidad de FedEx para el seguimiento en tiempo real y la mejora de la experiencia del cliente.","[{'name': 'fdx-Q225-10-Q', 'url': 'https://storage.googleapis.com/reflexivity-documents-prod/edgar/filing/10-q/fdx-Q225-10-Q.html'}, {'name': 'fdx-Q325-10-Q', 'url': 'https://storage.googleapis.com/reflexivity-documents-prod/edgar/filing/10-q/fdx-Q325-10-Q.html'}, {'name': 'fdx-Q125-10-Q', 'url': 'https://storage.googleapis.com/reflexivity-documents-prod/edgar/filing/10-q/fdx-Q125-10-Q.html'}, {'name': 'fdx-FY25-10-K', 'url': 'https://storage.googleapis.com/reflexivity-documents-prod/edgar/filing/10-k/fdx-FY25-10-K.html'}]",5100583,USD,FDX,SMART,STK,True,SUP
transportation and logistics,supply_chain_management,US12541W2098,C.H. ROBINSON WORLDWIDE INC,2,"Sirve como líder mundial en gestión de la cadena de suministro, ofreciendo servicios y tecnología logística integrales para optimizar el movimiento de carga y mejorar la eficiencia en diversas industrias.","El compromiso de C.H. Robinson con la Gestión de la Cadena de Suministro es significativo, ya que la empresa declara explícitamente su papel en ayudar a los clientes a navegar por cadenas de suministro globales cada vez más complejas y resolver desafíos logísticos. Los servicios de la empresa incluyen ayudar a los clientes a diversificar sus cadenas de suministro, desarrollar estrategias de eficiencia y rentabilidad, y gestionar el flujo de mercancías entre industrias y continentes. Además, C.H. Robinson tiene como objetivo reimaginar las cadenas de suministro y avanzar en la tecnología de carga, ofreciendo soluciones integradas de cadena de suministro para clientes minoristas y de servicios de alimentos, destacando el papel central del tema en las ofertas de servicios y el modelo de negocio de la empresa.","[{'name': 'chrw-Q225-10-Q', 'url': 'https://storage.googleapis.com/reflexivity-documents-prod/edgar/filing/10-q/chrw-Q225-10-Q.html'}, {'name': 'chrw-Q125-10-Q', 'url': 'https://storage.googleapis.com/reflexivity-documents-prod/edgar/filing/10-q/chrw-Q125-10-Q.html'}, {'name': 'chrw-Q324-10-Q', 'url': 'https://storage.googleapis.com/reflexivity-documents-prod/edgar/filing/10-q/chrw-Q324-10-Q.html'}, {'name': 'chrw-FY24-10-K', 'url': 'https://storage.googleapis.com/reflexivity-documents-prod/edgar/filing/10-k/chrw-FY24-10-K.html'}]",36320731,USD,CHRW,SMART,STK,True,SUP
transportation and logistics,supply_chain_management,US9113121068,UNITED PARCEL SERVICE-CL B,3,"Ofrece servicios integrales de logística, transporte y entrega a nivel mundial, lo que permite de manera crítica el flujo eficiente de bienes y optimiza las redes de la cadena de suministro para diversas industrias.","La participación de UPS en la Gestión de la Cadena de Suministro es evidente a través de sus iniciativas estratégicas y su enfoque operativo. La empresa gestiona cadenas de suministro para sus clientes, aprovechando su cartera global y su tecnología de corretaje de próxima generación para ayudarles a navegar por las cambiantes políticas comerciales, aranceles y disrupciones en las fronteras. El enfoque de UPS en mejorar la calidad de los ingresos en segmentos de mercado clave como el de la salud, el internacional, el B2B y el de las PYMES, junto con su capacidad para trasladar activos en función de las necesidades del cliente, demuestra un compromiso con la gestión de la cadena de suministro. Esto se ve aún más respaldado por el segmento de Soluciones de Cadena de Suministro de la empresa y adquisiciones como MNX Global Logistics y Frigo-Trans, destinadas a mejorar capacidades específicas como la logística con control de temperatura y la logística crítica en tiempo.","[{'name': 'ups-FY24-10-K', 'url': 'https://storage.googleapis.com/reflexivity-documents-prod/edgar/filing/10-k/ups-FY24-10-K.html'}, {'name': 'ups-Q324-10-Q', 'url': 'https://storage.googleapis.com/reflexivity-documents-prod/edgar/filing/10-q/ups-Q324-10-Q.html'}]",6231002,USD,UPS,SMART,STK,True,SUP
transportation and logistics,supply_chain_management,US8718291078,SYSCO CORP,4,Impulsa la eficiencia y la confiabilidad dentro de la industria de servicios de alimentos al administrar extensas cadenas de suministro para la distribución de productos a los clientes.,"El compromiso de Sysco con la gestión de la cadena de suministro es evidente en sus iniciativas estratégicas para desarrollar una cadena de suministro más ágil, accesible y productiva para apoyar mejor a los clientes. Esto incluye esfuerzos para servir a los clientes de manera eficiente y consistente a través de un marco de entrega flexible. La empresa se centra en la expansión de la capacidad de la cadena de suministro, ejemplificada por una nueva instalación en las afueras de Londres, y en la mejora del abastecimiento estratégico para gestionar los costos y aumentar el beneficio bruto. Además, Sysco está gestionando activamente la cadena de suministro desde el abastecimiento hasta la entrega, formando a los equipos de operaciones, inventario, comercialización y ventas.","[{'name': 'syy-FY25-10-K', 'url': 'https://storage.googleapis.com/reflexivity-documents-prod/edgar/filing/10-k/syy-FY25-10-K.html'}]",12581,USD,SYY,SMART,STK,True,SUP
transportation and logistics,supply_chain_management,US4456581077,HUNT (JB) TRANSPRT SVCS INC,5,Impulsa la eficiencia y la fiabilidad de las operaciones de la cadena de suministro a través de sus completos servicios de transporte y logística.,"El compromiso de J.B. Hunt con la Gestión de la Cadena de Suministro es evidente en sus prácticas operativas y soluciones tecnológicas. La empresa gestiona el flujo de mercancías desde la recogida hasta la entrega y controla el cumplimiento de los servicios prometidos, operando como principal en estas transacciones. J.B. Hunt 360°®, la plataforma en línea de la empresa, mejora la visibilidad y la transparencia de la cadena de suministro para expedidores y transportistas. Además, J.B. Hunt se enfoca en ayudar a los clientes a optimizar dinámicamente sus planes de cadena de suministro y capacidad para satisfacer las necesidades de servicio y los requisitos presupuestarios.","[{'name': 'jbht-Q125-10-Q', 'url': 'https://storage.googleapis.com/reflexivity-documents-prod/edgar/filing/10-q/jbht-Q125-10-Q.html'}, {'name': 'jbht-FY24-10-K', 'url': 'https://storage.googleapis.com/reflexivity-documents-prod/edgar/filing/10-k/jbht-FY24-10-K.html'}]",270825,USD,JBHT,SMART,STK,True,SUP
transportation and logistics,supply_chain_management,US74340W1036,PROLOGIS INC,6,"Proporciona bienes raíces y soluciones logísticas críticas, facilitando el almacenamiento y la distribución eficientes de bienes esenciales para las operaciones modernas de la cadena de suministro.","Prologis participa activamente en la gestión de la cadena de suministro, como lo demuestran sus esfuerzos por desarrollar las cadenas de suministro de los clientes en medio de la incertidumbre macroeconómica. La empresa enfatiza su papel como socio en tiempos turbulentos, destacando que un mundo desconectado requiere un mayor espacio de almacén. Prologis también reconoce posibles interrupciones en la logística y las cadenas de suministro, abogando por un posicionamiento flexible del inventario y señalando una mayor utilización de la capacidad 3PL, lo que demuestra su apoyo a los clientes para navegar estos desafíos.",,88819288,USD,PLD,SMART,STK,True,SUP
transportation and logistics,supply_chain_management,US0231351067,AMAZON.COM INC,7,"Gestiona una red logística y de cumplimiento global vasta y tecnológicamente avanzada, influyendo significativamente y estableciendo puntos de referencia en la eficiencia de la cadena de suministro y la entrega de última milla.","El enfoque de Amazon en la gestión de la cadena de suministro es evidente en sus esfuerzos por mejorar la eficiencia y la rentabilidad de su red de cumplimiento. Esto incluye la regionalización de la red en centros regionales para almacenar artículos más cerca de los clientes, lo que permite tiempos de entrega más rápidos, reducción de embalajes y menores costos de entrega. Para optimizar aún más las operaciones, Amazon rediseñó su arquitectura de entrada para ampliar la cuota de productos que puede colocar en cada centro de cumplimiento, mejorando las velocidades de entrega y reduciendo los costos. La red de entrada recién re-arquitectada está impulsando la productividad en la red de cumplimiento y transporte, lo que lleva a una mejor colocación de inventario y mayores unidades por paquete.",,3691937,USD,AMZN,SMART,STK,True,SUP
transportation and logistics,supply_chain_management,US3848021040,WW GRAINGER INC,8,"Proporciona productos esenciales de mantenimiento, reparación y operación (MRO) industriales y soluciones de cadena de suministro, lo que permite a las empresas optimizar su eficiencia y continuidad operativa.","Grainger enfatiza su compromiso con la gestión de la cadena de suministro a través de varias estrategias clave. La empresa se enfoca en mejorar los procesos operativos para optimizar el servicio y los costos a través de la experiencia del cliente, la tecnología y la infraestructura de la cadena de suministro. Grainger colabora estrechamente con su red de proveedores para garantizar que los clientes reciban los productos correctos cuándo y dónde los necesiten, respaldado por una cadena de suministro de clase mundial e inversiones estratégicas en información de productos y capacidades digitales. Además, Grainger monitorea activamente las condiciones económicas e implementa estrategias para mitigar los desafíos de la cadena de suministro, incluidas las inversiones continuas en su capacidad de cadena de suministro en EE. UU.","[{'name': 'gww-Q125-10-Q', 'url': 'https://storage.googleapis.com/reflexivity-documents-prod/edgar/filing/10-q/gww-Q125-10-Q.html'}, {'name': 'gww-FY24-10-K', 'url': 'https://storage.googleapis.com/reflexivity-documents-prod/edgar/filing/10-k/gww-FY24-10-K.html'}]",7867,USD,GWW,SMART,STK,True,SUP
transportation and logistics,supply_chain_management,US5627501092,MANHATTAN ASSOCIATES INC,9,"Desarrolla y proporciona soluciones integrales de comercio para la cadena de suministro que optimizan el inventario, agilizan el cumplimiento de pedidos y mejoran la gestión de almacenes para empresas a nivel mundial.","El negocio principal de Manhattan Associates se centra en proporcionar soluciones de software para la gestión de cadenas de suministro, inventario y operaciones omnicanal, ya que desarrollan, venden, implementan, dan servicio y mantienen estas soluciones para una variedad de organizaciones. Su modelo de negocio se centra exclusivamente en el desarrollo e implementación de complejas soluciones de software de habilitación de comercio diseñadas para optimizar las cadenas de suministro. Las soluciones de la compañía son de misión crítica, respaldan complejas cadenas de suministro globales y ofrecen lo que creen que es la cartera de soluciones más amplia en el mercado de soluciones de cadena de suministro, abordando todos los aspectos de la optimización de inventario, la gestión del transporte, la gestión de la distribución y la planificación.","[{'name': 'manh-Q125-10-Q', 'url': 'https://storage.googleapis.com/reflexivity-documents-prod/edgar/filing/10-q/manh-Q125-10-Q.html'}, {'name': 'manh-Q225-10-Q', 'url': 'https://storage.googleapis.com/reflexivity-documents-prod/edgar/filing/10-q/manh-Q225-10-Q.html'}, {'name': 'manh-Q324-10-Q', 'url': 'https://storage.googleapis.com/reflexivity-documents-prod/edgar/filing/10-q/manh-Q324-10-Q.html'}, {'name': 'manh-FY24-10-K', 'url': 'https://storage.googleapis.com/reflexivity-documents-prod/edgar/filing/10-k/manh-FY24-10-K.html'}]",4814485,USD,MANH,SMART,STK,True,SUP
transportation and logistics,supply_chain_management,US6795801009,OLD DOMINION FREIGHT LINE,10,"Proporciona servicios de envío de carga consolidada (LTL), que son integrales para el movimiento eficiente de bienes y la logística dentro de la gestión de la cadena de suministro global.","Old Dominion Freight Line (ODFL) integra consideraciones de la cadena de suministro en sus operaciones al enfatizar la importancia de su red en las cadenas de suministro de los clientes, ayudando a los clientes a ahorrar dinero y ofreciendo consultoría de la cadena de suministro como un servicio de valor agregado. La compañía destaca la importancia de la sofisticación de la cadena de suministro, particularmente en relación con los costos de inventario en relación con las tasas de interés, y posiciona su servicio confiable y a tiempo como una propuesta de valor clave para los clientes. Además, ODFL reconoce el impacto del comercio electrónico en las cadenas de suministro, incluida la tendencia de la reducción del tamaño de los envíos y la conversión de camiones completos a LTL, y ve oportunidades potenciales en las tendencias de nearshoring y reshoring dentro de América del Norte. La compañía se enfoca en agregar valor para los clientes y ayudarlos a crear valor para sus propios clientes.","[{'name': 'odfl-Q224-10-Q', 'url': 'https://storage.googleapis.com/reflexivity-documents-prod/edgar/filing/10-q/odfl-Q224-10-Q.html'}, {'name': 'odfl-FY24-10-K', 'url': 'https://storage.googleapis.com/reflexivity-documents-prod/edgar/filing/10-k/odfl-FY24-10-K.html'}]",272667,USD,ODFL,SMART,STK,True,SUP
transportation and logistics,supply_chain_management,US37045V1008,GENERAL MOTORS CO,11,"Implica una extensa coordinación global de materiales, componentes y logística para respaldar sus operaciones de fabricación y distribución a gran escala.","El compromiso de GM con la Gestión de la Cadena de Suministro es evidente en sus prioridades estratégicas, que incluyen la expansión de su huella de fabricación en EE. UU. y su cadena de suministro nacional. Esto implica aumentar las compras directas en EE. UU. para la producción norteamericana, con el objetivo de un mayor cumplimiento del T-MEC y reducir la dependencia de China para los materiales. Además, GM trabaja activamente con los proveedores para mejorar el contenido estadounidense, aumentar la eficiencia y garantizar el cumplimiento, al tiempo que se enfoca en la resiliencia de la cadena de suministro y la mitigación de interrupciones, como las causadas por incendios en fábricas de proveedores.",,80986742,USD,GM,SMART,STK,True,SUP
transportation and logistics,supply_chain_management,US9311421039,WALMART INC,12,"Orquesta una vasta y compleja red global de proveedores, centros de distribución y transporte para optimizar la disponibilidad y eficiencia de los productos en su extensa huella minorista.","La participación de Walmart en la Gestión de la Cadena de Suministro es evidente a través de varios factores clave. La compañía está asignando la mayor parte de su capital a áreas de mayor rendimiento centradas en la automatización, incluido el comercio electrónico, la cadena de suministro y las inversiones en tiendas y clubes, con gastos significativos asignados a la cadena de suministro, iniciativas orientadas al cliente y tecnología. Este énfasis estratégico se ve aún más subrayado por las acciones tomadas para aumentar las inversiones en automatización y cadena de suministro, junto con el reconocimiento de la influencia de las interrupciones en la cadena de suministro y la gestión de inventario en la empresa y el sector minorista en general.","[{'name': 'wmt-FY24-10-K', 'url': 'https://storage.googleapis.com/reflexivity-documents-prod/edgar/filing/10-k/wmt-FY24-10-K.html'}, {'name': 'wmt-Q225-10-Q', 'url': 'https://storage.googleapis.com/reflexivity-documents-prod/edgar/filing/10-q/wmt-Q225-10-Q.html'}, {'name': 'wmt-Q325-10-Q', 'url': 'https://storage.googleapis.com/reflexivity-documents-prod/edgar/filing/10-q/wmt-Q325-10-Q.html'}]",13824,USD,WMT,SMART,STK,True,SUP
transportation and logistics,supply_chain_management,US22160K1051,COSTCO WHOLESALE CORP,13,"Opera una vasta red minorista global que depende de sofisticados sistemas de logística y gestión de inventario para obtener, almacenar y distribuir eficientemente una amplia gama de productos a sus miembros.","El enfoque de Costco en la gestión de la cadena de suministro es evidente en varias estrategias operativas, incluidas las mejoras que han beneficiado los márgenes en todas las categorías. Están trabajando activamente con los proveedores para mitigar el impacto de los aranceles trasladando estratégicamente las ubicaciones de producción y consolidando los esfuerzos de compra globales. Además, Costco está aumentando su enfoque en productos de origen nacional para reducir los precios en ciertos mercados, lo que requiere una gestión ágil de la cadena de suministro. La empresa también gestiona los plazos de pago con los proveedores y tiene obligaciones de compra relacionadas con mercancías, equipos y servicios de terceros.","[{'name': 'cost-FY24-10-K', 'url': 'https://storage.googleapis.com/reflexivity-documents-prod/edgar/filing/10-k/cost-FY24-10-K.html'}]",272997,USD,COST,SMART,STK,True,SUP
transportation and logistics,supply_chain_management,US36262G1013,GXO LOGISTICS INC,14,"Proporciona soluciones logísticas integrales que optimizan y gestionan cadenas de suministro complejas para diversas industrias, abarcando servicios de almacenamiento, distribución y transporte.","GXO Logistics se identifica como el mayor proveedor de logística por contrato exclusivamente dedicada, enfatizando su papel en la oferta de servicios de valor añadido como almacenamiento, distribución, cumplimiento de pedidos, comercio electrónico, logística inversa y otros servicios de la cadena de suministro. Los clientes de la empresa confían en GXO para mover eficientemente los bienes a través de sus cadenas de suministro, aprovechando soluciones personalizadas y habilitadas por la tecnología. Además, GXO ayuda a las marcas a navegar por las complejidades de la cadena de suministro global, destacando la creciente demanda de soluciones efectivas de la cadena de suministro en un mundo con dinámicas comerciales complejas.","[{'name': 'gxo-Q125-10-Q', 'url': 'https://storage.googleapis.com/reflexivity-documents-prod/edgar/filing/10-q/gxo-Q125-10-Q.html'}, {'name': 'gxo-Q225-10-Q', 'url': 'https://storage.googleapis.com/reflexivity-documents-prod/edgar/filing/10-q/gxo-Q225-10-Q.html'}, {'name': 'gxo-Q324-10-Q', 'url': 'https://storage.googleapis.com/reflexivity-documents-prod/edgar/filing/10-q/gxo-Q324-10-Q.html'}, {'name': 'gxo-FY24-10-K', 'url': 'https://storage.googleapis.com/reflexivity-documents-prod/edgar/filing/10-k/gxo-FY24-10-K.html'}]",502252244,USD,GXO,SMART,STK,True,SUP
transportation and logistics,supply_chain_management,US6558441084,NORFOLK SOUTHERN CORP,15,Sirve como un enlace crucial en la gestión de la cadena de suministro al proporcionar soluciones confiables de transporte ferroviario para diversas industrias para optimizar la logística y la entrega.,"La participación de Norfolk Southern en la Gestión de la Cadena de Suministro es evidente en la fusión con Union Pacific, que tiene como objetivo transformar la cadena de suministro de EE. UU. mediante la creación de nuevas rutas y el aumento del acceso en todo el país. Esta fusión se centra en optimizar el flujo de bienes e información, reducir los tiempos de tránsito y mejorar la eficiencia general de la red. El énfasis en la integración perfecta para mantener el servicio al cliente, reducir los tiempos de ciclo y optimizar las entregas demuestra aún más el enfoque de la empresa en mejorar la confiabilidad y la eficiencia de la cadena de suministro.",,10497,USD,NSC,SMART,STK,True,SUP
transportation and logistics,supply_chain_management,US9120081099,US FOODS HOLDING CORP,16,"Opera una compleja red de distribución para entregar eficientemente alimentos y productos relacionados a clientes del sector de la restauración, lo que requiere una gestión sólida de la cadena de suministro para el abastecimiento, la logística y el control de inventario.","US Foods demuestra un enfoque en la gestión de la cadena de suministro a través de varias iniciativas. Están implementando la implementación de Descartes en toda su red de distribución para mejorar la productividad de las rutas, con el sistema en funcionamiento o en despliegue activo en 65 mercados, lo que representa aproximadamente el 90% de las millas enrutadas. Además, están implementando nuevos procesos de control de inventario, incluida la tecnología de escaneo para reducir las entradas manuales y los errores, y han comenzado a utilizar instalaciones semiautomatizadas para apoyar el crecimiento y acelerar las mejoras en la cadena de suministro. US Foods también monitorea el entorno arancelario y colabora con los proveedores para obtener productos alternativos, al mismo tiempo que trabaja para eliminar los residuos y reducir las bajas.",,234662860,USD,USFD,SMART,STK,True,SUP
transportation and logistics,supply_chain_management,US14149Y1082,CARDINAL HEALTH INC,17,"Proporciona servicios integrales de distribución y logística para productos farmacéuticos y médicos, garantizando el flujo eficiente y fiable de bienes esenciales para la atención sanitaria.","La participación de Cardinal Health en la Gestión de la Cadena de Suministro es evidente en su provisión de productos farmacéuticos y médicos, junto con soluciones rentables destinadas a mejorar la eficiencia de la cadena de suministro. El enfoque de la empresa se extiende a conectar pacientes, proveedores, pagadores, farmacéuticos y fabricantes para una coordinación integrada de la atención. Además, Cardinal Health ofrece servicios de logística a través de OptiFreight® Logistics y gestiona el flujo de bienes dentro de sus segmentos de Soluciones Farmacéuticas y Especializadas y Productos Médicos y Distribución Global, lo que destaca la importancia de la gestión de la cadena de suministro para las operaciones de la empresa.","[{'name': 'cah-Q325-10-Q', 'url': 'https://storage.googleapis.com/reflexivity-documents-prod/edgar/filing/10-q/cah-Q325-10-Q.html'}, {'name': 'cah-Q225-10-Q', 'url': 'https://storage.googleapis.com/reflexivity-documents-prod/edgar/filing/10-q/cah-Q225-10-Q.html'}]",5407,USD,CAH,SMART,STK,True,SUP
transportation and logistics,supply_chain_management,US4663131039,JABIL INC,18,"Proporciona soluciones integrales de fabricación y cadena de suministro, integrando diseño, producción y distribución para optimizar la entrega de productos a nivel mundial para su diversa base de clientes.","El compromiso de Jabil con la Gestión de la Cadena de Suministro es evidente en sus ofertas de servicios, que incluyen diseño electrónico integral, producción y gestión de productos. La compañía declara explícitamente que sus servicios permiten a los clientes reducir los costos de fabricación, mejorar la gestión de la cadena de suministro, reducir la obsolescencia del inventario, disminuir los costos de transporte y reducir el tiempo de cumplimiento del producto. Los servicios y soluciones de gestión de fabricación y cadena de suministro de Jabil también abarcan la innovación, el diseño, la planificación, la fabricación y el ensamblaje, la entrega y la gestión del flujo de recursos y productos.","[{'name': 'jbl-Q225-10-Q', 'url': 'https://storage.googleapis.com/reflexivity-documents-prod/edgar/filing/10-q/jbl-Q225-10-Q.html'}, {'name': 'jbl-Q325-10-Q', 'url': 'https://storage.googleapis.com/reflexivity-documents-prod/edgar/filing/10-q/jbl-Q325-10-Q.html'}, {'name': 'jbl-Q125-10-Q', 'url': 'https://storage.googleapis.com/reflexivity-documents-prod/edgar/filing/10-q/jbl-Q125-10-Q.html'}]",4457282,USD,JBL,SMART,STK,True,SUP
