type,link_type,key,name,rank,description,evidence,evidenceSources,conid,currency,symbol,exchange,assetType,navigable,theme_id
transportation and logistics,supply_chain_management,US85254J1025,STAG INDUSTRIAL INC,46,"Contribuye a la eficiencia de la cadena de suministro al poseer y operar propiedades inmobiliarias industriales cruciales para la logística, la distribución y los procesos de fabricación.","El compromiso de STAG Industrial con la Gestión de la Cadena de Suministro es evidente a través de su apoyo a inquilinos que priorizan la diversificación de la cadena de suministro, impulsada por factores como las preocupaciones sobre la guerra comercial mundial, las huelgas portuarias y los aranceles. Esta diversificación se considera un aspecto positivo neto para STAG, dada su diversidad geográfica y su enfoque en los mercados CBRE Tier 1, con inquilinos que buscan cada vez más oportunidades de producción nacional y cercana. Además, STAG reconoce el impacto de los desarrollos tecnológicos en las cadenas de suministro y la logística, junto con el creciente atractivo de los Estados Unidos como centro de fabricación y distribución debido al deseo de una mayor resiliencia y redundancia de la cadena de suministro.","[{'name': 'stag-Q125-10-Q', 'url': 'https://storage.googleapis.com/reflexivity-documents-prod/edgar/filing/10-q/stag-Q125-10-Q.html'}, {'name': 'stag-Q225-10-Q', 'url': 'https://storage.googleapis.com/reflexivity-documents-prod/edgar/filing/10-q/stag-Q225-10-Q.html'}]",86792819,USD,STAG,SMART,STK,True,SUP
transportation and logistics,supply_chain_management,US67011P1003,DNOW INC,47,"Gestiona la distribución de productos energéticos e industriales, asegurando una entrega eficiente y confiable a través de logística optimizada y soluciones de inventario.","El enfoque de DNOW en la Gestión de la Cadena de Suministro es evidente a través de su provisión de soluciones de gestión de la cadena de suministro y materiales para los mismos mercados donde vende productos. Estas soluciones abarcan una gama de servicios, que incluyen la externalización de partes de la adquisición de clientes, la gestión de almacenes e inventarios y la logística. La empresa también ofrece soluciones de abastecimiento, adquisición, gestión de almacenes e inventarios como parte de sus ofertas de gestión de la cadena de suministro y materiales.","[{'name': 'dnow-FY24-10-K', 'url': 'https://storage.googleapis.com/reflexivity-documents-prod/edgar/filing/10-k/dnow-FY24-10-K.html'}]",151137271,USD,DNOW,SMART,STK,True,SUP
transportation and logistics,supply_chain_management,US7134481081,PEPSICO INC,48,"Aprovecha las extensas operaciones de la cadena de suministro global para obtener eficientemente materias primas, fabricar y distribuir su diversa cartera de productos de alimentos y bebidas a mercados de todo el mundo.","El compromiso de PepsiCo con la Gestión de la Cadena de Suministro es evidente a través de varias consideraciones operativas y estratégicas. La empresa tiene como objetivo aprovechar la escala y reducir la duplicación al combinar las operaciones de la cadena de suministro, creando un sistema más cohesivo para la gestión de inventario y logística. Esta optimización es parte de su estrategia de salida al mercado, impulsando las mejores prácticas consistentes. PepsiCo también reconoce los riesgos asociados con las interrupciones de la cadena de suministro, las presiones inflacionarias y otros factores externos, gestionando activamente estos desafíos a través de varias estrategias, incluidos acuerdos de financiación de la cadena de suministro y la optimización de su huella de fabricación y cadena de suministro como parte de su plan de productividad.","[{'name': 'pep-Q125-10-Q', 'url': 'https://storage.googleapis.com/reflexivity-documents-prod/edgar/filing/10-q/pep-Q125-10-Q.html'}, {'name': 'pep-Q324-10-Q', 'url': 'https://storage.googleapis.com/reflexivity-documents-prod/edgar/filing/10-q/pep-Q324-10-Q.html'}, {'name': 'pep-FY24-10-K', 'url': 'https://storage.googleapis.com/reflexivity-documents-prod/edgar/filing/10-k/pep-FY24-10-K.html'}]",11017,USD,PEP,SMART,STK,True,SUP
transportation and logistics,supply_chain_management,DE0007236101,SIEMENS AG-REG,49,Proporciona soluciones avanzadas de digitalización y automatización que optimizan y mejoran la resiliencia de las cadenas de suministro industriales a nivel mundial.,,,14217,EUR,SIE,SMART,STK,False,SUP
transportation and logistics,supply_chain_management,US9892071054,ZEBRA TECHNOLOGIES CORP-CL A,50,"Proporciona soluciones críticas de inteligencia de activos empresariales, que incluyen computación móvil, captura de datos y tecnologías de impresión, para mejorar la visibilidad y la eficiencia en las operaciones de la cadena de suministro global.","La participación de Zebra en la Gestión de la Cadena de Suministro es evidente en sus soluciones diseñadas para optimizar el movimiento de paquetes a través de la cadena de suministro. La visión de Inteligencia de Activos Empresariales de la compañía se centra en mejorar la gestión de la cadena de suministro al hacer que cada activo y trabajador de primera línea sea visible, conectado y completamente optimizado. Las soluciones de Zebra, incluidos escáneres de códigos de barras, lectores RFID y computadoras móviles, desempeñan un papel crucial en la gestión del flujo de bienes e información, y la compañía está expandiendo sus soluciones de visión artificial 3D a la logística. Además, Zebra está posicionada para beneficiarse de las tendencias seculares en la digitalización y automatización de flujos de trabajo, con un gran proveedor de logística de transporte aumentando el rendimiento y la visibilidad de activos en tiempo real utilizando las soluciones de Zebra.","[{'name': 'zbra-Q324-10-Q', 'url': 'https://storage.googleapis.com/reflexivity-documents-prod/edgar/filing/10-q/zbra-Q324-10-Q.html'}, {'name': 'zbra-Q225-10-Q', 'url': 'https://storage.googleapis.com/reflexivity-documents-prod/edgar/filing/10-q/zbra-Q225-10-Q.html'}]",276304,USD,ZBRA,SMART,STK,True,SUP
transportation and logistics,supply_chain_management,US58155Q1031,MCKESSON CORP,51,"Gestiona la intrincada distribución y logística de productos farmacéuticos y suministros médicos, garantizando una entrega eficiente a los proveedores de atención médica en diversos entornos de atención.","El compromiso de McKesson con la Gestión de la Cadena de Suministro es evidente a través de su segmento de Soluciones Médicas-Quirúrgicas, que se enfoca en la distribución de suministros médicos-quirúrgicos, logística y otros servicios relacionados para proveedores de atención médica. La compañía está fortaleciendo sus capacidades de distribución principales a través de inversiones específicas en tecnología e infraestructura. McKesson también enfatiza un sólido programa de abastecimiento en los negocios farmacéuticos y médico-quirúrgicos, junto con una ejecución disciplinada para impulsar la eficiencia de costos y mantener la disponibilidad de productos, trabajando para diversificar y crear una cadena de suministro confiable y predecible.","[{'name': 'mck-Q325-10-Q', 'url': 'https://storage.googleapis.com/reflexivity-documents-prod/edgar/filing/10-q/mck-Q325-10-Q.html'}]",9657,USD,MCK,SMART,STK,True,SUP
transportation and logistics,supply_chain_management,US1096961040,BRINK'S CO/THE,52,Proporciona soluciones seguras de logística y gestión de efectivo que son esenciales para mantener la integridad y eficiencia de diversas cadenas de suministro.,"La participación de Brink's en la Gestión de la Cadena de Suministro es evidente a través de Brink's Global Services (BGS), que ofrece servicios como transporte internacional seguro, recogida, embalaje, despacho de aduanas, almacenamiento seguro en bóveda y gestión de inventario de productos y mercancías de alto valor. Estos servicios, aunque forman parte de una oferta más amplia de gestión de efectivo y objetos de valor, resaltan la participación de la empresa en la gestión de la cadena de suministro de artículos de alto valor. Además, Brink's probablemente gestiona su propia cadena de suministro de vehículos blindados y otros equipos.","[{'name': 'bco-Q225-10-Q', 'url': 'https://storage.googleapis.com/reflexivity-documents-prod/edgar/filing/10-q/bco-Q225-10-Q.html'}, {'name': 'bco-Q324-10-Q', 'url': 'https://storage.googleapis.com/reflexivity-documents-prod/edgar/filing/10-q/bco-Q324-10-Q.html'}]",11475,USD,BCO,SMART,STK,True,SUP
transportation and logistics,supply_chain_management,US0533321024,AUTOZONE INC,53,"Implica la gestión de la adquisición, almacenamiento y distribución de piezas y accesorios de automoción para garantizar la disponibilidad de productos en su red minorista y para el cumplimiento directo de los clientes.","El compromiso de AutoZone con la Gestión de la Cadena de Suministro es evidente a través de sus inversiones estratégicas destinadas a mejorar la eficiencia y reducir los costos. La empresa está asignando aproximadamente $1.3 mil millones en CapEx, parte de los cuales se destina a mejorar la cadena de suministro, los tiempos de entrega y la velocidad de entrega. Esto incluye la apertura de nuevos centros de distribución mientras se optimizan los existentes para impulsar la eficiencia y reducir los costos de la cadena de suministro, así como mejorar la disponibilidad de inventario en tiendas satélite, Hub y MegaHub. Además, el enfoque de AutoZone en las mejoras de la cadena de suministro es parte de una estrategia más amplia para mejorar el servicio al cliente y la variedad de productos, posicionando a la empresa para el crecimiento futuro.",,4750,USD,AZO,SMART,STK,True,SUP
transportation and logistics,supply_chain_management,US6092071058,MONDELEZ INTERNATIONAL INC-A,54,"Opera una extensa cadena de suministro global para obtener materias primas de manera eficiente, fabricar y distribuir su amplia gama de productos de alimentos y bebidas en todo el mundo.","Mondelēz International está significativamente involucrada en la gestión de la cadena de suministro, lo que se demuestra por su inversión de $1.2 mil millones en un programa de transformación de sistemas multianual para actualizar sus sistemas ERP y de cadena de suministro globales. La empresa monitorea activamente la oferta, los costos de las materias primas y las tendencias de divisas para asegurar los recursos necesarios para la producción e implementa estrategias para mitigar los impactos en su cadena de suministro, operaciones y activos. Su gestión del suministro de cacao, incluidas las estrategias de cobertura en respuesta a las fluctuaciones de precios y la consideración de los impactos del clima en los rendimientos de los cultivos en África Occidental, resalta aún más su enfoque en la dinámica de la cadena de suministro. Además, la empresa aborda la reducción de existencias de los minoristas y se adapta cambiando el enfoque a canales alternativos, lo que indica una gestión proactiva de los niveles de inventario y las redes de distribución.","[{'name': 'mdlz-Q225-10-Q', 'url': 'https://storage.googleapis.com/reflexivity-documents-prod/edgar/filing/10-q/mdlz-Q225-10-Q.html'}]",113599091,USD,MDLZ,SMART,STK,True,SUP
transportation and logistics,supply_chain_management,US5949181045,MICROSOFT CORP,55,"Proporciona plataformas basadas en la nube y soluciones empresariales que permiten a las organizaciones optimizar la logística, mejorar la eficiencia operativa e impulsar la toma de decisiones basada en datos en sus redes de cadena de suministro.",,,272093,USD,MSFT,SMART,STK,True,SUP
transportation and logistics,supply_chain_management,FR0014003TT8,DASSAULT SYSTEMES SE,56,"Ofrece una plataforma integral 3DEXPERIENCE que integra la gestión del ciclo de vida del producto, el diseño y los procesos de fabricación, contribuyendo directamente a la optimización y eficiencia de las cadenas de suministro globales.",,,500760943,EUR,DSY,SMART,STK,False,SUP
transportation and logistics,supply_chain_management,US03937C1053,ARCBEST CORP,57,Proporciona soluciones integrales de logística y transporte de carga esenciales para optimizar y gestionar diversos aspectos de la cadena de suministro.,"ArcBest opera como una empresa de logística integrada de miles de millones de dólares, que proporciona un conjunto de soluciones que abordan las demandas de la cadena de suministro de los clientes. La empresa se enfoca en ayudar a los clientes a adaptarse rápidamente optimizando los modos y las estrategias de distribución, con un énfasis en mejorar la estabilidad de la cadena de suministro. ArcBest también se posiciona como un asesor estratégico, que ofrece experiencia para navegar los desafíos y ofrecer eficiencia de costos y estabilidad de la cadena de suministro. Al hacerlo, la empresa aprovecha la tecnología y su red para fortalecer sus ofertas de servicios.","[{'name': 'arcb-FY24-10-K', 'url': 'https://storage.googleapis.com/reflexivity-documents-prod/edgar/filing/10-k/arcb-FY24-10-K.html'}]",150304976,USD,ARCB,SMART,STK,True,SUP
transportation and logistics,supply_chain_management,US9837931008,XPO INC,58,Juega un papel significativo en la optimización del flujo y almacenamiento de bienes e información a lo largo de las cadenas de suministro globales.,"La participación de XPO en la Gestión de la Cadena de Suministro es evidente en su papel como proveedor líder de servicios de transporte de carga, utilizando tecnología propietaria para mover eficientemente bienes a través de las cadenas de suministro de los clientes en América del Norte y Europa. Sus servicios de carga en Europa incluyen carga dedicada, LTL, corretaje de carga completa, almacenamiento, gestión de transporte, última milla, transitario y soluciones multimodales, personalizadas para los clientes. Los clientes también buscan establecer relaciones con proveedores de servicios confiables que hayan invertido en innovación para reducir el riesgo de sus cadenas de suministro, lo que está respaldado por la tecnología de XPO que anticipa los cambios de volumen para ajustar las horas de mano de obra en tiempo real y hacer que su red sea más resiliente.","[{'name': 'xpo-Q225-10-Q', 'url': 'https://storage.googleapis.com/reflexivity-documents-prod/edgar/filing/10-q/xpo-Q225-10-Q.html'}, {'name': 'xpo-FY24-10-K', 'url': 'https://storage.googleapis.com/reflexivity-documents-prod/edgar/filing/10-k/xpo-FY24-10-K.html'}, {'name': 'xpo-Q324-10-Q', 'url': 'https://storage.googleapis.com/reflexivity-documents-prod/edgar/filing/10-q/xpo-Q324-10-Q.html'}, {'name': 'xpo-Q125-10-Q', 'url': 'https://storage.googleapis.com/reflexivity-documents-prod/edgar/filing/10-q/xpo-Q125-10-Q.html'}]",93957038,USD,XPO,SMART,STK,True,SUP
transportation and logistics,supply_chain_management,US3453708600,FORD MOTOR CO,59,"Se enfoca en optimizar su intrincada cadena de suministro global de materias primas, componentes y vehículos terminados para respaldar sus extensas redes de fabricación y distribución.","El compromiso de Ford con la Gestión de la Cadena de Suministro es evidente a través de varias consideraciones operativas. La empresa utiliza un programa de financiación de la cadena de suministro que permite a los proveedores vender sus cuentas por cobrar de Ford a instituciones financieras. Ford se enfrenta a desafíos en la cadena de suministro, como interrupciones de proveedores, aranceles y restricciones a las exportaciones de minerales de tierras raras, que aumentan el riesgo de interrupciones en la producción y los costos, lo que lleva a Ford a celebrar acuerdos de compra con proveedores de materias primas para asegurar materiales críticos.","[{'name': 'f-Q225-10-Q', 'url': 'https://storage.googleapis.com/reflexivity-documents-prod/edgar/filing/10-q/f-Q225-10-Q.html'}, {'name': 'f-Q324-10-Q', 'url': 'https://storage.googleapis.com/reflexivity-documents-prod/edgar/filing/10-q/f-Q324-10-Q.html'}]",9599491,USD,F,SMART,STK,True,SUP
transportation and logistics,supply_chain_management,US03073E1055,CENCORA INC,60,Orquesta la gestión integral de la distribución de productos y los procesos logísticos dentro de su cadena de suministro.,,,1714996,USD,COR,SMART,STK,True,SUP
transportation and logistics,supply_chain_management,US2566771059,DOLLAR GENERAL CORP,61,"Se basa en gran medida en una logística, distribución y gestión de inventario eficientes para abastecer sus numerosos puntos de venta minorista con una amplia gama de productos, garantizando la rentabilidad y la disponibilidad de los mismos.","La participación de Dollar General en la Gestión de la Cadena de Suministro es evidente a través de varias iniciativas y mejoras operativas. Los planes de gasto de capital de la compañía incluyen inversiones para apoyar y mejorar las iniciativas de la cadena de suministro, específicamente para las instalaciones de los centros de distribución y los activos de transporte. Se centran en mejorar los márgenes a través de eficiencias de distribución y transporte, gestión de inventario y estrategias de abastecimiento global, y cuentan con empleados dedicados que trabajan en centros de distribución y una flota privada. Además, la iniciativa 'DG Fresh', un modelo de autodisribución para productos congelados y refrigerados, contribuye positivamente a las ventas y al margen bruto.","[{'name': 'dg-Q125-10-Q', 'url': 'https://storage.googleapis.com/reflexivity-documents-prod/edgar/filing/10-q/dg-Q125-10-Q.html'}, {'name': 'dg-Q324-10-Q', 'url': 'https://storage.googleapis.com/reflexivity-documents-prod/edgar/filing/10-q/dg-Q324-10-Q.html'}]",70212228,USD,DG,SMART,STK,True,SUP
transportation and logistics,supply_chain_management,US4592001014,INTL BUSINESS MACHINES CORP,62,"Contribuye a la modernización y optimización de la gestión de la cadena de suministro a través de tecnología avanzada y servicios de consultoría, mejorando la eficiencia y la resiliencia para las empresas.",,,8314,USD,IBM,SMART,STK,True,SUP
transportation and logistics,supply_chain_management,US7835491082,RYDER SYSTEM INC,63,"Proporciona logística integrada, gestión de flotas y soluciones de cadena de suministro, optimizando el transporte, la distribución y la eficiencia operativa general para las empresas.","Ryder está significativamente involucrado en la gestión de la cadena de suministro, principalmente a través de su segmento de negocio Supply Chain Solutions (SCS), que proporciona soluciones de cadena de suministro a los clientes. La empresa se beneficia de las tendencias seculares a largo plazo en soluciones de cadena de suministro, logística y transporte. La importancia de este segmento se ve subrayada por su contribución al crecimiento de los ingresos contractuales y su papel en la mitigación de las condiciones débiles del mercado. Ryder también se enfoca en optimizar su red de almacenes minoristas omnicanal para impulsar la eficiencia operativa, lo que refleja un compromiso con la mejora continua en sus operaciones de cadena de suministro.","[{'name': 'r-Q125-10-Q', 'url': 'https://storage.googleapis.com/reflexivity-documents-prod/edgar/filing/10-q/r-Q125-10-Q.html'}, {'name': 'r-Q324-10-Q', 'url': 'https://storage.googleapis.com/reflexivity-documents-prod/edgar/filing/10-q/r-Q324-10-Q.html'}, {'name': 'r-FY24-10-K', 'url': 'https://storage.googleapis.com/reflexivity-documents-prod/edgar/filing/10-k/r-FY24-10-K.html'}]",11478,USD,R,SMART,STK,True,SUP
transportation and logistics,supply_chain_management,US0970231058,BOEING CO/THE,64,"Gestiona una vasta red global de proveedores de componentes y sistemas críticos para aeronaves, garantizando la entrega oportuna y el control de calidad esenciales para la fabricación aeroespacial a gran escala.","Boeing enfrenta desafíos considerables en la gestión de la cadena de suministro, como lo demuestran las frecuentes menciones de interrupciones, restricciones y problemas de calidad que afectan la producción, las entregas y el rendimiento financiero. La compañía monitorea activamente la salud y estabilidad de su cadena de suministro y se ve afectada por presiones inflacionarias, restricciones en la cadena de suministro global e inestabilidad laboral que afectan tanto a Boeing como a sus proveedores. Los esfuerzos de Boeing para gestionar estos problemas incluyen la posible adquisición de Spirit AeroSystems para mejorar el control de la cadena de suministro; sin embargo, los ingresos continúan viéndose afectados significativamente hasta que la cadena de suministro global se estabilice.","[{'name': 'ba-Q125-10-Q', 'url': 'https://storage.googleapis.com/reflexivity-documents-prod/edgar/filing/10-q/ba-Q125-10-Q.html'}, {'name': 'ba-Q324-10-Q', 'url': 'https://storage.googleapis.com/reflexivity-documents-prod/edgar/filing/10-q/ba-Q324-10-Q.html'}]",4762,USD,BA,SMART,STK,True,SUP
transportation and logistics,supply_chain_management,US7782961038,ROSS STORES INC,65,"Orquesta una compleja cadena de suministro global para el abastecimiento, la gestión de inventario y la distribución eficiente para respaldar su modelo minorista de precios bajos y garantizar la disponibilidad de productos en su red de tiendas.","La gestión de la cadena de suministro de Ross Stores es importante debido a su necesidad de navegar en un entorno externo volátil, particularmente en lo que respecta a aranceles y abastecimiento. La compañía está trabajando activamente con los proveedores, explorando cambios en el país de origen y utilizando estrategias como liquidaciones y almacenamiento para gestionar los costos. Para respaldar el crecimiento a largo plazo, Ross está invirtiendo en su cadena de suministro, incluida la construcción de nuevos centros de distribución en Randleman, Carolina del Norte, y Buckeye, Arizona. Estas inversiones y estrategias están destinadas a mitigar los riesgos asociados con las interrupciones de la cadena de suministro, los retrasos en el envío y los mayores costos de flete, especialmente considerando que más de la mitad de la mercancía de la compañía se origina en China.","[{'name': 'rost-Q125-10-Q', 'url': 'https://storage.googleapis.com/reflexivity-documents-prod/edgar/filing/10-q/rost-Q125-10-Q.html'}, {'name': 'rost-Q324-10-Q', 'url': 'https://storage.googleapis.com/reflexivity-documents-prod/edgar/filing/10-q/rost-Q324-10-Q.html'}]",273939,USD,ROST,SMART,STK,True,SUP
transportation and logistics,supply_chain_management,US69370C1009,PTC INC,66,"Proporciona soluciones de software empresarial que permiten a las empresas optimizar sus operaciones de cadena de suministro, mejorar la visibilidad y aumentar la eficiencia en redes globales.","La participación de PTC en la Gestión de la Cadena de Suministro se demuestra a través del lanzamiento de Arena Supply Chain Intelligence, que integra el monitoreo de riesgos impulsado por IA directamente en el entorno PLM. Esta oferta tiene como objetivo llevar el monitoreo de riesgos de la cadena de suministro impulsado por IA directamente al entorno PLM. Además, las soluciones de la compañía facilitan un flujo conectado de datos de productos a través del diseño, la fabricación y el servicio, lo que apoya implícitamente la gestión de la cadena de suministro al mejorar la consistencia y la trazabilidad de los datos.",,121507047,USD,PTC,SMART,STK,True,SUP
transportation and logistics,supply_chain_management,US1890541097,CLOROX COMPANY,67,"La gestión eficaz de su cadena de suministro es fundamental para garantizar la producción, distribución y disponibilidad de sus productos de consumo, lo que repercute en la eficiencia operativa y la capacidad de respuesta del mercado.","Clorox demuestra su compromiso con la gestión de la cadena de suministro a través de varias iniciativas. La empresa se centra en solidificar su cadena de suministro y garantizar una mayor protección contra eventos dinámicos, abordando problemas de la cadena de suministro relacionados con ciberataques y gestionando el inventario de manera eficaz. Para mejorar la eficiencia y gestionar los inventarios, Clorox está implementando un nuevo sistema ERP y realizando cambios para mitigar los impactos arancelarios, incluido el cambio de abastecimiento. Además, Clorox utiliza un programa de financiación de la cadena de suministro en beneficio de los proveedores de la empresa.","[{'name': 'clx-Q225-10-Q', 'url': 'https://storage.googleapis.com/reflexivity-documents-prod/edgar/filing/10-q/clx-Q225-10-Q.html'}]",5794,USD,CLX,SMART,STK,True,SUP
transportation and logistics,supply_chain_management,US8485741099,SPIRIT AEROSYSTEMS HOLD-CL A,68,"Sus operaciones implican una extensa gestión de la cadena de suministro global para obtener, adquirir y entregar estructuras y componentes aeroespaciales altamente complejos para la industria de la aviación.","La participación de Spirit AeroSystems en la Gestión de la Cadena de Suministro es evidente en sus discusiones sobre el rendimiento de los proveedores, la disponibilidad de materias primas, los costos de flete y el impacto de los eventos globales. Las interrupciones en la cadena de suministro y el crecimiento de los costos afectan a varios programas, incluidos B787, A350 y A220, lo que impacta los cargos por pérdidas futuras y la capacidad de cumplir con los estándares de entrega. La empresa está gestionando activamente su cadena de suministro para mitigar riesgos y mantener la producción, incluidos los programas de financiación de la cadena de suministro y la gestión de las relaciones con los proveedores.","[{'name': 'spr-Q125-10-Q', 'url': 'https://storage.googleapis.com/reflexivity-documents-prod/edgar/filing/10-q/spr-Q125-10-Q.html'}]",41692407,USD,SPR,VALUE,STK,False,SUP
