industry,theme,isin_code,name,rank,description,evidence,ib_conid,currency,symbol,exchange,assetType,navigable,evidenceSources,theme_id
real estate,urban_real_estate,US09257W1009,BLACKSTONE MORTGAGE TRU-CL A,64,Facilita el desarrollo y la adquisición de propiedades en entornos urbanos al proporcionar financiación hipotecaria esencial.,"El enfoque de Blackstone Mortgage Trust en originar y administrar préstamos senior garantizados por bienes raíces comerciales de alta calidad en los principales mercados de América del Norte, Europa y Australia impulsa su compromiso con el tema de Bienes Raíces Urbanos. La cartera de la empresa se compone principalmente de préstamos garantizados por activos institucionales en estos mercados principales, patrocinados por propietarios y operadores experimentados de inversiones inmobiliarias. Aunque las actividades de la empresa involucran significativamente bienes raíces urbanos, no se menciona un enfoque explícito o una cantidad de inversión específica.",127149807,USD,BXMT,SMART,STK,True,"[{'name': 'bxmt-Q324-10-Q', 'url': 'https://storage.googleapis.com/reflexivity-documents-prod/edgar/filing/10-q/bxmt-Q324-10-Q.html'}, {'name': 'bxmt-FY24-10-K', 'url': 'https://storage.googleapis.com/reflexivity-documents-prod/edgar/filing/10-k/bxmt-FY24-10-K.html'}]",UR1
real estate,urban_real_estate,US0147521092,ALEXANDER'S INC,65,Su negocio abarca el sector inmobiliario urbano.,,4382,USD,ALX,SMART,STK,False,,UR1
real estate,urban_real_estate,US03762U1051,APOLLO COMMERCIAL REAL ESTAT,66,"Implica la provisión de soluciones de financiación para propiedades inmobiliarias comerciales, que son fundamentales para el desarrollo urbano y el funcionamiento de los mercados inmobiliarios metropolitanos.","La cartera de préstamos de la empresa incluye propiedades en importantes áreas urbanas como Manhattan, Londres, Brooklyn, Chicago y Miami, lo que indica una inversión en bienes raíces urbanos. Esto está respaldado además por un préstamo de 'Predesarrollo Urbano' en Miami. La cartera de préstamos hipotecarios comerciales también incluye préstamos garantizados por propiedades en otras ubicaciones urbanas como Long Island City, Berlín y Milán.",69052095,USD,ARI,SMART,STK,True,"[{'name': 'ari-Q324-10-Q', 'url': 'https://storage.googleapis.com/reflexivity-documents-prod/edgar/filing/10-q/ari-Q324-10-Q.html'}, {'name': 'ari-FY24-10-K', 'url': 'https://storage.googleapis.com/reflexivity-documents-prod/edgar/filing/10-k/ari-FY24-10-K.html'}]",UR1
real estate,urban_real_estate,US9396531017,ELME COMMUNITIES,67,"Participa en la adquisición, desarrollo y gestión de propiedades dentro de entornos urbanos.","La compañía demuestra su compromiso con el tema de Bienes Raíces Urbanos a través de la propiedad de aproximadamente 9,400 viviendas residenciales en las regiones metropolitanas de Washington, DC y Atlanta. Adicionalmente, la compañía posee y opera aproximadamente 300,000 pies cuadrados de espacio comercial en la región metropolitana de Washington, DC. Estas propiedades en importantes áreas metropolitanas resaltan la presencia e inversión de la compañía en bienes raíces urbanos.",758160,USD,ELME,SMART,STK,True,"[{'name': 'elme-Q125-10-Q', 'url': 'https://storage.googleapis.com/reflexivity-documents-prod/edgar/filing/10-q/elme-Q125-10-Q.html'}, {'name': 'elme-Q324-10-Q', 'url': 'https://storage.googleapis.com/reflexivity-documents-prod/edgar/filing/10-q/elme-Q324-10-Q.html'}, {'name': 'elme-FY24-10-K', 'url': 'https://storage.googleapis.com/reflexivity-documents-prod/edgar/filing/10-k/elme-FY24-10-K.html'}]",UR1
real estate,urban_real_estate,US8754651060,TANGER INC,68,Posee y gestiona propiedades inmobiliarias comerciales que contribuyen al panorama comercial de las áreas urbanas.,,12187,USD,SKT,SMART,STK,True,,UR1
real estate,urban_real_estate,US0144911049,ALEXANDER & BALDWIN INC,69,"Contribuye al sector inmobiliario urbano a través de la propiedad, gestión y desarrollo de diversas propiedades comerciales e industriales.","La empresa demuestra su enfoque en el tema de Bienes Raíces Urbanos a través de su segmento de Bienes Raíces Comerciales, que incluye el diseño, desarrollo desde cero, reposicionamiento y remodelación de propiedades. Las clases de activos preferidas de la empresa incluyen propiedades mejoradas en espacios minoristas e industriales, y también arrendamientos de terrenos urbanos. La empresa especifica 'arrendamientos de terrenos urbanos' como una clase de activo preferida, lo que indica inversión en bienes raíces urbanos.",108670127,USD,ALEX,SMART,STK,True,"[{'name': 'alex-Q324-10-Q', 'url': 'https://storage.googleapis.com/reflexivity-documents-prod/edgar/filing/10-q/alex-Q324-10-Q.html'}, {'name': 'alex-FY24-10-K', 'url': 'https://storage.googleapis.com/reflexivity-documents-prod/edgar/filing/10-k/alex-FY24-10-K.html'}]",UR1
real estate,urban_real_estate,US57164Y1073,MARRIOTT VACATIONS WORLD,70,"Gestiona propiedades de propiedad vacacional, algunas de las cuales están situadas en mercados inmobiliarios urbanos.","La empresa demuestra su compromiso con el sector inmobiliario urbano a través de su City Collection, anteriormente ubicaciones Pulse, que atiende a propietarios interesados en explorar destinos urbanos como Nueva York, Boston, San Diego, Bangkok y Waikiki. Reforzando este enfoque, la empresa está desarrollando un nuevo Marriott Vacation Club en el centro de Nashville. Estas iniciativas reflejan el interés estratégico de la empresa en expandir su presencia y ofertas dentro de entornos urbanos.",96965587,USD,VAC,SMART,STK,True,,UR1
real estate,urban_real_estate,US3434121022,FLUOR CORP,71,"Implica actividades de ingeniería, adquisición y construcción relevantes para el desarrollo de infraestructura y servicios urbanos.","La participación de Fluor en el tema de Bienes Raíces Urbanos se demuestra a través de su segmento 'Soluciones Urbanas', que reportó ingresos significativos de $2,157 millones para el trimestre finalizado el 31 de marzo de 2025. Este segmento abarca varios proyectos, incluyendo ciencias de la vida, metales, minería y proyectos de carreteras, como el contrato de construcción para la Carretera Estatal 6 en Texas. El aumento de las ganancias del segmento durante el trimestre de 2025 se atribuyó a un aumento en las actividades de ejecución en ciencias de la vida y un gran proyecto de metales, junto con reducciones de costos por optimización de diseño en un proyecto de carreteras.",11218575,USD,FLR,SMART,STK,True,"[{'name': 'flr-Q125-10-Q', 'url': 'https://storage.googleapis.com/reflexivity-documents-prod/edgar/filing/10-q/flr-Q125-10-Q.html'}]",UR1
